id;left;kwic;right
"26";"Problém/problém/NNIS1-----A---- je/být/VB-S---3P-AAI-- v/v/RR--6---------- tom/ten/PDNS6---------- ,/,/Z:------------- jak/jak/Db------------- píše/psát/VB-S---3P-AAI-- americký/americký/AAMS1----1A---- politolog/politolog/NNMS1-----A---- John/John/NNMS1-----A---- Mearsheimer/Mearsheimer/X@------------- ,/,/Z:------------- že/že/J,------------- „/""/Z:------------- velmoci/velmoc/NNFP1-----A---- se/se/P7--4----------";"nechovají/chovat/VB-P---3P-NAI-- agresivně/agresivně/Dg-------1A---- proto/proto/Db------------- ,/,/Z:------------- že/že/J,------------- to/ten/PDNS4---------- chtějí/chtít/VB-P---3P-AAI-- nebo/nebo/J^------------- že/že/J,------------- mají/mít/VB-P---3P-AAI-- nějakou/nějaký/PZFS4---------- vnitřní/vnitřní/AAFS4----1A---- touhu/touha/NNFS4-----A----";"vládnout/vládnout/Vf--------A-I-- ,/,/Z:------------- ale/ale/J^------------- proto/proto/Db------------- ,/,/Z:------------- že/že/J,------------- musejí/muset/VB-P---3P-AAI-- hledat/hledat/Vf--------A-I-- více/hodně/Dg-------2A---- moci/moc/NNFS2-----A---- ,/,/Z:------------- když/když/J,------------- chtějí/chtít/VB-P---3P-AAI-- maximalizovat/maximalizovat/Vf--------A-B-- svoji/svůj/P8FS4---------- naději/naděje/NNFS4-----A---- přežít/přežít/Vf--------A-P-- …/.../Z:-------------"
"27";"právu/právo/NNNS6-----A---- ,/,/Z:------------- abych/aby|být/J,-------------|Vc-S---1----I-- mohl/moci/VpMS----R-AAI-- tvrdit/tvrdit/Vf--------A-I-- ,/,/Z:------------- že/že/J,------------- mezi/mezi/RR--7---------- všemi/všechen/PLMP7---------- obchodníky/obchodník/NNMP7-----A---- se/s/RV--7---------- zlem/zlo/NNNS7-----A---- je/být/VB-S---3P-AAI-- Larry/Larry/NNMS1-----A---- Clark/Clark/NNMS1-----A---- jeden/jeden/ClMS1---------- z/z/RR--2---------- nejbanálnějších/banální/AAMP2----3A---- ,/,/Z:------------- nejvulgárnějších/vulgární/AAMP2----3A---- ,/,/Z:------------- čistě/čistě/Dg-------1A---- proto/proto/Db------------- ,/,/Z:------------- že/že/J,------------- se/se/P7--4---------- neomaleně/neomaleně/Dg-------1A---- staví/stavit/VB-S---3P-AAP-- na/na/RR--4---------- stranu/strana/NNFS4-----A---- mladých/mladý/AAMP2----1A---- proti/proti/RR--3---------- starým/starý/AAMP3----1A---- ,/,/Z:------------- že/že/J,------------- všechny/všechen/PLIP1---------- jeho/jeho/PSIP1-S3------- filmy/film/NNIP1-----A---- nemají/mít/VB-P---3P-NAI-- jiný/jiný/AAIS4----1A---- cíl/cíl/NNIS4-----A---- než/než/J,------------- ponoukat/ponoukat/Vf--------A-I-- děti/dítě/NNFP4-----A---- ,/,/Z:------------- aby/aby|být/J,-------------|Vc----------I-- se/se/P7--4---------- ke/k/RV--3---------- svým/svůj/P8MP3---------- rodičům/rodič/NNMP3-----A----";"chovaly/chovat/VpFP----R-AAI-- bez/bez/RR--2---------- špetky/špetka/NNFS2-----A---- lidskosti/lidskost/NNFS2-----A---- ,/,/Z:------------- bez/bez/RR--2---------- kapky/kapka/NNFS2-----A---- lítosti/lítost/NNFS2-----A---- ,/,/Z:------------- a/a/J^------------- že/že/J,------------- na/na/RR--6---------- tom/ten/PDNS6---------- není/být/VB-S---3P-NAI-- nic/nic/PW--1---------- nového/nový/AANS2----1A---- ani/ani/J^------------- originálního/originální/AANS2----1A---- ,/,/Z:------------- ve/v/RV--6---------- všech/všechen/PLFP6---------- kulturních/kulturní/AAFP6----1A---- sférách/sféra/NNFP6-----A---- už/už/Db------------- dobře/dobře/Dg-------1A---- padesát/padesát/Cn-S4---------- let/rok/NNNP2-----A---- běží/běžet/VB-S---3P-AAI-- to/ten/PDNS1---------- samé/samý/PLNS1---------- ,/,/Z:------------- tato/tento/PDFS1---------- domněle/domněle/Dg-------1A---- kulturní/kulturní/AAFS1----1A---- tendence/tendence/NNFS1-----A---- v/v/RR--6---------- podstatě/podstata/NNFS6-----A---- jen/jen/Db------------- skrývá/skrývat/VB-S---3P-AAI-- touhu/touha/NNFS4-----A----";"po/po/RR--6---------- návratu/návrat/NNIS6-----A---- k/k/RR--3---------- primitivnímu/primitivní/AANS3----1A---- stadiu/stadium/NNNS3-----A---- ,/,/Z:------------- kdy/kdy/Db------------- se/se/P7--4---------- mladí/mladý/AAMP1----1A---- bezohledně/bezohledně/Dg-------1A---- ,/,/Z:------------- bez/bez/RR--2---------- výčitek/výčitka/NNFP2-----A---- zbavovali/zbavovat/VpMP----R-AAI-- starých/starý/AAFP2----1A---- prostě/prostě/TT------------- jen/jen/Db------------- proto/proto/Db------------- ,/,/Z:------------- že/že/J,------------- ti/ten/PDMP1---------- už/už/Db------------- byli/být/VpMP----R-AAI-- příliš/příliš/Db------------- slabí/slabý/AAMP1----1A---- ,/,/Z:------------- aby/aby|být/J,-------------|Vc----------I-- se/se/P7--4---------- mohli/moci/VpMP----R-AAI-- bránit/bránit/Vf--------A-I-- ,/,/Z:------------- znamená/znamenat/VB-S---3P-AAI-- to/ten/PDNS1---------- jen/jen/Db------------- pro/pro/RR--4---------- moderní/moderní/AAFS4----1A---- dobu/doba/NNFS4-----A---- typický/typický/AAIS4----1A---- surový/surový/AAIS4----1A---- návrat/návrat/NNIS4-----A---- k/k/RR--3---------- období/období/NNNS3-----A---- předcházejícímu/předcházející/AGIS3-----A---- civilizovanému/civilizovaný/AAIS3----1A---- světu/svět/NNIS3-----A---- ,/,/Z:------------- neboť/neboť/J^------------- každou/každý/PLFS4---------- kulturu/kultura/NNFS4-----A---- je/být/VB-S---3P-AAI--"
"28";"Ale/ale/J^------------- cožpak/copak/TT-------------";"nechovalo/chovat/VpNS----R-NAI-- každé/každý/PLNS1---------- rozmetání/rozmetání/NNNS1-----A---- v/v/RR--6---------- sobě/se/P6--6---------- stesk/stesk/NNIS4-----A---- po/po/RR--6---------- pořádku/pořádek/NNIS6-----A---- minulém/minulý/AAIS6----1A---- a/a/J^------------- touhu/touha/NNFS4-----A----";"po/po/RR--6---------- předchozím/předchozí/AAIS6----1A---- řádu/řád/NNIS6-----A---1 ?/?/Z:-------------"
"29";"Každý/každý/PLMS1---------- z/z/RR--2---------- nás/my/PP-P2--1-------";"choval/chovat/VpMS----R-AAI-- na/na/RR--6---------- srdci/srdce/NNNS6-----A---- jedinou/jediný/AAFS4----1A---- touhu/touha/NNFS4-----A----";",/,/Z:------------- poznat/poznat/Vf--------A-P-- alespoň/alespoň/Db------------- na/na/RR--4---------- okamžik/okamžik/NNIS4-----A---- nitro/nitro/NNNS4-----A---- těchto/tento/PDIP2---------- evropských/evropský/AAIP2----1A---- klenotů/klenot/NNIP2-----A---- ././Z:-------------"
"30";"Jak/jak/Db------------- boháč/boháč/NNMS1-----A---- jsem/být/VB-S---1P-AAI-- ,/,/Z:------------- co/co/PQ--1---------- s/s/RR--7---------- klíčem/klíč/NNIS7-----A---- v/v/RR--6---------- ruce/ruka/NNFS6-----A---- jde/jít/VB-S---3P-AAI-- otevřít/otevřít/Vf--------A-P-- pokladnu/pokladna/NNFS4-----A---- ,/,/Z:------------- v/v/RR--6---------- níž/jenž/P9FS6---------- šperky/šperk/NNIP4-----A----";"chová/chovat/VB-S---3P-AAI-- ,/,/Z:------------- však/však/J^------------- zarazí/zarazit/VB-S---3P-AAP-- se/se/P7--4---------- radši/rád/Dg-------2A---1 pokaždé/pokaždé/Db------------- ,/,/Z:------------- aby/aby|být/J,-------------|Vc----------I-- svou/svůj/P8FS4---------1 touhu/touha/NNFS4-----A----";"vychutnat/vychutnat/Vf--------A-P-- moh/moci/VpMS----R-AAI-6 znova/znovu/Db------------- ././Z:-------------"
"31";"Láska/láska/NNFS1-----A---- je/být/VB-S---3P-AAI-- silný/silný/AAIS1----1A---- cit/cit/NNIS1-----A---- ,/,/Z:------------- který/který/P4IS4----------";"chováme/chovat/VB-P---1P-AAI-- k/k/RR--3---------- osobám/osoba/NNFP3-----A---- ,/,/Z:------------- zvířatům/zvíře/NNNP3-----A---- nebo/nebo/J^------------- věcem/věc/NNFP3-----A---- ,/,/Z:------------- které/který/P4FP1---------- uspokojovaly/uspokojovat/VpFP----R-AAI-- ,/,/Z:------------- uspokojují/uspokojovat/VB-P---3P-AAI-- nebo/nebo/J^------------- budou/být/VB-P---3F-AAI-- uspokojovat/uspokojovat/Vf--------A-I-- naše/náš/PSFP4-P1------- nejhlubší/hluboký/AAFP4----3A---- touhy/touha/NNFP4-----A----";"a/a/J^------------- potřeby/potřeba/NNFP4-----A---- ././Z:-------------"
"32";"Podle/podle/RR--2---------- zažitého/zažitý/AANS2----1A---- klišé/klišé/NNNS2-----A---- v/v/RR--6---------- sobě/se/P6--6---------- ženy/žena/NNFP1-----A----";"chovají/chovat/VB-P---3P-AAI-- skrytou/skrytý/AAFS4----1A---- touhu/touha/NNFS4-----A----";"po/po/RR--6---------- zločincích/zločinec/NNMP6-----A---- a/a/J^------------- desperátech/desperát/NNMP6-----A---- ././Z:-------------"
"33";"";"Chováme/chovat/VB-P---1P-AAI-- -/-/Z0------------- li/li/J,------------- se/se/P7--4---------- v/v/RR--6---------- této/tento/PDFS6---------- oblasti/oblast/NNFS6-----A---- racionálně/racionálně/Dg-------1A---- ,/,/Z:------------- pak/pak/Db------------- pravděpodobnost/pravděpodobnost/NNFS1-----A---- ,/,/Z:------------- že/že/J,------------- svou/svůj/P8FS4---------1 touhu/touha/NNFS4-----A----";"po/po/RR--6---------- slasti/slast/NNFS6-----A---- skutečně/skutečně/TT------------- uspokojíme/uspokojit/VB-P---1P-AAP-- ,/,/Z:------------- výrazně/výrazně/Dg-------1A---- roste/růst/VB-S---3P-AAI-- ././Z:-------------"
"34";"Nejen/nejen/Db------------- že/že/J,------------- mě/já/PH-S4--1------- naučil/naučit/VpMS----R-AAP-- se/se/P7--4---------- zdvořileji/zdvořile/Dg-------2A----";"chovat/chovat/Vf--------A-I-- k/k/RR--3---------- ostatním/ostatní/AAMP3----1A---- ,/,/Z:------------- chápat/chápat/Vf--------A-I-- jejich/jejich/PSFP4-P3------- potřeby/potřeba/NNFP4-----A---- a/a/J^------------- touhy/touha/NNFP4-----A----";",/,/Z:------------- ale/ale/J^------------- naučil/naučit/VpMS----R-AAP-- mě/já/PH-S4--1------- také/také/Db------------- větší/velký/AAFS4----2A---- spolupráci/spolupráce/NNFS4-----A---- s/s/RR--7---------- ostatními/ostatní/AAMP7----1A---- spolužáky/spolužák/NNMP7-----A---- ././Z:-------------"
"35";"Někdy/někdy/Db------------- ovšem/ovšem/TT------------- –/-/Z:------------- a/a/J^------------- to/ten/PDNS1---------- patří/patřit/VB-S---3P-AAI-- k/k/RR--3---------- těm/ten/PDFP3---------- negativním/negativní/AAFP3----1A---- stránkám/stránka/NNFP3-----A---- její/její/PSFS2FS3------- povahy/povaha/NNFS2-----A---- –/-/Z:------------- se/se/P7--4----------";"chovala/chovat/VpFS----R-AAI-- hrubě/hrubě/Dg-------1A---- k/k/RR--3---------- lidem/člověk/NNMP3-----A---- ,/,/Z:------------- kteří/který/P4MP1---------- to/ten/PDNS4---------- s/s/RR--7---------- ní/on/P5FS7--3------- mysleli/myslet/VpMP----R-AAI-- dobře/dobře/Dg-------1A---- ,/,/Z:------------- kteří/který/P4MP1---------- jí/on/PPFS3--3------- chtěli/chtít/VpMP----R-AAI-- pomoct/pomoci/Vf--------A-P-- ,/,/Z:------------- kterým/který/P4MP3---------- imponovala/imponovat/VpFS----R-AAI-- právě/právě/Db------------- ta/ten/PDFS1---------- její/její/PSFS1FS3------- tvrdohlavost/tvrdohlavost/NNFS1-----A---- ,/,/Z:------------- s/s/RR--7---------- níž/jenž/P9FS7---------- se/se/P7--4---------- snažila/snažit/VpFS----R-AAI-- prosadit/prosadit/Vf--------A-P-- své/svůj/P8FP4---------1 touhy/touha/NNFP4-----A----";"a/a/J^------------- představy/představa/NNFP4-----A---- ././Z:-------------"
"36";"Ona/on/PPFS1--3------- duchovní/duchovní/AANS4----1A---- ochlazení/ochlazení/NNNS4-----A---- ,/,/Z:------------- které/který/P4NS4---------- tu/tu/Db------------- a/a/J^------------- tam/tam/Db------------- zakoušíš/zakoušet/VB-S---2P-AAI-- ,/,/Z:------------- tě/ty/PH-S4--2------- nesmějí/smět/VB-P---3P-NAI-- udivovat/udivovat/Vf--------A-I-- ,/,/Z:------------- srážet/srážet/Vf--------A-I-- ani/ani/J^------------- znechucovat/znechucovat/Vf--------A-I-- ,/,/Z:------------- jestliže/jestliže/J,------------- ve/v/RV--6---------- svém/svůj/P8NS6---------- srdci/srdce/NNNS6-----A----";"chováš/chovat/VB-S---2P-AAI-- skutečnou/skutečný/AAFS4----1A---- touhu/touha/NNFS4-----A----";"po/po/RR--6---------- duchovní/duchovní/AAFS6----1A---- horlivosti/horlivost/NNFS6-----A---- ,/,/Z:------------- jestliže/jestliže/J,------------- kvůli/kvůli/RR--3---------- takovýmto/takovýto/PDFP3---------- zkušenostem/zkušenost/NNFP3-----A---- tvá/tvůj/PSFS1-S2------1 duše/duše/NNFS1-----A---- nepřestává/přestávat/VB-S---3P-NAI-- pokračovat/pokračovat/Vf--------A-I-- ve/v/RV--6---------- svých/svůj/P8NP6---------- svatých/svatý/AANP6----1A---- cvičeních/cvičení/NNNP6-----A---- a/a/J^------------- nezištně/zištně/Dg-------1N---- slouží/sloužit/VB-S---3P-AAI-- Bohu/bůh/NNMS3-----A---- a/a/J^------------- miluje/milovat/VB-S---3P-AAI-- ho/on/PHMS4--3------- ././Z:-------------"
"37";"Když/když/J,------------- jsem/být/VB-S---1P-AAI-- vyrůstala/vyrůstat/VpFS----R-AAI-- ,/,/Z:------------- máma/máma/NNFS1-----A---- byla/být/VpFS----R-AAI-- má/můj/PSFS1-S1------1 věrná/věrný/AAFS1----1A---- kamarádka/kamarádka/NNFS1-----A---- ,/,/Z:------------- srdečná/srdečný/AAFS1----1A---- a/a/J^------------- otevřená/otevřený/AAFS1----1A---- ,/,/Z:------------- organizovala/organizovat/VpFS----R-AAB-- krásné/krásný/AAFP4----1A---- dovolené/dovolená/NNFP4-----A---- u/u/RR--2---------- moře/moře/NNNS2-----A---- a/a/J^------------- ze/z/RV--2---------- studeného/studený/AAIS2----1A---- nehostinného/nehostinný/AAIS2----1A---- venkova/venkov/NNIS2-----A---- udělala/udělat/VpFS----R-AAP-- cosi/cosi/PZ--4---------- zábavného/zábavný/AANS2----1A---- a/a/J^------------- vzrušujícího/vzrušující/AGNS2-----A---- ,/,/Z:------------- takže/takže/J,------------- jsem/být/VB-S---1P-AAI-- až/až/TT------------- doteď/doteď/Db------------- netušila/tušit/VpFS----R-NAI-- ,/,/Z:------------- že/že/J,------------- v/v/RR--6---------- sobě/se/P6--6----------";"chová/chovat/VB-S---3P-AAI-- sžíravou/sžíravý/AAFS4----1A---- touhu/touha/NNFS4-----A----";"po/po/RR--6---------- něčem/něco/PZ--6---------- jiném/jiný/AANS6----1A---- než/než/J,------------- po/po/RR--6---------- bezpečné/bezpečný/AAFS6----1A---- domácí/domácí/NNFS6-----A---- rutině/rutina/NNFS6-----A---- ././Z:-------------"
"38";"";"Nechoval/chovat/VpMS----R-NAI-- jsem/být/VB-S---1P-AAI-- totiž/totiž/TT------------- nikdy/nikdy/Db------------- v/v/RR--6---------- sobě/se/P6--6---------- touhu/touha/NNFS4-----A----";"mít/mít/Vf--------A-I-- vlastní/vlastní/AANS4----1A---- divadlo/divadlo/NNNS4-----A---- a/a/J^------------- už/už/Db------------- vůbec/vůbec/TT------------- ne/ne/TT------------- nějaké/nějaký/PZNS4---------- divadlo/divadlo/NNNS4-----A---- vést/vést/Vf--------A-I-- ,/,/Z:------------- což/co/PE--1---------- platí/platit/VB-S---3P-AAI-- dodnes/dodnes/Db------------- ././Z:-------------"
"39";"Rumun/Rumun/NNMS1-----A---- se/se/P7--4----------";"choval/chovat/VpMS----R-AAI-- vybraně/vybraně/Dg-------1A---- ,/,/Z:------------- úslužně/úslužně/Dg-------1A---- a/a/J^------------- laskavě/laskavě/Dg-------1A---- ,/,/Z:------------- Anna/Anna/NNFS1-----A---- také/také/Db------------- ,/,/Z:------------- jen/jen/Db------------- nebyla/být/VpFS----R-NAI-- s/s/RR--4---------- to/ten/PDNS4---------- skrýt/skrýt/Vf--------A-P-- svoji/svůj/P8FS4---------- touhu/touha/NNFS4-----A----";"zmizet/zmizet/Vf--------A-P-- ,/,/Z:------------- být/být/Vf--------A-I-- nezávislá/závislý/AAFS1----1N---- ././Z:-------------"
"40";"Tak/tak/Db------------- jako/jako/J,------------- v/v/RR--6---------- nás/my/PP-P6--1------- bez/bez/RR--2---------- našeho/náš/PSNS2-P1------- vědomí/vědomí/NNNS2-----A---- probíhají/probíhat/VB-P---3P-AAI-- úkony/úkon/NNIP1-----A---- fyzické/fyzický/AAIP1----1A---- ,/,/Z:------------- říkal/říkat/VpMS----R-AAI-- ,/,/Z:------------- stejně/stejně/Dg-------1A---- i/i/J^------------- naše/náš/PSNS1-P1------- myšlení/myšlení/NNNS1-----A---- může/moci/VB-S---3P-AAI-- v/v/RR--6---------- sobě/se/P6--6----------";"chovat/chovat/Vf--------A-I-- choutky/choutka/NNFP4-----A---- ,/,/Z:------------- nebezpečné/bezpečný/AAFP4----1N---- touhy/touha/NNFP4-----A----";"-/-/Z:------------- touhy/touha/NNFP4-----A---- tím/ten/PDNS7---------- nebezpečnější/bezpečný/AAFS1----2N---- ,/,/Z:------------- že/že/J,------------- je/oni/PPFP4--3------- považujeme/považovat/VB-P---1P-AAI-- za/za/RR--4---------- mrtvé/mrtvý/AAFP4----1A---- ,/,/Z:------------- zatímco/zatímco/J,------------- jsou/být/VB-P---3P-AAI-- jenom/jen/Db------------- zasuté/zasutý/AAFP1----1A---- a/a/J^------------- před/před/RR--7---------- námi/my/PP-P7--1------- zamaskované/zamaskovaný/AAFP1----1A---- ././Z:-------------"
"41";"Ane/Ana/X@------------- se/se/P7--4----------";"chovat/chovat/Vf--------A-I-- jako/jako/J,------------- lidová/lidový/AAFS1----1A---- scéna/scéna/NNFS1-----A---- s/s/RR--7---------- povšechnou/povšechný/AAFS7----1A---- dramaturgií/dramaturgie/NNFS7-----A---- ,/,/Z:------------- která/který/P4FS1---------- si/se/P7--3---------- ještě/ještě/Db------------- plní/plnit/VB-S---3P-AAI-- staré/starý/AAFP4----1A---- touhy/touha/NNFP4-----A----";"podle/podle/RR--2---------- toho/ten/PDNS2---------- ,/,/Z:------------- co/co/PQ--1---------- panu/pán/NNMS3-----A---1 řediteli/ředitel/NNMS3-----A---- kdysi/kdysi/Db------------- uteklo/utéci/VpNS----R-AAP-- ././Z:-------------"
"42";"Na/na/RR--4---------- to/ten/PDNS4---------- ,/,/Z:------------- jak/jak/Db------------- se/se/P7--4---------- k/k/RR--3---------- sobě/se/P6--3---------- lidé/člověk/NNMP1-----A---- ten/ten/PDIS4---------- měsíc/měsíc/NNIS4-----A---- a/a/J^------------- půl/půl/CyFS4----------";"chovali/chovat/VpMP----R-AAI-- ,/,/Z:------------- jaká/jaký/P4FS1---------- nálada/nálada/NNFS1-----A---- byla/být/VpFS----R-AAI-- a/a/J^------------- že/že/J,------------- všichni/všechen/PLMP1---------- v/v/RR--6---------- sobě/se/P6--6---------- našli/najít/VpMP----R-AAP-- naději/naděje/NNFS4-----A---- a/a/J^------------- touhu/touha/NNFS4-----A----";"změnit/změnit/Vf--------A-P-- svět/svět/NNIS4-----A---- ././Z:-------------"
"43";"";"Choval/chovat/VpMS----R-AAI-- v/v/RR--6---------- sobě/se/P6--6---------- někdy/někdy/Db------------- touhu/touha/NNFS4-----A----";",/,/Z:------------- že/že/J,------------- jeho/jeho/PSFS1-S3------- holčička/holčička/NNFS1-----A---- bude/být/VB-S---3F-AAI-- taky/také/Db------------- vědkyně/vědkyně/NNFS1-----A---- ?/?/Z:-------------"
"44";"Zatímco/zatímco/J,------------- někteří/některý/PZMP1---------- se/se/P7--4---------- snaží/snažit/VB-P---3P-AAI--";"chovat/chovat/Vf--------A-I-- stejně/stejně/Dg-------1A---- jako/jako/J,------------- v/v/RR--6---------- minulosti/minulost/NNFS6-----A---- ,/,/Z:------------- šedí/šedý/AAMP1----1A---- Dana/Dana/NNFS1-----A---- a/a/J^------------- Robert/Robert/NNMS1-----A---- už/už/Db------------- touhu/touha/NNFS4-----A----";"po/po/RR--6---------- vítězství/vítězství/NNNS6-----A---- nedokážou/dokázat/VB-P---3P-NAP-- skrývat/skrývat/Vf--------A-I-- ani/ani/J^------------- před/před/RR--7---------- televizními/televizní/AAFP7----1A---- kamerami/kamera/NNFP7-----A---- ././Z:-------------"
"45";"Již/již/Db------------- malí/malý/AAMP1----1A---- chlapci/chlapec/NNMS3-----A---- na/na/RR--6---------- základní/základní/AAFS6----1A---- škole/škola/NNFS6-----A---- šije/šít/VB-S---3P-AAI-- poměřují/poměřovat/VB-P---3P-AAI-- a/a/J^------------- snad/snad/TT------------- každý/každý/PLMS1---------- muž/muž/NNMS1-----A----";"chová/chovat/VB-S---3P-AAI-- ve/v/RV--6---------- svém/svůj/P8NS6---------- srdci/srdce/NNNS6-----A---- tajnou/tajný/AAFS4----1A---- touhu/touha/NNFS4-----A----";",/,/Z:------------- aby/aby|být/J,-------------|Vc----------I-- ten/ten/PDIS1---------- jeho/jeho/PSIS1-S3------- úd/úd/NNIS1-----A---- byl/být/VpIS----R-AAI-- o/o/RR--4---------- něco/něco/PZ--4---------- větší/velký/AAIS1----2A---- ,/,/Z:------------- snad/snad/TT------------- proto/proto/Db------------- ,/,/Z:------------- že/že/J,------------- se/se/P7--4---------- všichni/všechen/PLMP1---------- muži/muž/NNMP1-----A---- bláhově/bláhově/Dg-------1A---- domnívají/domnívat/VB-P---3P-AAI-- ,/,/Z:------------- že/že/J,------------- jeho/jeho/PSFS1-S3------- velikost/velikost/NNFS1-----A---- je/být/VB-S---3P-AAI-- přímo/přímo/Dg-------1A---- úměrná/úměrný/AAFS1----1A---- schopnosti/schopnost/NNFS3-----A---- uspokojit/uspokojit/Vf--------A-P-- ženu/žena/NNFS4-----A---- a/a/J^------------- ""/""/Z:------------- být/být/Vf--------A-I-- mužem/muž/NNMS7-----A---- ""/""/Z:------------- ././Z:-------------"
"46";"Je/být/VB-S---3P-AAI-- možné/možný/AANS1----1A---- ,/,/Z:------------- že/že/J,------------- někteří/některý/PZMP1---------- lidé/člověk/NNMP1-----A---- v/v/RR--6---------- sobě/se/P6--6----------";"chovají/chovat/VB-P---3P-AAI-- podvědomou/podvědomý/AAFS4----1A---- touhu/touha/NNFS4-----A----";"po/po/RR--6---------- sebezničení/sebezničení/NNNS6-----A---- ././Z:-------------"
"47";"Mým/můj/PSIS7-S1------- regulérním/regulérní/AAIS7----1A---- producentským/producentský/AAIS7----1A---- křtem/křest/NNIS7-----A---- byl/být/VpIS----R-AAI-- až/až/TT------------- debut/debut/NNIS1-----A---- skupiny/skupina/NNFS2-----A---- Kryštof/Kryštof/NNMS1-----A---- ;/;/Z:------------- a/a/J^------------- tu/ten/PDFS4---------- desku/deska/NNFS4-----A---- jsem/být/VB-S---1P-AAI-- vzal/vzít/VpMS----R-AAP-- jako/jako/J,------------- pokus/pokus/NNIS4-----A---- ,/,/Z:------------- hezky/hezky/Dg-------1A---- se/se/P7--4---------- ke/k/RV--3---------- mně/já/PP-S3--1-------";"chovala/chovat/VpFS----R-AAI-- gramofonová/gramofonový/AAFS1----1A---- firma/firma/NNFS1-----A---- ,/,/Z:------------- pro/pro/RR--4---------- kterou/který/P4FS4---------- se/se/P7--4---------- deska/deska/NNFS1-----A---- točila/točit/VpFS----R-AAI-- ,/,/Z:------------- a/a/J^------------- já/já/PP-S1--1------- v/v/RR--6---------- té/ten/PDFS6---------- době/doba/NNFS6-----A---- cítil/cítit/VpMS----R-AAI-- touhu/touha/NNFS4-----A----";",/,/Z:------------- že/že/J,------------- to/ten/PDNS4---------- konečně/konečně/Dg-------1A---- můžu/moci/VB-S---1P-AAI-- -/-/Z:------------- když/když/J,------------- jsem/být/VB-S---1P-AAI-- takový/takový/PDMS1---------- kverulant/kverulant/NNMS1-----A---- -/-/Z:------------- zkusit/zkusit/Vf--------A-P-- ,/,/Z:------------- když/když/J,------------- jsem/být/VB-S---1P-AAI-- tak/tak/Db------------- chytrý/chytrý/AAMS1----1A---- ././Z:-------------"
"48";"";"Nechoval/chovat/VpMS----R-NAI-- jsem/být/VB-S---1P-AAI-- totiž/totiž/TT------------- nikdy/nikdy/Db------------- v/v/RR--6---------- sobě/se/P6--6---------- touhu/touha/NNFS4-----A----";"mít/mít/Vf--------A-I-- vlastní/vlastní/AANS4----1A---- divadlo/divadlo/NNNS4-----A---- ././Z:-------------"
"49";"Ti/ten/PDMP1---------- staří/starý/AAMP1----1A---- a/a/J^------------- nemocní/nemocný/AAMP1----1A---- lidé/člověk/NNMP1-----A---- se/se/P7--4---------- přesto/přesto/Db------------- k/k/RR--3---------- sobě/se/P6--3----------";"chovají/chovat/VB-P---3P-AAI-- ohleduplně/ohleduplně/Dg-------1A---- a/a/J^------------- pozorně/pozorně/Dg-------1A---- ,/,/Z:------------- z/z/RR--2---------- jejich/jejich/PSFP2-P3------- tváří/tvář/NNFP2-----A---- čtu/číst/VB-S---1P-AAI-- touhu/touha/NNFS4-----A----";"nevzdat/vzdát/Vf--------N-P-- předčasně/předčasně/Dg-------1A---- život/život/NNIS4-----A---- ././Z:-------------"
"50";"Stoupenci/stoupenec/NNMP1-----A---- násilí/násilí/NNNS2-----A---- jsou/být/VB-P---3P-AAI-- ti/ten/PDMP1---------- ,/,/Z:------------- kdo/kdo/PKM-1---------- se/se/P7--4---------- ve/v/RV--6---------- stylu/styl/NNIS6-----A---- Georgese/Georges/NNMS2-----A---- Sorela/Sorel/NNMS2-----A---- domnívají/domnívat/VB-P---3P-AAI-- ,/,/Z:------------- že/že/J,------------- kompromisy/kompromis/NNIP1-----A---- jsou/být/VB-P---3P-AAI-- zavrženíhodné/zavrženíhodný/AAIP1----1A---- a/a/J^------------- že/že/J,------------- je/být/VB-S---3P-AAI-- potupné/potupný/AANS1----1A---- dosáhnout/dosáhnout/Vf--------A-P-- jednáním/jednání/NNNS7-----A---- toho/ten/PDNS2---------- ,/,/Z:------------- čeho/co/PQ--2---------- je/být/VB-S---3P-AAI-- možno/možno/Db------------- zmocnit/zmocnit/Vf--------A-P-- se/s/RV--7---------- silou/síla/NNFS7-----A---- ,/,/Z:------------- a/a/J^-------------";"chovají/chovat/VB-P---3P-AAI-- touhu/touha/NNFS4-----A----";"po/po/RR--6---------- režimu/režim/NNIS6-----A---- jiného/jiný/AAIS2----1A---- druhu/druh/NNIS2-----A---- ././Z:-------------"
