id;left;kwic;right
"438";"""/""/Z:------------- Úkolem/úkol/NNIS7-----A---- je/být/VB-S---3P-AAI-- ,/,/Z:------------- aby/aby|být/J,-------------|Vc----------I-- děti/dítě/NNFP1-----A---- získaly/získat/VpFP----R-AAP-- dobrý/dobrý/AAIS4----1A----";"vztah/vztah/NNIS4-----A---- k/k/RR--3---------- přírodě/příroda/NNFS3-----A---- ,/,/Z:------------- pomáhaly/pomáhat/VpFP----R-AAI-- ji/on/PPFS4--3------- chránit/chránit/Vf--------A-I-- a/a/J^------------- také/také/Db------------- ,/,/Z:------------- aby/aby|být/J,-------------|Vc----------I-- se/se/P7--4---------- uměly/umět/VpFP----R-AAI-- pěkně/pěkně/Dg-------1A---- chovat/chovat/Vf--------A-I--";"k/k/RR--3---------- sobě/se/P6--3---------- navzájem/navzájem/Db------------- ,/,/Z:------------- ""/""/Z:------------- říká/říkat/VB-S---3P-AAI-- Miluška/Miluška/NNFS1-----A---- Janoušková/Janoušková/NNFS1-----A----"
"439";"Efektivně/efektivně/Dg-------1A---- řídit/řídit/Vf--------A-I--";"vztah/vztah/NNIS4-----A---- se/s/RV--7---------- zákazníkem/zákazník/NNMS7-----A---- nejde/jít/VB-S---3P-NAI-- bez/bez/RR--2---------- informací/informace/NNFP2-----A---- o/o/RR--6---------- tom/ten/PDNS6---------- ,/,/Z:------------- jak/jak/Db------------- se/se/P7--4---------- chová/chovat/VB-S---3P-AAI--";"v/v/RR--6---------- oblasti/oblast/NNFS6-----A---- platebního/platební/AAIS2----1A---- styku/styk/NNIS2-----A---- ,/,/Z:------------- jaké/jaký/P4IP4---------- využívá/využívat/VB-S---3P-AAI-- produkty/produkt/NNIP4-----A---- ,/,/Z:------------- jakým/jaký/P4IS7---------- způsobem/způsob/NNIS7-----A---- komunikuje/komunikovat/VB-S---3P-AAB-- s/s/RR--7---------- bankou/banka/NNFS7-----A---- ,/,/Z:------------- kdy/kdy/Db------------- naposledy/naposledy/Db------------- obdržel/obdržet/VpIS----R-AAP-- produktovou/produktový/AAFS4----1A---- nabídku/nabídka/NNFS4-----A---- a/a/J^------------- jak/jak/Db------------- na/na/RR--4---------- ni/on/P5FS4--3------- reagoval/reagovat/VpIS----R-AAI-- nebo/nebo/J^------------- jak/jak/Db------------- k/k/BN------------- využívá/využívat/VB-S---3P-AAI-- internetové/internetový/AANS4----1A---- bankovnictví/bankovnictví/NNNS4-----A---- ,/,/Z:------------- bankomaty/bankomat/NNIP4-----A---- či/či/J^------------- pobočky/pobočka/NNFP4-----A---- ././Z:-------------"
"440";"Protože/protože/J,------------- jsem/být/VB-S---1P-AAI-- zatím/zatím/Db------------- takhle/takhle/Db------------- stabilní/stabilní/AAIS4----1A----";"vztah/vztah/NNIS4-----A---- v/v/RR--6---------- podstatě/podstata/NNFS6-----A---- neměla/mít/VpFS----R-NAI-- ,/,/Z:------------- nevím/vědět/VB-S---1P-NAI-- ,/,/Z:------------- jestli/jestli/J,------------- je/být/VB-S---3P-AAI-- chyba/chyba/NNFS1-----A---- ve/v/RV--6---------- mně/já/PP-S6--1------- a/a/J^------------- jsem/být/VB-S---1P-AAI-- prostě/prostě/TT------------- nastavená/nastavený/AAFS1----1A---- jenom/jen/Db------------- na/na/RR--4---------- racionální/racionální/AANS4----1A---- jednání/jednání/NNNS4-----A---- ,/,/Z:------------- anebo/anebo/J^------------- jsem/být/VB-S---1P-AAI-- jinak/jinak/Db------------- normální/normální/AAFS1----1A---- ,/,/Z:------------- ale/ale/J^------------- v/v/RR--6---------- tomhle/tenhle/PDIS6---------- případě/případ/NNIS6-----A---- se/se/P7--4---------- chovám/chovat/VB-S---1P-AAI--";"takhle/takhle/Db------------- divně/divně/Dg-------1A---- ././Z:-------------"
"441";"Neměl/mít/VpMS----R-NAI-- jsem/být/VB-S---1P-AAI-- nikdy/nikdy/Db------------- nepřátelský/přátelský/AAIS4----1N----";"vztah/vztah/NNIS4-----A---- s/s/RR--7---------- žádným/žádný/PWMS7---------- autorem/autor/NNMS7-----A---- a/a/J^------------- nevím/vědět/VB-S---1P-NAI-- ,/,/Z:------------- jestli/jestli/J,------------- někdo/někdo/PZM-1---------- choval/chovat/VpMS----R-AAI--";"takový/takový/PDIS4---------- ke/k/RV--3---------- mně/já/PP-S3--1------- ././Z:-------------"
"442";"Není/být/VB-S---3P-NAI-- důvod/důvod/NNIS1-----A---- mít/mít/Vf--------A-I-- se/s/RV--7---------- zřizovatelem/zřizovatel/NNMS7-----A---- špatné/špatný/AAIP4----1A---- nebo/nebo/J^------------- odtažité/odtažitý/AAIP4----1A----";"vztahy/vztah/NNIP4-----A---- ,/,/Z:------------- navíc/navíc/Db------------- když/když/J,------------- se/se/P7--4---------- k/k/RR--3---------- nám/my/PP-P3--1------- město/město/NNNS1-----A---- Brno/Brno/NNNS1-----A---- chová/chovat/VB-S---3P-AAI--";"velmi/velmi/Db------------- solidně/solidně/Dg-------1A---- a/a/J^------------- velkoryse/velkoryse/Dg-------1A---- ././Z:-------------"
"443";"Hrad/hrad/NNIS1-----A---- je/být/VB-S---3P-AAI-- mimo/mimo/RR--4---------- jiné/jiný/AANS4----1A---- zajímavý/zajímavý/AANS4----1A---6 i/i/J^------------- tím/ten/PDNS7---------- ,/,/Z:------------- jak/jak/Db------------- se/se/P7--4---------- zapsal/zapsat/VpMS----R-AAP-- do/do/RR--2---------- života/život/NNIS2-----A---- císaře/císař/NNMS2-----A---- Karla/Karel/NNMS2-----A---- IV/IV/C}------------- ././Z0------------- a/a/J^------------- jaký/jaký/P4IS4----------";"vztah/vztah/NNIS4-----A---- k/k/RR--3---------- němu/on/P5MS3--3------- tento/tento/PDMS1---------- panovník/panovník/NNMS1-----A---- choval/chovat/VpMS----R-AAI--";"././Z:-------------"
"444";"Bílý/bílý/AAIS1----1A---- dům/dům/NNIS1-----A---- pouze/pouze/Db------------- informoval/informovat/VpIS----R-AAB-- ,/,/Z:------------- že/že/J,------------- prezident/prezident/NNMS1-----A---- „/""/Z:------------- vyjádří/vyjádřit/VB-S---3P-AAP-- některé/některý/PZIP4---------- nové/nový/AAIP4----1A---- názory/názor/NNIP4-----A---- na/na/RR--4---------- americkoevropské/americkoevropský/AAIP4----1A----";"vztahy/vztah/NNIP4-----A---- a/a/J^------------- na/na/RR--4---------- to/ten/PDNS4---------- ,/,/Z:------------- jak/jak/Db------------- se/se/P7--4---------- USA/USA/BN------------- hodlají/hodlat/VB-P---3P-AAI-- chovat/chovat/Vf--------A-I--";"v/v/RR--6---------- nové/nový/AAFS6----1A---- situaci/situace/NNFS6-----A---- ,/,/Z:------------- kdy/kdy/Db------------- Východ/východ/NNIS1-----A---- začíná/začínat/VB-S---3P-AAI-- spolupracovat/spolupracovat/Vf--------A-I-- se/s/RV--7---------- Západem/západ/NNIS7-----A---- “/""/Z:------------- ././Z:-------------"
"445";"Podle/podle/RR--2---------- nich/oni/P5MP2--3------- je/být/VB-S---3P-AAI-- v/v/RR--6---------- lidské/lidský/AAFS6----1A---- přirozenosti/přirozenost/NNFS6-----A---- si/se/P7--3----------";"vztahy/vztah/NNIP4-----A---- idealizovat/idealizovat/Vf--------A-B-- a/a/J^------------- věřit/věřit/Vf--------A-I-- ,/,/Z:------------- že/že/J,------------- když/když/J,------------- k/k/RR--3---------- někomu/někdo/PZM-3---------- chováme/chovat/VB-P---1P-AAI--";"náklonnost/náklonnost/NNFS4-----A---- ,/,/Z:------------- bude/být/VB-S---3F-AAI-- ji/on/PPFS4--3------- opětovat/opětovat/Vf--------A-I-- ././Z:-------------"
"446";"Je/být/VB-S---3P-AAI-- náročná/náročný/AAFS1----1A---- na/na/RR--4---------- mezilidské/mezilidský/AAIP4----1A----";"vztahy/vztah/NNIP4-----A---- ,/,/Z:------------- lidi/člověk/NNMP1-----A---1 jsou/být/VB-P---3P-AAI-- k/k/RR--3---------- sobě/se/P6--3---------- ostří/ostrý/AAMP1----1A---- ,/,/Z:------------- člověk/člověk/NNMS1-----A---- se/se/P7--4---------- musí/muset/VB-S---3P-AAI-- chovat/chovat/Vf--------A-I--";"superprofesionálně/superprofesionálně/X@------------- ,/,/Z:------------- nikdo/nikdo/PWM-1---------- vám/vy/PP-P3--2------- nic/nic/PW--4---------- neodpustí/odpustit/VB-S---3P-NAP-- ,/,/Z:------------- “/""/Z:------------- uvedl/uvést/VpMS----R-AAP-- Ivo/Ivo/NNMS1-----A---- Toman/Toman/NNMS1-----A---- ././Z:-------------"
"447";"Podle/podle/RR--2---------- chování/chování/NNNS2-----A---- všech/všechen/PLMP2---------- tří/tři/ClMP2---------- mužů/muž/NNMP2-----A---- si/se/P7--3---------- nebyli/být/VpMP----R-NAI-- jisti/jistý/ACMP------A---- ,/,/Z:------------- s/s/RR--7---------- kterým/který/P4MS7---------- z/z/RR--2---------- nich/oni/P5MP2--3------- má/mít/VB-S---3P-AAI--";"vztah/vztah/NNIS4-----A---- ,/,/Z:------------- všichni/všechen/PLMP1---------- se/se/P7--4---------- k/k/RR--3---------- ní/on/P5FS3--3------- chovali/chovat/VpMP----R-AAI--";"až/až/TT------------- moc/moc/Db------------- důvěrně/důvěrně/Dg-------1A---- ././Z:-------------"
"448";"„/""/Z:------------- Pod/pod/RR--7---------- záminkou/záminka/NNFS7-----A---- péče/péče/NNFS2-----A---- ze/ze/RV--2---------- strany/strana/NNFS2-----A---- rodiny/rodina/NNFS2-----A---- ,/,/Z:------------- s/s/RR--7---------- níž/jenž/P9FS7---------- desítky/desítka/NNFP4-----A---- let/léta/NNNP2-----A---- neměla/mít/VpFS----R-NAI-- dobré/dobrý/AAIP4----1A----";"vztahy/vztah/NNIP4-----A---- ,/,/Z:------------- protože/protože/J,------------- se/se/P7--4---------- k/k/RR--3---------- ní/on/P5FS3--3------- jediná/jediný/AAFS1----1A---- dcera/dcera/NNFS1-----A---- ,/,/Z:------------- její/její/PSMS1FS3------- manžel/manžel/NNMS1-----A---- a/a/J^------------- pět/pět/Cn-S4---------- vnoučat/vnouče/NNNP2-----A---- nechovali/chovat/VpMP----R-NAI--";"vždy/vždy/Db------------- dobře/dobře/Dg-------1A---- ,/,/Z:------------- prodala/prodat/VpFS----R-AAP-- v/v/RR--6---------- létě/léto/NNNS6-----A---- 2018/2018/C=------------- zcela/zcela/Db------------- pod/pod/RR--7---------- cenou/cena/NNFS7-----A---- svému/svůj/P8MS3---------- vnukovi/vnuk/NNMS3-----A---- Tomášovi/Tomáš/NNMS3-----A---1 novostavbu/novostavba/NNFS4-----A---- na/na/RR--6---------- Mělnicku/Mělnicko/NNNS6-----A---- ,/,/Z:------------- která/který/P4FS1---------- měla/mít/VpFS----R-AAI-- dvakrát/dvakrát/Cv------------- takovou/takový/PDFS4---------- hodnotu/hodnota/NNFS4-----A---- ././Z:-------------"
"449";"Zároveň/zároveň/Db------------- má/mít/VB-S---3P-AAI-- ale/ale/J^------------- s/s/RR--7---------- nemocnicemi/nemocnice/NNFP7-----A---- dobré/dobrý/AAIP4----1A----";"vztahy/vztah/NNIP4-----A---- ,/,/Z:------------- chová/chovat/VB-S---3P-AAI--";"se/se/P7--4---------- k/k/RR--3---------- nim/oni/P5IP3--3------- partnersky/partnersky/Dg-------1A---- a/a/J^------------- to/ten/PDNS1---------- je/být/VB-S---3P-AAI-- třeba/třeba/Db------------- dostat/dostat/Vf--------A-P-- i/i/J^------------- do/do/RR--2---------- pojišťovny/pojišťovna/NNFS2-----A---- ././Z:-------------"
"450";"Ale/ale/J^------------- když/když/J,------------- vám/vy/PP-P3--2------- řeknu/říci/VB-S---1P-AAP-- ,/,/Z:------------- že/že/J,------------- každou/každý/PLFS4---------- volnou/volný/AAFS4----1A---- chvíli/chvíle/NNFS4-----A---- jezdím/jezdit/VB-S---1P-AAI-- právě/právě/Db------------- sem/sem/Db------------- ,/,/Z:------------- žádná/žádný/PWFS1---------- jiná/jiný/AAFS1----1A---- dovolená/dovolená/NNFS1-----A---- pro/pro/RR--4---------- mě/já/PH-S4--1------- neexistuje/existovat/VB-S---3P-NAI-- ,/,/Z:------------- asi/asi/TT------------- to/ten/PDNS1---------- mluví/mluvit/VB-S---3P-AAI-- za/za/RR--4---------- vše/všechen/PLNS4---------1 a/a/J^------------- vypovídá/vypovídat/VB-S---3P-AAI-- to/ten/PDNS1---------- zcela/zcela/Db------------- jednoznačně/jednoznačně/Dg-------1A---- o/o/RR--6---------- tom/ten/PDNS6---------- ,/,/Z:------------- jaký/jaký/P4IS4----------";"vztah/vztah/NNIS4-----A---- k/k/RR--3---------- tomuto/tento/PDNS3---------- místu/místo/NNNS3-----A---- chovám/chovat/VB-S---1P-AAI--";"././Z:-------------"
"451";"Kdyby/kdyby|být/J,-------------|Vc----------I-- člověk/člověk/NNMS1-----A---- nevzhlížel/vzhlížet/VpMS----R-NAI-- vzhůru/vzhůru/Db------------- ,/,/Z:------------- nebyl/být/VpMS----R-NAI-- přitahován/přitahovat/VsMS------API-- převyšujícím/převyšující/AGMS7-----A---- a/a/J^------------- netoužil/toužit/VpMS----R-NAI-- po/po/RR--6---------- něm/on/P5MS6--3------- ,/,/Z:------------- netušil/tušit/VpMS----R-NAI-- by/být/Vc----------I-- ani/ani/J^------------- ,/,/Z:------------- co/co/PQ--1---------- je/být/VB-S---3P-AAI-- Země/země/NNFS1-----A---- ,/,/Z:------------- a/a/J^------------- neměl/mít/VpMS----R-NAI-- by/být/Vc----------I-- k/k/RR--3---------- ní/on/P5FS3--3------- onen/onen/PDIS4----------";"vztah/vztah/NNIS4-----A---- ,/,/Z:------------- který/který/P4IS1---------- podstatně/podstatně/Dg-------1A---- určuje/určovat/VB-S---3P-AAI-- jeho/jeho/PSNS4-S3------- lidství/lidství/NNNS4-----A---- :/:/Z:------------- nevěděl/vědět/VpMS----R-NAI-- by/být/Vc----------I-- ,/,/Z:------------- že/že/J,------------- Země/země/NNFS1-----A---- je/být/VB-S---3P-AAI-- kolébka/kolébka/NNFS1-----A---- i/i/J^------------- rakev/rakev/NNFS1-----A---- a/a/J^------------- nechoval/chovat/VpMS----R-NAI--";"by/být/Vc----------I-- se/se/P7--4---------- k/k/RR--3---------- ní/on/P5FS3--3------- jako/jako/J,------------- ke/k/RV--3---------- své/svůj/P8FS3---------1 kolébce/kolébka/NNFS3-----A---- a/a/J^------------- rakvi/rakev/NNFS3-----A---- ././Z:-------------"
"452";"Jejich/jejich/PSIS4-P3-------";"vztah/vztah/NNIS4-----A---- popisují/popisovat/VB-P---3P-AAI-- tak/tak/Db------------- ,/,/Z:------------- že/že/J,------------- se/se/P7--4---------- Sergio/Sergio/NNMS1-----A---- ,/,/Z:------------- šéf/šéf/NNMS1-----A---- hotelové/hotelový/AAFS2----1A---- recepce/recepce/NNFS2-----A---- Interclub/Interclub/X@------------- Atlántic/Atlántic/X@------------- v/v/RR--6---------- San/San/F%------------- Agustínu/Agustín/NNMS6-----A---1 ,/,/Z:------------- choval/chovat/VpMS----R-AAI--";"majetnicky/majetnicky/Dg-------1A---- ././Z:-------------"
"453";"Domnívám/domnívat/VB-S---1P-AAI-- se/se/P7--4---------- ,/,/Z:------------- že/že/J,------------- toto/tento/PDNS4---------- napětí/napětí/NNNS4-----A---- je/být/VB-S---3P-AAI-- třeba/třeba/Db------------- překonat/překonat/Vf--------A-P-- ,/,/Z:------------- a/a/J^------------- to/ten/PDNS1---------- s/s/RR--7---------- pomocí/pomoc/NNFS7-----A---- lidí/člověk/NNMP2-----A---- obdařených/obdařený/AAMP2----1A---- novým/nový/AANS7----1A---- myšlením/myšlení/NNNS7-----A---- ,/,/Z:------------- kteří/který/P4MP1---------- veřejně/veřejně/Dg-------1A---- vznesou/vznést/VB-P---3P-AAP-- otázku/otázka/NNFS4-----A---- :/:/Z:------------- proč/proč/Db------------- Rusko/Rusko/NNNS1-----A---- může/moci/VB-S---3P-AAI-- spolupracovat/spolupracovat/Vf--------A-I-- s/s/RR--7---------- NATO/NATO/BN------------- ,/,/Z:------------- rozvíjet/rozvíjet/Vf--------A-I--";"vztahy/vztah/NNIP4-----A---- s/s/RR--7---------- USA/USA/BN------------- a/a/J^------------- hledat/hledat/Vf--------A-I-- nové/nový/AAFP4----1A---- cesty/cesta/NNFP4-----A---- spolupůsobení/spolupůsobení/NNNS2-----A---- s/s/RR--7---------- NATO/NATO/BN------------- ,/,/Z:------------- a/a/J^------------- člen/člen/NNMS1-----A---- tohoto/tento/PDNS2---------- uskupení/uskupení/NNNS2-----A---- ,/,/Z:------------- Česko/Česko/NNNS1-----A---- ,/,/Z:------------- se/se/P7--4---------- stejně/stejně/Dg-------1A---- chovat/chovat/Vf--------A-I--";"nemůže/moci/VB-S---3P-NAI-- ?/?/Z:-------------"
"454";"Je/být/VB-S---3P-AAI-- krásné/krásný/AANS1----1A---- mít/mít/Vf--------A-I-- pevné/pevný/AAIP4----1A---- rodinné/rodinný/AAIP4----1A----";"vztahy/vztah/NNIP4-----A---- ,/,/Z:------------- je/být/VB-S---3P-AAI-- krásné/krásný/AANS1----1A---- mít/mít/Vf--------A-I-- tak/tak/Db------------- blízko/blízko/Dg-------1A---- u/u/RR--2---------- sebe/se/P6--2---------- spřízněnou/spřízněný/AAFS4----1A---- duši/duše/NNFS4-----A---- a/a/J^------------- stát/stát/Vf--------A-I-- při/při/RR--6---------- sobě/se/P6--6---------- v/v/RR--6---------- dobrém/dobrý/AANS6----1A---- i/i/J^------------- zlém/zlý/AANS6----1A---- ,/,/Z:------------- “/""/Z:------------- vyznala/vyznat/VpFS----R-AAP-- Monika/Monika/NNFS1-----A---- city/cit/NNIP4-----A---- ,/,/Z:------------- které/který/P4IP4---------- chová/chovat/VB-S---3P-AAI--";"k/k/RR--3---------- mladší/mladý/AAFS3----2A---- sestřičce/sestřička/NNFS3-----A---- ././Z:-------------"
"455";"Ale/ale/J^------------- Dalibor/Dalibor/NNMS1-----A---- patří/patřit/VB-S---3P-AAI-- do/do/RR--2---------- té/ten/PDFS2---------- nevelké/velký/AAFS2----1N---- skupiny/skupina/NNFS2-----A---- hráčů/hráč/NNMP2-----A---- ,/,/Z:------------- s/s/RR--7---------- nimiž/jenž/P9MP7---------- jsem/být/VB-S---1P-AAI-- si/se/P7--3---------- vytvořil/vytvořit/VpMS----R-AAP-- nadstandardní/nadstandardní/AAIS4----1A----";"vztah/vztah/NNIS4-----A---- ,/,/Z:------------- dalo/dát/VpNS----R-AAP-- by/být/Vc----------I-- se/se/P7--4---------- říct/říci/Vf--------A-P-- ,/,/Z:------------- že/že/J,------------- k/k/RR--3---------- sobě/se/P6--3---------- chováme/chovat/VB-P---1P-AAI--";"vzájemnou/vzájemný/AAFS4----1A---- úctu/úcta/NNFS4-----A---- ././Z:------------- ""/""/Z:-------------"
"456";"Třikrát/třikrát/Cv------------- se/se/P7--4---------- jednalo/jednat/VpNS----R-AAI-- o/o/RR--4----------";"vztahy/vztah/NNIP4-----A---- zletilých/zletilý/AAFP2----1A---- dětí/dítě/NNFP2-----A---- vůči/vůči/RR--3---------- rodičům/rodič/NNMP3-----A---- ,/,/Z:------------- jednou/jednou/Db------------- se/se/P7--4---------- pak/pak/Db------------- násilnicky/násilnicky/Dg-------1A---- choval/chovat/VpMS----R-AAI--";"otec/otec/NNMS1-----A---- k/k/RR--3---------- dospělé/dospělý/AAFS3----1A---- dceři/dcera/NNFS3-----A---- ,/,/Z:------------- ""/""/Z:------------- uvedl/uvést/VpMS----R-AAP-- Drahomír/Drahomír/NNMS1-----A---- Ševčík/Ševčík/NNMS1-----A---- ze/z/RV--2---------- Střediska/středisko/NNNS2-----A---- sociální/sociální/AAFS2----1A---- prevence/prevence/NNFS2-----A---- ././Z:-------------"
"457";"Nijak/nijak/Db------------- vřelý/vřelý/AAIS4----1A----";"vztah/vztah/NNIS4-----A---- k/k/RR--3---------- němu/on/P5IS3--3------- nechová/chovat/VB-S---3P-NAI--";"ani/ani/J^------------- lídr/lídr/NNMS1-----A---- republikánské/republikánský/AAFS2----1A---- většiny/většina/NNFS2-----A---- v/v/RR--6---------- Senátu/senát/NNIS6-----A---1 Mitch/Mitch/NNMS1-----A---- McConnell/McConnell/NNMS1-----A---- ././Z:-------------"
"458";"Mesiášská/mesiášský/AAFS1----1A---- podstata/podstata/NNFS1-----A---- počítače/počítač/NNIS2-----A---- se/se/P7--4---------- už/už/Db------------- projevila/projevit/VpFS----R-AAP-- ,/,/Z:------------- když/když/J,------------- příslušní/příslušný/AAMP1----1A---- výborně/výborně/Dg-------1A---- placení/placený/AAMP1----1A---- odborníci/odborník/NNMP1-----A---- na/na/RR--6---------- exkluzívních/exkluzivní/AAFP6----1A---- univerzitách/univerzita/NNFP6-----A---- ""/""/Z:------------- nakrmili/nakrmit/VpMP----R-AAP-- ""/""/Z:------------- počítač/počítač/NNIS4-----A---- vším/všechen/PLNS7---------- ,/,/Z:------------- co/co/PQ--1---------- obnáší/obnášet/VB-S---3P-AAI-- lidské/lidský/AAIP4----1A----";"vztahy/vztah/NNIP4-----A---- ,/,/Z:------------- a/a/J^------------- vyšlo/vyjít/VpNS----R-AAP-- jim/oni/PPMP3--3------- ,/,/Z:------------- že/že/J,------------- jedině/jedině/Db------------- možná/možná/TT------------- morálka/morálka/NNFS1-----A---- ,/,/Z:------------- která/který/P4FS1---------- zachrání/zachránit/VB-S---3P-AAP-- lidstvo/lidstvo/NNNS4-----A---- ,/,/Z:------------- je/být/VB-S---3P-AAI-- následující/následující/AGNS1-----A---- :/:/Z:------------- ""/""/Z:------------- V/v/RR--6---------- prvním/první/CrIS6---------- kroku/krok/NNIS6-----A---- se/se/P7--4---------- chovej/chovat/Vi-S---2--A-I-- k/k/RR--3---------- druhému/druhý/CrMS3---------- vstřícně/vstřícně/Dg-------1A---- ,/,/Z:------------- v/v/RR--6---------- druhém/druhý/CrIS6---------- kroku/krok/NNIS6-----A---- se/se/P7--4---------- chovej/chovat/Vi-S---2--A-I--";"jako/jako/J,------------- on/on/PPMS1--3------- ././Z:-------------"
"459";"""/""/Z:------------- Anketě/anketa/NNFS3-----A---- rozdělení/rozdělení/NNNS2-----A---- na/na/RR--4---------- dvě/dva/ClFP4---------- půlroční/půlroční/AAFP4----1A---- části/část/NNFP4-----A---- určitě/určitě/TT------------- přidalo/přidat/VpNS----R-AAP-- na/na/RR--6---------- objektivitě/objektivita/NNFS6-----A---- ,/,/Z:------------- a/a/J^------------- to/ten/PDNS4---------- neříkám/říkat/VB-S---1P-NAI-- jen/jen/Db------------- kvůli/kvůli/RR--3---------- své/svůj/P8FS3---------1 letošní/letošní/AAFS3----1A---- výhře/výhra/NNFS3-----A---- ,/,/Z:------------- ""/""/Z:------------- prohodil/prohodit/VpMS----R-AAP-- před/před/RR--7---------- vyhlášením/vyhlášení/NNNS7-----A---- ,/,/Z:------------- při/při/RR--6---------- němž/jenž/P9NS6---------- mu/on/PHMS3--3------- cenu/cena/NNFS4-----A---- předali/předat/VpMP----R-AAP-- František/František/NNMS1-----A---- Veselý/Veselý/NNMS1-----A---- za/za/RR--7---------- internacionály/internacionál/NNMP7-----A---- a/a/J^------------- Martin/Martin/NNMS1-----A---- Hašek/Hašek/NNMS1-----A---- za/za/RR--4---------- současné/současný/AAMP4----1A---- hráče/hráč/NNMP4-----A---- ././Z:------------- ""/""/Z:------------- K/k/RR--3---------- různým/různý/AAMP3----1A---- novinářům/novinář/NNMP3-----A---- mám/mít/VB-S---1P-AAI-- sice/sice/J^------------- také/také/Db------------- různý/různý/AAIS4----1A----";"vztah/vztah/NNIS4-----A---- ,/,/Z:------------- ale/ale/J^------------- celkově/celkově/Dg-------1A---- mohu/moci/VB-S---1P-AAI-1 říci/říci/Vf--------A-P-- ,/,/Z:------------- že/že/J,------------- obě/oba/ClFP1---------- strany/strana/NNFP1-----A---- se/se/P7--4---------- k/k/RR--3---------- sobě/se/P6--3---------- v/v/RR--6---------- poslední/poslední/AAFS6----1A---- době/doba/NNFS6-----A---- chovají/chovat/VB-P---3P-AAI--";"mnohem/mnohem/Db------------- profesionálněji/profesionálně/Dg-------2A---- ././Z:-------------"
"460";"Cílem/cíl/NNIS7-----A---- společnosti/společnost/NNFS2-----A---- SELIKO/Seliko/NNNS1-----A---- trading/trading/F%------------- ,/,/Z:------------- a/a/BA------------- ././Z0------------- s/s/BN------------- ././Z0------------- ,/,/Z:------------- je/být/VB-S---3P-AAI-- udržovat/udržovat/Vf--------A-I-- dobré/dobrý/AAIP4----1A----";"vztahy/vztah/NNIP4-----A---- s/s/RR--7---------- jednotlivými/jednotlivý/AAMP7----1A---- sousedy/soused/NNMP7-----A---- ,/,/Z:------------- chovat/chovat/Vf--------A-I--";"se/se/P7--4---------- šetrně/šetrně/Dg-------1A---- k/k/RR--3---------- životnímu/životní/AANS3----1A---- prostředí/prostředí/NNNS3-----A---- tak/tak/Db------------- ,/,/Z:------------- abychom/aby|být/J,-------------|Vc-P---1----I-- našim/náš/PSMP3-P1------- potomkům/potomek/NNMP3-----A---- mohli/moci/VpMP----R-AAI-- předat/předat/Vf--------A-P-- naši/náš/PSFS4-P1------- zem/země/NNFS4-----A---- v/v/RR--6---------- dobrém/dobrý/AAIS6----1A---- stavu/stav/NNIS6-----A---- ././Z:-------------"
"461";"Najednou/najednou/Db------------- pak/pak/Db------------- přehodnotíte/přehodnotit/VB-P---2P-AAP--";"vztah/vztah/NNIS4-----A---- k/k/RR--3---------- pacientovi/pacient/NNMS3-----A---- a/a/J^------------- začnete/začít/VB-P---2P-AAP-- se/se/P7--4---------- k/k/RR--3---------- němu/on/P5MS3--3------- chovat/chovat/Vf--------A-I--";"trochu/trochu/Db------------- jinak/jinak/Db------------- ././Z:-------------"
"462";"Prezidentovi/prezidentův/AUMP1M--------- lidé/člověk/NNMP1-----A---- a/a/J^------------- tým/tým/NNIS1-----A---- Andreje/Andrej/NNMS2-----A---- Babiše/Babiš/NNMS2-----A---- k/k/RR--3---------- sobě/se/P6--3---------- nicméně/nicméně/J^------------- příliš/příliš/Db------------- vřelé/vřelý/AAIP1----1A----";"vztahy/vztah/NNIP4-----A---- nechovají/chovat/VB-P---3P-NAI--";"././Z:-------------"
"463";"Podle/podle/RR--2---------- něj/on/P5MS2--3------- naopak/naopak/TT------------- zákoník/zákoník/NNIS1-----A---- vytvoří/vytvořit/VB-S---3P-AAP-- lepší/dobrý/AAFP4----2A---- podmínky/podmínka/NNFP4-----A---- pro/pro/RR--4---------- pracovněprávní/pracovněprávní/AAIP4----1A----";"vztahy/vztah/NNIP4-----A---- a/a/J^------------- přiměřeně/přiměřeně/Dg-------1A---- ochrání/ochránit/VB-S---3P-AAP-- zaměstnance/zaměstnanec/NNMP4-----A---- před/před/RR--7---------- zaměstnavateli/zaměstnavatel/NNMP7-----A---- ,/,/Z:------------- kteří/který/P4MP1---------- by/být/Vc----------I-- se/se/P7--4---------- k/k/RR--3---------- nim/oni/P5MP3--3------- jinak/jinak/Db------------- nechovali/chovat/VpMP----R-NAI--";"nejlépe/dobře/Dg-------3A---- ././Z:-------------"
