id;left;kwic;right
"129";"Kanadský/kanadský/AAIS1----1A---- snímek/snímek/NNIS1-----A---- v/v/RR--6---------- několika/několik/Ca--6---------- pohledech/pohled/NNIP6-----A---- vypráví/vyprávět/VB-S---3P-AAI-- příběhy/příběh/NNIP4-----A---- šestnáctiletého/šestnáctiletý/AAMS2----1A---- Guillauma/Guillaume/NNMS2-----A---- ,/,/Z:------------- který/který/P4MS1---------- se/se/P7--4---------- na/na/RR--6---------- soukromé/soukromý/AAFS6----1A---- chlapecké/chlapecký/AAFS6----1A---- škole/škola/NNFS6-----A---- zamiluje/zamilovat/VB-S---3P-AAP-- do/do/RR--2---------- svého/svůj/P8MS2---------- nejlepšího/dobrý/AAMS2----3A---- přítele/přítel/NNMS2-----A---- ,/,/Z:------------- jeho/jeho/PSFS2-S3------- osmnáctileté/osmnáctiletý/AAFS2----1A---- sestry/sestra/NNFS2-----A---- Charlotte/Charlotte/NNFS1-----A---- ,/,/Z:------------- které/který/P4FS3---------- přítel/přítel/NNMS1-----A---- k/k/RR--3---------- jejímu/její/PSNS3FS3------- překvapení/překvapení/NNNS3-----A---- navrhne/navrhnout/VB-S---3P-AAP-- otevřený/otevřený/AAIS4----1A----";"vztah/vztah/NNIS4-----A---- ,/,/Z:------------- a/a/J^------------- dvanáctiletého/dvanáctiletý/AAMS4----1A---- Félixe/Felix/NNMS4-----A---- ,/,/Z:------------- jenž/jenž/PJMS1---------- neví/vědět/VB-S---3P-NAI-- ,/,/Z:------------- jak/jak/J,------------- se/se/P7--4---------- na/na/RR--6---------- letním/letní/AAIS6----1A---- táboře/tábor/NNIS6-----A---1 chovat/chovat/Vf--------A-I--";"k/k/RR--3---------- vytoužené/vytoužený/AAFS3----1A---- Béatrice/Beatrice/NNFS3-----A---- ././Z:-------------"
"130";"Šenk/Šenk/NNMS1-----A---- ve/v/RV--6---------- svých/svůj/P8FP6---------- výpovědích/výpověď/NNFP6-----A---- přiznal/přiznat/VpMS----R-AAP-- ,/,/Z:------------- že/že/J,------------- měl/mít/VpMS----R-AAI-- s/s/RR--7---------- Melicharovou/Melicharův/AUFS7M--------- manželkou/manželka/NNFS7-----A---- důvěrný/důvěrný/AAIS4----1A----";"vztah/vztah/NNIS4-----A---- a/a/J^------------- těžce/těžce/Dg-------1A---- nesl/nést/VpMS----R-AAI-- ,/,/Z:------------- že/že/J,------------- se/se/P7--4---------- k/k/RR--3---------- ní/on/P5FS3--3------- její/její/PSMS1FS3------- manžel/manžel/NNMS1-----A---- choval/chovat/VpMS----R-AAI--";"hrubě/hrubě/Dg-------1A---- ././Z:-------------"
"131";",/,/Z:------------- přilil/přilít/VpMS----R-AAP-- olej/olej/NNIS4-----A---- do/do/RR--2---------- ohně/oheň/NNIS2-----A---- Sean/Sean/NNMS1-----A---- Parker/Parker/NNMS1-----A---- ,/,/Z:------------- spoluzakladatel/spoluzakladatel/NNMS1-----A---- Napsteru/Napster/NNIS2-----A---- a/a/J^------------- bývalý/bývalý/AAMS1----1A---- prezident/prezident/NNMS1-----A---- Facebooku/Facebook/NNIS2-----A---- -/-/Z:------------- namísto/namísto/RR--2---------- toho/ten/PDNS2---------- ,/,/Z:------------- aby/aby|být/J,-------------|Vc----------I-- mluvil/mluvit/VpMS----R-AAI-- o/o/RR--6---------- léčbě/léčba/NNFS6-----A---- rakoviny/rakovina/NNFS2-----A---- ,/,/Z:------------- jak/jak/Db------------- bylo/být/VpNS----R-AAI-- plánováno/plánovat/VsNS------API-- ,/,/Z:------------- přešel/přejít/VpMS----R-AAP-- během/během/RR--2---------- přednášky/přednáška/NNFS2-----A---- v/v/RR--6---------- National/National/F%------------- Constitution/Constitution/X@------------- Center/Center/F%------------- ve/v/RV--6---------- Philadelphii/Philadelphia/NNFS6-----A---- v/v/RR--6---------- listopadu/listopad/NNIS6-----A---- loňského/loňský/AAIS2----1A---- roku/rok/NNIS2-----A---1 k/k/RR--3---------- sociálním/sociální/AAFP3----1A---- sítím/síť/NNFP3-----A---- :/:/Z:------------- „/""/Z:------------- Facebook/Facebook/NNIS1-----A---- doslova/doslova/Db------------- změnil/změnit/VpIS----R-AAP-- náš/náš/PSIS4-P1-------";"vztah/vztah/NNIS4-----A---- ke/k/RV--3---------- společnosti/společnost/NNFS3-----A---- i/i/J^------------- to/ten/PDNS4---------- ,/,/Z:------------- jak/jak/Db------------- se/se/P7--4---------- chováme/chovat/VB-P---1P-AAI--";"k/k/RR--3---------- sobě/se/P6--3---------- navzájem/navzájem/Db------------- ././Z:------------- “/""/Z:------------- A/a/J^------------- přidal/přidat/VpMS----R-AAP-- větu/věta/NNFS4-----A---- ,/,/Z:------------- která/který/P4FS1---------- pak/pak/Db------------- po/po/RR--4---------- celé/celý/AAIP4----1A---- dlouhé/dlouhý/AAIP4----1A---- dny/den/NNIP4-----A---- rezonovala/rezonovat/VpFS----R-AAI-- v/v/RR--6---------- mnoha/mnoho/Ca--6---------- názorových/názorový/AAIP6----1A---- sloupečcích/sloupeček/NNIP6-----A---- :/:/Z:------------- „/""/Z:------------- Bůh/bůh/NNMS1-----A---- ví/vědět/VB-S---3P-AAI-- ,/,/Z:------------- co/co/PQ--4---------- to/ten/PDNS1---------- dělá/dělat/VB-S---3P-AAI-- s/s/RR--7---------- mozky/mozek/NNIP7-----A---- našich/náš/PSFP2-P1------- dětí/dítě/NNFP2-----A---- ././Z:------------- “/""/Z:-------------"
"132";"";"Vztah/vztah/NNIS4-----A---- k/k/RR--3---------- přírodě/příroda/NNFS3-----A---- však/však/J^------------- mám/mít/VB-S---1P-AAI-- silný/silný/AAIS4----1A---- a/a/J^------------- myslím/myslet/VB-S---1P-AAI-- ,/,/Z:------------- že/že/J,------------- by/být/Vc----------I-- se/se/P7--4---------- k/k/RR--3---------- ní/on/P5FS3--3------- -/-/Z:------------- ale/ale/J^------------- i/i/J^------------- k/k/RR--3---------- sobě/se/P6--3---------- -/-/Z:------------- měli/mít/VpMP----R-AAI-- lidé/člověk/NNMP1-----A---- chovat/chovat/Vf--------A-I--";"lépe/dobře/Dg-------2A---- ././Z:-------------"
"133";"Sedlák/sedlák/NNMS1-----A---- má/mít/VB-S---3P-AAI-- nadefinovány/nadefinovat/VsIP------APP--";"vztahy/vztah/NNIP4-----A---- k/k/RR--3---------- jednotlivým/jednotlivý/AAMP3----1A---- lidem/člověk/NNMP3-----A---- ,/,/Z:------------- objektům/objekt/NNIP3-----A---- i/i/J^------------- lokalitám/lokalita/NNFP3-----A---- a/a/J^------------- podle/podle/RR--2---------- toho/ten/PDNS2---------- se/se/P7--4---------- chová/chovat/VB-S---3P-AAI--";"././Z:-------------"
"134";"Zvláštní/zvláštní/AAIS4----1A----";"vztah/vztah/NNIS4-----A---- chová/chovat/VB-S---3P-AAI--";"Adolf/Adolf/NNMS1-----A---- Born/Born/NNMS1-----A---- k/k/RR--3---------- Machovi/Mach/NNMS3-----A---- a/a/J^------------- Šebestové/Šebestová/NNFS3-----A---- ././Z:-------------"
"135";"V/v/RR--6---------- každém/každý/PLIS6---------- případě/případ/NNIS6-----A---- však/však/J^------------- pro/pro/RR--4----------";"vztah/vztah/NNIS4-----A---- k/k/RR--3---------- nemluvňatům/nemluvně/NNNP3-----A---- platí/platit/VB-S---3P-AAI-- :/:/Z:------------- nechovejme/chovat/Vi-P---1--N-I--";"se/se/P7--4---------- k/k/RR--3---------- nim/oni/P5MP3--3------- jako/jako/J,------------- k/k/RR--3---------- nemocným/nemocný/NNMP3-----A---- ,/,/Z:------------- tím/ten/PDNS7---------- jim/oni/PPMP3--3------- lze/lze/Db------------- jenom/jen/Db------------- uškodit/uškodit/Vf--------A-P-- ././Z:-------------"
"136";"";"Vztah/vztah/NNIS4-----A---- k/k/RR--3---------- nim/oni/P5MP3--3------- jsme/být/VB-P---1P-AAI-- měli/mít/VpMP----R-AAI-- osobní/osobní/AAIS4----1A---- ,/,/Z:------------- přátelský/přátelský/AAIS4----1A---- ,/,/Z:------------- zároveň/zároveň/Db------------- jsme/být/VB-P---1P-AAI-- ale/ale/J^------------- všichni/všechen/PLMP1---------- respektovali/respektovat/VpMP----R-AAI-- jejich/jejich/PSIP4-P3------- pokyny/pokyn/NNIP4-----A---- ,/,/Z:------------- jak/jak/Db------------- se/se/P7--4---------- chovat/chovat/Vf--------A-I--";"././Z:-------------"
"137";"Taky/také/Db------------- jsme/být/VB-P---1P-AAI-- na/na/RR--4---------- to/ten/PDNS4---------- doplatili/doplatit/VpMP----R-AAP-- a/a/J^------------- doplácíme/doplácet/VB-P---1P-AAI-- dodnes/dodnes/Db------------- :/:/Z:------------- že/že/J,------------- jsme/být/VB-P---1P-AAI-- měli/mít/VpMP----R-AAI-- kladný/kladný/AAIS4----1A----";"vztah/vztah/NNIS4-----A---- k/k/RR--3---------- naprosto/naprosto/Db------------- vzdáleným/vzdálený/AAIP3----1A---- národům/národ/NNIP3-----A---- ,/,/Z:------------- o/o/RR--6---------- kterých/který/P4IP6---------- jsme/být/VB-P---1P-AAI-- chovali/chovat/VpMP----R-AAI--";"iluze/iluze/NNFP4-----A---- ././Z:-------------"
"138";"„/""/Z:------------- Průměrný/průměrný/AAMS1----1A---- chlapec/chlapec/NNMS1-----A---- sleduje/sledovat/VB-S---3P-AAI-- padesát/padesát/Cn-S4---------- pornografických/pornografický/AANP2----1A---- videí/video/NNNP2-----A---- za/za/RR--4---------- týden/týden/NNIS4-----A---- …/.../Z:------------- a/a/J^------------- je/být/VB-S---3P-AAI-- –/-/Z:------------- jak/jak/Db------------- si/se/P7--3---------- pak/pak/Db------------- stěžují/stěžovat/VB-P---3P-AAI-- spolužačky/spolužačka/NNFP1-----A---- na/na/RR--6---------- střední/střední/AAFS6----1A---- škole/škola/NNFS6-----A---- –/-/Z:------------- nepoužitelný/použitelný/AAMS1----1N---- pro/pro/RR--4---------- pěkný/pěkný/AAIS4----1A---- ,/,/Z:------------- romantický/romantický/AAIS4----1A----";"vztah/vztah/NNIS4-----A---- ././Z:------------- “/""/Z:------------- –/-/Z:------------- Jak/jak/Db------------- by/být/Vc----------I-- ne/ne/TT------------- ,/,/Z:------------- když/když/J,------------- od/od/RR--2---------- dob/doba/NNFP2-----A---- Beauvoirové/Beauvoirová/NNFS2-----A---- mu/on/PHMS3--3------- cpou/cpát/VB-P---3P-AAI-- do/do/RR--2---------- hlavy/hlava/NNFS2-----A---- ,/,/Z:------------- že/že/J,------------- jediným/jediný/AAIS7----1A---- pohledem/pohled/NNIS7-----A---- ,/,/Z:------------- gestem/gesto/NNNS7-----A---- či/či/J^------------- slovem/slovo/NNNS7-----A---- může/moci/VB-S---3P-AAI-- dívce/dívka/NNFS3-----A---- zničit/zničit/Vf--------A-P-- celý/celý/AAIS4----1A---- život/život/NNIS4-----A---- ,/,/Z:------------- a/a/J^------------- když/když/J,------------- se/se/P7--4---------- chová/chovat/VB-S---3P-AAI--";"v/v/RR--6---------- souladu/soulad/NNIS6-----A---- s/s/RR--7---------- tím/ten/PDNS7---------- ,/,/Z:------------- jak/jak/Db------------- ho/on/PHMS4--3------- naprogramovala/naprogramovat/VpFS----R-AAP-- příroda/příroda/NNFS1-----A---- ,/,/Z:------------- je/být/VB-S---3P-AAI-- sexistické/sexistický/AANS1----1A---- prase/prase/NNNS1-----A---- ././Z:-------------"
"139";"Měla/mít/VpFS----R-AAI-- k/k/RR--3---------- nim/oni/P5MP3--3------- vřelý/vřelý/AAIS4----1A----";"vztah/vztah/NNIS4-----A---- ,/,/Z:------------- její/její/PSFS1FS3------- rodina/rodina/NNFS1-----A---- je/oni/PPMP4--3------- chovala/chovat/VpFS----R-AAI--";",/,/Z:------------- navíc/navíc/Db------------- její/její/PSMS1FS3------- prastrýc/prastrýc/NNMS1-----A---- Oktavián/Oktavián/NNMS1-----A---- Kinský/Kinský/NNMS1-----A---- byl/být/VpMS----R-AAI-- jedním/jeden/ClMS7---------- z/z/RR--2---------- mužů/muž/NNMP2-----A---- ,/,/Z:------------- kteří/který/P4MP1---------- roku/rok/NNIS2-----A---1 1874/1874/C=------------- zorganizovali/zorganizovat/VpMP----R-AAP-- první/první/CrFS4---------- Velkou/velký/AAFS4----1A---- pardubickou/pardubický/AAFS4----1A---- ././Z:-------------"
"140";"Možná/možná/TT------------- si/se/P7--3---------- svůj/svůj/P8IS4----------";"vztah/vztah/NNIS4-----A---- s/s/RR--7---------- prarodiči/prarodič/NNMP7-----A---- pamatujete/pamatovat/VB-P---2P-AAI-- docela/docela/Db------------- jinak/jinak/Db------------- :/:/Z:------------- měli/mít/VpMP----R-AAI-- jste/být/VB-P---2P-AAI-- před/před/RR--7---------- nimi/oni/P5MP7--3------- obrovský/obrovský/AAIS4----1A---- respekt/respekt/NNIS4-----A---- ,/,/Z:------------- chovali/chovat/VpMP----R-AAI--";"jste/být/VB-P---2P-AAI-- se/se/P7--4---------- slušně/slušně/Dg-------1A---- a/a/J^------------- o/o/RR--6---------- nějakém/nějaký/PZNS6---------- odmlouvání/odmlouvání/NNNS6-----A---- nebo/nebo/J^------------- kamarádíčkování/kamarádíčkování/NNNS6-----A---- nemohlo/moci/VpNS----R-NAI-- být/být/Vf--------A-I-- řeči/řeč/NNFS2-----A---- ././Z:-------------"
"141";"Jde/jít/VB-S---3P-AAI-- o/o/RR--4---------- odlišný/odlišný/AAIS4----1A----";"vztah/vztah/NNIS4-----A---- k/k/RR--3---------- práci/práce/NNFS3-----A---- ,/,/Z:------------- k/k/RR--3---------- výchově/výchova/NNFS3-----A---- dětí/dítě/NNFP2-----A---- ,/,/Z:------------- k/k/RR--3---------- bydlení/bydlení/NNNS3-----A---- ,/,/Z:------------- k/k/RR--3---------- soukromému/soukromý/AAIS3----1A---- majetku/majetek/NNIS3-----A---- obecně/obecně/Dg-------1A---- ,/,/Z:------------- k/k/RR--3---------- tomu/ten/PDNS3---------- ,/,/Z:------------- jak/jak/Db------------- se/se/P7--4---------- sluší/slušet/VB-S---3P-AAI-- chovat/chovat/Vf--------A-I--";"doma/doma/Db------------- a/a/J^------------- jak/jak/Db------------- na/na/RR--6---------- veřejnosti/veřejnost/NNFS6-----A---- ,/,/Z:------------- jak/jak/Db------------- ve/v/RV--6---------- dne/den/NNIS6-----A---2 a/a/J^------------- jak/jak/Db------------- v/v/RR--6---------- noci/noc/NNFS6-----A---- ././Z:-------------"
"142";"Dítě/dítě/NNNS1-----A---- ,/,/Z:------------- které/který/P4NS4---------- tento/tento/PDIS4----------";"vztah/vztah/NNIS4-----A---- prožije/prožít/VB-S---3P-AAP-- jako/jako/J,------------- jistý/jistý/AAIS1----1A---- a/a/J^------------- bezpečný/bezpečný/AAIS1----1A---- ,/,/Z:------------- se/se/P7--4---------- bude/být/VB-S---3F-AAI-- pravděpodobně/pravděpodobně/Dg-------1A---- chovat/chovat/Vf--------A-I--";"jistě/jistě/Dg-------1A---- a/a/J^------------- suverénně/suverénně/Dg-------1A---- i/i/J^------------- ve/v/RV--6---------- všech/všechen/PLIP6---------- svých/svůj/P8IP6---------- budoucích/budoucí/AAIP6----1A---- vztazích/vztah/NNIP6-----A---- ././Z:-------------"
"143";"Zatímco/zatímco/J,------------- partneři/partner/NNMP1-----A---- manipulátorek/manipulátorka/NNFP2-----A---- často/často/Dg-------1A---- prožívají/prožívat/VB-P---3P-AAI-- počáteční/počáteční/AAFS4----1A---- fázi/fáze/NNFS4-----A---- jako/jako/J,------------- šťastné/šťastný/AANS1----1A---- životní/životní/AANS1----1A---- období/období/NNNS1-----A---- ,/,/Z:------------- kdy/kdy/Db------------- partnerka/partnerka/NNFS1-----A---- projevuje/projevovat/VB-S---3P-AAI-- velkou/velký/AAFS4----1A---- toleranci/tolerance/NNFS4-----A---- a/a/J^------------- pochopení/pochopení/NNNS4-----A---- ,/,/Z:------------- partnerky/partnerka/NNFP1-----A---- mužů/muž/NNMP2-----A---- –/-/Z:------------- manipulátorů/manipulátor/NNMP2-----A---- se/se/P7--4---------- překvapivě/překvapivě/Dg-------1A---- často/často/Dg-------1A---- rozhodují/rozhodovat/VB-P---3P-AAI-- pro/pro/RR--4----------";"vztah/vztah/NNIS4-----A---- i/i/J^------------- přes/přes/RR--4---------- nejasné/jasný/AAFP4----1N---- pochyby/pochyba/NNFP4-----A---- a/a/J^------------- spíš/spíš/TT------------- racionálně/racionálně/Dg-------1A---- :/:/Z:------------- „/""/Z:------------- Měl/mít/VpMS----R-AAI-- nás/my/PP-P4--1------- rád/rád/ACMS------A---- ,/,/Z:------------- k/k/RR--3---------- mým/můj/PSFP3-S1------- dětem/dítě/NNFP3-----A---- se/se/P7--4---------- choval/chovat/VpMS----R-AAI--";"krásně/krásně/Dg-------1A---- ,/,/Z:------------- a/a/J^------------- pořád/pořád/Db------------- prosil/prosit/VpMS----R-AAI-- ,/,/Z:------------- ať/ať/J,------------- si/se/P7--3---------- ho/on/PHMS4--3------- vezmu/vzít/VB-S---1P-AAP-- ././Z:-------------"
"144";"Moc/moc/Db------------- si/se/P7--3---------- ode/od/RV--2---------- mě/já/PH-S2--1------- nenechá/nechat/VB-S---3P-NAP-- poradit/poradit/Vf--------A-P-- ,/,/Z:------------- pokud/pokud/J,------------- jde/jít/VB-S---3P-AAI-- o/o/RR--4----------";"vztahy/vztah/NNIP4-----A---- k/k/RR--3---------- holkám/holka/NNFP3-----A---- ,/,/Z:------------- ani/ani/J^------------- se/s/RV--7---------- mnou/já/PP-S7--1------- o/o/RR--6---------- tom/ten/PDNS6---------- nechce/chtít/VB-S---3P-NAI-- moc/moc/Db------------- mluvit/mluvit/Vf--------A-I-- ,/,/Z:------------- ale/ale/J^------------- vedu/vést/VB-S---1P-AAI-- ho/on/PHMS4--3------- k/k/RR--3---------- tomu/ten/PDNS3---------- ,/,/Z:------------- že/že/J,------------- k/k/RR--3---------- ženě/žena/NNFS3-----A---- se/se/P7--4---------- má/mít/VB-S---3P-AAI-- chovat/chovat/Vf--------A-I--";"hezky/hezky/Dg-------1A---- ,/,/Z:------------- ovšem/ovšem/J^------------- jemně/jemně/Dg-------1A---- naznačuji/naznačovat/VB-S---1P-AAI-1 ,/,/Z:------------- aby/aby|být/J,-------------|Vc----------I-- si/se/P7--3---------- dal/dát/VpMS----R-AAP-- pozor/pozor/NNIS4-----A---- na/na/RR--4---------- potvory/potvora/NNFP4-----A---- ././Z:-------------"
"145";"Zjišťoval/zjišťovat/VpMS----R-AAI--";"vztah/vztah/NNIS4-----A---- dětí/dítě/NNFP2-----A---- k/k/RR--3---------- rodičům/rodič/NNMP3-----A---- a/a/J^------------- také/také/Db------------- to/ten/PDNS4---------- ,/,/Z:------------- do/do/RR--2---------- jaké/jaký/P4FS2---------- míry/míra/NNFS2-----A---- se/se/P7--4---------- kluci/kluk/NNMP1-----A---- ztotožňují/ztotožňovat/VB-P---3P-AAI-- s/s/RR--7---------- vlastnostmi/vlastnost/NNFP7-----A---- ,/,/Z:------------- které/který/P4FP1---------- jsou/být/VB-P---3P-AAI-- stereotypně/stereotypně/Dg-------1A---- přisuzovány/přisuzovat/VsFP------API-- mužům/muž/NNMP3-----A---- (/(/Z:------------- například/například/TT------------- tvrdost/tvrdost/NNFS1-----A---- ,/,/Z:------------- emocionální/emocionální/AAIS1----1A---- chlad/chlad/NNIS1-----A---- a/a/J^------------- odstup/odstup/NNIS1-----A---- )/)/Z:------------- ,/,/Z:------------- a/a/J^------------- s/s/RR--7---------- těmi/ten/PDFP7---------- ,/,/Z:------------- jež/jenž/PJFP1---------- se/se/P7--4---------- obecně/obecně/Dg-------1A---- považují/považovat/VB-P---3P-AAI-- za/za/RR--4---------- spíše/spíš/TT------------- ženské/ženská/NNFP4-----A---- ,/,/Z:------------- ba/ba/TT------------- chová/chovat/VB-S---3P-AAI--";"-/-/Z0------------- li/li/J,------------- se/se/P7--4---------- tak/tak/Db------------- muž/muž/NNMS1-----A---- ,/,/Z:------------- pak/pak/Db------------- až/až/TT------------- za/za/RR--4---------- zženštilé/zženštilý/AAMP4----1A---- (/(/Z:------------- například/například/TT------------- projevování/projevování/NNNS1-----A---- citů/cit/NNIP2-----A---- ,/,/Z:------------- otevřenost/otevřenost/NNFS1-----A---- ,/,/Z:------------- schopnost/schopnost/NNFS1-----A---- komunikace/komunikace/NNFS2-----A---- )/)/Z:------------- ././Z:-------------"
"146";"Třetí/třetí/CrFS1---------- expozice/expozice/NNFS1-----A---- ,/,/Z:------------- nazvaná/nazvaný/AAFS1----1A---- Rilke/Rilke/NNMS1-----A---- ,/,/Z:------------- Kraus/Kraus/NNMS1-----A---- a/a/J^------------- Vrchotovy/Vrchotův/AUFP1M--------- Janovice/Janovice/NNFP1-----A---- ,/,/Z:------------- zachycuje/zachycovat/VB-S---3P-AAI--";"vztah/vztah/NNIS4-----A---- ,/,/Z:------------- který/který/P4IS4---------- oba/oba/ClMP1---------- významní/významný/AAMP1----1A---- literáti/literát/NNMP1-----A---- chovali/chovat/VpMP----R-AAI--";"jak/jak/Db------------- k/k/RR--3---------- zámku/zámek/NNIS3-----A---- ,/,/Z:------------- tak/tak/J^------------- především/především/TT------------- k/k/RR--3---------- Sidonii/Sidonia/NNFS3-----A---- Nádherné/nádherný/AAFS3----1A---- ,/,/Z:------------- jeho/jeho/PSFS3-S3------- poslední/poslední/AAFS3----1A---- majitelce/majitelka/NNFS3-----A---- ././Z:-------------"
"147";"Díky/díky/RR--3---------- nim/oni/P5IP3--3------- snáz/snadno/Dg-------2A---2 pochopí/pochopit/VB-P---3P-AAP-- i/i/J^------------- rozporuplný/rozporuplný/AAIS4----1A----";"vztah/vztah/NNIS4-----A---- ,/,/Z:------------- který/který/P4IS4---------- k/k/RR--3---------- sobě/se/P6--3---------- navzájem/navzájem/Db------------- Gombrowicz/Gombrowicz/NNMS1-----A---- a/a/J^------------- Polsko/Polsko/NNNS1-----A---- donedávna/donedávna/Db------------- chovali/chovat/VpMP----R-AAI--";"././Z:-------------"
"148";"Na/na/RR--4---------- druhou/druhý/CrFS4---------- stranu/strana/NNFS4-----A---- to/ten/PDNS1---------- neznamená/znamenat/VB-S---3P-NAI-- ,/,/Z:------------- že/že/J,------------- lidé/člověk/NNMP1-----A---- se/s/RV--7---------- stejným/stejný/AANS7----1A---- nadšením/nadšení/NNNS7-----A---- (/(/Z:------------- někdy/někdy/Db------------- dokonce/dokonce/TT------------- i/i/J^------------- původem/původ/NNIS7-----A---- )/)/Z:------------- a/a/J^------------- odborností/odbornost/NNFS7-----A---- nepracují/pracovat/VB-P---3P-NAI-- také/také/Db------------- v/v/RR--6---------- těch/ten/PDIP6---------- tak/tak/Db------------- zvaně/zvaně/Dg-------1A---- „/""/Z:------------- velkých/velký/AAIP6----1A---- “/""/Z:------------- zemědělských/zemědělský/AAIP6----1A---- podnicích/podnik/NNIP6-----A---- a/a/J^------------- k/k/RR--3---------- půdě/půda/NNFS3-----A---- ,/,/Z:------------- venkovu/venkov/NNIS3-----A---- a/a/J^------------- vlasti/vlast/NNFS3-----A---- nemají/mít/VB-P---3P-NAI-- silný/silný/AAIS4----1A----";"vztah/vztah/NNIS4-----A---- ,/,/Z:------------- který/který/P4IS1---------- by/být/Vc----------I-- jim/oni/PPMP3--3------- ani/ani/J^------------- nedovolil/dovolit/VpIS----R-NAP-- se/se/P7--4---------- chovat/chovat/Vf--------A-I--";"nezodpovědně/zodpovědně/Dg-------1N---- k/k/RR--3---------- okolí/okolí/NNNS3-----A---- ,/,/Z:------------- k/k/RR--3---------- půdě/půda/NNFS3-----A---- ,/,/Z:------------- krajině/krajina/NNFS3-----A---- ,/,/Z:------------- zvířatům/zvíře/NNNP3-----A---- a/a/J^------------- hlavně/hlavně/Dg-------1A---- bez/bez/RR--2---------- respektu/respekt/NNIS2-----A---- k/k/RR--3---------- našim/náš/PSMP3-P1------- předkům/předek/NNMP3-----A---- a/a/J^------------- dalším/další/AAFP3----1A---- generacím/generace/NNFP3-----A---- ././Z:-------------"
"149";"„/""/Z:------------- To/ten/PDNS1---------- se/se/P7--4---------- nám/my/PP-P3--1------- v/v/RR--6---------- této/tento/PDFS6---------- části/část/NNFS6-----A---- Evropy/Evropa/NNFS2-----A---- daří/dařit/VB-S---3P-AAI-- ,/,/Z:------------- protože/protože/J,------------- víme/vědět/VB-P---1P-AAI-- ,/,/Z:------------- jaká/jaký/P4FS1---------- je/být/VB-S---3P-AAI-- historie/historie/NNFS1-----A---- ,/,/Z:------------- jak/jak/Db------------- je/být/VB-S---3P-AAI-- třeba/třeba/Db------------- budovat/budovat/Vf--------A-I--";"vztahy/vztah/NNIP4-----A---- s/s/RR--7---------- Ruskem/Rusko/NNNS7-----A---- ,/,/Z:------------- které/který/P4NS1---------- se/se/P7--4---------- chová/chovat/VB-S---3P-AAI-- tak/tak/Db------------- ,/,/Z:------------- jak/jak/Db------------- se/se/P7--4---------- v/v/RR--6---------- posledních/poslední/AAIP6----1A---- měsících/měsíc/NNIP6-----A---- na/na/RR--6---------- Krymu/Krym/NNIS6-----A---- a/a/J^------------- na/na/RR--6---------- východní/východní/AAFS6----1A---- Ukrajině/Ukrajina/NNFS6-----A---- chová/chovat/VB-S---3P-AAI--";",/,/Z:------------- “/""/Z:------------- podotýká/podotýkat/VB-S---3P-AAI-- Schetyna/Schetyna/NNMS1-----A---- ././Z:-------------"
"150";"Říkáme/říkat/VB-P---1P-AAI-- ,/,/Z:------------- že/že/J,-------------";"vztah/vztah/NNIS4-----A---- lze/lze/Db------------- vytvořit/vytvořit/Vf--------A-P-- snáze/snadno/Dg-------2A---1 s/s/RR--7---------- člověkem/člověk/NNMS7-----A---- ,/,/Z:------------- který/který/P4MS1---------- se/se/P7--4---------- chová/chovat/VB-S---3P-AAI--";"způsobem/způsob/NNIS7-----A---- nám/my/PP-P3--1------- vyhovujícím/vyhovující/AGIS7-----A---- ././Z:-------------"
"151";"Podle/podle/RR--2---------- výsledků/výsledek/NNIP2-----A---- průzkumu/průzkum/NNIS2-----A---- je/být/VB-S---3P-AAI-- ruská/ruský/AAFS1----1A---- mládež/mládež/NNFS1-----A---- ve/v/RV--6---------- věku/věk/NNIS6-----A---- od/od/RR--2---------- 17/17/C=------------- do/do/RR--2---------- 26/26/C=------------- let/rok/NNNP2-----A---- toho/ten/PDIS2---------- názoru/názor/NNIS2-----A---- ,/,/Z:------------- že/že/J,------------- nejpřátelštější/přátelský/AAIP4----3A----";"vztahy/vztah/NNIP4-----A---- vůči/vůči/RR--3---------- Rusku/Rusko/NNNS3-----A---- chovají/chovat/VB-P---3P-AAI--";"obyvatelé/obyvatel/NNMP1-----A---- Francie/Francie/NNFS2-----A---- ,/,/Z:------------- Velké/velký/AAFS2----1A---- Británie/Británie/NNFS2-----A---- ,/,/Z:------------- Itálie/Itálie/NNFS2-----A---- a/a/J^------------- České/český/AAFS2----1A---- republiky/republika/NNFS2-----A---- ././Z:-------------"
"152";"Jedete/jet/VB-P---2P-AAI-- -/-/Z0------------- li/li/J,------------- na/na/RR--4---------- vodu/voda/NNFS4-----A---- se/s/RV--7---------- psem/pes/NNMS7-----A---- poprvé/poprvé/Cv------------- ,/,/Z:------------- s/s/RR--7---------- předstihem/předstih/NNIS7-----A---- se/se/P7--4---------- přesvědčte/přesvědčit/Vi-P---2--A-P-- ,/,/Z:------------- jaký/jaký/P4IS4---------- má/mít/VB-S---3P-AAI--";"vztah/vztah/NNIS4-----A---- ke/k/RV--3---------- koupání/koupání/NNNS3-----A---- a/a/J^------------- jak/jak/Db------------- se/se/P7--4---------- bude/být/VB-S---3F-AAI-- chovat/chovat/Vf--------A-I--";"na/na/RR--6---------- lodi/loď/NNFS6-----A---- ././Z:-------------"
"153";"Podobný/podobný/AAIS4----1A----";"vztah/vztah/NNIS4-----A---- Ejzenštejn/Ejzenštejn/NNMS1-----A---- choval/chovat/VpMS----R-AAI--";"ke/k/RV--3---------- svému/svůj/P8MS3---------- otci/otec/NNMS3-----A---- ././Z:-------------"
