id;left;kwic;right
"261";"Hasina/Hasina/NNFS1-----A---- dokonce/dokonce/TT------------- musela/muset/VpFS----R-AAI--";"vztah/vztah/NNIS4-----A---- tajit/tajit/Vf--------A-I-- až/až/TT------------- do/do/RR--2---------- smrti/smrt/NNFS2-----A---- svého/svůj/P8MS2---------- otce/otec/NNMS2-----A---- ,/,/Z:------------- protože/protože/J,------------- Mohammed/Mohammed/NNMS1-----A---- se/se/P7--4---------- prý/prý/TT------------- choval/chovat/VpMS----R-AAI--";"méně/málo/Dg-------2A---- ""/""/Z:------------- tradičně/tradičně/Dg-------1A---- ""/""/Z:------------- než/než/J,------------- její/její/PSFS1FS3------- rodina/rodina/NNFS1-----A---- ././Z:-------------"
"262";"Jistý/jistý/AAIS4----1A---- náboj/náboj/NNIS4-----A---- a/a/J^------------- jiskření/jiskření/NNNS4-----A---- ,/,/Z:------------- které/který/P4NS1---------- bylo/být/VpNS----R-AAI-- na/na/RR--6---------- počátku/počátek/NNIS6-----A---- ,/,/Z:------------- si/se/P7--3---------- může/moci/VB-S---3P-AAI--";"vztah/vztah/NNIS4-----A---- zachovat/zachovat/Vf--------A-P-- ,/,/Z:------------- ale/ale/J^------------- bude/být/VB-S---3F-AAI-- se/se/P7--4---------- chovat/chovat/Vf--------A-I--";"trochu/trochu/Db------------- jako/jako/J,------------- lochnesská/lochnesský/AAFS1----1A---- příšera/příšera/NNFS1-----A---- ;/;/Z:------------- na/na/RR--4---------- chvíli/chvíle/NNFS4-----A---- se/se/P7--4---------- objeví/objevit/VB-S---3P-AAP-- a/a/J^------------- pak/pak/Db------------- zas/zase/Db------------- kamsi/kamsi/Db------------- zmizí/zmizet/VB-S---3P-AAP-- ././Z:-------------"
"263";"Schwarzenberg/Schwarzenberg/NNMS1-----A---- má/mít/VB-S---3P-AAI-- k/k/RR--3---------- asijskému/asijský/AAIS3----1A---- regionu/region/NNIS3-----A---- vřelý/vřelý/AAIS4----1A----";"vztah/vztah/NNIS4-----A---- ,/,/Z:------------- a/a/J^------------- co/co/PQ--1---------- je/být/VB-S---3P-AAI-- důležitější/důležitý/AANS1----2A---- ,/,/Z:------------- tamní/tamní/AAMP1----1A---- politici/politik/NNMP1-----A---- se/se/P7--4---------- k/k/RR--3---------- němu/on/P5MS3--3------- chovají/chovat/VB-P---3P-AAI--";"s/s/RR--7---------- respektem/respekt/NNIS7-----A---- ././Z:-------------"
"264";"„/""/Z:------------- Vzpomínám/vzpomínat/VB-S---1P-AAI-- si/se/P7--3---------- na/na/RR--4---------- jednoho/jeden/ClMS4---------- spoluhráče/spoluhráč/NNMS4-----A---- ,/,/Z:------------- neměli/mít/VpMP----R-NAI-- jsme/být/VB-P---1P-AAI-- spolu/spolu/Db------------- vůbec/vůbec/TT------------- dobrý/dobrý/AAIS4----1A----";"vztah/vztah/NNIS4-----A---- ,/,/Z:------------- nechoval/chovat/VpMS----R-NAI--";"se/se/P7--4---------- ke/k/RV--3---------- mně/já/PP-S3--1------- dobře/dobře/Dg-------1A---- a/a/J^------------- vůbec/vůbec/TT------------- jsem/být/VB-S---1P-AAI-- se/se/P7--4---------- necítil/cítit/VpMS----R-NAI-- v/v/RR--6---------- kabině/kabina/NNFS6-----A---- ,/,/Z:------------- půl/půl/CyFS4---------- roku/rok/NNIS2-----A---1 jsem/být/VB-S---1P-AAI-- v/v/RR--6---------- ní/on/P5FS6--3------- trpěl/trpět/VpMS----R-AAI-- ,/,/Z:------------- když/když/J,------------- jsme/být/VB-P---1P-AAI-- se/se/P7--4---------- spolu/spolu/Db------------- potkali/potkat/VpMP----R-AAP-- v/v/RR--6---------- Příbrami/Příbram/NNFS6-----A---- ././Z:-------------"
"265";"";"Vztah/vztah/NNIS4-----A---- očekávání/očekávání/NNNS2-----A---- ,/,/Z:------------- interpretace/interpretace/NNFS2-----A---- a/a/J^------------- porozumění/porozumění/NNNS2-----A---- můžete/moci/VB-P---2P-AAI-- otestovat/otestovat/Vf--------A-P-- ještě/ještě/Db------------- hlouběji/hluboko/Dg-------2A---- :/:/Z:------------- Jak/jak/Db------------- by/být/Vc----------I-- pravděpodobně/pravděpodobně/Dg-------1A---- reagovali/reagovat/VpMP----R-AAI-- rodiče/rodič/NNMP1-----A---- ,/,/Z:------------- kdybyste/kdyby|být/J,-------------|Vc-P---2----I-- se/se/P7--4---------- začali/začít/VpMP----R-AAP-- chovat/chovat/Vf--------A-I--";"doma/doma/Db------------- třeba/třeba/TT------------- jako/jako/J,------------- vyšeřující/vyšeřující/X@------------- soudce/soudce/NNMS1-----A---- .../.../Z:-------------"
"266";"Později/pozdě/Dg-------2A---- na/na/RR--6---------- tiskové/tiskový/AAFS6----1A---- besedě/beseda/NNFS6-----A---- v/v/RR--6---------- teplickém/teplický/AAIS6----1A---- hotelu/hotel/NNIS6-----A---- Prince/Princ/NNMS2-----A---- de/de/F%------------- Ligne/Ligne/F%------------- ,/,/Z:------------- kam/kam/Db------------- výprava/výprava/NNFS1-----A---- z/z/RR--2---------- letiště/letiště/NNNS2-----A---- hned/hned/Db------------- odjela/odjet/VpFS----R-AAP-- ,/,/Z:------------- prohlásil/prohlásit/VpMS----R-AAP-- ,/,/Z:------------- že/že/J,------------- přijeli/přijet/VpMP----R-AAP-- do/do/RR--2---------- Teplic/Teplice/NNFP2-----A---- s/s/RR--7---------- radostí/radost/NNFS7-----A---- ,/,/Z:------------- protože/protože/J,------------- mají/mít/VB-P---3P-AAI-- s/s/RR--7---------- českým/český/AAIS7----1A---- fotbalem/fotbal/NNIS7-----A---- dobré/dobrý/AAIP4----1A----";"vztahy/vztah/NNIP4-----A---- ,/,/Z:------------- ale/ale/J^------------- i/i/J^------------- s/s/RR--7---------- respektem/respekt/NNIS7-----A---- ,/,/Z:------------- který/který/P4IS4---------- k/k/RR--3---------- našemu/náš/PSIS3-P1------- fotbalu/fotbal/NNIS3-----A---- chovají/chovat/VB-P---3P-AAI--";"././Z:-------------"
"267";"""/""/Z:------------- Zkoušeli/zkoušet/VpMP----R-AAI-- jsme/být/VB-P---1P-AAI-- s/s/RR--7---------- Ruskem/Rusko/NNNS7-----A---- navázat/navázat/Vf--------A-P-- konstruktivní/konstruktivní/AAIS4----1A----";"vztah/vztah/NNIS4-----A---- ,/,/Z:------------- ale/ale/J^------------- bohužel/bohužel/TT------------- se/se/P7--4---------- chová/chovat/VB-S---3P-AAI--";"tak/tak/Db------------- ,/,/Z:------------- že/že/J,------------- destabilizuje/destabilizovat/VB-S---3P-AAI-- celý/celý/AAIS4----1A---- region/region/NNIS4-----A---- ././Z:-------------"
"268";"Zápasit/zápasit/Vf--------A-I-- s/s/RR--7---------- Čínou/Čína/NNFS7-----A---- je/oni/PPMP4--3------- čím/co/PQ--7---------- dál/daleko/Dg-------2A---- složitější/složitý/AAIP1----2A---- Protichůdné/protichůdný/AAIP1----1A---- bruselské/bruselský/AAIP1----1A---- podněty/podnět/NNIP1-----A---- umocňují/umocňovat/VB-P---3P-AAI-- nejasný/jasný/AAIS4----1N----";"vztah/vztah/NNIS4-----A---- ,/,/Z:------------- který/který/P4IS4---------- chová/chovat/VB-S---3P-AAI--";"Čína/Čína/NNFS1-----A---- ke/k/RV--3---------- krizí/krize/NNFS7-----A---- zmítané/zmítaný/AAFS3----1A---- Evropě/Evropa/NNFS3-----A---- ././Z:-------------"
"269";"KLDR/KLDR/BN------------- je/být/VB-S---3P-AAI-- podle/podle/RR--2---------- svého/svůj/P8MS2---------- vůdce/vůdce/NNMS2-----A---- Kim/Kim/NNMS1-----A---- Čong-una/Čong-un/NNMS2-----A---- připravena/připravit/VsFS------APP-- normalizovat/normalizovat/Vf--------A-B--";"vztahy/vztah/NNIP4-----A---- se/s/RV--7---------- zeměmi/země/NNFP7-----A---- ,/,/Z:------------- které/který/P4FP1---------- se/se/P7--4---------- k/k/RR--3---------- ní/on/P5FS3--3------- v/v/RR--6---------- minulosti/minulost/NNFS6-----A---- chovaly/chovat/VpFP----R-AAI--";"nepřátelsky/přátelsky/Dg-------1N---- ././Z:-------------"
"270";"""/""/Z:------------- Pokud/pokud/J,------------- tito/tento/PDMP1---------- lidé/člověk/NNMP1-----A---- mají/mít/VB-P---3P-AAI-- takovýto/takovýto/PDIS4----------";"vztah/vztah/NNIS4-----A---- k/k/RR--3---------- soukromému/soukromý/AAIS3----1A---- majetku/majetek/NNIS3-----A---- teď/teď/Db------------- ,/,/Z:------------- jak/jak/Db------------- se/se/P7--4---------- k/k/RR--3---------- němu/on/P5IS3--3------- budou/být/VB-P---3F-AAI-- chovat/chovat/Vf--------A-I--";",/,/Z:------------- až/až/J,------------- budou/být/VB-P---3F-AAI-- v/v/RR--6---------- zastupitelstvu/zastupitelstvo/NNNS6-----A---- ././Z:-------------"
"271";"Podle/podle/RR--2---------- něj/on/P5MS2--3------- naopak/naopak/TT------------- zákoník/zákoník/NNIS1-----A---- vytvoří/vytvořit/VB-S---3P-AAP-- lepší/dobrý/AAFP4----2A---- podmínky/podmínka/NNFP4-----A---- pro/pro/RR--4---------- pracovněprávní/pracovněprávní/AAIP4----1A----";"vztahy/vztah/NNIP4-----A---- a/a/J^------------- přiměřeně/přiměřeně/Dg-------1A---- ochrání/ochránit/VB-S---3P-AAP-- zaměstnance/zaměstnanec/NNMP4-----A---- před/před/RR--7---------- zaměstnavateli/zaměstnavatel/NNMP7-----A---- ,/,/Z:------------- kteří/který/P4MP1---------- by/být/Vc----------I-- se/se/P7--4---------- k/k/RR--3---------- nim/oni/P5MP3--3------- jinak/jinak/Db------------- nechovali/chovat/VpMP----R-NAI--";"nejlépe/dobře/Dg-------3A---- ././Z:-------------"
"272";"Upevňujte/upevňovat/Vi-P---2--A-I--";"vztah/vztah/NNIS4-----A---- :/:/Z:------------- Zkuste/zkusit/Vi-P---2--A-P-- se/se/P7--4---------- k/k/RR--3---------- puberťákovi/puberťák/NNMS3-----A---- chovat/chovat/Vf--------A-I-- spíš/spíš/TT------------- jako/jako/J,------------- k/k/RR--3---------- dospělému/dospělý/NNMS3-----A---- než/než/J,------------- jako/jako/J,------------- k/k/RR--3---------- malému/malý/AANS3----1A---- dítěti/dítě/NNNS3-----A---- ,/,/Z:------------- i/i/J^------------- když/když/J,------------- zároveň/zároveň/Db------------- s/s/RR--7---------- velkým/velký/AANS7----1A---- pochopením/pochopení/NNNS7-----A---- (/(/Z:------------- co/co/PQ--4---------- si/se/P7--3---------- budeme/být/VB-P---1F-AAI-- namlouvat/namlouvat/Vf--------A-I-- ,/,/Z:------------- puberťák/puberťák/NNMS1-----A---- se/se/P7--4---------- někdy/někdy/Db------------- chová/chovat/VB-S---3P-AAI--";"jako/jako/J,------------- malé/malý/AANS1----1A---- dítě/dítě/NNNS1-----A---- )/)/Z:------------- ././Z:-------------"
"273";"Porušila/porušit/VpFS----R-AAP-- totiž/totiž/TT------------- všechna/všechen/PLNP4---------- její/její/PSNP4FS3------- pravidla/pravidlo/NNNP4-----A---- :/:/Z:------------- 1/1/C=------------- )/)/Z:------------- Vztah/vztah/NNIS4-----A---- s/s/RR--7---------- místním/místní/AAIS7----1A---- 2/2/C=------------- )/)/Z:-------------";"Vztah/vztah/NNIS4-----A---- s/s/RR--7---------- někým/někdo/PZM-7---------- ,/,/Z:------------- jehož/jehož/P1FS1-S3------- kultura/kultura/NNFS1-----A---- je/být/VB-S---3P-AAI-- tak/tak/Db------------- vzdálená/vzdálený/AAFS1----1A---- ,/,/Z:------------- že/že/J,------------- není/být/VB-S---3P-NAI-- možné/možný/AANS1----1A---- vidět/vidět/Vf--------A-I-- nezávaznou/závazný/AAFS4----1N---- nomádskou/nomádský/AAFS4----1A---- romanci/romance/NNFS4-----A---- stejnýma/stejný/AAFD7----1A---- očima/oko/NNFD7-----A---- 3/3/C=------------- )/)/Z:------------- Všechny/všechen/PLFP4---------- karty/karta/NNFP4-----A---- na/na/RR--6---------- stole/stůl/NNIS6-----A---- ,/,/Z:------------- žádné/žádný/PWIP1---------- sliby/slib/NNIP1-----A---- 4/4/C=------------- )/)/Z:------------- Nedramatický/dramatický/AAIS1----1N---- rozchod/rozchod/NNIS1-----A---- 5/5/C=------------- )/)/Z:------------- Chovat/chovat/Vf--------A-I--";"se/se/P7--4---------- tak/tak/Db------------- ,/,/Z:------------- aby/aby|být/J,-------------|Vc----------I-- celý/celý/AAIS1----1A---- můj/můj/PSIS1-S1------- národ/národ/NNIS1-----A---- následkem/následek/NNIS7-----A---- mého/můj/PSNS2-S1------- chování/chování/NNNS2-----A---- nezískal/získat/VpIS----R-NAP-- „/""/Z:------------- reputaci/reputace/NNFS4-----A---- “/""/Z:-------------"
"274";"„/""/Z:------------- Velká/velký/AAFS1----1A---- euforie/euforie/NNFS1-----A---- to/ten/PDNS1---------- nebyla/být/VpFS----R-NAI-- ,/,/Z:------------- medvědi/medvěd/NNMP1-----A---1 jsou/být/VB-P---3P-AAI-- samotářská/samotářský/AANP1----1A---- zvířata/zvíře/NNNP1-----A---- ,/,/Z:------------- takže/takže/J,------------- si/se/P7--3---------- nejprve/nejprve/Db------------- museli/muset/VpMP----R-AAI-- ujasnit/ujasnit/Vf--------A-P-- vzájemné/vzájemný/AAIP4----1A----";"vztahy/vztah/NNIP4-----A---- ,/,/Z:------------- ale/ale/J^------------- nyní/nyní/Db------------- se/se/P7--4---------- k/k/RR--3---------- sobě/se/P6--3---------- chovají/chovat/VB-P---3P-AAI--";"přátelsky/přátelsky/Dg-------1A---- ././Z:-------------"
"275";"K/k/RR--3---------- automobilům/automobil/NNIP3-----A---- si/se/P7--3---------- okamžitě/okamžitě/Dg-------1A---- vytvářím/vytvářet/VB-S---1P-AAI-- osobní/osobní/AAIS4----1A----";"vztah/vztah/NNIS4-----A---- ,/,/Z:------------- dávám/dávat/VB-S---1P-AAI-- jim/oni/PPMP3--3------- jména/jméno/NNNP4-----A---- a/a/J^------------- chovám/chovat/VB-S---1P-AAI--";"se/se/P7--4---------- k/k/RR--3---------- nim/oni/P5IP3--3------- hezky/hezky/Dg-------1A---- ,/,/Z:------------- protože/protože/J,------------- věřím/věřit/VB-S---1P-AAI-- ,/,/Z:------------- že/že/J,------------- ony/oni/PPFP1--3------- se/se/P7--4---------- pak/pak/Db------------- budou/být/VB-P---3F-AAI-- hezky/hezky/Dg-------1A---- chovat/chovat/Vf--------A-I-- ke/k/RV--3---------- mně/já/PP-S3--1------- ././Z:-------------"
"276";"""/""/Z:------------- Nechápu/chápat/VB-S---1P-NAI-- ,/,/Z:------------- proč/proč/Db------------- by/být/Vc----------I-- nemohl/moci/VpMS----R-NAI-- darovat/darovat/Vf--------A-B-- krev/krev/NNFS4-----A---- gay/gay/NNMS1-----A---- ,/,/Z:------------- který/který/P4MS1---------- má/mít/VB-S---3P-AAI-- dlouhodobý/dlouhodobý/AAIS4----1A----";"vztah/vztah/NNIS4-----A---- s/s/RR--7---------- partnerem/partner/NNMS7-----A---- a/a/J^------------- nechová/chovat/VB-S---3P-NAI--";"se/se/P7--4---------- promiskuitně/promiskuitně/Dg-------1A---- ,/,/Z:------------- ""/""/Z:------------- přidává/přidávat/VB-S---3P-AAI-- se/se/P7--4---------- Vladimír/Vladimír/NNMS1-----A---- Hrubý/Hrubý/NNMS1-----A---- ,/,/Z:------------- mluvčí/mluvčí/NNMS1-----A---- G/G/BN------------- -/-/Z0------------- ligy/liga/NNFS2-----A---- ././Z:-------------"
"277";"Myslím/myslet/VB-S---1P-AAI-- si/se/P7--3---------- ,/,/Z:------------- že/že/J,------------- český/český/AAMS1----1A---- občan/občan/NNMS1-----A---- nemůže/moci/VB-S---3P-NAI-- pochopit/pochopit/Vf--------A-P-- ,/,/Z:------------- o/o/RR--4---------- co/co/PQ--4---------- Rakousku/Rakousko/NNNS3-----A---- v/v/RR--6---------- této/tento/PDFS6---------- fázi/fáze/NNFS6-----A---- šlo/jít/VpNS----R-AAI-- ;/;/Z:------------- proč/proč/Db------------- se/se/P7--4---------- rakouská/rakouský/AAFS1----1A---- vláda/vláda/NNFS1-----A---- nepokusila/pokusit/VpFS----R-NAP-- zabránit/zabránit/Vf--------A-P-- dlouhodobým/dlouhodobý/AAFP3----1A---- blokádám/blokáda/NNFP3-----A---- ,/,/Z:------------- ohrožujícím/ohrožující/AGFP3-----A---- dobré/dobrý/AAIP4----1A---- sousedské/sousedský/AAIP4----1A----";"vztahy/vztah/NNIP4-----A---- ;/;/Z:------------- proč/proč/Db------------- vládní/vládní/AAFS1----1A---- rakouská/rakouský/AAFS1----1A---- strana/strana/NNFS1-----A---- Svobodných/svobodný/AAMP2----1A---- dopustila/dopustit/VpFS----R-AAP-- ,/,/Z:------------- aby/aby|být/J,-------------|Vc----------I-- se/se/P7--4---------- Temelín/Temelín/NNIS1-----A---- prostřednictvím/prostřednictvím/RR--2---------- Haiderovy/Haiderův/AUFS2M--------- účasti/účast/NNFS2-----A---- na/na/RR--6---------- blokádách/blokáda/NNFP6-----A---- stal/stát/VpIS----R-AAP-- výrazným/výrazný/AAMS7----1A---- předvolebním/předvolební/AAMS7----1A---- politikem/politik/NNMS7-----A---- ,/,/Z:------------- přestože/přestože/J,------------- by/být/Vc----------I-- se/se/P7--4---------- její/její/PSMP1FS3------- představitelé/představitel/NNMP1-----A---- měli/mít/VpMP----R-AAI-- chovat/chovat/Vf--------A-I--";"státotvorně/státotvorně/Dg-------1A---- ././Z:-------------"
"278";"S/s/RR--7---------- mandolínou/mandolína/NNFS7-----A---- mám/mít/VB-S---1P-AAI-- trochu/trochu/Db------------- komplikovaný/komplikovaný/AAIS4----1A----";"vztah/vztah/NNIS4-----A---- ,/,/Z:------------- protože/protože/J,------------- se/se/P7--4---------- někdy/někdy/Db------------- chová/chovat/VB-S---3P-AAI--";"jako/jako/J,------------- překážka/překážka/NNFS1-----A---- mezi/mezi/RR--7---------- mou/můj/PSFS7-S1------1 představivostí/představivost/NNFS7-----A---- a/a/J^------------- skutečností/skutečnost/NNFS7-----A---- ././Z:-------------"
"279";"Žena/žena/NNFS1-----A---- ,/,/Z:------------- která/který/P4FS1---------- má/mít/VB-S---3P-AAI--";"vztah/vztah/NNIS4-----A---- se/s/RV--7---------- šéfem/šéf/NNMS7-----A---- ,/,/Z:------------- se/se/P7--4---------- jednoduše/jednoduše/Dg-------1A---- stává/stávat/VB-S---3P-AAI-- terčem/terč/NNIS7-----A---- pomluv/pomluva/NNFP2-----A---- a/a/J^------------- kolegové/kolega/NNMP1-----A---- se/se/P7--4---------- k/k/RR--3---------- ní/on/P5FS3--3------- mohou/moci/VB-P---3P-AAI-1 začít/začít/Vf--------A-P-- hůř/špatně/Dg-------2A---- chovat/chovat/Vf--------A-I--";"././Z:-------------"
"280";"Podle/podle/RR--2---------- Kahleho/Kahle/NNMS2-----A---- měl/mít/VpMS----R-AAI-- samec/samec/NNMS1-----A---- zpočátku/zpočátku/Db------------- totiž/totiž/TT------------- k/k/RR--3---------- prvorozené/prvorozený/AAFS3----1A---- Moje/můj/PSFS1-S1------- odtažitý/odtažitý/AAIS4----1A----";"vztah/vztah/NNIS4-----A---- a/a/J^------------- choval/chovat/VpMS----R-AAI--";"se/se/P7--4---------- ,/,/Z:------------- jako/jako/J,------------- by/být/Vc----------I-- ho/on/PHMS4--3------- nezajímala/zajímat/VpFS----R-NAI-- ././Z:-------------"
"281";"Pokud/pokud/J,------------- máme/mít/VB-P---1P-AAI-- takovýhle/takovýhle/PDIS4----------";"vztah/vztah/NNIS4-----A---- ,/,/Z:------------- tak/tak/J^------------- ho/on/PHIS4--3------- nemůžeme/moci/VB-P---1P-NAI-- bořit/bořit/Vf--------A-I-- a/a/J^------------- nemůžeme/moci/VB-P---1P-NAI-- se/se/P7--4---------- chovat/chovat/Vf--------A-I--";"nadutě/nadutě/Dg-------1A---- ,/,/Z:------------- namyšleně/namyšleně/Dg-------1A---- a/a/J^------------- hrdopyšsky/hrdopyšsky/X@------------- ././Z:------------- ""/""/Z:-------------"
"282";"""/""/Z:------------- Neměl/mít/VpMS----R-NAI-- jsem/být/VB-S---1P-AAI-- s/s/RR--7---------- ním/on/P5MS7--3------- vynikající/vynikající/AGIP4-----A----";"vztahy/vztah/NNIP4-----A---- ,/,/Z:------------- ale/ale/J^------------- chovali/chovat/VpMP----R-AAI--";"jsme/být/VB-P---1P-AAI-- se/se/P7--4---------- k/k/RR--3---------- sobě/se/P6--3---------- korektně/korektně/Dg-------1A---- ././Z:-------------"
"283";"V/v/RR--6---------- první/první/CrFS6---------- řadě/řada/NNFS6-----A---- je/být/VB-S---3P-AAI-- tu/tu/Db------------- biologický/biologický/AAMS1----1A---- otec/otec/NNMS1-----A---- ,/,/Z:------------- se/s/RV--7---------- kterým/který/P4MS7---------- nejspíš/nejspíš/TT------------- nebudete/být/VB-P---2F-NAI-- mít/mít/Vf--------A-I-- ty/ten/PDIP4---------- nejlepší/dobrý/AAIP4----3A----";"vztahy/vztah/NNIP4-----A---- ,/,/Z:------------- dále/dále/Db------------- tu/ten/PDFS4---------- je/být/VB-S---3P-AAI-- vaše/váš/PSFS1-P2------- bývalá/bývalý/AAFS1----1A---- partnerka/partnerka/NNFS1-----A---- a/a/J^------------- vaše/váš/PSFP1-P2------- vlastní/vlastní/AAFP1----1A---- děti/dítě/NNFP1-----A---- z/z/RR--2---------- předchozích/předchozí/AAIP2----1A---- vztahů/vztah/NNIP2-----A---- ,/,/Z:------------- k/k/RR--3---------- nimž/jenž/P9FP3---------- máte/mít/VB-P---2P-AAI-- závazky/závazek/NNIP4-----A---- a/a/J^------------- citovou/citový/AAFS4----1A---- vazbu/vazba/NNFS4-----A---- ,/,/Z:------------- a/a/J^------------- své/svůj/P8NS4---------1 si/se/P7--3---------- chtějí/chtít/VB-P---3P-AAI-- říct/říci/Vf--------A-P-- i/i/J^------------- babičky/babička/NNFP1-----A---- a/a/J^------------- dědečkové/dědeček/NNMP1-----A---1 ,/,/Z:------------- kterým/který/P4FP3---------- se/se/P7--4---------- nemusí/muset/VB-P---3P-NAI-1 líbit/líbit/Vf--------A-I-- ,/,/Z:------------- jak/jak/Db------------- se/se/P7--4---------- k/k/RR--3---------- jejich/jejich/PSMP3-P3------- vnukům/vnuk/NNMP3-----A---- chováte/chovat/VB-P---2P-AAI--";"././Z:-------------"
"284";"";"Vztah/vztah/NNIS4-----A---- k/k/RR--3---------- půdě/půda/NNFS3-----A---- tu/tu/Db------------- ale/ale/J^------------- měl/mít/VpMS----R-AAI-- skoro/skoro/Db------------- každý/každý/PLMS1---------- ,/,/Z:------------- i/i/J^------------- na/na/RR--6---------- malých/malý/AAFP6----1A---- zahrádkách/zahrádka/NNFP6-----A---- lidi/člověk/NNMP1-----A---1 pěstovali/pěstovat/VpMP----R-AAI-- brambory/brambora/NNFP4-----A---- a/a/J^------------- mrkev/mrkev/NNFS4-----A---- ,/,/Z:------------- chovali/chovat/VpMP----R-AAI--";"slepice/slepice/NNFP4-----A---- ,/,/Z:------------- kachny/kachna/NNFP4-----A---- ,/,/Z:------------- krůty/krůta/NNFP4-----A---- ././Z:-------------"
"285";"""/""/Z:------------- Ukrajinci/Ukrajinec/NNMP1-----A---- mají/mít/VB-P---3P-AAI-- ke/k/RV--3---------- zvířatům/zvíře/NNNP3-----A---- pěkný/pěkný/AAIS4----1A----";"vztah/vztah/NNIS4-----A---- ,/,/Z:------------- doma/doma/Db------------- každý/každý/PLMS1---------- z/z/RR--2---------- nich/oni/P5IP2--3------- chová/chovat/VB-S---3P-AAI--";"dobytek/dobytek/NNIS4-----A---- ,/,/Z:------------- což/co/PE--1---------- je/být/VB-S---3P-AAI-- zkušenost/zkušenost/NNFS1-----A---- k/k/RR--3---------- nezaplacení/nezaplacení/NNNS3-----A---- ,/,/Z:------------- ""/""/Z:------------- říká/říkat/VB-S---3P-AAI-- farmář/farmář/NNMS1-----A---- ././Z:-------------"
"286";"Odmítáme/odmítat/VB-P---1P-AAI-- směšovat/směšovat/Vf--------A-I-- kritické/kritický/AANS4----1A---- stanovisko/stanovisko/NNNS4-----A---- Arabů/Arab/NNMP2-----A---- a/a/J^------------- muslimů/muslim/NNMP2-----A---- ke/k/RV--3---------- stranění/stranění/NNNS3-----A---- americké/americký/AAFS2----1A---- administrativy/administrativa/NNFS2-----A---- Izraeli/Izrael/NNIS3-----A---- a/a/J^-------------";"vztahy/vztah/NNIP4-----A---- založené/založený/AAIP4----1A---- na/na/RR--6---------- respektu/respekt/NNIS6-----A---- a/a/J^------------- přátelství/přátelství/NNNS6-----A---- ,/,/Z:------------- jež/jenž/PJIP4---------- chováme/chovat/VB-P---1P-AAI--";"k/k/RR--3---------- americkému/americký/AAIS3----1A---- lidu/lid/NNIS3-----A---- ././Z:-------------"
"287";"Pak/pak/Db------------- jsem/být/VB-S---1P-AAI-- ale/ale/J^------------- prožila/prožít/VpFS----R-AAP-- dlouhodobý/dlouhodobý/AAIS4----1A----";"vztah/vztah/NNIS4-----A---- ,/,/Z:------------- kdy/kdy/Db------------- jsme/být/VB-P---1P-AAI-- si/se/P7--3---------- v/v/RR--6---------- jisté/jistý/AAFS6----1A---- fázi/fáze/NNFS6-----A---- byli/být/VpMP----R-AAI-- sebou/se/P6--7---------- taky/také/Db------------- moc/moc/Db------------- jistí/jistý/AAMP1----1A---- ,/,/Z:------------- přestali/přestat/VpMP----R-AAP-- jsme/být/VB-P---1P-AAI-- o/o/RR--4---------- vztah/vztah/NNIS4-----A---- dbát/dbát/Vf--------A-I-- ,/,/Z:------------- nechovali/chovat/VpMP----R-NAI--";"se/se/P7--4---------- k/k/RR--3---------- sobě/se/P6--3---------- hezky/hezky/Dg-------1A---- a/a/J^------------- kvůli/kvůli/RR--3---------- tomu/ten/PDNS3---------- se/se/P7--4---------- nám/my/PP-P3--1------- vše/všechen/PLNS1---------1 zkazilo/zkazit/VpNS----R-AAP-- ././Z:-------------"
"288";"Zcela/zcela/Db------------- opačný/opačný/AAIS4----1A---- ,/,/Z:------------- velmi/velmi/Db------------- vřelý/vřelý/AAIS4----1A----";"vztah/vztah/NNIS4-----A---- chovala/chovat/VpFS----R-AAI--";"Stel/Stella/NNFP2-----A---- la/la/F%------------- ke/k/RV--3---------- svému/svůj/P8MS3---------- otci/otec/NNMS3-----A---- ,/,/Z:------------- známému/známý/AAMS3----1A---- pražskému/pražský/AAMS3----1A---- architektovi/architekt/NNMS3-----A---- ,/,/Z:------------- a/a/J^------------- dobře/dobře/Dg-------1A---- si/se/P7--3---------- rozuměla/rozumět/VpFS----R-AAI-- i/i/J^------------- se/s/RV--7---------- starším/starý/AAMS7----2A---- bratrem/bratr/NNMS7-----A---- Janem/Jan/NNMS7-----A---- ,/,/Z:------------- ze/z/RV--2---------- kterého/který/P4MS2---------- se/se/P7--4---------- stal/stát/VpMS----R-AAP-- také/také/Db------------- architekt/architekt/NNMS1-----A---- a/a/J^------------- scénograf/scénograf/NNMS1-----A---- ././Z:-------------"
"289";"I/i/J^------------- pro/pro/RR--4---------- náš/náš/PSIS4-P1-------";"vztah/vztah/NNIS4-----A---- k/k/RR--3---------- Evropě/Evropa/NNFS3-----A---- bude/být/VB-S---3F-AAI-- dobré/dobrý/AANS1----1A---- ,/,/Z:------------- když/když/J,------------- si/se/P7--3---------- budeme/být/VB-P---1F-AAI-- dělat/dělat/Vf--------A-I-- řadu/řada/NNFS4-----A---- „/""/Z:------------- domácích/domácí/AAIP2----1A---- úkolů/úkol/NNIP2-----A---- “/""/Z:------------- –/-/Z:------------- chovat/chovat/Vf--------A-I--";"se/se/P7--4---------- ,/,/Z:------------- jako/jako/J,------------- bychom/být/Vc-P---1----I-- v/v/RR--6---------- té/ten/PDFS6---------- eurozóně/eurozóna/NNFS6-----A---- byli/být/VpMP----R-AAI-- ././Z:-------------"
