id;left;kwic;right;VNP?;doc.txtype_group
61;Je/být/VB-S---3P-AAI-- mladá/mladý/AAFS1----1A---- ,/,/Z:------------- křehká/křehký/AAFS1----1A---- ,/,/Z:------------- a/a/J^------------- já/já/PP-S1--1------- jsem/být/VB-S---1P-AAI-- se/se/P7--4---------- jí/on/PPFS3--3------- neodvážil/odvážit/VpMS----R-NAP-- jakkoli/jakkoli/Db------------- vyznat/vyznat/Vf--------A-P-- svou/svůj/P8FS4---------1;lásku/láska/NNFS4-----A---- ,/,/Z:------------- dala/dát/VpFS----R-AAP-- mi/já/PH-S3--1------- však/však/J^------------- ve/v/RV--6---------- své/svůj/P8FS6---------1 dobrotě/dobrota/NNFS6-----A---- dostatečně/dostatečně/Dg-------1A---- najevo/najevo/Db------------- ,/,/Z:------------- že/že/J,------------- sdílí/sdílet/VB-S---3P-AAI-- cit/cit/NNIS4-----A---- ,/,/Z:------------- který/který/P4IS4---------- k/k/RR--3---------- ní/on/P5FS3--3------- chovám/chovat/VB-S---1P-AAI--;,/,/Z:------------- a/a/J^------------- věřím/věřit/VB-S---1P-AAI-- ,/,/Z:------------- že/že/J,------------- její/její/PSFS1FS3------- rodina/rodina/NNFS1-----A---- by/být/Vc----------I-- nebyla/být/VpFS----R-NAI-- proti/proti/RR--3---------- mé/můj/PSFS3-S1------1 nabídce/nabídka/NNFS3-----A---- ././Z:-------------;0;FIC: beletrie
62;Chtěla/chtít/VpFS----R-AAI-- mu/on/PHMS3--3------- tak/tak/Db------------- dokázat/dokázat/Vf--------A-P--;lásku/láska/NNFS4-----A---- a/a/J^------------- oddanost/oddanost/NNFS4-----A---- ,/,/Z:------------- kterou/který/P4FS4---------- k/k/RR--3---------- němu/on/P5MS3--3------- chová/chovat/VB-S---3P-AAI--;././Z:-------------;3;NMG: publicistika
63;Podobnou/podobný/AAFS4----1A----;lásku/láska/NNFS4-----A---- chová/chovat/VB-S---3P-AAI--;ke/ke/RV--3---------- koňaku/koňak/NNIS3-----A---- ,/,/Z:------------- za/za/RR--4---------- který/který/P4IS4---------- je/být/VB-S---3P-AAI-- ročně/ročně/Dg-------1A---- schopen/schopen/ACMS------A---- utratit/utratit/Vf--------A-P-- až/až/TT------------- 30/30/C=------------- milionů/milion/CzIP2---------- dolarů/dolar/NNIP2-----A---- !/!/Z:-------------;1;NMG: publicistika
64;V/v/RR--6---------- takovém/takový/PDNS6---------- prostředí/prostředí/NNNS6-----A---- se/se/P7--4---------- mi/já/PH-S3--1------- skvěle/skvěle/Dg-------1A---- bydlí/bydlet/VB-S---3P-AAI-- –/-/Z:-------------;lásku/láska/NNFS4-----A---- k/k/RR--3---------- modernismu/modernismus/NNIS3-----A---- chovám/chovat/VB-S---1P-AAI--;již/již/Db------------- odedávna/odedávna/Db------------- ,/,/Z:------------- neboť/neboť/J^------------- ji/on/PPFS4--3------- mám/mít/VB-S---1P-AAI-- po/po/RR--6---------- mámě/máma/NNFS6-----A---- ././Z:-------------;1;NMG: publicistika
65;V/v/RR--6---------- zákulisí/zákulisí/NNNS6-----A---- však/však/J^------------- k/k/RR--3---------- sobě/se/P6--3---------- Dánka/Dánka/NNFS1-----A---- Caroline/Caroline/NNFS1-----A---- Wozniacká/Wozniacká/NNFS1-----A---- a/a/J^------------- Ruska/Ruska/NNFS1-----A---- Maria/Marie/NNFS1-----A---1 Šarapovová/Šarapovová/NNFS1-----A---- přílišnou/přílišný/AAFS4----1A----;lásku/láska/NNFS4-----A---- nechovají/chovat/VB-P---3P-NAI--;././Z:-------------;1;NMG: publicistika
66;;Lásku/láska/NNFS4-----A---- k/k/RR--3---------- třícípé/třícípý/AAFS3----1A---- hvězdě/hvězda/NNFS3-----A---- chováte/chovat/VB-P---2P-AAI--;odmalička/odmalička/Db------------- ?/?/Z:-------------;1;NFC: oborová literatura
67;Obávám/obávat/VB-S---1P-AAI-- se/se/P7--4---------- ,/,/Z:------------- že/že/J,------------- pan/pán/NNMS1-----A---- X/X/BN------------- žárlí/žárlit/VB-S---3P-AAI-- na/na/RR--4----------;lásku/láska/NNFS4-----A---- ,/,/Z:------------- kterou/který/P4FS4---------- k/k/RR--3---------- Ele/Ela/NNFS3-----A---- chováte/chovat/VB-P---2P-AAI--;",/,/Z:------------- a/a/J^------------- vzal/vzít/VpMS----R-AAP-- vám/vy/PP-P3--2------- ji/on/PPFS4--3------- ,/,/Z:------------- aby/aby|být/J,-------------|Vc----------I-- se/se/P7--4---------- jí/on/PPFS2--3------- zbavil/zbavit/VpMS----R-AAP-- ././Z:------------- ""/""/Z:-------------";3;FIC: beletrie
68;Jak/jak/Db------------- ukázaly/ukázat/VpIP----R-AAP-- záznamy/záznam/NNIP1-----A---- z/z/RR--2---------- chatů/chat/NNIP2-----A---- ,/,/Z:------------- démonický/démonický/AAMS1----1A---- Devilman/Devilman/X@------------- se/se/P7--4---------- například/například/TT------------- prezentoval/prezentovat/VpMS----R-AAB-- jako/jako/J,------------- mladý/mladý/AAMS1----1A---- Casanova/Casanova/NNMS1-----A---- ,/,/Z:------------- miláček/miláček/NNMS1-----A---- žen/žena/NNFP2-----A---- žijící/žijící/AGMS1-----A---- rozverným/rozverný/AAIS7----1A---- životem/život/NNIS7-----A---- (/(/Z:------------- třebaže/třebaže/J,------------- největší/velký/AAFS4----3A----;lásku/láska/NNFS4-----A---- choval/chovat/VpMS----R-AAI--;"k/k/RR--3---------- levným/levný/AAIP3----1A---- „/""/Z:------------- dumpům/dump/NNIP3-----A---- “/""/Z:------------- )/)/Z:------------- ././Z:-------------";1;NFC: oborová literatura
69;Znám/znát/VB-S---1P-AAI-- verše/verš/NNIP4-----A---- pro/pro/RR--4---------- královské/královský/AAFP4----1A---- ženy/žena/NNFP4-----A---- Nářky/nářek/NNIP4-----A---- nad/nad/RR--7---------- během/běh/NNIS7-----A---- vlastních/vlastní/AANP2----1A---- let/rok/NNNP2-----A---- Otroků/otrok/NNMP2-----A---- hymny/hymna/NNFS2-----A---- na/na/RR--4---------- murény/muréna/NNFP4-----A---- Romanci/romance/NNFS3-----A---- milostných/milostný/AAFP2----1A---- mých/můj/PSFP2-S1------- běd/běda/NNFP2-----A---- A/a/J^------------- také/také/Db------------- písně/píseň/NNFP4-----A---- pro/pro/RR--4---------- sirény/siréna/NNFP4-----A---- Láska/láska/NNFS1-----A---- je/oni/PPFP4--3------- mrtvá/mrtvý/AAFS1----1A---- naříkám/naříkat/VB-S---1P-AAI-- Mám/mít/VB-S---1P-AAI-- idol/idol/NNIS4-----A---- rád/rád/ACMS------A---- jenž/jenž/PJMS1----------;lásku/láska/NNFS4-----A---- chová/chovat/VB-S---3P-AAI--;Podobá/podobat/VB-S---3P-AAI-- se/se/P7--4---------- mým/můj/PSFP3-S1------- vzpomínkám/vzpomínka/NNFP3-----A---- Tak/tak/Db------------- jako/jako/J,------------- žena/žena/NNFS1-----A---- Mausolova/Mausolova/X@------------- Pokorně/pokorně/Dg-------1A---- věrný/věrný/AAMS1----1A---- zůstávám/zůstávat/VB-S---1P-AAI--;1;FIC: beletrie
70;od/od/RR--2---------- mého/můj/PSMS2-S1------- letce/letec/NNMS2-----A---- ,/,/Z:------------- zase/zase/Db------------- mi/já/PH-S3--1------- opakoval/opakovat/VpMS----R-AAI-- ,/,/Z:------------- že/že/J,------------- se/se/P7--4---------- chce/chtít/VB-S---3P-AAI-- se/s/RV--7---------- mnou/já/PP-S7--1------- oženit/oženit/Vf--------A-P-- ,/,/Z:------------- že/že/J,------------- si/se/P7--3---------- nepřeje/přát/VB-S---3P-NAI-- ,/,/Z:------------- abych/aby|být/J,-------------|Vc-S---1----I-- se/se/P7--4---------- vrátila/vrátit/VpFS----R-AAP-- do/do/RR--2---------- Francie/Francie/NNFS2-----A---- ,/,/Z:------------- že/že/J,------------- dobře/dobře/Dg-------1A---- ví/vědět/VB-S---3P-AAI-- ,/,/Z:------------- že/že/J,------------- jsem/být/VB-S---1P-AAI-- přijela/přijet/VpFS----R-AAP-- na/na/RR--4---------- pozvání/pozvání/NNNS4-----A---- vlády/vláda/NNFS2-----A---- ,/,/Z:------------- ale/ale/J^------------- neměla/mít/VpFS----R-NAI-- bych/být/Vc-S---1----I-- se/se/P7--4---------- plést/plést/Vf--------A-I-- do/do/RR--2---------- místní/místní/AAFS2----1A---- politiky/politika/NNFS2-----A---- ,/,/Z:------------- zato/zato/Db------------- bych/být/Vc-S---1----I-- měla/mít/VpFS----R-AAI-- brát/brát/Vf--------A-I-- vážně/vážně/Dg-------1A----;lásku/láska/NNFS4-----A---- ,/,/Z:------------- kterou/který/P4FS4---------- ke/k/RV--3---------- mně/já/PP-S3--1------- chová/chovat/VB-S---3P-AAI--;././Z:-------------;3;NFC: oborová literatura
71;Bezmeznou/bezmezný/AAFS4----1A---- otcovskou/otcovský/AAFS4----1A----;"lásku/láska/NNFS4-----A---- Karla/Karel/NNMS2-----A---- k/k/RR--3---------- Pražanům/Pražan/NNMP3-----A---- zase/zase/Db------------- relativizuje/relativizovat/VB-S---3P-AAB-- jiný/jiný/AAMS1----1A---- současník/současník/NNMS1-----A---- ,/,/Z:------------- Konrád/Konrád/NNMS1-----A---- z/z/RR--2---------- Halberstadtu/Halberstadt/NNIS2-----A---- :/:/Z:------------- „/""/Z:------------- …/.../Z:------------- k/k/RR--3---------- pražským/pražský/AAMP3----1A---- měšťanům/měšťan/NNMP3-----A---- se/se/P7--4---------- choval/chovat/VpMS----R-AAI--";"jako/jako/J,------------- k/k/RR--3---------- čeledínům/čeledín/NNMP3-----A---- a/a/J^------------- nadmíru/nadmíru/Db------------- je/oni/PPMP4--3------- ponižoval/ponižovat/VpMS----R-AAI-- ././Z:------------- “/""/Z:-------------";0;NMG: publicistika
72;Umiň/umínit/Vi-S---2--A-P-- si/se/P7--3---------- tedy/tedy/TT------------- ,/,/Z:------------- že/že/J,------------- budeš/být/VB-S---2F-AAI-- velkodušně/velkodušně/Dg-------1A---- odpovídat/odpovídat/Vf--------A-I-- (/(/Z:------------- na/na/RR--4---------- Boží/boží/AAFS4----1A----;lásku/láska/NNFS4-----A---- a/a/J^------------- vyvolení/vyvolený/AAMP1----1A---- vzhledem/vzhledem/RF------------- ke/k/RV--3---------- tvé/tvůj/PSFS3-S2------1 osobě/osoba/NNFS3-----A---- )/)/Z:------------- ,/,/Z:------------- a/a/J^------------- tak/tak/J^------------- se/se/P7--4---------- budeš/být/VB-S---2F-AAI-- chovat/chovat/Vf--------A-I--;důstojně/důstojně/Dg-------1A---- ,/,/Z:------------- aby/aby|být/J,-------------|Vc----------I-- to/ten/PDNS1---------- bylo/být/VpNS----R-AAI-- hodné/hodný/AANS1----1A---- jeho/jeho/PSNS2-S3------- a/a/J^------------- aby/aby|být/J,-------------|Vc----------I-- ses/se|být/P7--4----------|VB-S---2P-AAI-1 mu/on/PHMS3--3------- podobal/podobat/VpMS----R-AAI-- ,/,/Z:------------- jak/jak/Db------------- to/ten/PDNS1---------- odpovídá/odpovídat/VB-S---3P-AAI-- dokonalosti/dokonalost/NNFS3-----A---- popisované/popisovaný/AAFS3----1A---- v/v/RR--6---------- Písmu/písmo/NNNS6-----A---- svatém/svatý/AANS6----1A---- a/a/J^------------- v/v/RR--6---------- evangeliu/evangelium/NNNS6-----A---- a/a/J^------------- jak/jak/Db------------- ses/se|být/P7--4----------|VB-S---2P-AAI-1 tomu/ten/PDNS3---------- již/již/Db------------- naučil/naučit/VpMS----R-AAP-- ././Z:-------------;0;NFC: oborová literatura
73;Otec/otec/NNMS1-----A---- se/se/P7--4---------- usilovně/usilovně/Dg-------1A---- snažil/snažit/VpMS----R-AAI-- nějak/nějak/Db------------- ji/on/PPFS4--3------- probudit/probudit/Vf--------A-P-- ,/,/Z:------------- použil/použít/VpMS----R-AAP-- veškerou/veškerý/PLFS4----------;lásku/láska/NNFS4-----A---- ,/,/Z:------------- kterou/který/P4FS4---------- k/k/RR--3---------- ní/on/P5FS3--3------- choval/chovat/VpMS----R-AAI--;././Z:-------------;3;FIC: beletrie
74;Protože/protože/J,------------- potřebuji/potřebovat/VB-S---1P-AAI-1;lásku/láska/NNFS4-----A---- každý/každý/PLIS4---------- den/den/NNIS4-----A---- ,/,/Z:------------- snažím/snažit/VB-S---1P-AAI-- se/se/P7--4---------- chovat/chovat/Vf--------A-I--;mile/mile/Dg-------1A---- pořád/pořád/Db------------- ,/,/Z:------------- a/a/J^------------- ne/ne/TT------------- jen/jen/Db------------- na/na/RR--4---------- Valentýna/Valentýn/NNMS4-----A---- ././Z:-------------;0;NMG: publicistika
75;;Lásku/láska/NNFS4-----A---- ke/k/RV--3---------- psům/pes/NNMP3-----A---- a/a/J^------------- touhu/touha/NNFS4-----A---- s/s/RR--7---------- nimi/oni/P5MP7--3------- komunikovat/komunikovat/Vf--------A-B-- chovám/chovat/VB-S---1P-AAI--;již/již/Db------------- od/od/RR--2---------- útlého/útlý/AANS2----1A---- dětství/dětství/NNNS2-----A---- ././Z:-------------;0;NFC: oborová literatura
76;Miluju/milovat/VB-S---1P-AAI-- tě/ty/PH-S4--2------- pro/pro/RR--4---------- tvou/tvůj/PSFS4-S2------1 tajnou/tajný/AAFS4----1A----;lásku/láska/NNFS4-----A---- k/k/RR--3---------- motýlům/motýl/NNMP3-----A---- ,/,/Z:------------- a/a/J^------------- protože/protože/J,------------- chovat/chovat/Vf--------A-I--;je/oni/PPMP4--3------- musí/muset/VB-S---3P-AAI-- být/být/Vf--------A-I-- ten/ten/PDIS1---------- nejkrásnější/krásný/AAIS1----3A---- koníček/koníček/NNIS1-----A---- na/na/RR--6---------- světě/svět/NNIS6-----A---- ././Z:-------------;0;FIC: beletrie
77;Stačí/stačit/VB-S---3P-AAI-- mi/já/PH-S3--1------- ,/,/Z:------------- abych/aby|být/J,-------------|Vc-S---1----I-- se/se/P7--4---------- zaposlouchal/zaposlouchat/VpMS----R-AAP-- do/do/RR--2---------- pouhého/pouhý/AAIS2----1A---- tónu/tón/NNIS2-----A---- hlasu/hlas/NNIS2-----A---- Zdeňka/Zdeněk/NNMS2-----A---- Štybara/Štybar/NNMS2-----A---- ,/,/Z:------------- a/a/J^------------- pochopím/pochopit/VB-S---1P-AAP-- ,/,/Z:------------- jakou/jaký/P4FS4----------;lásku/láska/NNFS4-----A---- i/i/J^------------- pokoru/pokora/NNFS4-----A---- ke/k/RV--3---------- klasice/klasika/NNFS3-----A---- Kolem/kolem/RR--2---------- Flander/Flandry/NNIP2-----A---1 chová/chovat/VB-S---3P-AAI--;././Z:-------------;1;NMG: publicistika
78;Největší/velký/AAFS4----3A----;lásku/láska/NNFS4-----A---- chová/chovat/VB-S---3P-AAI--;k/k/RR--3---------- bluesové/bluesový/AAFS3----1A---- muzice/muzika/NNFS3-----A---- ././Z:-------------;1;NMG: publicistika
79;Lidé/člověk/NNMP1-----A---- znají/znát/VB-P---3P-AAI-- Charlese/Charles/NNMS4-----A---- sedícího/sedící/AGMS4-----A---- za/za/RR--7---------- pianem/piano/NNNS7-----A---- v/v/RR--6---------- černých/černý/AAFP6----1A---- brýlích/brýle/NNFP6-----A---- ,/,/Z:------------- jak/jak/Db------------- se/se/P7--4---------- kýve/kývat/VB-S---3P-AAI-1 ze/z/RV--2---------- strany/strana/NNFS2-----A---- na/na/RR--4---------- stranu/strana/NNFS4-----A---- ,/,/Z:------------- ten/ten/PDIS1---------- jeho/jeho/PSIS1-S3------- úsměv/úsměv/NNIS1-----A---- ,/,/Z:------------- který/který/P4IS1---------- všem/všechen/PLMP3---------- zvěstuje/zvěstovat/VB-S---3P-AAB-- ,/,/Z:------------- jak/jak/Db------------- hlubokou/hluboký/AAFS4----1A----;lásku/láska/NNFS4-----A---- k/k/RR--3---------- hudbě/hudba/NNFS3-----A---- chová/chovat/VB-S---3P-AAI--;,/,/Z:------------- jak/jak/Db------------- se/se/P7--4---------- na/na/RR--6---------- pódiu/podium/NNNS6-----A---- cítí/cítit/VB-S---3P-AAI-- šťasten/šťastný/ACMS------A---- ,/,/Z:------------- jak/jak/Db------------- ho/on/PHMS4--3------- hudba/hudba/NNFS1-----A---- léčí/léčit/VB-S---3P-AAI-- ././Z:-------------;1;NMG: publicistika
80;Všem/všechen/PLFP3---------- občankám/občanka/NNFP3-----A---- a/a/J^------------- občanům/občan/NNMP3-----A---- královské/královský/AAFS2----1A---- naší/náš/PSFS2-P1------- Prahy/Praha/NNFS2-----A---- ,/,/Z:------------- jakož/jakož/J,------------- i/i/J^------------- na/na/RR--6---------- venkově/venkov/NNIS6-----A---- ,/,/Z:------------- přeju/přát/VB-S---1P-AAI-- ve/v/RV--6---------- všem/všechen/PLNS6---------- zdar/zdar/NNIS4-----A---- ,/,/Z:------------- zvláště/zvlášť/Db------------- pak/pak/Db------------- našim/náš/PSFP3-P1------- bodrým/bodrý/AAFP3----1A---- ženám/žena/NNFP3-----A---- na/na/RR--6---------- tržišti/tržiště/NNNS6-----A---- děkuji/děkovat/VB-S---1P-AAI-1 za/za/RR--4----------;lásku/láska/NNFS4-----A---- ,/,/Z:------------- kterou/který/P4FS7---------- vždy/vždy/Db------------- ke/k/RV--3---------- mně/já/PP-S3--1------- chovaly/chovat/VpFP----R-AAI--;,/,/Z:------------- a/a/J^------------- nechť/nechť/TT------------- obětavost/obětavost/NNFS1-----A---- pro/pro/RR--4---------- naše/náš/PSIP4-P1------- národní/národní/AAIP4----1A---- podniky/podnik/NNIP4-----A---- ,/,/Z:------------- kterou/který/P4FS4---------- vždy/vždy/Db------------- při/při/RR--6---------- každé/každý/PLFS6---------- příležitosti/příležitost/NNFS6-----A---- osvědčily/osvědčit/VpFP----R-AAP-- ,/,/Z:------------- vštěpují/vštěpovat/VB-P---3P-AAI-- též/též/Db------------- svým/svůj/P8FP3---------- dítkám/dítky/NNFP3-----A---- ././Z:-------------;3;NFC: oborová literatura
81;;Lásku/láska/NNFS4-----A---- ke/k/RV--3---------- koním/kůň/NNMP3-----A---- v/v/RR--6---------- ní/on/P5FS6--3------- probudila/probudit/VpFS----R-AAP-- její/její/PSFS1FS3------- babička/babička/NNFS1-----A---- ,/,/Z:------------- která/který/P4FS1---------- v/v/RR--6---------- rodném/rodný/AANS6----1A---- Portugalsku/Portugalsko/NNNS6-----A---- koně/kůň/NNMP4-----A---- chovala/chovat/VpFS----R-AAI--;././Z:-------------;0;NMG: publicistika
82;COM/COM/BN------------- Slova/slovo/NNNP1-----A---- nám/my/PP-P3--1------- nestačí/stačit/VB-P---3P-NAI-- na/na/RR--4---------- to/ten/PDNS4---------- ,/,/Z:------------- abychom/aby|být/J,-------------|Vc-P---1----I-- vyjádřili/vyjádřit/VpMP----R-AAP-- ,/,/Z:------------- jak/jak/Db------------- hlubokou/hluboký/AAFS4----1A----;lásku/láska/NNFS4-----A---- chováme/chovat/VB-P---1P-AAI--;k/k/RR--3---------- unikátním/unikátní/AANP3----1A---- ,/,/Z:------------- překvapivým/překvapivý/AANP3----1A---- uměleckým/umělecký/AANP3----1A---- dílům/dílo/NNNP3-----A---- italské/italský/AAFS2----1A---- kloboučnice/kloboučnice/NNFS2-----A---- Federicy/Federica/NNFP1-----A---6 Moretti/Moretti/NNMS1-----A---- ././Z0------------- tti/tti/X@------------- ././Z:-------------;1;NMG: publicistika
83;Kéž/kéž/TT------------- by/být/Vc----------I-- mi/já/PH-S3--1------- bylo/být/VpNS----R-AAI-- dopřáno/dopřát/VsNS------APP-- vtělit/vtělit/Vf--------A-P-- do/do/RR--2---------- posledních/poslední/AANP2----1A---- slov/slovo/NNNP2-----A---- tohoto/tento/PDNS2---------- podle/podle/RR--2---------- všeho/všechen/PLIS2---------- posledního/poslední/AAIS2----1A---- dopisu/dopis/NNIS2-----A---- ,/,/Z:------------- který/který/P4IS4---------- Francisi/Francis/NNMS3-----A---- Baconovi/Bacon/NNMS3-----A---- píši/psát/VB-S---1P-AAI-1 ,/,/Z:------------- veškerou/veškerý/PLFS4----------;lásku/láska/NNFS4-----A---- i/i/J^------------- vděčnost/vděčnost/NNFS4-----A---- ,/,/Z:------------- veškerý/veškerý/PLIS4---------- bezmezný/bezmezný/AAIS4----1A---- obdiv/obdiv/NNIS4-----A---- ,/,/Z:------------- jaký/jaký/P4IS4---------- k/k/RR--3---------- dobrodinci/dobrodinec/NNMS3-----A---- mého/můj/PSMS2-S1------- ducha/duch/NNMS2-----A---- ,/,/Z:------------- k/k/RR--3---------- přednímu/přední/AAMS3----1A---- Angličanovi/Angličan/NNMS3-----A---- mé/můj/PSFS2-S1------1 doby/doba/NNFS2-----A---- v/v/RR--6---------- srdci/srdce/NNNS6-----A---- chovám/chovat/VB-S---1P-AAI--;a/a/J^------------- vždycky/vždy/Db------------- chovat/chovat/Vf--------A-I-- budu/být/VB-S---1F-AAI-- ,/,/Z:------------- dokud/dokud/J,------------- mi/já/PH-S3--1------- v/v/RR--6---------- smrti/smrt/NNFS6-----A---- nepukne/puknout/VB-S---3P-NAP-- ././Z:-------------;0;FIC: beletrie
84;Mateřskou/mateřský/AAFS4----1A----;lásku/láska/NNFS4-----A---- ta/ten/PDFS1---------- žena/žena/NNFS1-----A---- nepocítila/pocítit/VpFS----R-NAP-- ,/,/Z:------------- k/k/RR--3---------- miminku/miminko/NNNS3-----A---- se/se/P7--4---------- chovala/chovat/VpFS----R-AAI--;hrozně/hrozně/Dg-------1A---- ,/,/Z:------------- zato/zato/Db------------- ho/on/PHMS4--3------- skvěle/skvěle/Dg-------1A---- uměla/umět/VpFS----R-AAI-- používat/používat/Vf--------A-I-- jako/jako/J,------------- nástroj/nástroj/NNIS4-----A---- k/k/RR--3---------- vydírání/vydírání/NNNS3-----A---- nás/my/PP-P4--1------- i/i/J^------------- Tibora/Tibor/NNMS2-----A---- ././Z:-------------;0;NMG: publicistika
85;Kéž/kéž/TT------------- by/být/Vc----------I-- mi/já/PH-S3--1------- bylo/být/VpNS----R-AAI-- dopřáno/dopřát/VsNS------APP-- vtělit/vtělit/Vf--------A-P-- do/do/RR--2---------- posledních/poslední/AANP2----1A---- slov/slovo/NNNP2-----A---- tohoto/tento/PDNS2---------- podle/podle/RR--2---------- všeho/všechen/PLIS2---------- posledního/poslední/AAIS2----1A---- dopisu/dopis/NNIS2-----A---- ,/,/Z:------------- který/který/P4IS4---------- Francisi/Francis/NNMS3-----A---- Baconovi/Bacon/NNMS3-----A---- píši/psát/VB-S---1P-AAI-1 ,/,/Z:------------- veškerou/veškerý/PLFS4----------;lásku/láska/NNFS4-----A---- i/i/J^------------- vděčnost/vděčnost/NNFS4-----A---- ,/,/Z:------------- veškerý/veškerý/PLIS4---------- bezmezný/bezmezný/AAIS4----1A---- obdiv/obdiv/NNIS4-----A---- ,/,/Z:------------- jaký/jaký/P4IS4---------- k/k/RR--3---------- dobrodinci/dobrodinec/NNMS3-----A---- mého/můj/PSMS2-S1------- ducha/duch/NNMS2-----A---- ,/,/Z:------------- k/k/RR--3---------- přednímu/přední/AAMS3----1A---- Angličanovi/Angličan/NNMS3-----A---- mé/můj/PSFS2-S1------1 doby/doba/NNFS2-----A---- v/v/RR--6---------- srdci/srdce/NNNS6-----A---- chovám/chovat/VB-S---1P-AAI-- a/a/J^------------- vždycky/vždy/Db------------- chovat/chovat/Vf--------A-I--;budu/být/VB-S---1F-AAI-- ,/,/Z:------------- dokud/dokud/J,------------- mi/já/PH-S3--1------- v/v/RR--6---------- smrti/smrt/NNFS6-----A---- nepukne/puknout/VB-S---3P-NAP-- ././Z:-------------;0;FIC: beletrie
86;Takové/takový/PDNS4---------- zalíbení/zalíbení/NNNS4-----A---- ,/,/Z:------------- takovou/takový/PDFS4----------;lásku/láska/NNFS4-----A---- a/a/J^------------- něhu/něha/NNFS4-----A---- nechová/chovat/VB-S---3P-NAI--;ani/ani/J^------------- leckterý/leckterý/PZMS1---------- muž/muž/NNMS1-----A---- ke/k/RV--3---------- své/svůj/P8FS3---------1 milé/milá/NNFS3-----A---- ././Z:-------------;1;NFC: oborová literatura
87;Ten/ten/PDMS1---------- arogantní/arogantní/AAMS1----1A---- darmošlap/darmošlap/NNMS1-----A---- ,/,/Z:------------- který/který/P4MS1---------- vypadá/vypadat/VB-S---3P-AAI-- jako/jako/J,------------- krysa/krysa/NNFS1-----A---- ,/,/Z:------------- dennodenně/dennodenně/Dg-------1A---- zneužívá/zneužívat/VB-S---3P-AAI-- Chantyinu/Chantyin/AUFS4F--------- nezaslouženou/zasloužený/AAFS4----1N----;lásku/láska/NNFS4-----A---- ,/,/Z:------------- díky/díky/RR--3---------- níž/jenž/P9FS3---------- má/mít/VB-S---3P-AAI-- jídlo/jídlo/NNNS4-----A---- ,/,/Z:------------- šaty/šaty/NNIP4-----A---- a/a/J^------------- domov/domov/NNIS4-----A---- ,/,/Z:------------- nepřispívá/přispívat/VB-S---3P-NAI-- do/do/RR--2---------- rodinného/rodinný/AAIS2----1A---- rozpočtu/rozpočet/NNIS2-----A---- jediným/jediný/AAIS7----1A---- halířem/haléř/NNIS7-----A---- a/a/J^------------- chová/chovat/VB-S---3P-AAI--;ke/k/RV--3---------- své/svůj/P8FS3---------1 krásné/krásný/AAFS3----1A---- dceři/dcera/NNFS3-----A---- odpor/odpor/NNIS4-----A---- ,/,/Z:------------- si/se/P7--3---------- troufá/troufat/VB-S---3P-AAI-- stěžovat/stěžovat/Vf--------A-I-- na/na/RR--4---------- nedostatek/nedostatek/NNIS4-----A---- prostoru/prostor/NNIS2-----A---- ?/?/Z:-------------;0;FIC: beletrie
88;Škoda/škoda/NNFS1-----A---- jen/jen/Db------------- ,/,/Z:------------- že/že/J,------------- herec/herec/NNMS1-----A---- rezignoval/rezignovat/VpMS----R-AAB-- na/na/RR--4----------;lásku/láska/NNFS4-----A---- postavy/postava/NNFS2-----A---- k/k/RR--3---------- oběma/oba/ClFP3---------- ženám/žena/NNFP3-----A---- (/(/Z:------------- matku/matka/NNFS4-----A---- ve/v/RV--6---------- vypjaté/vypjatý/AAFS6----1A---- emocionální/emocionální/AAFS6----1A---- scéně/scéna/NNFS6-----A---- mlátí/mlátit/VB-S---3P-AAI-- po/po/RR--6---------- hlavě/hlava/NNFS6-----A---- polštářem/polštář/NNIS7-----A---- ,/,/Z:------------- a/a/J^------------- i/i/J^------------- k/k/RR--3---------- Ofélii/Ofélie/NNFS3-----A---- se/se/P7--4---------- chová/chovat/VB-S---3P-AAI--;příliš/příliš/Db------------- jednostrunně/jednostrunně/Dg-------1A---- krutě/krutě/Dg-------1A---- )/)/Z:------------- ././Z:-------------;0;NMG: publicistika
89;;Lásku/láska/NNFS4-----A---- k/k/RR--3---------- přírodě/příroda/NNFS3-----A---- ,/,/Z:------------- živočichům/živočich/NNMP3-----A---- a/a/J^------------- zejména/zejména/TT------------- ptactvu/ptactvo/NNNS3-----A---- choval/chovat/VpMS----R-AAI--;Peter/Peter/NNMS1-----A---- Baláž/Baláž/NNMS1-----A---- už/už/Db------------- jako/jako/J,------------- malý/malý/AAMS1----1A---- chlapec/chlapec/NNMS1-----A---- ././Z:-------------;1;NMG: publicistika
90;Pak/pak/Db------------- trénujte/trénovat/Vi-P---2--A-I--;lásku/láska/NNFS4-----A---- a/a/J^------------- ochotu/ochota/NNFS4-----A---- a/a/J^------------- zjistěte/zjistit/Vi-P---2--A-P-- ,/,/Z:------------- kdy/kdy/Db------------- se/se/P7--4---------- podle/podle/RR--2---------- toho/ten/PDNS2---------- nechováte/chovat/VB-P---2P-NAI--;././Z:-------------;0;NFC: oborová literatura
91;Chtěl/chtít/VpMS----R-AAI-- jsem/být/VB-S---1P-AAI-- jim/oni/PPMP3--3------- dát/dát/Vf--------A-P-- najevo/najevo/Db------------- přízeň/přízeň/NNFS4-----A---- ,/,/Z:------------- či/či/J^------------- dokonce/dokonce/TT-------------;lásku/láska/NNFS4-----A---- ,/,/Z:------------- již/jenž/PJFS4---------- jsem/být/VB-S---1P-AAI-- k/k/RR--3---------- nim/oni/P5MP3--3------- choval/chovat/VpMS----R-AAI--;././Z:-------------;3;NFC: oborová literatura
