id;left;kwic;right
"86";"V/v/RR--6---------- některých/některý/PZFP6---------- zemích/země/NNFP6-----A---- bývalého/bývalý/AAIS2----1A---- Sovětského/sovětský/AAIS2----1A---- svazu/svaz/NNIS2-----A---- jsou/být/VB-P---3P-AAI-- jeleni/jelen/NNMP1-----A---1 dodnes/dodnes/Db-------------";"chováni/chovat/VsMP------API-- pro/pro/RR--4---------- potřeby/potřeba/NNFP4-----A----";"farmaceutického/farmaceutický/AAIS2----1A---- průmyslu/průmysl/NNIS2-----A---- ././Z:-------------"
"87";"Běta/Běta/NNFS1-----A---- se/se/P7--4----------";"chová/chovat/VB-S---3P-AAI-- jako/jako/J,------------- dítě/dítě/NNNS1-----A---- :/:/Z:------------- je/být/VB-S---3P-AAI-- rozmazlená/rozmazlený/AAFS1----1A---- ,/,/Z:------------- líná/líný/AAFS1----1A---- ,/,/Z:------------- má/mít/VB-S---3P-AAI-- potřebu/potřeba/NNFS4-----A----";"být/být/Vf--------A-I-- středem/střed/NNIS7-----A---- pozornosti/pozornost/NNFS2-----A---- ,/,/Z:------------- nezralá/zralý/AAFS1----1N---- pro/pro/RR--4---------- partnerský/partnerský/AAIS4----1A---- vztah/vztah/NNIS4-----A---- ././Z:-------------"
"88";"Bláhově/bláhově/Dg-------1A---- jsem/být/VB-S---1P-AAI-- se/se/P7--4---------- domníval/domnívat/VpMS----R-AAI-- ,/,/Z:------------- že/že/J,------------- po/po/RR--6---------- odchodu/odchod/NNIS6-----A---1 do/do/RR--2---------- důchodu/důchod/NNIS2-----A---- budu/být/VB-S---1F-AAI-- na/na/RR--6---------- svých/svůj/P8IP6---------- pozemcích/pozemek/NNIP6-----A---- pěstovat/pěstovat/Vf--------A-I-- zeleninu/zelenina/NNFS4-----A---- a/a/J^-------------";"chovat/chovat/Vf--------A-I-- zvířata/zvíře/NNNP4-----A---- pro/pro/RR--4---------- potřebu/potřeba/NNFS4-----A----";"rodiny/rodina/NNFS2-----A---- ././Z:-------------"
"89";"";"Choval/chovat/VpMS----R-AAI-- a/a/J^------------- cvičil/cvičit/VpMS----R-AAI-- bílé/bílý/AAMP4----1A---- kočárové/kočárový/AAMP4----1A---- koně/kůň/NNMP4-----A---- pro/pro/RR--4---------- potřeby/potřeba/NNFP4-----A----";"vídeňského/vídeňský/AAIS2----1A---- dvora/dvůr/NNIS2-----A---- ././Z:-------------"
"90";"V/v/RR--6---------- sexu/sex/NNIS6-----A---- se/se/P7--4----------";"chováte/chovat/VB-P---2P-AAI-- přirozeně/přirozeně/Dg-------1A---- ,/,/Z:------------- nemáte/mít/VB-P---2P-NAI-- potřebu/potřeba/NNFS4-----A----";"nikomu/nikdo/PWM-3---------- nic/nic/PW--4---------- dokazovat/dokazovat/Vf--------A-I-- a/a/J^------------- umíte/umět/VB-P---2P-AAI-- přijmout/přijmout/Vf--------A-P-- rozkoš/rozkoš/NNFS4-----A---- ,/,/Z:------------- kterou/který/P4FS4---------- vám/vy/PP-P3--2------- poskytuje/poskytovat/VB-S---3P-AAI-- někdo/někdo/PZM-1---------- jiný/jiný/AAMS1----1A---- ././Z0------------- a36/a36/X@------------- –/-/Z:------------- 45/45/C=------------- bodů/bod/NNIP2-----A---- Sebevědomí/sebevědomí/NNNS2-----A---- ?/?/Z:-------------"
"91";"„/""/Z:------------- Je/být/VB-S---3P-AAI-- potřeba/potřeba/Db------------- s/s/RR--7---------- nimi/oni/P5MP7--3------- zacházet/zacházet/Vf--------A-I-- stejným/stejný/AAIS7----1A---- způsobem/způsob/NNIS7-----A---- ,/,/Z:------------- jakým/jaký/P4IS7---------- se/se/P7--4---------- společnosti/společnost/NNFP1-----A----";"chovají/chovat/VB-P---3P-AAI-- k/k/RR--3---------- chytrým/chytrý/AAIP3----1A---- telefonům/telefon/NNIP3-----A---- ,/,/Z:------------- tabletům/tablet/NNIP3-----A---- a/a/J^------------- notebookům/notebook/NNIP3-----A---- ,/,/Z:------------- zejména/zejména/TT------------- v/v/RR--6---------- případech/případ/NNIP6-----A---- aktualizací/aktualizace/NNFP2-----A---- aplikací/aplikace/NNFP2-----A---- a/a/J^------------- zabezpečení/zabezpečení/NNNS6-----A---- ,/,/Z:------------- “/""/Z:------------- prohlašuje/prohlašovat/VB-S---3P-AAI-- Llamas/Llamas/X@------------- a/a/J^------------- dodává/dodávat/VB-S---3P-AAI-- :/:/Z:------------- „/""/Z:------------- Vidíme/vidět/VB-P---1P-AAI-- také/také/Db------------- potřebu/potřeba/NNFS4-----A----";"řešení/řešení/NNNS2-----A---- podnikové/podnikový/AAFS2----1A---- mobility/mobilita/NNFS2-----A---- pro/pro/RR--4---------- periferní/periferní/AAFS4----1A---- AR/AR/BN------------- a/a/J^------------- VR/VR/BN------------- ,/,/Z:------------- ale/ale/J^------------- většina/většina/NNFS1-----A---- z/z/RR--2---------- těchto/tento/PDIP2---------- produktů/produkt/NNIP2-----A---- bude/být/VB-S---3F-AAI-- aktualizována/aktualizovat/VsFS------APB-- prostřednictvím/prostřednictvím/RR--2---------- počítače/počítač/NNIS2-----A---- ,/,/Z:------------- konzole/konzole/NNFS2-----A---- nebo/nebo/J^------------- smartphonu/smartphone/NNIS2-----A---- ././Z:------------- “/""/Z:-------------"
"92";"Každý/každý/PLMS1---------- chovatel/chovatel/NNMS1-----A---- je/být/VB-S---3P-AAI-- povinen/povinný/ACMS------A----";"chovat/chovat/Vf--------A-I-- zvířata/zvíře/NNNP4-----A---- způsobem/způsob/NNIS7-----A---- ,/,/Z:------------- v/v/RR--6---------- prostředí/prostředí/NNNS6-----A---- a/a/J^------------- podmínkách/podmínka/NNFP6-----A---- ,/,/Z:------------- které/který/P4FP1---------- vyžadují/vyžadovat/VB-P---3P-AAI-- jejich/jejich/PSFP4-P3------- biologické/biologický/AAFP4----1A---- potřeby/potřeba/NNFP4-----A----";"a/a/J^------------- fyziologické/fyziologický/AAFP4----1A---- funkce/funkce/NNFP4-----A---- ././Z:-------------"
"93";"";"Chová/chovat/VB-S---3P-AAI-- se/se/P7--4---------- nesnesitelně/snesitelně/Dg-------1N---- ,/,/Z:------------- provokativně/provokativně/Dg-------1A---- i/i/J^------------- asociálně/asociálně/Dg-------1A---- bez/bez/RR--2---------- ohledu/ohled/NNIS2-----A---- na/na/RR--4---------- osobní/osobní/AAFP4----1A---- ztráty/ztráta/NNFP4-----A---- i/i/J^------------- bezpečnost/bezpečnost/NNFS4-----A---- s/s/RR--7---------- jediným/jediný/AAIS7----1A---- cílem/cíl/NNIS7-----A---- -/-/Z:------------- prosadit/prosadit/Vf--------A-P-- svou/svůj/P8FS4---------1 vůli/vůle/NNFS4-----A---- ,/,/Z:------------- své/svůj/P8FP4---------1 potřeby/potřeba/NNFP4-----A----";"a/a/J^------------- vyhrát/vyhrát/Vf--------A-P-- tím/ten/PDNS7---------- ,/,/Z:------------- že/že/J,------------- upoutá/upoutat/VB-S---3P-AAP-- pozornost/pozornost/NNFS4-----A---- ././Z:-------------"
"94";"""/""/Z:------------- Na/na/RR--6---------- jedné/jeden/ClFS6---------- straně/strana/NNFS6-----A---- se/se/P7--4---------- chceme/chtít/VB-P---1P-AAI--";"chovat/chovat/Vf--------A-I-- jako/jako/J,------------- solidní/solidní/AAMS1----1A---- partner/partner/NNMS1-----A---- podle/podle/RR--2---------- Evropské/evropský/AAFS2----1A---- dohody/dohoda/NNFS2-----A---- ,/,/Z:------------- na/na/RR--6---------- druhé/druhý/CrFS6---------- pociťujeme/pociťovat/VB-P---1P-AAI-- potřebu/potřeba/NNFS4-----A----";"chránit/chránit/Vf--------A-I-- svůj/svůj/P8IS4---------- trh/trh/NNIS4-----A---- ,/,/Z:------------- ""/""/Z:------------- uvedl/uvést/VpMS----R-AAP-- ././Z:-------------"
"95";"Chamtivost/chamtivost/NNFS1-----A---- cti/čest/NNFS2-----A---- (/(/Z:------------- ne/ne/BN------------- )/)/Z:------------- tratí/trať/NNFP2-----A---- Leč/leč/J^------------- i/i/J^------------- z/z/RR--2---------- dalších/další/AAIP2----1A---- pokusů/pokus/NNIP2-----A---- vždy/vždy/Db------------- vyplynulo/vyplynout/VpNS----R-AAP-- ,/,/Z:------------- že/že/J,------------- lidé/člověk/NNMP1-----A---- dlouhodobě/dlouhodobě/Dg-------1A---- či/či/J^------------- krátkodobě/krátkodobě/Dg-------1A---- náležející/náležející/AGMP1-----A---- do/do/RR--2---------- vyšší/vysoký/AAFS2----2A---- společenské/společenský/AAFS2----1A---- vrstvy/vrstva/NNFS2-----A---- jsou/být/VB-P---3P-AAI-- cílevědomější/cílevědomý/AAMP1----2A---- ,/,/Z:-------------";"chovají/chovat/VB-P---3P-AAI-- se/se/P7--4---------- spíše/spíš/TT------------- s/s/RR--7---------- důrazem/důraz/NNIS7-----A---- na/na/RR--4---------- vlastní/vlastní/AAIS4----1A---- zájem/zájem/NNIS4-----A---- než/než/J,------------- na/na/RR--4---------- potřeby/potřeba/NNFP4-----A----";"druhých/druhý/CrMP2---------- ././Z:-------------"
"96";"Naše/náš/PSFS1-P1------- lidová/lidový/AAFS1----1A---- kultura/kultura/NNFS1-----A---- je/být/VB-S---3P-AAI-- pokladnicí/pokladnice/NNFS7-----A---- ,/,/Z:------------- která/který/P4FS1---------- se/se/P7--4----------";"nechová/chovat/VB-S---3P-NAI-- nikdy/nikdy/Db------------- až/až/TT------------- neomaleně/neomaleně/Dg-------1A---- ,/,/Z:------------- třeba/třeba/TT------------- na/na/RR--4---------- rozdíl/rozdíl/NNIS4-----A---- od/od/RR--2---------- některých/některý/PZNP2---------- zábavných/zábavný/AANP2----1A---- médií/médium/NNNP2-----A---- ,/,/Z:------------- a/a/J^------------- nevnucuje/vnucovat/VB-S---3P-NAI-- se/se/P7--4---------- nám/my/PP-P3--1------- permanentně/permanentně/Dg-------1A---- a/a/J^------------- všudypřítomně/všudypřítomně/Dg-------1A---- a/a/J^------------- jaksi/jaksi/Db------------- „/""/Z:------------- přes/přes/RR--4---------- závit/závit/NNIS4-----A---- “/""/Z:------------- i/i/J^------------- ve/v/RV--6---------- chvílích/chvíle/NNFP6-----A---- ,/,/Z:------------- kdy/kdy/Db------------- o/o/RR--4---------- ni/on/P5FS4--3------- nestojíme/stát/VB-P---1P-NAI-- i/i/J^------------- kdyžmáme/kdyžmáme/X@------------- jiné/jiný/AAFP4----1A---- starosti/starost/NNFP4-----A---- a/a/J^------------- potřeby/potřeba/NNFP4-----A----";"…/.../Z:-------------"
"97";"Láska/láska/NNFS1-----A---- je/být/VB-S---3P-AAI-- silný/silný/AAIS1----1A---- cit/cit/NNIS1-----A---- ,/,/Z:------------- který/který/P4IS4----------";"chováme/chovat/VB-P---1P-AAI-- k/k/RR--3---------- osobám/osoba/NNFP3-----A---- ,/,/Z:------------- zvířatům/zvíře/NNNP3-----A---- nebo/nebo/J^------------- věcem/věc/NNFP3-----A---- ,/,/Z:------------- které/který/P4FP1---------- uspokojovaly/uspokojovat/VpFP----R-AAI-- ,/,/Z:------------- uspokojují/uspokojovat/VB-P---3P-AAI-- nebo/nebo/J^------------- budou/být/VB-P---3F-AAI-- uspokojovat/uspokojovat/Vf--------A-I-- naše/náš/PSFP4-P1------- nejhlubší/hluboký/AAFP4----3A---- touhy/touha/NNFP4-----A---- a/a/J^------------- potřeby/potřeba/NNFP4-----A----";"././Z:-------------"
"98";"Někdo/někdo/PZM-1---------- se/se/P7--4----------";"chová/chovat/VB-S---3P-AAI-- tak/tak/Db------------- ,/,/Z:------------- že/že/J,------------- se/se/P7--4---------- přetvařuje/přetvařovat/VB-S---3P-AAI-- ,/,/Z:------------- ale/ale/J^------------- já/já/PP-S1--1------- nemám/mít/VB-S---1P-NAI-- potřebu/potřeba/NNFS4-----A----";"se/se/P7--4---------- přetvařovat/přetvařovat/Vf--------A-I-- nikde/nikde/Db------------- a/a/J^------------- před/před/RR--7---------- nikým/nikdo/PWM-7---------- ././Z:-------------"
"99";"Pár/pár/Db------------- křepelek/křepelka/NNFP2-----A---- jsem/být/VB-S---1P-AAI--";"choval/chovat/VpMS----R-AAI-- už/už/Db------------- dřív/brzy/Dg-------2A---- ,/,/Z:------------- pro/pro/RR--4---------- naši/náš/PSFS4-P1------- potřebu/potřeba/NNFS4-----A----";"a/a/J^------------- rozhodl/rozhodnout/VpMS----R-AAP-1 jsem/být/VB-S---1P-AAI-- se/se/P7--4---------- přejít/přejít/Vf--------A-P-- na/na/RR--4---------- větší/velký/AAIS4----2A---- chov/chov/NNIS4-----A---- ,/,/Z:------------- ""/""/Z:------------- vysvětluje/vysvětlovat/VB-S---3P-AAI-- Hobza/Hobza/NNMS1-----A---- ././Z:-------------"
"100";"Zemědělské/zemědělský/AANS1----1A---- obchodní/obchodní/AANS1----1A---- družstvo/družstvo/NNNS1-----A---- Olešník/Olešník/NNIS1-----A----";"chová/chovat/VB-S---3P-AAI-- v/v/RR--6---------- současné/současný/AAFS6----1A---- době/doba/NNFS6-----A---- 470/470/C=------------- prasnic/prasnice/NNFP2-----A---- ,/,/Z:------------- prodává/prodávat/VB-S---3P-AAI-- selata/sele/NNNP4-----A---- a/a/J^------------- prasata/prase/NNNP4-----A---- vykrmuje/vykrmovat/VB-S---3P-AAI-- jen/jen/Db------------- okrajově/okrajově/Dg-------1A---- pro/pro/RR--4---------- potřeby/potřeba/NNFP4-----A----";"vlastníků/vlastník/NNMP2-----A---- půdy/půda/NNFS2-----A---- a/a/J^------------- členů/člen/NNMP2-----A---- družstva/družstvo/NNNS2-----A---- ././Z:-------------"
"101";"modul/modul/NNIS1-----A---- Proč/proč/Db------------- se/se/P7--4----------";"chováme/chovat/VB-P---1P-AAI-- ,/,/Z:------------- jak/jak/Db------------- se/se/P7--4---------- chováme/chovat/VB-P---1P-AAI-- ;/;/Z:------------- cíl/cíl/NNIS1-----A---- :/:/Z:------------- naučit/naučit/Vf--------A-P-- účastníky/účastník/NNMP4-----A---- rozpoznávat/rozpoznávat/Vf--------A-I-- lidské/lidský/AAFP4----1A---- potřeby/potřeba/NNFP4-----A----";"a/a/J^------------- uspokojovat/uspokojovat/Vf--------A-I-- je/oni/PPFP4--3------- společensky/společensky/Dg-------1A---- přijatelným/přijatelný/AAIS7----1A---- způsobem/způsob/NNIS7-----A---- ;/;/Z:------------- prozkoumat/prozkoumat/Vf--------A-P-- ,/,/Z:------------- proč/proč/Db------------- se/se/P7--4---------- chováme/chovat/VB-P---1P-AAI-- ,/,/Z:------------- jak/jak/Db------------- se/se/P7--4---------- chováme/chovat/VB-P---1P-AAI-- ././Z:-------------"
"102";"Z/z/RR--2---------- levicového/levicový/AAIS2----1A---- pohledu/pohled/NNIS2-----A---- se/se/P7--4----------";"choval/chovat/VpMS----R-AAI-- racionálně/racionálně/Dg-------1A---- a/a/J^------------- i/i/J^------------- ekonom/ekonom/NNMS1-----A---- musí/muset/VB-S---3P-AAI-- připustit/připustit/Vf--------A-P-- ,/,/Z:------------- že/že/J,------------- privatizace/privatizace/NNFS1-----A---- dominantního/dominantní/AANS2----1A---- letiště/letiště/NNNS2-----A---- pokrývajícího/pokrývající/AGNS2-----A---- potřeby/potřeba/NNFP4-----A----";"většiny/většina/NNFS2-----A---- země/země/NNFS2-----A---- má/mít/VB-S---3P-AAI-- svá/svůj/P8NP4---------1 problematická/problematický/AANP4----1A---- místa/místo/NNNP4-----A---- ././Z:-------------"
"103";"";"Chovat/chovat/Vf--------A-I-- se/se/P7--4---------- hospodárně/hospodárně/Dg-------1A---- ,/,/Z:------------- protože/protože/J,------------- víme/vědět/VB-P---1P-AAI-- ,/,/Z:------------- že/že/J,------------- někdy/někdy/Db------------- můžeme/moci/VB-P---1P-AAI-- stejnou/stejný/AAFS4----1A---- cestu/cesta/NNFS4-----A---- absolvovat/absolvovat/Vf--------A-B-- třeba/třeba/TT------------- společně/společně/Dg-------1A---- s/s/RR--7---------- kolegy/kolega/NNMP7-----A---- nebo/nebo/J^------------- městskou/městský/AAFS7----1A---- dopravou/doprava/NNFS7-----A---- ;/;/Z:------------- pokud/pokud/J,------------- existuje/existovat/VB-S---3P-AAI-- odpovídající/odpovídající/AGFS1-----A---- alternativa/alternativa/NNFS1-----A---- na/na/RR--4---------- naše/náš/PSFP4-P1------- mobilitní/mobilitní/X@------------- potřeby/potřeba/NNFP4-----A----";",/,/Z:------------- je/být/VB-S---3P-AAI-- vhodné/vhodný/AANS1----1A---- ji/on/PPFS4--3------- využít/využít/Vf--------A-P-- ././Z:-------------"
"104";"Tím/ten/PDNS7---------- ,/,/Z:------------- že/že/J,------------- je/oni/PPIP4--3-------";"chováme/chovat/VB-P---1P-AAI-- doma/doma/Db------------- ,/,/Z:------------- v/v/RR--6---------- bytech/byt/NNIP6-----A---- ,/,/Z:------------- na/na/RR--6---------- dvorku/dvorek/NNIS6-----A---- nebo/nebo/J^------------- v/v/RR--6---------- zahradě/zahrada/NNFS6-----A---- ,/,/Z:------------- do/do/RR--2---------- značné/značný/AAFS2----1A---- míry/míra/NNFS2-----A---- měníme/měnit/VB-P---1P-AAI-- jejich/jejich/PSFP4-P3------- životní/životní/AAFP4----1A---- potřeby/potřeba/NNFP4-----A----";"a/a/J^------------- musíme/muset/VB-P---1P-AAI-- víc/hodně/Dg-------2A---- dbát/dbát/Vf--------A-I-- na/na/RR--4---------- vyváženost/vyváženost/NNFS4-----A---- potravy/potrava/NNFS2-----A---- a/a/J^------------- dostatečný/dostatečný/AAIS4----1A---- přísun/přísun/NNIS4-----A---- živin/živina/NNFP2-----A---- ././Z:-------------"
"105";"Sice/sice/J^------------- byl/být/VpMS----R-AAI-- za/za/RR--2---------- husitů/husita/NNMP2-----A---- vypálený/vypálený/AAMS1----1A---- ,/,/Z:------------- ale/ale/J^------------- do/do/RR--2---------- té/ten/PDFS2---------- doby/doba/NNFS2-----A---- brtníci/brtník/NNMP1-----A---- ,/,/Z:------------- kteří/který/P4MP1---------- žili/žít/VpMP----R-AAI-- ve/v/RV--6---------- zdejších/zdejší/AAIP6----1A---- lesích/les/NNIP6-----A---- ,/,/Z:-------------";"chovali/chovat/VpMP----R-AAI-- včely/včela/NNFP4-----A---- především/především/TT------------- pro/pro/RR--4---------- jeho/jeho/PSFP4-S3------- potřeby/potřeba/NNFP4-----A----";"././Z:-------------"
"106";"Nájemce/nájemce/NNMS1-----A---- (/(/Z:------------- 32/32/C=------------- )/)/Z:------------- rybníka/rybník/NNIS2-----A----";"choval/chovat/VpMS----R-AAI-- ryby/ryba/NNFP4-----A---- pro/pro/RR--4---------- vlastní/vlastní/AAFS4----1A---- potřebu/potřeba/NNFS4-----A----";"a/a/J^------------- ke/k/RV--3---------- sportovnímu/sportovní/AAIS3----1A---- rybolovu/rybolov/NNIS3-----A---- ././Z:-------------"
"107";"Nic/nic/PW--4---------- takovýho/takový/PDNS2---------6 necítím/cítit/VB-S---1P-NAI-- ,/,/Z:------------- protože/protože/J,------------- já/já/PP-S1--1------- myslím/myslet/VB-S---1P-AAI-- ,/,/Z:------------- že/že/J,------------- v/v/RR--6---------- hloubi/hloub/NNFS6-----A---- duše/duše/NNFS2-----A---- vím/vědět/VB-S---1P-AAI-- ,/,/Z:------------- že/že/J,------------- kdybych/kdyby|být/J,-------------|Vc-S---1----I-- to/ten/PDNS1---------- nebyla/být/VpFS----R-NAI-- já/já/PP-S1--1------- ,/,/Z:------------- udělal/udělat/VpMS----R-AAP-- by/být/Vc----------I-- ti/ty/PH-S3--2------- to/ten/PDNS4---------- někdo/někdo/PZM-1---------- jiný/jiný/AAMS1----1A---- ,/,/Z:------------- myslím/myslet/VB-S---1P-AAI-- ,/,/Z:------------- že/že/J,------------- v/v/RR--6---------- nejhlubší/hluboký/AAFS6----3A---- duši/duše/NNFS6-----A---- vím/vědět/VB-S---1P-AAI-- ,/,/Z:------------- že/že/J,------------- to/ten/PDNS4---------- všechno/všechen/PLNS4---------- si/se/P7--3---------- způsobuješ/způsobovat/VB-S---2P-AAI-- sám/sám/PLMS1---------- ,/,/Z:------------- k/k/RR--3---------- většině/většina/NNFS3-----A---- lidí/člověk/NNMP2-----A---- se/se/P7--4---------- tak/tak/Db-------------";"nechovám/chovat/VB-S---1P-NAI-- ,/,/Z:------------- většinu/většina/NNFS4-----A---- lidí/člověk/NNMP2-----A---- nechám/nechat/VB-S---1P-AAP-- žít/žít/Vf--------A-I-- si/se/P7--3---------- svůj/svůj/P8IS4---------- život/život/NNIS4-----A---- ,/,/Z:------------- nebo/nebo/J^------------- se/se/P7--4---------- s/s/RR--7---------- nima/oni/P5MP7--3------6 i/i/J^------------- zasměju/zasmát/VB-S---1P-AAP-- a/a/J^------------- tak/tak/J^------------- ,/,/Z:------------- ale/ale/J^------------- u/u/RR--2---------- tebe/ty/PP-S2--2------- mám/mít/VB-S---1P-AAI-- z/z/RR--2---------- nějakého/nějaký/PZIS2---------- důvodu/důvod/NNIS2-----A---- potřebu/potřeba/NNFS4-----A----";"srážet/srážet/Vf--------A-I-- tě/ty/PH-S4--2------- ,/,/Z:------------- podle/podle/RR--2---------- mě/já/PH-S2--1------- se/se/P7--4---------- to/ten/PDNS1---------- ve/v/RV--6---------- společnosti/společnost/NNFS6-----A---- ,/,/Z:------------- v/v/RR--6---------- určité/určitý/AAFS6----1A---- kultuře/kultura/NNFS6-----A---- ,/,/Z:------------- tak/tak/J^------------- vyvinulo/vyvinout/VpNS----R-AAP-- ,/,/Z:------------- že/že/J,------------- když/když/J,------------- vidíme/vidět/VB-P---1P-AAI-- někoho/někdo/PZM-4---------- ,/,/Z:------------- kdo/kdo/PKM-1---------- sráží/srážet/VB-S---3P-AAI-- celý/celý/AAIS4----1A---- kmen/kmen/NNIS4-----A---- a/a/J^------------- tak/tak/Db------------- dolů/dolů/Db------------- ,/,/Z:------------- někoho/někdo/PZM-4---------- ,/,/Z:------------- kdo/kdo/PKM-1---------- nás/my/PP-P4--1------- ostatní/ostatní/AAMP4----1A---- sere/srát/VB-S---3P-AAI-- ,/,/Z:------------- protože/protože/J,------------- je/být/VB-S---3P-AAI-- blbej/blbý/AAMS1----1A---6 nebo/nebo/J^------------- pomalej/pomalý/AAMS1----1A---6 nebo/nebo/J^------------- slabej/slabý/AAMS1----1A---6 nebo/nebo/J^------------- hubenej/hubený/AAMS1----1A---6 nebo/nebo/J^------------- prcek/prcek/NNMS1-----A---- nebo/nebo/J^------------- nebo/nebo/J^-------------"
"108";"Tímpádem/Tímpádem/X@------------- mají/mít/VB-P---3P-AAI-- politici/politik/NNMP1-----A---- u/u/RR--2---------- nás/my/PP-P2--1------- obtížnější/obtížný/AAFS4----2A---- situaci/situace/NNFS4-----A---- ,/,/Z:------------- ale/ale/J^------------- i/i/J^------------- přesto/přesto/Db------------- se/se/P7--4---------- na/na/RR--4---------- můj/můj/PSIS4-S1------- vkus/vkus/NNIS4-----A----";"chovají/chovat/VB-P---3P-AAI-- tak/tak/Db------------- ,/,/Z:------------- aby/aby|být/J,-------------|Vc----------I-- se/se/P7--4---------- mohli/moci/VpMP----R-AAI-- těšit/těšit/Vf--------A-I-- vlastnímu/vlastní/AANS3----1A---- pohodlí/pohodlí/NNNS3-----A---- a/a/J^------------- nedbají/dbát/VB-P---3P-NAI-- tolik/tolik/Ca--4---------- na/na/RR--4---------- potřeby/potřeba/NNFP4-----A----";"a/a/J^------------- přání/přání/NNNP4-----A---- našich/náš/PSMP2-P1------- spoluobčanů/spoluobčan/NNMP2-----A---- ././Z:-------------"
"109";"";"Chovám/chovat/VB-S---1P-AAI-- se/se/P7--4---------- slušně/slušně/Dg-------1A---- ,/,/Z:------------- neplivu/plivat/VB-S---1P-NAI-1 na/na/RR--6---------- ulici/ulice/NNFS6-----A---- ,/,/Z:------------- potřebu/potřeba/NNFS4-----A----";"vykonávám/vykonávat/VB-S---1P-AAI-- zásadně/zásadně/Dg-------1A---- na/na/RR--6---------- toaletě/toaleta/NNFS6-----A---- k/k/RR--3---------- tomu/ten/PDNS3---------- určené/určený/AANS4----1A---- a/a/J^------------- když/když/J,------------- se/se/P7--4---------- přestanu/přestat/VB-S---1P-AAP-- chovat/chovat/Vf--------A-I-- slušně/slušně/Dg-------1A---- ,/,/Z:------------- platit/platit/Vf--------A-I-- daně/daň/NNFP4-----A---- a/a/J^------------- chodit/chodit/Vf--------A-I-- do/do/RR--2---------- práce/práce/NNFS2-----A---- ,/,/Z:------------- tak/tak/J^------------- oni/oni/PPMP1--3------- mi/já/PH-S3--1------- taky/také/Db------------- nepomohou/pomoci/VB-P---3P-NAP-1 a/a/J^------------- ani/ani/J^------------- nikdo/nikdo/PWM-1---------- jiný/jiný/AAMS1----1A---- ././Z:-------------"
"110";"Věc/věc/NNFS1-----A---- se/se/P7--4---------- má/mít/VB-S---3P-AAI-- tak/tak/Db------------- ,/,/Z:------------- že/že/J,------------- lidé/člověk/NNMP1-----A---- ,/,/Z:------------- kteří/který/P4MP1----------";"nechovají/chovat/VB-P---3P-NAI-- zvířata/zvíře/NNNP4-----A---- a/a/J^------------- nemají/mít/VB-P---3P-NAI-- potřebu/potřeba/NNFS4-----A----";"s/s/RR--7---------- nimi/oni/P5MP7--3------- žít/žít/Vf--------A-I-- ,/,/Z:------------- nejsou/být/VB-P---3P-NAI-- povinni/povinný/ACMP------A---- snášet/snášet/Vf--------A-I-- to/ten/PDNS4---------- ,/,/Z:------------- že/že/J,------------- jejich/jejich/PSIS4-P3------- majetek/majetek/NNIS4-----A---- nebo/nebo/J^------------- pozemek/pozemek/NNIS4-----A---- narušují/narušovat/VB-P---3P-AAI-- zvířata/zvíře/NNNP1-----A---- sousedů/soused/NNMP2-----A---- ././Z:-------------"
"111";"S/s/RR--7---------- Camilou/Camila/NNFS7-----A---- jsem/být/VB-S---1P-AAI-- měl/mít/VpMS----R-AAI-- krásný/krásný/AAIS4----1A---- vztah/vztah/NNIS4-----A---- ,/,/Z:-------------";"choval/chovat/VpMS----R-AAI-- jsem/být/VB-S---1P-AAI-- se/se/P7--4---------- k/k/RR--3---------- ní/on/P5FS3--3------- pořád/pořád/Db------------- stejně/stejně/Dg-------1A---- něžně/něžně/Dg-------1A---- ,/,/Z:------------- dělal/dělat/VpMS----R-AAI-- jsem/být/VB-S---1P-AAI-- ,/,/Z:------------- co/co/PQ--4---------- jsem/být/VB-S---1P-AAI-- jí/on/PPFS3--3------- i/i/J^------------- malé/malý/AANS4----1A---- na/na/RR--6---------- očích/oko/NNFP6-----A---- viděl/vidět/VpMS----R-AAI-- ,/,/Z:------------- a/a/J^------------- současně/současně/Dg-------1A---- jsem/být/VB-S---1P-AAI-- byl/být/VpMS----R-AAI-- Natalii/Natálie/NNFS3-----A---- oporou/opora/NNFS7-----A---- při/při/RR--6---------- rozvodu/rozvod/NNIS6-----A---1 ,/,/Z:------------- užíval/užívat/VpMS----R-AAI-- si/se/P7--3---------- její/její/PSFS2FS3------- blízkosti/blízkost/NNFS2-----A---- a/a/J^------------- uspokojoval/uspokojovat/VpMS----R-AAI-- její/její/PSFS4FS3------- potřebu/potřeba/NNFS4-----A----";"mít/mít/Vf--------A-I-- někoho/někdo/PZM-4---------- ,/,/Z:------------- kdo/kdo/PKM-1---------- ji/on/PPFS4--3------- miluje/milovat/VB-S---3P-AAI-- ././Z:-------------"
