id;left;kwic;right
"264";"Že/že/J,------------- všichni/všechen/PLMP1---------- vědí/vědět/VB-P---3P-AAI-- ,/,/Z:------------- jak/jak/J,------------- se/se/P7--4---------- ke/k/RV--3---------- psům/pes/NNMP3-----A----";"chovat/chovat/Vf--------A-I-- ,/,/Z:------------- co/co/PQ--1---------- jim/oni/PPMP3--3------- nevadí/vadit/VB-S---3P-NAI-- a/a/J^------------- co/co/PQ--1---------- již/již/Db------------- ano/ano/TT------------- ,/,/Z:------------- z/z/RR--2---------- druhé/druhý/CrFS2---------- strany/strana/NNFS2-----A---- zase/zase/Db------------- psi/pes/NNMP1-----A---- zažívající/zažívající/AGMP1-----A---- dnes/dnes/Db------------- a/a/J^------------- denně/denně/Dg-------1A---- různé/různý/AAFP4----1A---- situace/situace/NNFP4-----A---- při/při/RR--6---------- vycházkách/vycházka/NNFP6-----A---- ,/,/Z:------------- cestování/cestování/NNNS4-----A---- MHD/MHD/BN------------- ,/,/Z:------------- výcviku/výcvik/NNIS6-----A---- apod/apod/Bb------------- ././Z0------------- spoustu/spousta/NNFS4-----A---- věcí/věc/NNFP2-----A---- ,/,/Z:------------- které/který/P4FP1---------- se/se/P7--4---------- dějí/dít/VB-P---3P-AAI-1 kolem/kolem/RR--2---------- nich/oni/P5FP2--3------- nebo/nebo/J^------------- přímo/přímo/Dg-------1A---- jim/oni/PPFP3--3------- neberou/brát/VB-P---3P-NAI-- jako/jako/J,------------- ohrožení/ohrožení/NNNS4-----A---- a/a/J^------------- necítí/cítit/VB-P---3P-NAI-- potřebu/potřeba/NNFS4-----A----";"se/se/P7--4---------- bránit/bránit/Vf--------A-I-- ././Z:-------------"
"265";"Je/být/VB-S---3P-AAI-- nutné/nutný/AANS1----1A---- zjistit/zjistit/Vf--------A-P-- ,/,/Z:------------- co/co/PQ--4---------- obyvatelé/obyvatel/NNMP1-----A---- chtějí/chtít/VB-P---3P-AAI-- a/a/J^------------- co/co/PQ--1---------- je/oni/PPMP4--3------- nutí/nutit/VB-P---3P-AAI--";"chovat/chovat/Vf--------A-I-- se/se/P7--4---------- určitým/určitý/AAIS7----1A---- způsobem/způsob/NNIS7-----A---- ,/,/Z:------------- jaké/jaký/P4IP1---------- jsou/být/VB-P---3P-AAI-- motivy/motiv/NNIP1-----A---- pro/pro/RR--4---------- výběr/výběr/NNIS4-----A---- toho/ten/PDNS2---------- ,/,/Z:------------- jak/jak/Db------------- uspokojují/uspokojovat/VB-P---3P-AAI-- své/svůj/P8FP4---------1 potřeby/potřeba/NNFP4-----A----";"././Z:-------------"
"266";"Vůči/vůči/RR--3---------- českému/český/AAMS3----1A---- voliči/volič/NNMS3-----A---- se/se/P7--4---------- však/však/J^------------- pan/pán/NNMS1-----A---- prezident/prezident/NNMS1-----A----";"chová/chovat/VB-S---3P-AAI-- téměř/téměř/Db------------- dokonale/dokonale/Dg-------1A---- -/-/Z:------------- pro/pro/RR--4---------- potřeby/potřeba/NNFP4-----A----";"té/ten/PDFS2---------- funkce/funkce/NNFS2-----A---- a/a/J^------------- jeho/jeho/PSFS2-S3------- politické/politický/AAFS2----1A---- budoucnosti/budoucnost/NNFS2-----A---- ././Z:-------------"
"267";"„/""/Z:------------- Když/když/J,------------- na/na/RR--4---------- drezurní/drezurní/AAIS4----1A---- obdélník/obdélník/NNIS4-----A---- vjedou/vjet/VB-P---3P-AAP-- koně/kůň/NNMP1-----A---- ,/,/Z:------------- kteří/který/P4MP1---------- jsou/být/VB-P---3P-AAI-- více/hodně/Dg-------2A---- jak/jak/Db------------- 400/400/C=------------- let/rok/NNNP2-----A----";"chováni/chovat/VsMP------API-- pro/pro/RR--4---------- vozatajské/vozatajský/AAFP4----1A---- potřeby/potřeba/NNFP4-----A----";",/,/Z:------------- je/být/VB-S---3P-AAI-- to/ten/PDNS1---------- ,/,/Z:------------- jako/jako/J,------------- když/když/J,------------- se/se/P7--4---------- na/na/RR--6---------- autosalonu/autosalon/NNIS6-----A---1 objeví/objevit/VB-S---3P-AAP-- poslední/poslední/AAIS1----1A---- model/model/NNIS1-----A---- porsche/porsche/NNNS2-----A---- ././Z:-------------"
"268";"Lidé/člověk/NNMP1-----A---- se/se/P7--4---------- začnou/začít/VB-P---3P-AAP--";"chovat/chovat/Vf--------A-I-- hospodárněji/hospodárně/Dg-------2A---- ,/,/Z:------------- protože/protože/J,------------- se/se/P7--4---------- víc/hodně/Dg-------2A---- zadluží/zadlužit/VB-P---3P-AAP-- a/a/J^------------- nebude/být/VB-S---3F-NAI-- se/se/P7--4---------- jim/oni/PPMP3--3------- dostávat/dostávat/Vf--------A-I-- peněz/peníze/NNIP2-----A---- na/na/RR--4---------- denní/denní/AAFP4----1A---- potřeby/potřeba/NNFP4-----A----";"././Z:-------------"
"269";"Jsme/být/VB-P---1P-AAI-- jiní/jiný/AAMP1----1A---- v/v/RR--6---------- tom/ten/PDNS6---------- ,/,/Z:------------- jak/jak/Db------------- se/se/P7--4----------";"chováme/chovat/VB-P---1P-AAI-- ,/,/Z:------------- jak/jak/Db------------- se/se/P7--4---------- vyjadřujeme/vyjadřovat/VB-P---1P-AAI-- ,/,/Z:------------- a/a/J^------------- jaké/jaký/P4FP4---------- máme/mít/VB-P---1P-AAI-- potřeby/potřeba/NNFP4-----A----";"././Z:-------------"
"270";"";"Chová/chovat/VB-S---3P-AAI-- se/se/P7--4---------- nesnesitelně/snesitelně/Dg-------1N---- ,/,/Z:------------- provokativně/provokativně/Dg-------1A---- i/i/J^------------- asociálně/asociálně/Dg-------1A---- bez/bez/RR--2---------- ohledu/ohled/NNIS2-----A---- na/na/RR--4---------- osobní/osobní/AAFP4----1A---- ztráty/ztráta/NNFP4-----A---- i/i/J^------------- bezpečnost/bezpečnost/NNFS4-----A---- s/s/RR--7---------- jediným/jediný/AAIS7----1A---- cílem/cíl/NNIS7-----A---- -/-/Z:------------- prosadit/prosadit/Vf--------A-P-- svou/svůj/P8FS4---------1 vůli/vůle/NNFS4-----A---- ,/,/Z:------------- své/svůj/P8FP4---------1 potřeby/potřeba/NNFP4-----A----";"a/a/J^------------- vyhrát/vyhrát/Vf--------A-P-- tím/ten/PDNS7---------- ,/,/Z:------------- že/že/J,------------- upoutá/upoutat/VB-S---3P-AAP-- pozornost/pozornost/NNFS4-----A---- ././Z:-------------"
"271";"Ti/ten/PDMP1---------- lidé/člověk/NNMP1-----A---- se/se/P7--4----------";"chovali/chovat/VpMP----R-AAI-- racionálně/racionálně/Dg-------1A---- v/v/RR--6---------- tom/ten/PDNS6---------- ,/,/Z:------------- že/že/J,------------- snažili/snažit/VpMP----R-AAI-- zabezpečit/zabezpečit/Vf--------A-P-- své/svůj/P8FP4---------1 potřeby/potřeba/NNFP4-----A----";"každodenního/každodenní/AAIS2----1A---- života/život/NNIS2-----A---- ././Z:-------------"
"272";"";"Nechová/chovat/VB-S---3P-NAI-- se/se/P7--4---------- tak/tak/Db------------- ,/,/Z:------------- aby/aby|být/J,-------------|Vc----------I-- lidé/člověk/NNMP1-----A---- neměli/mít/VpMP----R-NAI-- potřebu/potřeba/NNFS4-----A----";"jej/on/PPMS4--3------2 zesměšňovat/zesměšňovat/Vf--------A-I-- či/či/J^------------- urážet/urážet/Vf--------A-I-- ././Z:-------------"
"273";"";"Chová/chovat/VB-S---3P-AAI-- zhruba/zhruba/Db------------- padesát/padesát/Cn-S4---------- kusů/kus/NNIP2-----A---- skotu/skot/NNIS2-----A---- a/a/J^------------- pro/pro/RR--4---------- svoji/svůj/P8FS4---------- potřebu/potřeba/NNFS4-----A----";"drůbež/drůbež/NNFS1-----A---- a/a/J^------------- prasata/prase/NNNP4-----A---- ././Z:-------------"
"274";"Lidé/člověk/NNMP1-----A---- je/oni/PPMP4--3-------";"chovají/chovat/VB-P---3P-AAI-- zejména/zejména/TT------------- pro/pro/RR--4---------- potřeby/potřeba/NNFP4-----A----";"vysoké/vysoký/AAFS2----1A---- jezdecké/jezdecký/AAFS2----1A---- školy/škola/NNFS2-----A---- ,/,/Z:------------- ale/ale/J^------------- často/často/Dg-------1A---- je/oni/PPFP4--3------- využívají/využívat/VB-P---3P-AAI-- k/k/RR--3---------- zápřahu/zápřah/NNIS3-----A---- do/do/RR--2---------- kočáru/kočár/NNIS2-----A---- ././Z:-------------"
"275";"Jámámtotiž/Jámámtotiž/X@------------- ráda/rád/ACFS------A---- ,/,/Z:------------- když/když/J,------------- je/být/VB-S---3P-AAI-- chlap/chlap/NNMS1-----A---- sice/sice/J^------------- schopný/schopný/AAMS1----1A---- ,/,/Z:------------- ale/ale/J^------------- také/také/Db------------- seumí/seumí/X@-------------";"chovat/chovat/Vf--------A-I-- a/a/J^------------- nemá/mít/VB-S---3P-NAI-- potřebu/potřeba/NNFS4-----A----";"vám/vy/PP-P3--2------- říkat/říkat/Vf--------A-I-- ,/,/Z:------------- že/že/J,------------- jste/být/VB-P---2P-AAI-- divná/divný/AAFS1----1A---- ,/,/Z:------------- když/když/J,------------- ho/on/PHMS4--3------- nechcete/chtít/VB-P---2P-NAI-- ,/,/Z:------------- protože/protože/J,------------- zrovna/zrovna/Db------------- on/on/PPMS1--3------- vám/vy/PP-P3--2------- může/moci/VB-S---3P-AAI-- nabídnout/nabídnout/Vf--------A-P-- naprosto/naprosto/Db------------- všechno/všechen/PLNS4---------- ././Z:-------------"
"276";"A/a/J^------------- mnozí/mnohý/AAMP1----1A---- z/z/RR--2---------- lidí/člověk/NNMP2-----A---- ,/,/Z:------------- kteří/který/P4MP1----------";"chovají/chovat/VB-P---3P-AAI-- slepice/slepice/NNFP4-----A---- doma/doma/Db------------- pro/pro/RR--4---------- vlastní/vlastní/AAFS4----1A---- potřebu/potřeba/NNFS4-----A----";",/,/Z:------------- nechávali/nechávat/VpMP----R-AAI-- drůbež/drůbež/NNFS4-----A---- pobíhat/pobíhat/Vf--------A-I-- volně/volně/Dg-------1A---- ve/v/RV--6---------- výbězích/výběh/NNIP6-----A---- ././Z:-------------"
"277";"";"Chová/chovat/VB-S---3P-AAI-- se/se/P7--4---------- jako/jako/J,------------- sobecké/sobecký/AANS1----1A---- malé/malý/AANS1----1A---- dítě/dítě/NNNS1-----A---- ,/,/Z:------------- které/který/P4NS1---------- chce/chtít/VB-S---3P-AAI-- mít/mít/Vf--------A-I-- všechny/všechen/PLFP4---------- hračky/hračka/NNFP4-----A---- pro/pro/RR--4---------- sebe/se/P6--4---------- a/a/J^------------- nemíní/mínit/VB-S---3P-NAI-- se/se/P7--4---------- žádné/žádný/PWNS1---------- vzdát/vzdát/Vf--------A-P-- bez/bez/RR--2---------- ohledu/ohled/NNIS2-----A---- na/na/RR--4---------- potřeby/potřeba/NNFP4-----A----";"druhých/druhý/CrMP2---------- ././Z:-------------"
"278";"První/první/CrNS1---------- ohnisko/ohnisko/NNNS1-----A---- se/se/P7--4---------- v/v/RR--6---------- kraji/kraj/NNIS6-----A---- objevilo/objevit/VpNS----R-AAP-- v/v/RR--6---------- Ostravě/Ostrava/NNFS6-----A---- -/-/Z0------------- Svinově/Svinov/NNIS6-----A---- ,/,/Z:------------- kde/kde/Db------------- bylo/být/VpNS----R-AAI-- utraceno/utratit/VsNS------APP-- 20/20/C=------------- slepic/slepice/NNFP2-----A---- ,/,/Z:------------- které/který/P4FP4---------- majitel/majitel/NNMS1-----A----";"choval/chovat/VpMS----R-AAI-- pro/pro/RR--4---------- vlastní/vlastní/AAFS4----1A---- potřebu/potřeba/NNFS4-----A----";"././Z:-------------"
"279";"Podmínkou/podmínka/NNFS7-----A---- je/být/VB-S---3P-AAI-- ,/,/Z:------------- aby/aby|být/J,-------------|Vc----------I-- zvířata/zvíře/NNNP1-----A---- nebyla/být/VpFS----R-NAI--";"chována/chovat/VsFS------API-- za/za/RR--7---------- účelem/účel/NNIS7-----A---- zisku/zisk/NNIS2-----A---- ,/,/Z:------------- ale/ale/J^------------- jen/jen/Db------------- pro/pro/RR--4---------- vlastní/vlastní/AAFS4----1A---- potřebu/potřeba/NNFS4-----A----";",/,/Z:------------- “/""/Z:------------- uvádí/uvádět/VB-S---3P-AAI-- Marcela/Marcela/NNFS1-----A---- Kotyrová/Kotyrová/NNFS1-----A---- z/z/RR--2---------- České/český/AAFS2----1A---- asociace/asociace/NNFS2-----A---- pojišťoven/pojišťovna/NNFP2-----A---- ././Z:-------------"
"280";"Lidé/člověk/NNMP1-----A---- se/se/P7--4----------";"chovají/chovat/VB-P---3P-AAI-- jako/jako/J,------------- by/být/Vc----------I-- ani/ani/J^------------- nešlo/jít/VpNS----R-NAI-- o/o/RR--4---------- bytosti/bytost/NNFP4-----A---- ,/,/Z:------------- které/který/P4FP1---------- mají/mít/VB-P---3P-AAI-- city/cit/NNIP4-----A---- a/a/J^------------- své/svůj/P8FP4---------1 potřeby/potřeba/NNFP4-----A----";"././Z:-------------"
"281";"Ovšem/ovšem/TT------------- biskup/biskup/NNMS1-----A---- Prusinovský/Prusinovský/NNMS1-----A----";"nechoval/chovat/VpMS----R-NAI-- zvěř/zvěř/NNFS4-----A---- u/u/RR--2---------- Hukvald/Hukvaldy/NNIP2-----A---- jen/jen/Db------------- pro/pro/RR--4---------- potřeby/potřeba/NNFP4-----A----";"lovu/lov/NNIS2-----A---- a/a/J^------------- své/svůj/P8FP4---------1 tabule/tabule/NNFP4-----A---- ,/,/Z:------------- ale/ale/J^------------- existují/existovat/VB-P---3P-AAI-- doklady/doklad/NNIP1-----A---- ,/,/Z:------------- že/že/J,------------- je/oni/PPIP4--3------- nechával/nechávat/VpMS----R-AAI-- i/i/J^------------- cvičit/cvičit/Vf--------A-I-- ././Z:-------------"
"282";"Korektury/korektura/NNFS2-----A---- i/i/J^------------- dělnické/dělnický/AAFS2----1A---- profese/profese/NNFS2-----A---- Stejně/stejně/Dg-------1A---- zdrženlivě/zdrženlivě/Dg-------1A---- se/se/P7--4----------";"choval/chovat/VpMS----R-AAI-- takříkajíc/takříkaje/TT------------- v/v/RR--6---------- civilu/civil/NNIS6-----A---- :/:/Z:------------- necítil/cítit/VpMS----R-NAI-- potřebu/potřeba/NNFS4-----A----";"vysvětlovat/vysvětlovat/Vf--------A-I-- na/na/RR--4---------- potkání/potkání/NNNS4-----A---- ,/,/Z:------------- že/že/J,------------- je/být/VB-S---3P-AAI-- známý/známý/AAMS1----1A---- spisovatel/spisovatel/NNMS1-----A---- ,/,/Z:------------- a/a/J^------------- podobně/podobně/Dg-------1A---- vykládal/vykládat/VpMS----R-AAI-- svůj/svůj/P8IS4---------- podpis/podpis/NNIS4-----A---- Charty/charta/NNFS2-----A---- 77/77/C=------------- :/:/Z:------------- „/""/Z:------------- Ve/v/RV--6---------- svých/svůj/P8IP6---------- postojích/postoj/NNIP6-----A---- po/po/RR--6---------- roce/rok/NNIS6-----A---1 1968/1968/C=------------- jsem/být/VB-S---1P-AAI-- měl/mít/VpMS----R-AAI-- jasno/jasno/Dg-------1A---- ,/,/Z:------------- takže/takže/J,------------- když/když/J,------------- za/za/RR--7---------- mnou/já/PP-S7--1------- přišel/přijít/VpMS----R-AAP-- Václav/Václav/NNMS1-----A---- Havel/Havel/NNMS1-----A---- s/s/RR--7---------- Chartou/charta/NNFS7-----A---- ,/,/Z:------------- ani/ani/J^------------- chvíli/chvíle/NNFS4-----A---- jsem/být/VB-S---1P-AAI-- nezapochyboval/zapochybovat/VpMS----R-NAP-- ././Z:-------------"
"283";"Může/moci/VB-S---3P-AAI-- se/se/P7--4---------- člověk/člověk/NNMS1-----A---- po/po/RR--6---------- přijetí/přijetí/NNNS6-----A---- soudního/soudní/AAIS2----1A---- rozsudku/rozsudek/NNIS2-----A----";"chovat/chovat/Vf--------A-I-- ,/,/Z:------------- jako/jako/J,------------- kdyby/kdyby|být/J,-------------|Vc----------I-- se/se/P7--4---------- zas/zase/Db------------- tak/tak/Db------------- moc/moc/Db------------- nestalo/stát/VpNS----R-NAP-- ,/,/Z:------------- nepociťovat/pociťovat/Vf--------N-I-- potřebu/potřeba/NNFS4-----A----";"cokoliv/cokoli/PZ--4---------- změnit/změnit/Vf--------A-P-- na/na/RR--6---------- svém/svůj/P8IS6---------- dosavadním/dosavadní/AAIS6----1A---- životě/život/NNIS6-----A---- ?/?/Z:-------------"
"284";"„/""/Z:------------- Seznámil/seznámit/VpMS----R-AAP-- jsem/být/VB-S---1P-AAI-- ji/on/PPFS4--3------- už/už/Db------------- se/s/RV--7---------- svými/svůj/P8FP7---------- dětmi/dítě/NNFP7-----A---- ,/,/Z:------------- “/""/Z:------------- svěřil/svěřit/VpMS----R-AAP-- se/se/P7--4---------- před/před/RR--7---------- časem/čas/NNIS7-----A---- Sokol/Sokol/NNIS1-----A---- ,/,/Z:------------- k/k/RR--3---------- němuž/jenž/P9IS3---------- jeho/jeho/PSFS1-S3------- milá/milý/AAFS1----1A----";"chová/chovat/VB-S---3P-AAI-- ryzí/ryzí/AAIP4----1A---- city/cit/NNIP4-----A---- a/a/J^------------- nemá/mít/VB-S---3P-NAI-- potřebu/potřeba/NNFS4-----A----";"se/se/P7--4---------- jakkoliv/jakkoli/Db------------- prostřednictvím/prostřednictvím/RR--2---------- Ondřeje/Ondřej/NNMS2-----A---- proslavovat/proslavovat/Vf--------A-I-- ,/,/Z:------------- jak/jak/Db------------- je/být/VB-S---3P-AAI-- zvykem/zvyk/NNIS7-----A---- u/u/RR--2---------- ostatních/ostatní/AAFP2----1A---- slečen/slečna/NNFP2-----A---- .../.../Z:-------------"
"285";"";"Chovejte/chovat/Vi-P---2--A-I-- se/se/P7--4---------- v/v/RR--6---------- Jizerkách/Jizerka/NNFP6-----A---- s/s/RR--7---------- ohledem/ohled/NNIS7-----A---- na/na/RR--4---------- potřebu/potřeba/NNFS4-----A----";"chránit/chránit/Vf--------A-I-- tamní/tamní/AAFS4----1A---- cennou/cenný/AAFS4----1A---- přírodu/příroda/NNFS4-----A---- ././Z:-------------"
"286";"Ti/ten/PDMP1---------- se/se/P7--4----------";"chovají/chovat/VB-P---3P-AAI-- jako/jako/J,------------- v/v/RR--6---------- pravěku/pravěk/NNIS6-----A---- a/a/J^------------- všemi/všechen/PLIP7---------- prostředky/prostředek/NNIP7-----A---- ,/,/Z:------------- těmi/ten/PDMP7---------- neférovými/férový/AAMP7----1N---- především/především/TT------------- ,/,/Z:------------- bojují/bojovat/VB-P---3P-AAI-- o/o/RR--4---------- základní/základní/AAFP4----1A---- životní/životní/AAFP4----1A---- potřeby/potřeba/NNFP4-----A----";"-/-/Z:------------- pitnou/pitný/AAFS4----1A---- vodu/voda/NNFS4-----A---- ,/,/Z:------------- vzduch/vzduch/NNIS4-----A---- a/a/J^------------- potraviny/potravina/NNFP4-----A---- ././Z:-------------"
"287";"Přestaňte/přestat/Vi-P---2--A-P-- se/se/P7--4---------- k/k/RR--3---------- ní/on/P5FS3--3-------";"chovat/chovat/Vf--------A-I-- jako/jako/J,------------- k/k/RR--3---------- dítěti/dítě/NNNS3-----A---- ,/,/Z:------------- berte/brát/Vi-P---2--A-I-- ji/on/PPFS4--3------- jako/jako/J,------------- mladou/mladý/AAFS4----1A---- ženu/žena/NNFS4-----A---- ,/,/Z:------------- která/který/P4FS1---------- je/být/VB-S---3P-AAI-- rovnocenná/rovnocenný/AAFS1----1A---- s/s/RR--7---------- vámi/vy/PP-P7--2------- a/a/J^------------- má/mít/VB-S---3P-AAI-- stejné/stejný/AAFP4----1A---- potřeby/potřeba/NNFP4-----A----";"jako/jako/J,------------- vy/vy/PP-P1--2------- ,/,/Z:------------- jen/jen/Db------------- není/být/VB-S---3P-NAI-- tak/tak/Db------------- zkušená/zkušený/AAFS1----1A---- ././Z:-------------"
"288";"Měli/mít/VpMP----R-AAI-- být/být/Vf--------A-I-- vyvedeni/vyvést/VsMP------APP-- ,/,/Z:-------------";"chovali/chovat/VpMP----R-AAI-- se/se/P7--4---------- protiprávně/protiprávně/Dg-------1A---- ,/,/Z:------------- když/když/J,------------- nás/my/PP-P4--1------- natáčeli/natáčet/VpMP----R-AAI-- pro/pro/RR--4---------- své/svůj/P8FP4---------1 potřeby/potřeba/NNFP4-----A----";"bez/bez/RR--2---------- našeho/náš/PSIS2-P1------- souhlasu/souhlas/NNIS2-----A---- ,/,/Z:------------- ""/""/Z:------------- míní/mínit/VB-S---3P-AAI-- Štixová/Štixová/NNFS1-----A---- ././Z:-------------"
"289";"Zpočátku/zpočátku/Db------------- se/se/P7--4---------- kapři/kapr/NNMP1-----A----";"chovali/chovat/VpMP----R-AAI-- pro/pro/RR--4---------- potřeby/potřeba/NNFP4-----A----";"klášterů/klášter/NNIP2-----A---- ././Z:-------------"
"290";"I/i/J^------------- když/když/J,------------- si/se/P7--3---------- pijavičky/pijavička/NNFP4-----A---- můžete/moci/VB-P---2P-AAI--";"chovat/chovat/Vf--------A-I-- pro/pro/RR--4---------- svoji/svůj/P8FS4---------- potřebu/potřeba/NNFS4-----A----";"také/také/Db------------- doma/doma/Db------------- ,/,/Z:------------- ve/v/RV--6---------- sklenici/sklenice/NNFS6-----A---- se/se/P7--4---------- nerozmnoží/rozmnožit/VB-S---3P-NAP-- ././Z:-------------"
"291";"Úbytek/úbytek/NNIS4-----A---- vody/voda/NNFS2-----A---- zatím/zatím/Db------------- nepozorují/pozorovat/VB-P---3P-NAI-- v/v/RR--6---------- rybnících/rybník/NNIP6-----A---- u/u/RR--2---------- Veselí/Veselí/NNNS2-----A---- nad/nad/RR--7---------- Moravou/Morava/NNFS7-----A---- ,/,/Z:------------- kde/kde/Db-------------";"chová/chovat/VB-S---3P-AAI-- ryby/ryba/NNFP4-----A---- pro/pro/RR--4---------- svou/svůj/P8FS4---------1 potřebu/potřeba/NNFS4-----A----";"místní/místní/AAFS2----1A---- organizace/organizace/NNFS2-----A---- Moravského/moravský/AAIS2----1A---- rybářského/rybářský/AAIS2----1A---- svazu/svaz/NNIS2-----A---- ././Z:-------------"
"292";"";"Chovají/chovat/VB-P---3P-AAI-- tu/tu/Db------------- starokladrubské/starokladrubský/AAMP4----1A---- koně/kůň/NNMP4-----A---- s/s/RR--7---------- typickou/typický/AAFS7----1A---- klabonosou/klabonosý/AAFS7----1A---- hlavou/hlava/NNFS7-----A---- ,/,/Z:------------- původně/původně/Dg-------1A---- vyšlechtěné/vyšlechtěný/AANS4----1A---- pro/pro/RR--4---------- potřeby/potřeba/NNFP4-----A----";"císařského/císařský/AAIS2----1A---- dvora/dvůr/NNIS2-----A---- ve/v/RV--6---------- Vídni/Vídeň/NNFS6-----A---- ././Z:-------------"
"293";"Že/že/J,------------- je/být/VB-S---3P-AAI-- normální/normální/AANS1----1A----";"chovat/chovat/Vf--------A-I-- se/se/P7--4---------- pragmaticky/pragmaticky/Dg-------1A---- a/a/J^------------- respektovat/respektovat/Vf--------A-I-- své/svůj/P8FP4---------1 potřeby/potřeba/NNFP4-----A----";",/,/Z:------------- pudy/pud/NNIP4-----A---- a/a/J^------------- city/cit/NNIP4-----A---- ././Z:-------------"
"294";"";"Choval/chovat/VpMS----R-AAI-- se/se/P7--4---------- jako/jako/J,------------- zlobivé/zlobivý/AANS1----1A---- samolibé/samolibý/AANS1----1A---- děcko/děcko/NNNS1-----A---- ,/,/Z:------------- i/i/J^------------- vlastní/vlastní/AAMP1----1A---- spoluhráči/spoluhráč/NNMP1-----A---- mu/on/PHMS3--3------- vyčítali/vyčítat/VpMP----R-AAI-- ,/,/Z:------------- že/že/J,------------- se/se/P7--4---------- snaží/snažit/VB-S---3P-AAI-- vyniknout/vyniknout/Vf--------A-P-- individuálně/individuálně/Dg-------1A---- bez/bez/RR--2---------- ohledu/ohled/NNIS2-----A---- na/na/RR--4---------- potřeby/potřeba/NNFP4-----A----";"týmu/tým/NNIS2-----A---- ,/,/Z:------------- často/často/Dg-------1A---- se/se/P7--4---------- dostával/dostávat/VpMS----R-AAI-- do/do/RR--2---------- rozporu/rozpor/NNIS2-----A---- s/s/RR--7---------- koučem/kouč/NNMS7-----A---- ././Z:-------------"
"295";"Protože/protože/J,------------- kůň/kůň/NNMS1-----A---- je/být/VB-S---3P-AAI-- převážně/převážně/Dg-------1A----";"chován/chovat/VsMS------API-- jako/jako/J,------------- partner/partner/NNMS1-----A---- člověka/člověk/NNMS2-----A---- pro/pro/RR--4---------- volný/volný/AAIS4----1A---- čas/čas/NNIS4-----A---- ,/,/Z:------------- je/být/VB-S---3P-AAI-- zapotřebí/zapotřebí/Db------------- realisticky/realisticky/Dg-------1A---- zohledňovat/zohledňovat/Vf--------A-I-- také/také/Db------------- potřeby/potřeba/NNFP4-----A----";"chovatele/chovatel/NNMS2-----A---- ,/,/Z:------------- neboť/neboť/J^------------- vyhasnutí/vyhasnutí/NNNS1-----A---- chovatelského/chovatelský/AAIS2----1A---- zájmu/zájem/NNIS2-----A---- může/moci/VB-S---3P-AAI-- vést/vést/Vf--------A-I-- až/až/TT------------- k/k/RR--3---------- ohrožení/ohrožení/NNNS3-----A---- koňských/koňský/AANP2----1A---- plemen/plemeno/NNNP2-----A---- ././Z:-------------"
"296";"Riziko/riziko/NNNS1-----A---- přenosu/přenos/NNIS2-----A---- ptačí/ptačí/AAFS2----1A---- chřipky/chřipka/NNFS2-----A---- z/z/RR--2---------- nakažených/nakažený/AAMP2----1A---- ptáků/pták/NNMP2-----A---- se/se/P7--4---------- tak/tak/Db------------- může/moci/VB-S---3P-AAI-- přesunout/přesunout/Vf--------A-P-- spíše/spíš/TT------------- na/na/RR--4---------- zahrady/zahrada/NNFP4-----A---- tisíců/tisíc/CzIP2---------- malých/malý/AAMP2----1A---- hospodářů/hospodář/NNMP2-----A---- ,/,/Z:------------- kteří/který/P4MP1---------- slepice/slepice/NNFP4-----A---- či/či/J^------------- krůty/krůta/NNFP4-----A----";"chovají/chovat/VB-P---3P-AAI-- pro/pro/RR--4---------- vlastní/vlastní/AAFS4----1A---- potřebu/potřeba/NNFS4-----A----";"././Z:-------------"
"297";"";"Chovali/chovat/VpMP----R-AAI-- ale/ale/J^------------- i/i/J^------------- koně/kůň/NNMP1-----A---- ,/,/Z:------------- hrabivou/hrabivý/AAFS4----1A---- i/i/J^------------- vodní/vodní/AAFS4----1A---- drůbež/drůbež/NNFS4-----A---- ,/,/Z:------------- byli/být/VpMP----R-AAI-- i/i/J^------------- výbornými/výborný/AAMP7----1A---- včelaři/včelař/NNMP7-----A---- ,/,/Z:------------- holubáři/holubář/NNMP7-----A---- a/a/J^------------- prováděli/provádět/VpMP----R-AAI-- v/v/RR--6---------- přírodě/příroda/NNFS6-----A---- i/i/J^------------- čižbu/čižba/NNFS4-----A---- ,/,/Z:------------- tj/tj/B^------------- ././Z0------------- odchyt/odchyt/NNIS4-----A---- ptactva/ptactvo/NNNS2-----A---- ,/,/Z:------------- a/a/J^------------- to/to/TT------------- jak/jak/Db------------- pro/pro/RR--4---------- svoji/svůj/P8FS4---------- potřebu/potřeba/NNFS4-----A----";"jako/jako/J,------------- potravu/potrava/NNFS4-----A---- ,/,/Z:------------- ale/ale/J^------------- i/i/J^------------- jako/jako/J,------------- zpěvné/zpěvný/AANS4----1A---- ptactvo/ptactvo/NNNS4-----A---- pro/pro/RR--4---------- své/svůj/P8NS4---------1 potěšení/potěšení/NNNS4-----A---- ././Z:-------------"
"298";"Důvod/důvod/NNIS1-----A---- dvojího/dvojí/CdIS2---------- metru/metr/NNIS2-----A---- je/být/VB-S---3P-AAI-- podle/podle/RR--2---------- veterinářů/veterinář/NNMP2-----A---- prostý/prostý/AAIS1----1A---- :/:/Z:------------- lidé/člověk/NNMP1-----A---- ,/,/Z:------------- kteří/který/P4MP1----------";"chovají/chovat/VB-P---3P-AAI-- drůbež/drůbež/NNFS4-----A---- jen/jen/Db------------- pro/pro/RR--4---------- vlastní/vlastní/AAFS4----1A---- potřebu/potřeba/NNFS4-----A----";",/,/Z:------------- nejsou/být/VB-P---3P-NAI-- nikde/nikde/Db------------- evidováni/evidovat/VsMP------API-- ,/,/Z:------------- a/a/J^------------- proto/proto/J^------------- je/oni/PPMP4--3------- úřady/úřad/NNIP1-----A---- nemohou/moci/VB-P---3P-NAI-1 kontrolovat/kontrolovat/Vf--------A-I-- ././Z:-------------"
