id;left;kwic;right;VNP?;doc.txtype_group
638;Z/z/RR--2---------- jeho/jeho/PSFS2-S3------- odpovědi/odpověď/NNFS2-----A---- je/být/VB-S---3P-AAI-- zřejmé/zřejmý/AANS1----1A---- ,/,/Z:------------- že/že/J,------------- ke/k/RV--3---------- spisovatelskému/spisovatelský/AANS3----1A---- řemeslu/řemeslo/NNNS3-----A----;chová/chovat/VB-S---3P-AAI-- patřičnou/patřičný/AAFS4----1A---- úctu/úcta/NNFS4-----A----;":/:/Z:------------- „/""/Z:------------- Psaní/psaní/NNNS1-----A---- je/být/VB-S---3P-AAI-- proces/proces/NNIS1-----A---- ,/,/Z:------------- při/při/RR--6---------- kterém/který/P4IS6---------- spisovatel/spisovatel/NNMS1-----A---- vytváří/vytvářet/VB-S---3P-AAI-- velké/velký/AAFP4----1A---- lži/lež/NNFP4-----A---- sofistikovaným/sofistikovaný/AAIS7----1A---- způsobem/způsob/NNIS7-----A---- a/a/J^------------- tyto/tento/PDFP1---------- lži/lež/NNFP1-----A---- jsou/být/VB-P---3P-AAI-- nakonec/nakonec/TT------------- pravdivější/pravdivý/AAFP1----2A---- než/než/J,------------- pouhá/pouhý/AAFS1----1A---- snůška/snůška/NNFS1-----A---- faktů/fakt/NNIP2-----A---- ././Z0------------- “/""/Z:------------- O/o/RR--4---------- to/ten/PDNS4---------- se/se/P7--4---------- pokouší/pokoušet/VB-S---3P-AAI-- i/i/J^------------- Barnes/Barnes/NNMS1-----A---- ././Z:-------------";1;NFC: oborová literatura
639;Naši/náš/PSMP1-P1------- učitelé/učitel/NNMP1-----A---- k/k/RR--3---------- nám/my/PP-P3--1-------;chovali/chovat/VpMP----R-AAI-- úctu/úcta/NNFS4-----A----;,/,/Z:------------- neboť/neboť/J^------------- jsme/být/VB-P---1P-AAI-- přišli/přijít/VpMP----R-AAP-- z/z/RR--2---------- fronty/fronta/NNFS2-----A---- ././Z:-------------;1;NFC: oborová literatura
640;Ke/k/RV--3---------- krávě/kráva/NNFS3-----A---- Indové/Ind/NNMP1-----A----;chovají/chovat/VB-P---3P-AAI-- úctu/úcta/NNFS4-----A----;proto/proto/Db------------- ,/,/Z:------------- že/že/J,------------- dává/dávat/VB-S---3P-AAI-- mléko/mléko/NNNS4-----A---- a/a/J^------------- je/být/VB-S---3P-AAI-- určitým/určitý/AAIS7----1A---- symbolem/symbol/NNIS7-----A---- ././Z:-------------;1;NMG: publicistika
641;Každopádně/každopádně/Db------------- lidé/člověk/NNMP1-----A---- k/k/RR--3---------- těmto/tento/PDIP3---------- zvláštním/zvláštní/AAIP3----1A---- útvarům/útvar/NNIP3-----A----;chovali/chovat/VpMP----R-AAI-- úctu/úcta/NNFS4-----A----;././Z:-------------;1;NMG: publicistika
642;Pokud/pokud/J,------------- se/se/P7--4---------- prezident/prezident/NNMS1-----A---- chová/chovat/VB-S---3P-AAI-- tak/tak/Db------------- ,/,/Z:------------- jak/jak/Db------------- se/se/P7--4---------- občas/občas/Db-------------;chová/chovat/VB-S---3P-AAI-- ,/,/Z:------------- nezaslouží/zasloužit/VB-S---3P-NAP-- si/se/P7--3---------- úctu/úcta/NNFS4-----A----;././Z:-------------;0;TODO empty
643;Pro/pro/RR--4---------- něho/on/P5MS4--3------1 to/ten/PDNS1---------- bylo/být/VpNS----R-AAI-- tak/tak/Db------------- snadné/snadný/AANS1----1A---- ,/,/Z:------------- vždyť/vždyť/J^------------- jsem/být/VB-S---1P-AAI-- měl/mít/VpMS----R-AAI-- k/k/RR--3---------- němu/on/P5MS3--3-------;chovat/chovat/Vf--------A-I-- zbožnou/zbožný/AAFS4----1A---- úctu/úcta/NNFS4-----A----;a/a/J^------------- ve/v/RV--6---------- všem/všechen/PLNS6---------- se/se/P7--4---------- řídit/řídit/Vf--------A-I-- jeho/jeho/PSFP7-S3------- radami/rada/NNFP7-----A---- ././Z:-------------;1;NFC: oborová literatura
644;O/o/RR--6---------- tom/ten/PDNS6---------- ,/,/Z:------------- že/že/J,------------- současný/současný/AAMS1----1A---- šéf/šéf/NNMS1-----A---- hradecké/hradecký/AAFS2----1A---- činohry/činohra/NNFS2-----A----;chová/chovat/VB-S---3P-AAI-- ke/k/RV--3---------- Grossmanově/Grossmanův/AUFS3M--------- inscenaci/inscenace/NNFS3-----A---- velkou/velký/AAFS4----1A---- úctu/úcta/NNFS4-----A----;,/,/Z:------------- svědčí/svědčit/VB-S---3P-AAI-- i/i/J^------------- nevšední/všední/AAIS1----1N---- průběh/průběh/NNIS1-----A---- první/první/CrFS2---------- zkoušky/zkouška/NNFS2-----A---- ././Z:-------------;1;NMG: publicistika
645;K/k/RR--3---------- Romanovi/Roman/NNMS3-----A----;chovám/chovat/VB-S---1P-AAI-- úctu/úcta/NNFS4-----A----;a/a/J^------------- respekt/respekt/NNIS4-----A---- ././Z:-------------;1;NMG: publicistika
646;Sportovci/sportovec/NNMP1-----A---- k/k/RR--3---------- sobě/se/P6--3----------;chovají/chovat/VB-P---3P-AAI-- velkou/velký/AAFS4----1A---- úctu/úcta/NNFS4-----A----;,/,/Z:------------- všechny/všechen/PLIP4---------- údery/úder/NNIP4-----A---- ,/,/Z:------------- které/který/P4IP4---------- provádějí/provádět/VB-P---3P-AAI-- ,/,/Z:------------- jsou/být/VB-P---3P-AAI-- kontrolované/kontrolovaný/AAIP1----1A---- ././Z:-------------;1;NMG: publicistika
647;"»/""/Z:------------- S/s/RR--7---------- hlubokým/hluboký/AAIS7----1A---- zármutkem/zármutek/NNIS7-----A---- vyjadřuji/vyjadřovat/VB-S---1P-AAI-1 upřímnou/upřímný/AAFS4----1A---- soustrast/soustrast/NNFS4-----A---- nad/nad/RR--7---------- úmrtím/úmrtí/NNNS7-----A---- Nelsona/Nelson/NNMS2-----A---- Mandely/Mandela/NNMS2-----A---- ,/,/Z:------------- k/k/RR--3---------- němuž/jenž/P9NS3---------- lid/lid/NNIS1-----A---- Kuby/Kuba/NNFS2-----A----";chová/chovat/VB-S---3P-AAI-- hlubokou/hluboký/AAFS4----1A---- úctu/úcta/NNFS4-----A----;a/a/J^------------- obdiv/obdiv/NNIS4-----A---- ././Z:-------------;1;NMG: publicistika
648;Naše/náš/PSFS1-P1------- společnost/společnost/NNFS1-----A---- je/být/VB-S---3P-AAI-- tak/tak/Db------------- zvrácená/zvrácený/AAFS1----1A---- ,/,/Z:------------- že/že/J,------------- lidé/člověk/NNMP1-----A---- vraždí/vraždit/VB-P---3P-AAI-- dokonce/dokonce/TT------------- i/i/J^------------- své/svůj/P8MP4---------1 rodiče/rodič/NNMP4-----A---- -/-/Z:------------- ty/ten/PDMP4---------- ,/,/Z:------------- ke/k/RV--3---------- kterým/který/P4MP3---------- mají/mít/VB-P---3P-AAI--;chovat/chovat/Vf--------A-I-- celoživotní/celoživotní/AAFS4----1A---- úctu/úcta/NNFS4-----A----;,/,/Z:------------- vraždí/vraždit/VB-P---3P-AAI-- děti/dítě/NNFP1-----A---- -/-/Z:------------- ty/ten/PDFP1---------- ,/,/Z:------------- ve/v/RV--6---------- kterých/který/P4FP6---------- se/se/P7--4---------- skrývá/skrývat/VB-S---3P-AAI-- nový/nový/AAIS1----1A---- život/život/NNIS1-----A---- ,/,/Z:------------- vraždí/vraždit/VB-P---3P-AAI-- své/svůj/P8MP4---------1 partnery/partner/NNMP4-----A---- -/-/Z:------------- ty/ten/PDMP4---------- ,/,/Z:------------- kterým/který/P4MP3---------- slibovali/slibovat/VpMP----R-AAI-- věrnost/věrnost/NNFS4-----A---- na/na/RR--4---------- věky/věk/NNIP4-----A---- věků/věk/NNIP2-----A---- ././Z:-------------;1;NMG: publicistika
649;K/k/RR--3---------- mrtvým/mrtvý/NNMP3-----A---- Romové/Rom/NNMP1-----A---- odevždy/odvždy/Db-------------;chovali/chovat/VpMP----R-AAI-- posvátnou/posvátný/AAFS4----1A---- úctu/úcta/NNFS4-----A----;,/,/Z:------------- smíšenou/smíšený/AAFS4----1A---- se/s/RV--7---------- strachem/strach/NNIS7-----A---- ././Z:-------------;1;NMG: publicistika
650;Žáci/žák/NNMP1-----A---- k/k/RR--3---------- nim/oni/P5MP3--3------- buď/buď/J^-------------;chovají/chovat/VB-P---3P-AAI-- velkou/velký/AAFS4----1A---- úctu/úcta/NNFS4-----A----;,/,/Z:------------- nebo/nebo/J^------------- z/z/RR--2---------- nich/oni/P5MP2--3------- naopak/naopak/TT------------- mají/mít/VB-P---3P-AAI-- legraci/legrace/NNFS4-----A---- …/.../Z:-------------;1;NMG: publicistika
651;Když/když/J,------------- vezmu/vzít/VB-S---1P-AAP-- ,/,/Z:------------- čím/co/PQ--7---------- si/se/P7--3---------- prošel/projít/VpMS----R-AAP-- ,/,/Z:-------------;chovám/chovat/VB-S---1P-AAI-- k/k/RR--3---------- němu/on/P5MS3--3------- respekt/respekt/NNIS4-----A---- a/a/J^------------- úctu/úcta/NNFS4-----A----;././Z:-------------;1;NMG: publicistika
652;"""/""/Z:------------- Rodina/rodina/NNFS1-----A---- se/se/P7--4---------- stará/starat/VB-S---3P-AAI-- o/o/RR--4---------- své/svůj/P8MP4---------1 starší/starý/AAMP4----2A---- členy/člen/NNMP4-----A---- a/a/J^-------------";chová/chovat/VB-S---3P-AAI-- k/k/RR--3---------- nim/oni/P5MP3--3------- velkou/velký/AAFS4----1A---- úctu/úcta/NNFS4-----A----;././Z:-------------;1;NMG: publicistika
653;Ovšem/ovšem/TT------------- my/my/PP-P1--1------- jsme/být/VB-P---1P-AAI-- k/k/RR--3---------- nim/oni/P5MP3--3-------;chovali/chovat/VpMP----R-AAI-- neobyčejnou/obyčejný/AAFS4----1N---- úctu/úcta/NNFS4-----A----;././Z:-------------;1;NFC: oborová literatura
654;Jak/jak/Db------------- upozornil/upozornit/VpMS----R-AAP-- zpravodaj/zpravodaj/NNMS1-----A---- BBC/BBC/BN------------- ,/,/Z:------------- většina/většina/NNFS1-----A---- Thajců/Thajec/NNMP2-----A----;chová/chovat/VB-S---3P-AAI-- mimořádnou/mimořádný/AAFS4----1A---- úctu/úcta/NNFS4-----A----;ke/k/RV--3---------- své/svůj/P8FS3---------1 monarchii/monarchie/NNFS3-----A---- ,/,/Z:------------- ale/ale/J^------------- současně/současně/Dg-------1A---- se/se/P7--4---------- kvůli/kvůli/RR--3---------- trestům/trest/NNIP3-----A---- za/za/RR--4---------- znevažování/znevažování/NNNS4-----A---- nebo/nebo/J^------------- urážku/urážka/NNFS4-----A---- členů/člen/NNMP2-----A---- královské/královský/AAFS2----1A---- rodiny/rodina/NNFS2-----A---- bojí/bát/VB-S---3P-AAI-- o/o/RR--6---------- této/tento/PDFS6---------- instituci/instituce/NNFS6-----A---- diskutovat/diskutovat/Vf--------A-I-- ././Z:-------------;1;NMG: publicistika
655;Kapela/kapela/NNFS1-----A---- vydala/vydat/VpFS----R-AAP-- docela/docela/Db------------- dobrou/dobrý/AAFS4----1A---- LP/LP/BN------------- desku/deska/NNFS4-----A---- ,/,/Z:------------- ale/ale/J^------------- jestli/jestli/J,------------- jsem/být/VB-S---1P-AAI-- to/ten/PDNS4---------- dobře/dobře/Dg-------1A---- pochopila/pochopit/VpFS----R-AAP-- ,/,/Z:------------- k/k/RR--3---------- Vám/vy/PP-P3--2-------;nechovají/chovat/VB-P---3P-NAI-- úctu/úcta/NNFS4-----A----;././Z:-------------;1;NMG: publicistika
656;Ale/ale/J^------------- myslím/myslet/VB-S---1P-AAI-- ,/,/Z:------------- že/že/J,------------- k/k/RR--3---------- sobě/se/P6--3----------;chováme/chovat/VB-P---1P-AAI-- sympatie/sympatie/NNFP4-----A---- i/i/J^------------- jistou/jistý/AAFS4----1A---- vzájemnou/vzájemný/AAFS4----1A---- úctu/úcta/NNFS4-----A----;././Z:-------------;1;NMG: publicistika
657;"""/""/Z:------------- Těžko/těžko/Dg-------1A---- hledám/hledat/VB-S---1P-AAI-- slova/slovo/NNNP4-----A---- ,/,/Z:-------------";choval/chovat/VpMS----R-AAI-- jsem/být/VB-S---1P-AAI-- k/k/RR--3---------- němu/on/P5MS3--3------- nesmírnou/nesmírný/AAFS4----1A---- úctu/úcta/NNFS4-----A----;",/,/Z:------------- ""/""/Z:------------- uvedl/uvést/VpMS----R-AAP-- k/k/RR--3---------- jeho/jeho/PSIS3-S3------- skonu/skon/NNIS3-----A---- Gorbačov/Gorbačov/NNMS1-----A---- ././Z:-------------";1;NMG: publicistika
658;Dienstbier/Dienstbier/NNMS1-----A---- se/se/P7--4---------- modelově/modelově/Dg-------1A---- zachoval/zachovat/VpMS----R-AAP-- jinak/jinak/Db------------- ,/,/Z:------------- než/než/J,------------- se/se/P7--4---------- očekává/očekávat/VB-S---3P-AAI-- od/od/RR--2---------- člověka/člověk/NNMS2-----A---- ,/,/Z:------------- který/který/P4MS1---------- dosáhl/dosáhnout/VpMS----R-AAP-- jeho/jeho/PSFS2-S3------- politické/politický/AAFS2----1A---- úrovně/úroveň/NNFS2-----A---- a/a/J^------------- hodlá/hodlat/VB-S---3P-AAI-- se/se/P7--4---------- ucházet/ucházet/Vf--------A-I-- o/o/RR--4---------- jeden/jeden/ClIS4---------- z/z/RR--2---------- nejvyšších/vysoký/AAIP2----3A---- ústavních/ústavní/AAIP2----1A---- postů/post/NNIP2-----A---- ,/,/Z:------------- k/k/RR--3---------- němuž/jenž/P9IS3---------- navíc/navíc/Db------------- lidé/člověk/NNMP1-----A---- tradičně/tradičně/Dg-------1A----;chovají/chovat/VB-P---3P-AAI-- zvláštní/zvláštní/AAFS4----1A---- úctu/úcta/NNFS4-----A----;././Z:-------------;1;NMG: publicistika
659;Mě/já/PH-S4--1------- zajímá/zajímat/VB-S---3P-AAI-- Sparta/Sparta/NNFS1-----A---- jako/jako/J,------------- klub/klub/NNIS1-----A---- ,/,/Z:------------- ke/k/RV--3---------- kterému/který/P4IS3----------;chovám/chovat/VB-S---1P-AAI-- úctu/úcta/NNFS4-----A----;././Z:-------------;1;NMG: publicistika
660;Přes/přes/RR--4---------- vzájemné/vzájemný/AAIP4----1A---- názorové/názorový/AAIP4----1A---- rozpory/rozpor/NNIP4-----A---- k/k/RR--3---------- sobě/se/P6--3---------- oba/oba/ClMP1---------- vždy/vždy/Db-------------;chovali/chovat/VpMP----R-AAI-- úctu/úcta/NNFS4-----A----;././Z:-------------;1;NMG: publicistika
661;Jediný/jediný/AAIS1----1A---- vůz/vůz/NNIS1-----A---- ,/,/Z:------------- k/k/RR--3---------- němuž/jenž/P9IS3---------- Sýkora/Sýkora/NNMS1-----A---- junior/junior/NNMS1-----A----;chová/chovat/VB-S---3P-AAI-- úctu/úcta/NNFS4-----A----;,/,/Z:------------- je/být/VB-S---3P-AAI-- jeho/jeho/PSNS1-S3------- Ferrari/Ferrari/NNNS1-----A---- 540/540/C=------------- ././Z:-------------;1;NMG: publicistika
662;;Chovám/chovat/VB-S---1P-AAI-- k/k/RR--3---------- němu/on/P5MS3--3------- obrovskou/obrovský/AAFS4----1A---- úctu/úcta/NNFS4-----A----;",/,/Z:------------- ale/ale/J^------------- už/už/Db------------- jsem/být/VB-S---1P-AAI-- se/se/P7--4---------- rozhodl/rozhodnout/VpMS----R-AAP-1 ././Z:------------- “/""/Z:-------------";1;NMG: publicistika
663;"»/""/Z:------------- Nikdy/nikdy/Db------------- jsem/být/VB-S---1P-AAI-- se/se/P7--4---------- netajila/tajit/VpFS----R-NAI-- tím/ten/PDNS7---------- ,/,/Z:------------- že/že/J,-------------";chovám/chovat/VB-S---1P-AAI-- úctu/úcta/NNFS4-----A----;k/k/RR--3---------- Václavu/Václav/NNMS3-----A---1 Klausovi/Klaus/NNMS3-----A---1 ././Z:-------------;1;NMG: publicistika
664;Naši/náš/PSMP1-P1------- předkové/předek/NNMP1-----A---1 dobře/dobře/Dg-------1A---- věděli/vědět/VpMP----R-AAI-- ,/,/Z:------------- že/že/J,------------- jejich/jejich/PSNS1-P3------- štěstí/štěstí/NNNS1-----A---- závisí/záviset/VB-S---3P-AAI-- na/na/RR--6---------- přírodě/příroda/NNFS6-----A---- ,/,/Z:------------- tudíž/tudíž/J^------------- k/k/RR--3---------- ní/on/P5FS3--3-------;chovali/chovat/VpMP----R-AAI-- úctu/úcta/NNFS4-----A----;././Z:-------------;1;NMG: publicistika
665;K/k/RR--3---------- těmto/tento/PDMP3---------- světcům/světec/NNMP3-----A---- ,/,/Z:------------- kteří/který/P4MP1---------- žili/žít/VpMP----R-AAI-- ještě/ještě/Db------------- před/před/RR--7---------- církevním/církevní/AAIS7----1A---- rozkolem/rozkol/NNIS7-----A---- v/v/RR--6---------- roce/rok/NNIS6-----A---1 1054/1054/C=------------- ,/,/Z:------------- totiž/totiž/TT-------------;chovají/chovat/VB-P---3P-AAI-- úctu/úcta/NNFS4-----A----;jak/jak/Db------------- východní/východní/AAMP1----1A---- ,/,/Z:------------- tak/tak/J^------------- západní/západní/AAMP1----1A---- křesťané/křesťan/NNMP1-----A---- ././Z:-------------;1;NMG: publicistika
666;K/k/RR--3---------- mistrovi/mistr/NNMS3-----A----;chová/chovat/VB-S---3P-AAI-- úctu/úcta/NNFS4-----A----;;1;NMG: publicistika
667;Po/po/RR--6---------- pěti/pět/Cn-P6---------- telefonátech/telefonát/NNIP6-----A---- mu/on/PHMS3--3------- odešel/odejít/VpIS----R-AAP-- mikrofon/mikrofon/NNIS1-----A---- ,/,/Z:------------- ale/ale/J^------------- to/ten/PDNS1---------- nic/nic/PW--4---------- neznamená/znamenat/VB-S---3P-NAI-- proti/proti/RR--3---------- tomu/ten/PDNS3---------- ,/,/Z:------------- že/že/J,------------- je/být/VB-S---3P-AAI-- to/ten/PDNS1---------- úžasný/úžasný/AAIS1----1A---- kus/kus/NNIS1-----A---- technologie/technologie/NNFS2-----A---- ,/,/Z:------------- k/k/RR--3---------- němuž/jenž/P9IS3----------;chovám/chovat/VB-S---1P-AAI-- nábožnou/nábožný/AAFS4----1A---- úctu/úcta/NNFS4-----A----;././Z:-------------;1;NMG: publicistika
668;Nedávno/dávno/Dg-------1N---- se/se/P7--4---------- pokusil/pokusit/VpMS----R-AAP-- pást/pást/Vf--------A-I-- i/i/J^------------- odrostlejší/odrostlý/AANS1----2A---- tele/tele/NNNS4-----A---- ,/,/Z:------------- ale/ale/J^------------- po/po/RR--6---------- útoku/útok/NNIS6-----A---- matky/matka/NNFS2-----A---- krávy/kráva/NNFS2-----A---- už/už/Db------------- ke/k/RV--3---------- skotu/skot/NNIS3-----A----;chová/chovat/VB-S---3P-AAI-- úctu/úcta/NNFS4-----A----;././Z:-------------;1;NMG: publicistika
669;"Nevím/vědět/VB-S---1P-NAI-- ,/,/Z:------------- jestli/jestli/J,------------- se/se/P7--4---------- ještě/ještě/Db------------- traduje/tradovat/VB-S---3P-AAI-- pejorativní/pejorativní/AANS1----1A---- označení/označení/NNNS1-----A---- ""/""/Z:------------- komplex/komplex/NNIS1-----A---- malých/malý/AAIP2----1A---- oborů/obor/NNIP2-----A---- ""/""/Z:------------- ,/,/Z:------------- ale/ale/J^------------- já/já/PP-S1--1------- ke/k/RV--3---------- kolegům/kolega/NNMP3-----A---- z/z/RR--2---------- oční/oční/AAFS2----1A---- kliniky/klinika/NNFS2-----A---- VFN/VFN/BN-------------";chovám/chovat/VB-S---1P-AAI-- upřímnou/upřímný/AAFS4----1A---- úctu/úcta/NNFS4-----A----;a/a/J^------------- obdiv/obdiv/NNIS4-----A---- ,/,/Z:------------- neboť/neboť/J^------------- sám/sám/PLMS1---------- nevím/vědět/VB-S---1P-NAI-- o/o/RR--6---------- oku/oko/NNNS6-----A---- o/o/RR--4---------- moc/moc/Db------------- víc/hodně/Dg-------2A---- ,/,/Z:------------- než/než/J,------------- že/že/J,------------- ho/on/PHIS4--3------- mám/mít/VB-S---1P-AAI-- v/v/RR--6---------- hlavě/hlava/NNFS6-----A---- ././Z:-------------;1;NMG: publicistika
670;;Chováme/chovat/VB-P---1P-AAI-- k/k/RR--3---------- němu/on/P5MS3--3------- velkou/velký/AAFS4----1A---- úctu/úcta/NNFS4-----A----;"jako/jako/J,------------- k/k/RR--3---------- hráči/hráč/NNMS3-----A---- i/i/J^------------- jako/jako/J,------------- k/k/RR--3---------- člověku/člověk/NNMS3-----A---- ,/,/Z:------------- “/""/Z:------------- řekl/říci/VpMS----R-AAP-- generální/generální/AAMS1----1A---- manažer/manažer/NNMS1-----A---- San/San/NNMS1-----A---- Jose/José/NNMS2-----A---- Dough/Dough/X@------------- Wilson/Wilson/NNMS1-----A---- ././Z:-------------";1;NMG: publicistika
671;"„/""/Z:-------------";Chováme/chovat/VB-P---1P-AAI-- k/k/RR--3---------- sobě/se/P6--3---------- vzájemnou/vzájemný/AAFS4----1A---- úctu/úcta/NNFS4-----A----;,/,/Z:------------- důvěru/důvěra/NNFS4-----A---- ,/,/Z:------------- vyznáváme/vyznávat/VB-P---1P-AAI-- stejný/stejný/AAIS4----1A---- žebříček/žebříček/NNIS4-----A---- hodnot/hodnota/NNFP2-----A---- ,/,/Z:------------- jeden/jeden/ClIS4---------- druhého/druhý/CrMS4---------- si/se/P7--3---------- vážíme/vážit/VB-P---1P-AAI-- ././Z:-------------;1;NMG: publicistika
672;;Chováme/chovat/VB-P---1P-AAI-- k/k/RR--3---------- vám/vy/PP-P3--2------- velikou/veliký/AAFS4----1A---- úctu/úcta/NNFS4-----A----;",/,/Z:------------- “/""/Z:------------- řekl/říci/VpMS----R-AAP-- na/na/RR--4---------- úvod/úvod/NNIS4-----A---- ././Z:-------------";1;NMG: publicistika
673;Neštěmice/Neštěmice/NNFP1-----A---- -/-/Z:------------- K/k/RR--3---------- Horstu/Horst/NNMS3-----A---1 Sieglovi/Siegl/NNMS3-----A----;chová/chovat/VB-S---3P-AAI-- velkou/velký/AAFS4----1A---- úctu/úcta/NNFS4-----A----;././Z:-------------;1;NMG: publicistika
674;;Chovám/chovat/VB-S---1P-AAI-- ale/ale/J^------------- hlubokou/hluboký/AAFS4----1A---- úctu/úcta/NNFS4-----A----;k/k/RR--3---------- řadovým/řadový/AAMP3----1A---- policistům/policista/NNMP3-----A---- za/za/RR--4---------- to/ten/PDNS4---------- ,/,/Z:------------- jak/jak/Db------------- zvládli/zvládnout/VpMP----R-AAP-1 boj/boj/NNIS4-----A---- na/na/RR--6---------- frontě/fronta/NNFS6-----A---- ././Z:-------------;1;NMG: publicistika
675;O/o/RR--6---------- liberální/liberální/AAFS6----1A---- demokracii/demokracie/NNFS6-----A---- mám/mít/VB-S---1P-AAI-- vysoké/vysoký/AANS4----1A---- mínění/mínění/NNNS4-----A---- a/a/J^-------------;chovám/chovat/VB-S---1P-AAI-- k/k/RR--3---------- ní/on/P5FS3--3------- velkou/velký/AAFS4----1A---- úctu/úcta/NNFS4-----A----;././Z:-------------;1;NMG: publicistika
676;Ke/k/RV--3---------- kariéře/kariéra/NNFS3-----A---- Zbyňka/Zbyněk/NNMS2-----A---- Irgla/Irgl/NNMS2-----A---- zdobené/zdobený/AAFS2----1A---- stříbrem/stříbro/NNNS7-----A---- z/z/RR--2---------- mistrovství/mistrovství/NNNS2-----A---- světa/svět/NNIS2-----A---- a/a/J^------------- vykládané/vykládaný/AAFS2----1A---- drahými/drahý/AAIP7----1A---- kovy/kov/NNIP7-----A---- z/z/RR--2---------- KHL/KHL/BN-------------;chovám/chovat/VB-S---1P-AAI-- úctu/úcta/NNFS4-----A----;,/,/Z:------------- jenže/jenže/J^------------- teď/teď/Db------------- není/být/VB-S---3P-NAI-- pro/pro/RR--4---------- olomoucké/olomoucký/AAMP4----1A---- hokejisty/hokejista/NNMP4-----A---- čas/čas/NNIS1-----A---- dojímat/dojímat/Vf--------A-I-- se/se/P7--4---------- nad/nad/RR--7---------- bývalými/bývalý/AAIP7----1A---- úspěchy/úspěch/NNIP7-----A---- nového/nový/AAMS2----1A---- muže/muž/NNMS2-----A---- v/v/RR--6---------- kabině/kabina/NNFS6-----A---- ././Z:-------------;1;NMG: publicistika
677;Pokud/pokud/J,------------- se/se/P7--4---------- prezident/prezident/NNMS1-----A----;chová/chovat/VB-S---3P-AAI-- tak/tak/Db------------- ,/,/Z:------------- jak/jak/Db------------- se/se/P7--4---------- občas/občas/Db------------- chová/chovat/VB-S---3P-AAI-- ,/,/Z:------------- nezaslouží/zasloužit/VB-S---3P-NAP-- si/se/P7--3---------- úctu/úcta/NNFS4-----A----;././Z:-------------;0;NMG: publicistika
678;A/a/J^------------- já/já/PP-S1--1------- osobně/osobně/Dg-------1A---- k/k/RR--3---------- nim/oni/P5MP3--3-------;chovám/chovat/VB-S---1P-AAI-- větší/velký/AAFS4----2A---- úctu/úcta/NNFS4-----A----;,/,/Z:------------- když/když/J,------------- vím/vědět/VB-S---1P-AAI-- ,/,/Z:------------- jak/jak/J,------------- obtížné/obtížný/AANS1----1A---- je/být/VB-S---3P-AAI-- vůbec/vůbec/TT------------- hrát/hrát/Vf--------A-I-- ././Z:-------------;1;NMG: publicistika
679;"„/""/Z:------------- Stále/stále/Dg-------1A---- na/na/RR--4---------- něj/on/P5MS4--3------- vzpomíná/vzpomínat/VB-S---3P-AAI-- mnoho/mnoho/Ca--1---------- lidí/člověk/NNMP2-----A---- ,/,/Z:------------- kteří/který/P4MP1---------- k/k/RR--3---------- němu/on/P5MS3--3-------";chovají/chovat/VB-P---3P-AAI-- velikou/veliký/AAFS4----1A---- úctu/úcta/NNFS4-----A----;",/,/Z:------------- “/""/Z:------------- dodal/dodat/VpMS----R-AAP-- na/na/RR--4---------- závěr/závěr/NNIS4-----A---- Jiří/Jiří/NNMS1-----A---- Gill/Gil/NNMS1-----A---- ././Z:-------------";1;NMG: publicistika
680;;Chovejte/chovat/Vi-P---2--A-I-- ke/k/RV--3---------- starým/starý/AAMP3----1A---- rodičům/rodič/NNMP3-----A---- úctu/úcta/NNFS4-----A----;;1;NMG: publicistika
681;Říkáte/říkat/VB-P---2P-AAI-- ,/,/Z:------------- že/že/J,------------- jste/být/VB-P---2P-AAI-- k/k/RR--3---------- rodičům/rodič/NNMP3-----A---- Karla/Karel/NNMS2-----A---- Schwarzenberga/Schwarzenberg/NNMS2-----A----;chovali/chovat/VpMP----R-AAI-- úctu/úcta/NNFS4-----A----;././Z:-------------;1;NMG: publicistika
682;Jak/jak/Db------------- to/ten/PDNS1---------- ,/,/Z:------------- že/že/J,------------- k/k/RR--3---------- němu/on/P5MS3--3------- stále/stále/Dg-------1A----;chováte/chovat/VB-P---2P-AAI-- úctu/úcta/NNFS4-----A----;a/a/J^------------- respekt/respekt/NNIS4-----A---- ?/?/Z:-------------;1;NMG: publicistika
683;"""/""/Z:-------------";Chovám/chovat/VB-S---1P-AAI-- k/k/RR--3---------- té/ten/PDFS3---------- hale/hala/NNFS3-----A---- úctu/úcta/NNFS4-----A----;,/,/Z:------------- ale/ale/J^------------- přece/přece/TT------------- jen/jen/TT------------- byla/být/VpFS----R-AAI-- postavená/postavený/AAFS1----1A---- před/před/RR--7---------- čtyřiceti/čtyřicet/Cn-P7---------- roky/rok/NNIP7-----A---- ././Z:-------------;1;NMG: publicistika
684;;Chovám/chovat/VB-S---1P-AAI-- k/k/RR--3---------- němu/on/P5MS3--3------- obrovskou/obrovský/AAFS4----1A---- úctu/úcta/NNFS4-----A----;",/,/Z:------------- ale/ale/J^------------- jsem/být/VB-S---1P-AAI-- rozhodnutý/rozhodnutý/AAMS1----1A---- ././Z:------------- “/""/Z:-------------";1;NMG: publicistika
685;V/v/RR--6---------- těžkých/těžký/AAFP6----1A---- dobách/doba/NNFP6-----A---- ,/,/Z:------------- kdy/kdy/Db------------- jsme/být/VB-P---1P-AAI-- měli/mít/VpMP----R-AAI-- cizí/cizí/AAMP4----1A---- panovníky/panovník/NNMP4-----A---- ,/,/Z:------------- čeština/čeština/NNFS1-----A---- byla/být/VpFS----R-AAI-- pronásledovaná/pronásledovaný/AAFS1----1A---- a/a/J^------------- česká/český/AAFS1----1A---- inteligence/inteligence/NNFS1-----A---- vyháněná/vyháněný/AAFS1----1A---- ,/,/Z:------------- mí/můj/PSMP1-S1------1 předkové/předek/NNMP1-----A---1;chovali/chovat/VpMP----R-AAI-- pevně/pevně/Dg-------1A---- v/v/RR--6---------- srdcích/srdce/NNNP6-----A---- lásku/láska/NNFS4-----A---- a/a/J^------------- úctu/úcta/NNFS4-----A----;k/k/RR--3---------- téhle/tenhle/PDFS3---------- zemi/země/NNFS3-----A---- a/a/J^------------- dokázali/dokázat/VpMP----R-AAP-- vybojovat/vybojovat/Vf--------A-P-- zpět/zpět/Db------------- ztracenou/ztracený/AAFS4----1A---- svobodu/svoboda/NNFS4-----A---- ././Z:-------------;1;NMG: publicistika
