id;left;kwic;right;VNP?;doc.txtype_group
1;Posléze/posléze/Db------------- jsem/být/VB-S---1P-AAI-- k/k/RR--3---------- ní/on/P5FS3--3------- začal/začít/VpMS----R-AAP--;chovat/chovat/Vf--------A-I-- navíc/navíc/Db------------- obrovskou/obrovský/AAFS4----1A---- úctu/úcta/NNFS4-----A----;,/,/Z:------------- protože/protože/J,------------- její/její/PSNS1FS3------- umírání/umírání/NNNS1-----A---- bylo/být/VpNS----R-AAI-- něco/něco/PZ--1---------- impozantního/impozantní/AANS2----1A---- a/a/J^------------- krásného/krásný/AANS2----1A---- ././Z:-------------;1;NFC: oborová literatura
2;;Chovají/chovat/VB-P---3P-AAI-- k/k/RR--3---------- sobě/se/P6--3---------- navzájem/navzájem/Db------------- velkou/velký/AAFS4----1A---- úctu/úcta/NNFS4-----A----;,/,/Z:------------- to/ten/PDNS1---------- mi/já/PH-S3--1------- jinde/jinde/Db------------- chybí/chybět/VB-S---3P-AAI-- ././Z:-------------;1;NMG: publicistika
3;PRAHA/Praha/NNFS1-----A---- -/-/Z:------------- Skladatel/skladatel/NNMS1-----A---- Karel/Karel/NNMS1-----A---- Svoboda/Svoboda/NNMS1-----A---- (/(/Z:------------- zemřel/zemřít/VpMS----R-AAP-- 68/68/C=------------- )/)/Z:------------- se/se/P7--4---------- chtěl/chtít/VpMS----R-AAI-- se/s/RV--7---------- svou/svůj/P8FS7---------1 manželkou/manželka/NNFS7-----A---- Vendulou/Vendula/NNFS7-----A---- nechat/nechat/Vf--------A-P-- rozvést/rozvést/Vf--------A-P-- ,/,/Z:------------- protože/protože/J,------------- k/k/RR--3---------- němu/on/P5MS3--3-------;nechovala/chovat/VpFS----R-NAI-- náležitou/náležitý/AAFS4----1A---- úctu/úcta/NNFS4-----A----;a/a/J^------------- respekt/respekt/NNIS4-----A---- !/!/Z:-------------;1;NMG: publicistika
4;"„/""/Z:-------------";Chovám/chovat/VB-S---1P-AAI-- k/k/RR--3---------- otci/otec/NNMS3-----A---- úctu/úcta/NNFS4-----A----;",/,/Z:------------- “/""/Z:------------- prohlásil/prohlásit/VpMS----R-AAP-- Chálid/Chálid/NNMS1-----A---- ,/,/Z:------------- „/""/Z:------------- ale/ale/J^------------- mám/mít/VB-S---1P-AAI-- před/před/RR--7---------- sebou/se/P6--7---------- větší/velký/AAIS4----2A---- úkol/úkol/NNIS4-----A---- ././Z:-------------";1;FIC: beletrie
5;;Chovám/chovat/VB-S---1P-AAI-- k/k/RR--3---------- němu/on/P5MS3--3------- velkou/velký/AAFS4----1A---- úctu/úcta/NNFS4-----A----;",/,/Z:------------- je/být/VB-S---3P-AAI-- to/ten/PDNS1---------- trenér/trenér/NNMS1-----A---- a/a/J^------------- osobnost/osobnost/NNFS1-----A---- ,/,/Z:------------- která/který/P4FS1---------- má/mít/VB-S---3P-AAI-- plné/plný/AANS4----1A---- právo/právo/NNNS4-----A---- rozhodnout/rozhodnout/Vf--------A-P-- se/se/P7--4---------- po/po/RR--6---------- sezoně/sezóna/NNFS6-----A---- tak/tak/Db------------- ,/,/Z:------------- jak/jak/Db------------- uzná/uznat/VB-S---3P-AAP-- za/za/RR--4---------- vhodné/vhodný/AANS4----1A---- ,/,/Z:------------- “/""/Z:------------- tvrdil/tvrdit/VpMS----R-AAI-- svazový/svazový/AAMS1----1A---- šéf/šéf/NNMS1-----A---- Tomáš/Tomáš/NNMS1-----A---- Král/Král/NNMS1-----A---- ././Z:-------------";1;NMG: publicistika
6;V/v/RR--6---------- důsledku/důsledek/NNIS6-----A---- toho/ten/PDNS2----------;chovám/chovat/VB-S---1P-AAI-- k/k/RR--3---------- mocným/mocný/AAMP3----1A---- pravděpodobně/pravděpodobně/Dg-------1A---- stejnou/stejný/AAFS4----1A---- úctu/úcta/NNFS4-----A----;"jako/jako/J,------------- ty/ty/PP-S1--2------- ,/,/Z:------------- jenže/jenže/J^------------- nejsem/být/VB-S---1P-NAI-- tak/tak/Db------------- upřímný/upřímný/AAMS1----1A---- jako/jako/J,------------- ty/ty/PP-S1--2------- ,/,/Z:------------- a/a/J^------------- většinou/většinou/Db------------- to/ten/PDNS4---------- nerad/rád/ACMS------N---- přiznávám/přiznávat/VB-S---1P-AAI-- ././Z:------------- ""/""/Z:-------------";1;FIC: beletrie
7;K/k/RR--3---------- jiným/jiný/AAIP3----1A---- státům/stát/NNIP3-----A----;chovám/chovat/VB-S---1P-AAI-- obdiv/obdiv/NNIS4-----A---- ,/,/Z:------------- úctu/úcta/NNFS4-----A----;,/,/Z:------------- uznání/uznání/NNNS4-----A---- ,/,/Z:------------- dokonce/dokonce/TT------------- i/i/J^------------- trochu/trochu/Db------------- náklonnosti/náklonnost/NNFS2-----A---- ,/,/Z:------------- ale/ale/J^------------- u/u/RR--2---------- Montany/Montana/NNFS2-----A---- je/být/VB-S---3P-AAI-- to/ten/PDNS1---------- láska/láska/NNFS1-----A---- a/a/J^------------- je/být/VB-S---3P-AAI-- obtížné/obtížný/AANS1----1A---- analyzovat/analyzovat/Vf--------A-I-- lásku/láska/NNFS4-----A---- ,/,/Z:------------- když/když/J,------------- je/být/VB-S---3P-AAI-- člověk/člověk/NNMS1-----A---- zamilován/zamilovat/VsMS------APP-- ././Z:-------------;1;FIC: beletrie
8;Nevylučuje/vylučovat/VB-S---3P-NAI-- ani/ani/J^------------- to/ten/PDNS4---------- ,/,/Z:------------- že/že/J,------------- děti/dítě/NNFP1-----A----;chovají/chovat/VB-P---3P-AAI-- lásku/láska/NNFS4-----A---- a/a/J^------------- úctu/úcta/NNFS4-----A---- ke/k/RV--3---------- svým/svůj/P8MP3---------- rodičům/rodič/NNMP3-----A---- ,/,/Z:------------- a/a/J^------------- –/-/Z:------------- nejdůležitější/důležitý/AAFS1----3A---- ze/z/RV--2---------- všeho/všechen/PLNS2---------- –/-/Z:------------- předpokládá/předpokládat/VB-S---3P-AAI-- ,/,/Z:------------- že/že/J,------------- rodiče/rodič/NNMP1-----A---- chovají/chovat/VB-P---3P-AAI-- také/také/Db------------- úctu/úcta/NNFS4-----A----;ke/k/RV--3---------- svým/svůj/P8FP3---------- dětem/dítě/NNFP3-----A---- ././Z:-------------;0;NMG: publicistika
9;Morgan/Morgan/NNMS1-----A---- vyrozuměl/vyrozumět/VpMS----R-AAP-- z/z/RR--2---------- tónu/tón/NNIS2-----A---- Changova/Changův/AUIS2M--------- hlasu/hlas/NNIS2-----A---- ,/,/Z:------------- že/že/J,------------- i/i/J^------------- při/při/RR--6---------- všech/všechen/PLFP6---------- potížích/potíž/NNFP6-----A---- ,/,/Z:------------- které/který/P4FP4---------- se/s/RV--7---------- svým/svůj/P8MS7---------- význačným/význačný/AAMS7----1A---- a/a/J^------------- nijak/nijak/Db------------- příjemným/příjemný/AAMS7----1A---- pasažérem/pasažér/NNMS7-----A---- má/můj/PSFS1-S1------1 ,/,/Z:-------------;chová/chovat/VB-S---3P-AAI-- k/k/RR--3---------- němu/on/P5MS3--3------- mimořádnou/mimořádný/AAFS4----1A---- úctu/úcta/NNFS4-----A----;././Z:-------------;1;FIC: beletrie
10;Úctu/úcta/NNFS4-----A---- k/k/RR--3---------- partnerovi/partner/NNMS3-----A---- je/být/VB-S---3P-AAI-- tedy/tedy/TT------------- zapotřebí/zapotřebí/Db------------- neustále/neustále/Dg-------1A---- udržovat/udržovat/Vf--------A-I-- a/a/J^------------- je/být/VB-S---3P-AAI-- i/i/J^------------- nutné/nutný/AANS1----1A---- se/se/P7--4----------;chovat/chovat/Vf--------A-I-- tak/tak/Db------------- ,/,/Z:------------- aby/aby|být/J,-------------|Vc----------I-- on/on/PPMS1--3------- neztratil/ztratit/VpMS----R-NAP-- úctu/úcta/NNFS4-----A----;ke/k/RV--3---------- mně/já/PP-S3--1------- ././Z:-------------;0;NFC: oborová literatura
11;Oba/oba/ClMP1---------- k/k/RR--3---------- sobě/se/P6--3----------;chovají/chovat/VB-P---3P-AAI-- velkou/velký/AAFS4----1A---- úctu/úcta/NNFS4-----A----;././Z:-------------;1;NMG: publicistika
12;A/a/J^-------------;choval/chovat/VpMS----R-AAI-- mimořádnou/mimořádný/AAFS4----1A---- úctu/úcta/NNFS4-----A----;k/k/RR--3---------- jazyku/jazyk/NNIS3-----A---- ././Z:-------------;1;NMG: publicistika
13;Na/na/RR--4---------- to/ten/PDNS4----------;chovala/chovat/VpFS----R-AAI-- k/k/RR--3---------- životu/život/NNIS3-----A---- příliš/příliš/Db------------- velkou/velký/AAFS4----1A---- úctu/úcta/NNFS4-----A----;a/a/J^------------- bála/bát/VpFS----R-AAI-- se/se/P7--4---------- Božího/boží/AAIS2----1A---- hněvu/hněv/NNIS2-----A---- ././Z:-------------;1;FIC: beletrie
14;;Chovej/chovat/Vi-S---2--A-I-- k/k/RR--3---------- ní/on/P5FS3--3------- úctu/úcta/NNFS4-----A----;a/a/J^------------- hýčkej/hýčkat/Vi-S---2--A-I-- vzpomínky/vzpomínka/NNFP4-----A---- na/na/RR--4---------- všechno/všechen/PLNS4---------- pěkné/pěkný/AANS4----1A---- ,/,/Z:------------- co/co/PQ--4---------- jste/být/VB-P---2P-AAI-- spolu/spolu/Db------------- prožili/prožít/VpMP----R-AAP-- ././Z:-------------;1;FIC: beletrie
15;Pane/pán/NNMS5-----A---- Rašíne/Rašín/NNMS5-----A---- ,/,/Z:-------------;chovám/chovat/VB-S---1P-AAI-- k/k/RR--3---------- vám/vy/PP-P3--2------- značnou/značný/AAFS4----1A---- úctu/úcta/NNFS4-----A----;,/,/Z:------------- věřte/věřit/Vi-P---2--A-I-- ,/,/Z:------------- prosím/prosit/VB-S---1P-AAI-- ,/,/Z:------------- naprosté/naprostý/AAFS3----1A---- upřímnosti/upřímnost/NNFS3-----A---- mých/můj/PSNP2-S1------- slov/slovo/NNNP2-----A---- ././Z:-------------;1;FIC: beletrie
16;Hailander/Hailander/X@------------- bude/být/VB-S---3F-AAI-- vůči/vůči/RR--3---------- panu/pán/NNMS3-----A---1 Režnému/Režný/NNMS3-----A---- vždy/vždy/Db-------------;chovat/chovat/Vf--------A-I-- velikou/veliký/AAFS4----1A---- úctu/úcta/NNFS4-----A----;././Z:-------------;1;NMG: publicistika
17;"Pan/pán/NNMS1-----A---- Pritchard/Pritchard/NNMS1-----A---- řekl/říci/VpMS----R-AAP-- :/:/Z:------------- ""/""/Z:------------- Rozumí/rozumět/VB-S---3P-AAI-- se/se/P7--4---------- ,/,/Z:------------- že/že/J,-------------";chovám/chovat/VB-S---1P-AAI-- nejhlubší/hluboký/AAFS4----3A---- úctu/úcta/NNFS4-----A----;"k/k/RR--3---------- našim/náš/PSMP3-P1------- vojákům/voják/NNMP3-----A---- a/a/J^------------- myslím/myslet/VB-S---1P-AAI-- ,/,/Z:------------- že/že/J,------------- by/být/Vc----------I-- jejich/jejich/PSIS1-P3------- hlas/hlas/NNIS1-----A---- měl/mít/VpIS----R-AAI-- být/být/Vf--------A-I-- slyšen/slyšet/VsIS------API-- ././Z:------------- ""/""/Z:-------------";1;FIC: beletrie
18;Hubený/hubený/AAMS1----1A---- kluk/kluk/NNMS1-----A----;choval/chovat/VpMS----R-AAI-- ke/k/RV--3---------- svému/svůj/P8MS3---------- nevlastnímu/vlastní/AAMS3----1N---- otci/otec/NNMS3-----A---- jenom/jen/Db------------- úctu/úcta/NNFS4-----A----;././Z:-------------;1;FIC: beletrie
19;K/k/RR--3---------- takovým/takový/PDMP3---------- lidem/člověk/NNMP3-----A---- i/i/J^------------- Kristián/Kristián/NNMS1-----A---- Najman/Najman/NNMS1-----A---- mohl/moci/VpMS----R-AAI--;chovati/chovat/Vf--------A-I-2 úctu/úcta/NNFS4-----A----;přesto/přesto/Db------------- ,/,/Z:------------- či/či/J^------------- snad/snad/TT------------- právě/právě/TT------------- proto/proto/Db------------- ,/,/Z:------------- že/že/J,------------- oba/oba/ClMP1---------- měli/mít/VpMP----R-AAI-- krev/krev/NNFS4-----A---- horkou/horký/AAFS4----1A---- ././Z:-------------;1;FIC: beletrie
20;K/k/RR--3---------- nim/oni/P5MP3--3-------;chová/chovat/VB-S---3P-AAI-- ,/,/Z:------------- jak/jak/Db------------- přiznala/přiznat/VpFS----R-AAP-- ,/,/Z:------------- velký/velký/AAIS4----1A---- respekt/respekt/NNIS4-----A---- a/a/J^------------- úctu/úcta/NNFS4-----A----;././Z:-------------;1;NMG: publicistika
21;Pana/pán/NNMS2-----A---- Pitínského/Pitínský/NNMS2-----A---- si/se/P7--3---------- velmi/velmi/Db------------- vážím/vážit/VB-S---1P-AAI-- a/a/J^-------------;chovám/chovat/VB-S---1P-AAI-- k/k/RR--3---------- němuhlubokou/němuhlubokou/X@------------- úctu/úcta/NNFS4-----A----;././Z:-------------;1;NMG: publicistika
22;Kdysi/kdysi/Db------------- jsme/být/VB-P---1P-AAI-- se/se/P7--4---------- ve/v/RV--6---------- škole/škola/NNFS6-----A---- učili/učit/VpMP----R-AAI-- ,/,/Z:------------- že/že/J,------------- vyspělost/vyspělost/NNFS1-----A---- společnosti/společnost/NNFS2-----A---- se/se/P7--4---------- pozná/poznat/VB-S---3P-AAP-- podle/podle/RR--2---------- toho/ten/PDNS2---------- ,/,/Z:------------- jak/jak/Db------------- se/se/P7--4----------;chová/chovat/VB-S---3P-AAI-- k/k/RR--3---------- dětem/dítě/NNFP3-----A---- a/a/J^------------- jakou/jaký/P4FS4---------- úctu/úcta/NNFS4-----A----;prokazuje/prokazovat/VB-S---3P-AAI-- stáří/stáří/NNNS1-----A---- ././Z:-------------;0;NMG: publicistika
23;Ale/ale/J^------------- já/já/PP-S1--1------- k/k/RR--3---------- nim/oni/P5MP3--3------- spíš/spíš/TT-------------;chovám/chovat/VB-S---1P-AAI-- obrovskou/obrovský/AAFS4----1A---- úctu/úcta/NNFS4-----A----;,/,/Z:------------- kolikrát/kolikrát/Co------------- mi/já/PH-S3--1------- přijdou/přijít/VB-P---3P-AAP-- zajímavější/zajímavý/AAMP1----2A---- a/a/J^------------- chytřejší/chytrý/AAMP1----2A---- než/než/J,------------- dospěláci/dospělák/NNMP1-----A---- ././Z:-------------;1;NMG: publicistika
24;Respektujte/respektovat/Vi-P---2--A-I-- vyšší/vysoký/AAIS4----2A---- věk/věk/NNIS4-----A---- a/a/J^------------- větší/velký/AAFP4----2A---- zkušenosti/zkušenost/NNFP4-----A---- ,/,/Z:-------------;chovejte/chovat/Vi-P---2--A-I-- se/se/P7--4---------- uctivě/uctivě/Dg-------1A---- k/k/RR--3---------- tomu/ten/PDMS3---------- ,/,/Z:------------- kdo/kdo/PKM-1---------- si/se/P7--3---------- úctu/úcta/NNFS4-----A----;zaslouží/zasloužit/VB-S---3P-AAP-- ././Z0------------- */*/Z:------------- Hloupý/hloupý/AAMS1----1A---- rozhodně/rozhodně/TT------------- není/být/VB-S---3P-NAI-- ten/ten/PDMS1---------- ,/,/Z:------------- kdo/kdo/PKM-1---------- přiměřeně/přiměřeně/Dg-------1A---- ustoupí/ustoupit/VB-S---3P-AAP-- ,/,/Z:------------- ale/ale/J^------------- naopak/naopak/TT------------- ten/ten/PDMS1---------- ,/,/Z:------------- kdo/kdo/PKM-1---------- to/ten/PDNS4---------- nedovede/dovést/VB-S---3P-NAP-- ././Z0------------- */*/Z:------------- Vaše/váš/PSFS1-P2------- asertivita/asertivita/NNFS1-----A---- nesmí/smět/VB-S---3P-NAI-- ostatní/ostatní/AAMP4----1A---- omezovat/omezovat/Vf--------A-I-- v/v/RR--6---------- jejich/jejich/PSIP6-P3------- oprávněných/oprávněný/AAIP6----1A---- nárocích/nárok/NNIP6-----A---- -/-/Z:------------- to/ten/PDNS4---------- ,/,/Z:------------- že/že/J,------------- je/oni/PPMP4--3------- třeba/třeba/Db------------- nedovedou/dovést/VB-P---3P-NAP-- tak/tak/Db------------- razantně/razantně/Dg-------1A---- prosazovat/prosazovat/Vf--------A-I-- ,/,/Z:------------- neznamená/znamenat/VB-S---3P-NAI-- ,/,/Z:------------- že/že/J,------------- na/na/RR--4---------- ně/oni/P5MP4--3------- nemají/mít/VB-P---3P-NAI-- právo/právo/NNNS4-----A---- ././Z:-------------;0;NMG: publicistika
25;Pak/pak/Db------------- se/se/P7--4---------- stal/stát/VpMS----R-AAP-- kaplanem/kaplan/NNMS7-----A---- nebo/nebo/J^------------- farářem/farář/NNMS7-----A---- v/v/RR--6---------- Prasetíně/Prasetín/NNIS6-----A---- na/na/RR--6---------- Milevsku/Milevsko/NNNS6-----A---- ,/,/Z:------------- byl/být/VpMS----R-AAI-- by/být/Vc----------I-- si/se/P7--3---------- rád/rád/ACMS------A---- vzal/vzít/VpMS----R-AAP-- matku/matka/NNFS4-----A---- k/k/RR--3---------- sobě/se/P6--3---------- ,/,/Z:------------- ale/ale/J^------------- ta/ten/PDFS1---------- byla/být/VpFS----R-AAI-- plachá/plachý/AAFS1----1A---- ,/,/Z:------------- bála/bát/VpFS----R-AAI-- se/se/P7--4---------- každé/každý/PLFS2---------- změny/změna/NNFS2-----A---- a/a/J^------------- jako/jako/J,------------- mnohé/mnohý/AAFS2----1A---- příbramské/příbramský/AAFS2----1A---- ženy/žena/NNFS2-----A---- neuměla/umět/VpFS----R-NAI-- si/se/P7--3---------- představit/představit/Vf--------A-P-- ,/,/Z:------------- že/že/J,------------- by/být/Vc----------I-- mohla/moci/VpFS----R-AAI-- opustit/opustit/Vf--------A-P-- město/město/NNNS4-----A---- ,/,/Z:------------- ke/k/RV--3---------- kterému/který/P4NS3----------;chovala/chovat/VpFS----R-AAI-- nejněžnější/něžný/AAFS4----3A---- lásku/láska/NNFS4-----A---- a/a/J^------------- úctu/úcta/NNFS4-----A----;a/a/J^------------- vděčnost/vděčnost/NNFS4-----A---- ././Z:-------------;1;FIC: beletrie
26;Právě/právě/Db------------- tak/tak/Db------------- však/však/J^------------- i/i/J^------------- babička/babička/NNFS1-----A----;chovala/chovat/VpFS----R-AAI-- úctu/úcta/NNFS4-----A----;k/k/RR--3---------- němu/on/P5MS3--3------- a/a/J^------------- se/s/RV--7---------- zbožnou/zbožný/AAFS7----1A---- láskou/láska/NNFS7-----A---- opatrovala/opatrovat/VpFS----R-AAI-- své/svůj/P8IP4---------1 černé/černý/AAIP4----1A---- svatební/svatební/AAIP4----1A---- šaty/šaty/NNIP4-----A---- ,/,/Z:------------- ve/v/RV--6---------- kterých/který/P4IP6---------- si/se/P7--3---------- ho/on/PHIS4--3------- brala/brát/VpFS----R-AAI-- jako/jako/J,------------- vdova/vdova/NNFS1-----A---- ././Z:-------------;1;FIC: beletrie
27;Lara/Lara/NNFS1-----A---- k/k/RR--3---------- oběma/oba/ClMP3----------;chovala/chovat/VpFS----R-AAI-- nadšenou/nadšený/AAFS4----1A---- úctu/úcta/NNFS4-----A----;././Z:-------------;1;FIC: beletrie
28;Šéf/šéf/NNMS1-----A---- krajského/krajský/AAIS2----1A---- svazu/svaz/NNIS2-----A---- Michal/Michal/NNMS1-----A---- Blaschke/Blaschke/NNMS1-----A---- si/se/P7--3---------- přeje/přát/VB-S---3P-AAI-- ,/,/Z:------------- aby/aby|být/J,-------------|Vc----------I-- fotbalisté/fotbalista/NNMP1-----A---- i/i/J^------------- diváci/divák/NNMP1-----A----;chovali/chovat/VpMP----R-AAI-- při/při/RR--6---------- utkáních/utkání/NNNP6-----A---- k/k/RR--3---------- sobě/se/P6--3---------- úctu/úcta/NNFS4-----A----;;1;NMG: publicistika
29;Ženy/žena/NNFP1-----A---- jsou/být/VB-P---3P-AAI-- přitahovány/přitahovat/VsFP------API-- silnými/silný/AAFP7----1A---- osobnostmi/osobnost/NNFP7-----A---- ,/,/Z:------------- chtějí/chtít/VB-P---3P-AAI-- muže/muž/NNMP4-----A---- ,/,/Z:------------- kteří/který/P4MP1---------- si/se/P7--3---------- věří/věřit/VB-P---3P-AAI-- a/a/J^-------------;chovají/chovat/VB-P---3P-AAI-- úctu/úcta/NNFS4-----A----;sami/sám/PLMP1---------- k/k/RR--3---------- sobě/se/P6--3---------- ././Z:-------------;1;NMG: publicistika
30;Ke/k/RV--3---------- starším/starý/AAMP3----2A---- lidem/člověk/NNMP3-----A---- bychom/být/Vc-P---1----I-- měli/mít/VpMP----R-AAI--;chovat/chovat/Vf--------A-I-- úctu/úcta/NNFS4-----A----;././Z:-------------;1;NMG: publicistika
31;Francouzi/Francouz/NNMP1-----A----;chovají/chovat/VB-P---3P-AAI-- ke/k/RV--3---------- spisovatelům/spisovatel/NNMP3-----A---- nesmírnou/nesmírný/AAFS4----1A---- úctu/úcta/NNFS4-----A----;,/,/Z:------------- to/ten/PDNS4---------- přece/přece/TT------------- víš/vědět/VB-S---2P-AAI-- ././Z:-------------;1;FIC: beletrie
32;Liberečtí/liberecký/AAMP1----1A---- fanoušci/fanoušek/NNMP1-----A----;"chovají/chovat/VB-P---3P-AAI-- ke/k/RV--3---------- sparťanskému/sparťanský/AAMS3----1A---- obránci/obránce/NNMS3-----A---- Tomáši/Tomáš/NNMS3-----A---- Řepkovi/Řepka/NNMS3-----A---- »/""/Z:------------- nesmírnou/nesmírný/AAFS4----1A---- «/""/Z:------------- úctu/úcta/NNFS4-----A----";././Z:-------------;1;NMG: publicistika
33;Měl/mít/VpMS----R-AAI-- svého/svůj/P8MS4---------- pána/pán/NNMS4-----A---- strašně/strašně/Dg-------1A---- rád/rád/ACMS------A---- ,/,/Z:------------- stejně/stejně/Dg-------1A---- jako/jako/J,------------- i/i/J^------------- jeho/jeho/PSMP4-S3------- psy/pes/NNMP4-----A---- a/a/J^------------- kočky/kočka/NNFP4-----A---- ,/,/Z:------------- ke/k/RV--3---------- všem/všechen/PLFP3---------- ženám/žena/NNFP3-----A----;choval/chovat/VpMS----R-AAI-- obdiv/obdiv/NNIS4-----A---- a/a/J^------------- úctu/úcta/NNFS4-----A----;,/,/Z:------------- a/a/J^------------- když/když/J,------------- vypukla/vypuknout/VpFS----R-AAP-1 hádka/hádka/NNFS1-----A---- ,/,/Z:------------- bylo/být/VpNS----R-AAI-- mu/on/PHMS3--3------- z/z/RR--2---------- toho/ten/PDNS2---------- vždycky/vždy/Db------------- strašně/strašně/Dg-------1A---- ././Z:-------------;1;FIC: beletrie
34;A/a/J^------------- když/když/J,------------- k/k/RR--3---------- sobě/se/P6--3----------;chovají/chovat/VB-P---3P-AAI-- úctu/úcta/NNFS4-----A----;a/a/J^------------- jsou/být/VB-P---3P-AAI-- schopni/schopný/ACMP------A---- tolerantního/tolerantní/AANS2----1A---- chování/chování/NNNS2-----A---- ,/,/Z:------------- může/moci/VB-S---3P-AAI-- jim/oni/PPMP3--3------- partnerství/partnerství/NNNS1-----A---- vydržet/vydržet/Vf--------A-P-- až/až/TT------------- navěky/navěky/Db------------- ././Z:-------------;1;NMG: publicistika
35;K/k/RR--3---------- lidem/člověk/NNMP3-----A---- v/v/RR--6---------- regionálních/regionální/AAFP6----1A---- redakcích/redakce/NNFP6-----A----;chovám/chovat/VB-S---1P-AAI-- úctu/úcta/NNFS4-----A----;,/,/Z:------------- jsou/být/VB-P---3P-AAI-- v/v/RR--6---------- nezáviděníhodné/záviděníhodný/AAFS6----1N---- pozici/pozice/NNFS6-----A---- ././Z:-------------;1;NFC: oborová literatura
36;Zuzi/Zuzi/NNFS1-----A----;chovala/chovat/VpFS----R-AAI-- k/k/RR--3---------- panu/pán/NNMS3-----A---1 Wagnerovi/Wagner/NNMS3-----A---- vždycky/vždy/Db------------- takovou/takový/PDFS4---------- úctu/úcta/NNFS4-----A----;,/,/Z:------------- že/že/J,------------- s/s/RR--7---------- ním/on/P5MS7--3------- mluvila/mluvit/VpFS----R-AAI-- téměř/téměř/Db------------- šeptem/šeptem/Db------------- ././Z:-------------;1;FIC: beletrie
37;Až/až/TT------------- do/do/RR--2---------- konce/konec/NNIS2-----A---- života/život/NNIS2-----A---- k/k/RR--3---------- němu/on/P5IS3--3------- bude/být/VB-S---3F-AAI--;chovat/chovat/Vf--------A-I-- posvátnou/posvátný/AAFS4----1A---- úctu/úcta/NNFS4-----A----;././Z:-------------;1;FIC: beletrie
38;Právě/právě/Db------------- kvůli/kvůli/RR--3---------- nim/oni/P5MP3--3-------;chovám/chovat/VB-S---1P-AAI-- velkou/velký/AAFS4----1A---- úctu/úcta/NNFS4-----A----;i/i/J^------------- k/k/RR--3---------- autorům/autor/NNMP3-----A---- Xantypy/Xantypa/NNFS2-----A---- ././Z:-------------;1;NMG: publicistika
39;Byl/být/VpMS----R-AAI-- to/ten/PDNS1---------- prý/prý/TT------------- ten/ten/PDMS1---------- ,/,/Z:------------- co/co/J,------------- mu/on/PHMS3--3------- před/před/RR--7---------- pár/pár/Db------------- týdny/týden/NNIP7-----A---- Legionář/legionář/NNMS1-----A---- vyžahnul/vyžahnout/VpMS----R-AAP-- tu/ten/PDFS4---------- flašku/flaška/NNFS4-----A---- slivovice/slivovice/NNFS2-----A---- :/:/Z:------------- od/od/RR--2---------- té/ten/PDFS2---------- doby/doba/NNFS2-----A----;choval/chovat/VpMS----R-AAI-- k/k/RR--3---------- Legionáři/legionář/NNMS3-----A---- ,/,/Z:------------- byť/byť/J,------------- seroucímu/seroucí/AGMS3-----A---- v/v/RR--6---------- bolestech/bolest/NNFP6-----A---- ,/,/Z:------------- bezmála/bezmála/Db------------- posvátnou/posvátný/AAFS4----1A---- úctu/úcta/NNFS4-----A----;././Z:-------------;1;FIC: beletrie
40;Princ/Princ/NNMS1-----A---- Ruprecht/Ruprecht/NNMS1-----A---- okamžitě/okamžitě/Dg-------1A---- po/po/RR--6---------- korunovaci/korunovace/NNFS6-----A---- odjel/odjet/VpMS----R-AAP-- kvůli/kvůli/RR--3---------- královým/králův/AUFP3M--------- záležitostem/záležitost/NNFP3-----A---- do/do/RR--2---------- ciziny/cizina/NNFS2-----A---- ,/,/Z:------------- takže/takže/J,------------- nemohl/moci/VpMS----R-NAI-- svou/svůj/P8FS4---------1 matku/matka/NNFS4-----A---- uvítat/uvítat/Vf--------A-P-- ,/,/Z:------------- ale/ale/J^------------- král/král/NNMS1-----A---- se/se/P7--4---------- k/k/RR--3---------- ní/on/P5FS3--3-------;choval/chovat/VpMS----R-AAI-- laskavě/laskavě/Dg-------1A---- a/a/J^------------- starší/starý/AAMP1----2A---- dvořané/dvořan/NNMP1-----A---- jí/on/PPFS3--3------- prokazovali/prokazovat/VpMP----R-AAI-- úctu/úcta/NNFS4-----A----;././Z:-------------;0;FIC: beletrie
41;Nevěděla/vědět/VpFS----R-NAI-- ,/,/Z:------------- jestli/jestli/J,------------- se/se/P7--4---------- má/mít/VB-S---3P-AAI-- k/k/RR--3---------- němu/on/P5MS3--3-------;chovat/chovat/Vf--------A-I-- s/s/RR--7---------- dosavadní/dosavadní/AAFS7----1A---- úctou/úcta/NNFS7-----A---- ,/,/Z:------------- nebo/nebo/J^------------- se/s/RV--7---------- soucitem/soucit/NNIS7-----A---- ,/,/Z:------------- jestli/jestli/J,------------- stojí/stát/VB-S---3P-AAI-- o/o/RR--4---------- úctu/úcta/NNFS4-----A----;,/,/Z:------------- nebo/nebo/J^------------- o/o/RR--4---------- soucit/soucit/NNIS4-----A---- ././Z:-------------;0;FIC: beletrie
42;Vládněte/vládnout/Vi-P---2--A-I-- spravedlivě/spravedlivě/Dg-------1A---- ,/,/Z:------------- buďte/být/Vi-P---2--A-I-- hodní/hodný/AAMP1----1A---- k/k/RR--3---------- mladším/mladý/AAMP3----2A---- spolužákům/spolužák/NNMP3-----A---- a/a/J^------------- k/k/RR--3---------- učitelům/učitel/NNMP3-----A----;chovejte/chovat/Vi-P---2--A-I-- úctu/úcta/NNFS4-----A----;a/a/J^------------- respekt/respekt/NNIS4-----A---- ././Z:-------------;1;FIC: beletrie
43;Zacházím/zacházet/VB-S---1P-AAI-- proto/proto/Db------------- s/s/RR--7---------- nimi/oni/P5MP7--3------- s/s/RR--7---------- respektem/respekt/NNIS7-----A---- ,/,/Z:-------------;chovám/chovat/VB-S---1P-AAI-- k/k/RR--3---------- nim/oni/P5MP3--3------- úctu/úcta/NNFS4-----A----;././Z:-------------;1;NMG: publicistika
44;;Chovají/chovat/VB-P---3P-AAI-- velikou/veliký/AAFS4----1A---- úctu/úcta/NNFS4-----A----;k/k/RR--3---------- rodičům/rodič/NNMP3-----A---- a/a/J^------------- respekt/respekt/NNIS4-----A---- vůči/vůči/RR--3---------- starším/starý/AAMP3----2A---- lidem/člověk/NNMP3-----A---- ././Z:-------------;1;NMG: publicistika
45;"""/""/Z:------------- Já/já/PP-S1--1------- k/k/RR--3---------- těm/ten/PDFP3---------- geniálním/geniální/AAFP3----1A---- dětem/dítě/NNFP3-----A----";chovám/chovat/VB-S---1P-AAI-- obrovskou/obrovský/AAFS4----1A---- úctu/úcta/NNFS4-----A----;././Z:-------------;1;FIC: beletrie
