id;left;kwic;right;VNP?;doc.txtype_group
1;LN/LN/BN------------- :/:/Z:------------- Když/když/J,------------- svůj/svůj/P8IS4----------;úmysl/úmysl/NNIS4-----A---- nekandidovat/kandidovat/Vf--------N-I-- oznamoval/oznamovat/VpMS----R-AAI-- ,/,/Z:------------- dodal/dodat/VpMS----R-AAP-- ,/,/Z:------------- že/že/J,------------- by/být/Vc----------I-- jeho/jeho/PSNS4-S3------- rozhodnutí/rozhodnutí/NNNS4-----A---- mohl/moci/VpIS----R-AAI-- zviklat/zviklat/Vf--------A-P-- pouze/pouze/Db------------- neúspěch/neúspěch/NNIS1-----A---- ve/v/RV--6---------- volbách/volba/NNFP6-----A---- a/a/J^------------- skutečnost/skutečnost/NNFS1-----A---- ,/,/Z:------------- že/že/J,------------- by/být/Vc----------I-- se/se/P7--4---------- ODS/ODS/BN------------- na/na/RR--6---------- kongresu/kongres/NNIS6-----A---1 chovala/chovat/VpFS----R-AAI--;tak/tak/Db------------- ,/,/Z:------------- že/že/J,------------- by/být/Vc----------I-- ztrácela/ztrácet/VpFS----R-AAI-- tvář/tvář/NNFS4-----A---- .../.../Z:-------------;0;NMG: publicistika
2;Vábnička/vábnička/NNFS1-----A---- byla/být/VpFS----R-AAI-- zatím/zatím/Db------------- přehlédnuta/přehlédnout/VsFS------APP-- ,/,/Z:------------- členy/člen/NNMP7-----A---- Evropského/evropský/AAIS2----1A---- parlamentu/parlament/NNIS2-----A---- dráždí/dráždit/VB-P---3P-AAI--;úmysl/úmysl/NNIS4-----A---- nominovaného/nominovaný/AAMS2----1A---- předsedy/předseda/NNMS2-----A---- Komise/komise/NNFS2-----A---- chovat/chovat/Vf--------A-I--;se/se/P7--4---------- zčásti/zčásti/Db------------- jako/jako/J,------------- předseda/předseda/NNMS1-----A---- vlády/vláda/NNFS2-----A---- ,/,/Z:------------- který/který/P4MS1---------- by/být/Vc----------I-- sám/sám/PLMS1---------- mohl/moci/VpMS----R-AAI-- odvolávat/odvolávat/Vf--------A-I-- ty/ten/PDMP4---------- členy/člen/NNMP4-----A---- svého/svůj/P8IS2---------- týmu/tým/NNIS2-----A---- ,/,/Z:------------- kteří/který/P4MP1---------- se/se/P7--4---------- neosvědčí/osvědčit/VB-P---3P-NAP-- ././Z:-------------;0;NMG: publicistika
3;Vábnička/vábnička/NNFS1-----A---- byla/být/VpFS----R-AAI-- zatím/zatím/Db------------- přehlédnuta/přehlédnout/VsFS------APP-- ,/,/Z:------------- členy/člen/NNMP7-----A---- Evropského/evropský/AAIS2----1A---- parlamentu/parlament/NNIS2-----A---- dráždí/dráždit/VB-P---3P-AAI--;úmysl/úmysl/NNIS4-----A---- nominovaného/nominovaný/AAMS2----1A---- předsedy/předseda/NNMS2-----A---- Komise/komise/NNFS2-----A---- chovat/chovat/Vf--------A-I--;se/se/P7--4---------- zčásti/zčásti/Db------------- jako/jako/J,------------- předseda/předseda/NNMS1-----A---- vlády/vláda/NNFS2-----A---- ,/,/Z:------------- který/který/P4MS1---------- by/být/Vc----------I-- sám/sám/PLMS1---------- mohl/moci/VpMS----R-AAI-- odvolávat/odvolávat/Vf--------A-I-- ty/ten/PDMP4---------- členy/člen/NNMP4-----A---- svého/svůj/P8IS2---------- týmu/tým/NNIS2-----A---- ,/,/Z:------------- kteří/který/P4MP1---------- se/se/P7--4---------- neosvědčí/osvědčit/VB-P---3P-NAP-- ././Z:-------------;0;NMG: publicistika
4;Pracovníci/pracovník/NNMP1-----A---- leteckého/letecký/AAIS2----1A---- provozu/provoz/NNIS2-----A---- už/už/Db------------- během/běh/NNIS7-----A---- odpoledně/odpoledně/Dg-------1A---- prohlásili/prohlásit/VpMP----R-AAP-- ,/,/Z:------------- že/že/J,------------- podle/podle/RR--2---------- jejich/jejich/PSNS2-P3------- zjištění/zjištění/NNNS2-----A---- nemá/mít/VB-S---3P-NAI-- teroristické/teroristický/AAIP4----1A----;úmysly/úmysl/NNIP4-----A---- a/a/J^------------- nechová/chovat/VB-S---3P-NAI--;se/se/P7--4---------- jako/jako/J,------------- terorista/terorista/NNMS1-----A---- ././Z:-------------;0;NMG: publicistika
5;Oči/oko/NNFP1-----A---- zúžené/zúžený/AAFP1----1A---- do/do/RR--2---------- štěrbin/štěrbina/NNFP2-----A---- svědčí/svědčit/VB-P---3P-AAI-- o/o/RR--6---------- někom/někdo/PZM-6---------- ,/,/Z:------------- kdo/kdo/PKM-1---------- druhým/druhý/CrMP3---------- předem/předem/Db------------- podsouvá/podsouvat/VB-S---3P-AAI-- zlé/zlý/AAIP4----1A----;úmysly/úmysl/NNIP4-----A---- ,/,/Z:------------- a/a/J^------------- proto/proto/J^------------- se/se/P7--4---------- k/k/RR--3---------- nim/oni/P5MP3--3------- chová/chovat/VB-S---3P-AAI--;nanejvýš/nanejvýš/Db------------- opatrně/opatrně/Dg-------1A---- a/a/J^------------- zdrženlivě/zdrženlivě/Dg-------1A---- ././Z:-------------;0;NFC: oborová literatura
6;Důležité/důležitý/AANS1----1A---- ale/ale/J^------------- je/být/VB-S---3P-AAI-- ,/,/Z:------------- že/že/J,------------- pro/pro/RR--4---------- popis/popis/NNIS4-----A---- systému/systém/NNIS2-----A---- je/být/VB-S---3P-AAI-- užitečné/užitečný/AAIP4----1A----;úmysly/úmysl/NNIP4-----A---- a/a/J^------------- zájmy/zájem/NNIP4-----A---- (/(/Z:------------- intencionalitu/intencionalita/NNFS4-----A---- )/)/Z:------------- jednajícím/jednající/AGFP3-----A---- stranám/strana/NNFP3-----A---- připisovat/připisovat/Vf--------A-I-- :/:/Z:------------- předpokládáme/předpokládat/VB-P---1P-AAI-- ,/,/Z:------------- že/že/J,------------- například/například/TT------------- evoluční/evoluční/AAIS1----1A---- proces/proces/NNIS1-----A---- preferoval/preferovat/VpIS----R-AAI-- organismy/organismus/NNIP4-----A---- ,/,/Z:------------- které/který/P4IP1---------- se/se/P7--4---------- snaží/snažit/VB-P---3P-AAI-- chovat/chovat/Vf--------A-I--;v/v/RR--6---------- nějakém/nějaký/PZIS6---------- ohledu/ohled/NNIS6-----A---- pro/pro/RR--4---------- sebe/se/P6--4---------- optimálně/optimálně/Dg-------1A---- ,/,/Z:------------- ať/ať/J,------------- už/už/Db------------- o/o/RR--6---------- svých/svůj/P8IP6---------- záměrech/záměr/NNIP6-----A---- přemýšlejí/přemýšlet/VB-P---3P-AAI-- nebo/nebo/J^------------- ne/ne/TT------------- ././Z:-------------;0;NFC: oborová literatura
7;A/a/J^------------- taky/také/Db------------- podle/podle/RR--2---------- míry/míra/NNFS2-----A---- své/svůj/P8FS2---------1 vlastní/vlastní/AAFS2----1A---- podezíravosti/podezíravost/NNFS2-----A---- ,/,/Z:------------- a/a/J^------------- tohle/tenhle/PDNS1---------- byl/být/VpIS----R-AAI-- přímo/přímo/Dg-------1A---- ukázkový/ukázkový/AAIS1----1A---- případ/případ/NNIS1-----A---- :/:/Z:------------- místodržitel/místodržitel/NNMS1-----A---- připisoval/připisovat/VpMS----R-AAI-- Ježíšovi/Ježíš/NNMS3-----A---1;úmysly/úmysl/NNIP4-----A---- ,/,/Z:------------- které/který/P4IP4---------- v/v/RR--6---------- nejtajnějších/tajný/AAFP6----3A---- hlubinách/hlubina/NNFP6-----A---- duše/duše/NNFS2-----A---- sám/sám/PLMS1---------- choval/chovat/VpMS----R-AAI--;,/,/Z:------------- ač/ač/J,------------- nedoufal/doufat/VpMS----R-NAI-- v/v/RR--6---------- jejich/jejich/PSNS6-P3------- uskutečnění/uskutečnění/NNNS6-----A---- ././Z:-------------;3;FIC: beletrie
8;Není/být/VB-S---3P-NAI-- bohužel/bohužel/TT------------- směrodatné/směrodatný/AANS1----1A---- ,/,/Z:------------- že/že/J,------------- k/k/RR--3---------- nám/my/PP-P3--1------- mnozí/mnohý/AAMP1----1A---- Íránci/Íránec/NNMP1-----A---- žádné/žádný/PWIP4---------- nepřátelské/přátelský/AAIP4----1N----;úmysly/úmysl/NNIP4-----A---- nechovají/chovat/VB-P---3P-NAI--;,/,/Z:------------- jak/jak/Db------------- nedávno/dávno/Dg-------1N---- řekl/říci/VpMS----R-AAP-- stínový/stínový/AAMS1----1A---- ministr/ministr/NNMS1-----A---- zahraničí/zahraničí/NNNS2-----A---- Lubomír/Lubomír/NNMS1-----A---- Zaorálek/Zaorálek/NNMS1-----A---- ././Z:-------------;1;NMG: publicistika
9;Lidé/člověk/NNMP1-----A---- se/se/P7--4---------- snaží/snažit/VB-P---3P-AAI-- skrýt/skrýt/Vf--------A-P-- svoje/svůj/P8IP4---------- záměry/záměr/NNIP4-----A---- ,/,/Z:-------------;úmysly/úmysl/NNIP4-----A---- ,/,/Z:------------- motivy/motiv/NNIP4-----A---- konání/konání/NNNS2-----A---- ,/,/Z:------------- často/často/Dg-------1A---- nemluví/mluvit/VB-P---3P-NAI-- o/o/RR--6---------- tom/ten/PDNS6---------- ,/,/Z:------------- co/co/PQ--4---------- si/se/P7--3---------- myslí/myslet/VB-P---3P-AAI-- ,/,/Z:------------- často/často/Dg-------1A---- se/se/P7--4---------- chovají/chovat/VB-P---3P-AAI--;v/v/RR--6---------- rozporu/rozpor/NNIS6-----A---- s/s/RR--7---------- hodnotami/hodnota/NNFP7-----A---- ,/,/Z:------------- které/který/P4FP4---------- uznávají/uznávat/VB-P---3P-AAI-- ,/,/Z:------------- nejsou/být/VB-P---3P-NAI-- si/se/P7--3---------- vědomi/vědomý/ACMP------A---- svých/svůj/P8IP2---------- pravých/pravý/AAIP2----1A---- motivů/motiv/NNIP2-----A---- anebo/anebo/J^------------- nemají/mít/VB-P---3P-NAI-- své/svůj/P8IP4---------1 záměry/záměr/NNIP4-----A---- vyjasněné/vyjasněný/AAIP4----1A---- ././Z:-------------;0;NFC: oborová literatura
10;Také/také/Db------------- nevíme/vědět/VB-P---1P-NAI-- ,/,/Z:------------- jaké/jaký/P4IP4----------;úmysly/úmysl/NNIP4-----A---- choval/chovat/VpMS----R-AAI--;se/s/RV--7---------- svým/svůj/P8MS7---------- vězněm/vězeň/NNMS7-----A---- markrabě/markrabě/NNMS1-----A---- ,/,/Z:------------- proč/proč/Db------------- otálel/otálet/VpMS----R-AAI-- s/s/RR--7---------- rozhodnutím/rozhodnutí/NNNS7-----A---- ,/,/Z:------------- co/co/PQ--4---------- dál/dál/Db------------- ././Z:-------------;0;NFC: oborová literatura
11;Své/svůj/P8IP4---------1 opravdové/opravdový/AAIP4----1A----;úmysly/úmysl/NNIP4-----A---- však/však/J^------------- na/na/RR--6---------- vládní/vládní/AAFS6----1A---- úrovni/úroveň/NNFS6-----A---- za/za/RR--4---------- celých/celý/AANP2----1A---- 22/22/C=------------- let/rok/NNNP2-----A---- neukázali/ukázat/VpMP----R-NAP-- ,/,/Z:------------- takže/takže/J,------------- těžko/těžko/Dg-------1A---- odhadovat/odhadovat/Vf--------A-I-- ,/,/Z:------------- zda/zda/J,------------- by/být/Vc----------I-- se/se/P7--4---------- ve/v/RV--6---------- Strakově/Strakův/AUFS6M--------- akademii/akademie/NNFS6-----A---- chovali/chovat/VpMP----R-AAI--;,/,/Z:------------- jak/jak/Db------------- sami/sám/PLMP1---------- deklarují/deklarovat/VB-P---3P-AAB-- ,/,/Z:------------- nebo/nebo/J^------------- spíše/spíš/TT------------- jako/jako/J,------------- českoslovenští/československý/AAMP1----1A---- komunisté/komunista/NNMP1-----A---- pod/pod/RR--7---------- vedením/vedení/NNNS7-----A---- Gottwalda/Gottwald/NNMS2-----A---- řízeného/řízený/AAMS2----1A---- Moskvou/Moskva/NNFS7-----A---- ././Z:-------------;0;NMG: publicistika
12;"„/""/Z:------------- Ze/z/RV--2---------- své/svůj/P8FS2---------1 praxe/praxe/NNFS2-----A---- ale/ale/J^------------- vím/vědět/VB-S---1P-AAI-- ,/,/Z:------------- že/že/J,------------- dobré/dobrý/AAIP4----1A----";úmysly/úmysl/NNIP4-----A---- mívá/mívat/VB-S---3P-AAI-- ve/v/RV--6---------- firmách/firma/NNFP6-----A---- 95/95/C=------------- %/%/Z:------------- lidí/člověk/NNMP2-----A---- ,/,/Z:------------- jen/jen/Db------------- se/se/P7--4---------- nedokážou/dokázat/VB-P---3P-NAP-- chovat/chovat/Vf--------A-I--;"tak/tak/Db------------- ,/,/Z:------------- aby/aby|být/J,-------------|Vc----------I-- sami/sám/PLMP1---------- sebe/se/P6--4---------- nepotopili/potopit/VpMP----R-NAP-- ././Z:------------- “/""/Z:-------------";0;NMG: publicistika
13;Nemusí/muset/VB-S---3P-NAI-- mít/mít/Vf--------A-I-- nejmenší/malý/AAIS4----3A----;úmysl/úmysl/NNIS4-----A---- někdy/někdy/Db------------- krávy/kráva/NNFP1-----A---- vystavovat/vystavovat/Vf--------A-I-- nebo/nebo/J^------------- chovat/chovat/Vf--------A-I--;plemenný/plemenný/AAIS4----1A---- dobytek/dobytek/NNIS4-----A---- (/(/Z:------------- i/i/J^------------- když/když/J,------------- někteří/některý/PZMP1---------- z/z/RR--2---------- nich/oni/P5MP2--3------- zjistili/zjistit/VpMP----R-AAP-- ,/,/Z:------------- že/že/J,------------- plemenné/plemenný/AAFP1----1A---- krávy/kráva/NNFP1-----A---- jsou/být/VB-P---3P-AAI-- cenné/cenný/AAFP1----1A---- ze/z/RV--2---------- stejných/stejný/AAIP2----1A---- důvodů/důvod/NNIP2-----A---- ,/,/Z:------------- jako/jako/J,------------- jsou/být/VB-P---3P-AAI-- plemenní/plemenný/AAMP1----1A---- býci/býk/NNMP1-----A---- účelní/účelný/AAMP1----1A---- )/)/Z:------------- ././Z:-------------;0;NFC: oborová literatura
14;Pokud/pokud/J,------------- odmyslíme/odmyslet/VB-P---1P-AAP-- jakékoliv/jakýkoli/PZIP4---------- podvodné/podvodný/AAIP4----1A----;úmysly/úmysl/NNIP4-----A---- spojené/spojený/AAIP4----1A---- s/s/RR--7---------- uzavíráním/uzavírání/NNNS7-----A---- nevýhodných/výhodný/AAFP2----1N---- smluv/smlouva/NNFP2-----A---- ,/,/Z:------------- management/management/NNIS1-----A---- DP/DP/BN------------- má/mít/VB-S---3P-AAI-- povinnost/povinnost/NNFS4-----A---- chovat/chovat/Vf--------A-I--;se/se/P7--4---------- s/s/RR--7---------- péčí/péče/NNFS7-----A---- řádného/řádný/AAMS2----1A---- hospodáře/hospodář/NNMS2-----A---- ././Z:-------------;0;NMG: publicistika
15;Když/když/J,------------- Američané/Američan/NNMP1-----A---- zjistili/zjistit/VpMP----R-AAP-- ,/,/Z:------------- že/že/J,------------- nemáme/mít/VB-P---1P-NAI-- žádné/žádný/PWIP4---------- nepřátelské/přátelský/AAIP4----1N----;úmysly/úmysl/NNIP4-----A---- ,/,/Z:------------- postupně/postupně/Dg-------1A---- se/se/P7--4---------- přestali/přestat/VpMP----R-AAP-- chovat/chovat/Vf--------A-I--;agresivně/agresivně/Dg-------1A---- a/a/J^------------- omezili/omezit/VpMP----R-AAP-- se/se/P7--4---------- maximálně/maximálně/Dg-------1A---- na/na/RR--4---------- výhružná/výhružný/AANP4----1A---- gesta/gesto/NNNP4-----A---- ,/,/Z:------------- jimiž/jenž/PJNP7---------- naše/náš/PSFP4-P1------- osádky/osádka/NNFP4-----A---- častovali/častovat/VpMP----R-AAI-- ve/v/RV--6---------- vzduchu/vzduch/NNIS6-----A---- piloti/pilot/NNMP1-----A---- jejich/jejich/PSFP2-P3------- stíhaček/stíhačka/NNFP2-----A---- ././Z:-------------;0;NFC: oborová literatura
16;Vzhledem/vzhledem/RF------------- k/k/RR--3---------- velké/velký/AAFS3----1A---- publicitě/publicita/NNFS3-----A---- případu/případ/NNIS2-----A---- spojeného/spojený/AAIS2----1A---- s/s/RR--7---------- darem/dar/NNIS7-----A---- ODS/ODS/BN------------- se/se/P7--4---------- zdá/zdát/VB-S---3P-AAI-- vyloučené/vyloučený/AANS1----1A---- ,/,/Z:------------- že/že/J,------------- se/se/P7--4---------- některý/některý/PZMS1---------- sponzor/sponzor/NNMS1-----A---- pokusí/pokusit/VB-S---3P-AAP-- porušit/porušit/Vf--------A-P-- daňové/daňový/AAIP4----1A---- předpisy/předpis/NNIP4-----A---- ,/,/Z:------------- přičemž/přičemž/Db------------- pochybuji/pochybovat/VB-S---1P-AAI-1 ,/,/Z:------------- zda/zda/J,------------- některý/některý/PZMS1---------- ze/z/RV--2---------- sponzorů/sponzor/NNMP2-----A---- v/v/RR--6---------- této/tento/PDFS6---------- záležitosti/záležitost/NNFS6-----A---- podobný/podobný/AAIS4----1A----;úmysl/úmysl/NNIS4-----A---- vůbec/vůbec/TT------------- kdy/kdy/Db------------- choval/chovat/VpMS----R-AAI--;././Z:-------------;1;NMG: publicistika
17;Nerad/rád/ACMS------N---- bych/být/Vc-S---1----I-- přirozeně/přirozeně/Dg-------1A---- podsunoval/podsunovat/VpMS----R-AAI-- Kunderovi/Kundera/NNMS3-----A----;úmysly/úmysl/NNIP4-----A---- ,/,/Z:------------- které/který/P4IP4---------- nechová/chovat/VB-S---3P-NAI--;",/,/Z:------------- ale/ale/J^------------- problematičnost/problematičnost/NNFS1-----A---- jeho/jeho/PSFS2-S3------- chvály/chvála/NNFS2-----A---- národa/národ/NNIS2-----A---- za/za/RR--4---------- srpnové/srpnový/AANS4----1A---- počínání/počínání/NNNS4-----A---- se/se/P7--4---------- mi/já/PH-S3--1------- žel/žel/TT------------- jen/jen/Db------------- potvrzuje/potvrzovat/VB-S---3P-AAI-- v/v/RR--6---------- tom/ten/PDNS6---------- ,/,/Z:------------- jak/jak/Db------------- tentýž/tentýž/PDIS1---------- národ/národ/NNIS1-----A---- (/(/Z:------------- to/ten/PDNS4---------- už/už/Db------------- mu/on/PHMS3--3------- ovšem/ovšem/TT------------- neříká/říkat/VB-S---3P-NAI-- ""/""/Z:------------- národ/národ/NNIS4-----A---- ""/""/Z:------------- ,/,/Z:------------- ale/ale/J^------------- ""/""/Z:------------- někteří/některý/PZMP1---------- lidé/člověk/NNMP1-----A---- ""/""/Z:------------- )/)/Z:------------- zároveň/zároveň/Db------------- napomíná/napomínat/VB-S---3P-AAI-- za/za/RR--4---------- jeho/jeho/PSNS4-S3------- počínání/počínání/NNNS4-----A---- dnes/dnes/Db------------- :/:/Z:------------- prý/prý/TT------------- se/se/P7--4---------- z/z/RR--2---------- toho/ten/PDIS2---------- kriticismu/kriticismus/NNIS2-----A---- už/už/Db------------- stává/stávat/VB-S---3P-AAI--";3;NFC: oborová literatura
18;Přes/přes/RR--4---------- tyto/tento/PDIP4---------- a/a/J^------------- další/další/AAIP4----1A---- dobré/dobrý/AAIP4----1A----;úmysly/úmysl/NNIP4-----A---- a/a/J^------------- aktivity/aktivita/NNFP4-----A---- se/se/P7--4---------- naše/náš/PSFS1-P1------- civilizace/civilizace/NNFS1-----A---- chová/chovat/VB-S---3P-AAI--;jako/jako/J,------------- hyperaktivní/hyperaktivní/AANS1----1A---- dítě/dítě/NNNS1-----A---- ,/,/Z:------------- které/který/P4NS1---------- neví/vědět/VB-S---3P-NAI-- co/co/PQ--4---------- dělat/dělat/Vf--------A-I-- ././Z:-------------;0;NFC: oborová literatura
19;Přestože/přestože/J,------------- premiér/premiér/NNMS1-----A---- Miloš/Miloš/NNMS1-----A---- Zeman/Zeman/NNMS1-----A---- po/po/RR--6---------- středeční/středeční/AAFS6----1A---- schůzce/schůzka/NNFS6-----A---- s/s/RR--7---------- prezidentem/prezident/NNMS7-----A---- Václavem/Václav/NNMS7-----A---- Havlem/Havel/NNMS7-----A---- oznámil/oznámit/VpMS----R-AAP--;úmysl/úmysl/NNIS4-----A---- ministra/ministr/NNMS2-----A---- zdravotnictví/zdravotnictví/NNNS2-----A---- Ivana/Ivan/NNMS2-----A---- Davida/David/NNMS2-----A---- rezignovat/rezignovat/Vf--------A-B-- ,/,/Z:------------- sám/sám/PLMS1---------- ministr/ministr/NNMS1-----A---- se/se/P7--4---------- chová/chovat/VB-S---3P-AAI--;,/,/Z:------------- jako/jako/J,------------- by/být/Vc----------I-- se/se/P7--4---------- mu/on/PHMS3--3------- z/z/RR--2---------- funkce/funkce/NNFS2-----A---- nechtělo/chtít/VpNS----R-NAI-- ././Z:-------------;0;NMG: publicistika
20;A/a/J^------------- i/i/J^------------- když/když/J,------------- má/mít/VB-S---3P-AAI-- politik/politik/NNMS1-----A---- dobré/dobrý/AAIP4----1A----;úmysly/úmysl/NNIP4-----A---- ,/,/Z:------------- musí/muset/VB-S---3P-AAI-- se/se/P7--4---------- chovat/chovat/Vf--------A-I--;populisticky/populisticky/Dg-------1A---- ,/,/Z:------------- aby/aby|být/J,-------------|Vc----------I-- ho/on/PHMS4--3------- lidé/člověk/NNMP1-----A---- volili/volit/VpMP----R-AAI-- ././Z:-------------;0;NMG: publicistika
21;To/ten/PDNS4---------- nelze/lze/Db--------N---- označit/označit/Vf--------A-P-- jinak/jinak/Db------------- ,/,/Z:------------- než/než/J,------------- jako/jako/J,------------- zlý/zlý/AAIS4----1A----;úmysl/úmysl/NNIS4-----A---- člověka/člověk/NNMS2-----A---- ,/,/Z:------------- který/který/P4MS1---------- se/se/P7--4---------- chová/chovat/VB-S---3P-AAI--;spíš/spíš/TT------------- jako/jako/J,------------- poťouchlý/poťouchlý/AAMS1----1A---- nedospělec/nedospělec/NNMS1-----A---- ,/,/Z:------------- než/než/J,------------- jako/jako/J,------------- odpovědný/odpovědný/AAMS1----1A---- vládní/vládní/AAMS1----1A---- úředník/úředník/NNMS1-----A---- přistupující/přistupující/AGMS1-----A---- k/k/RR--3---------- problému/problém/NNIS3-----A---- s/s/RR--7---------- veškerou/veškerý/PLFS7---------- odpovědností/odpovědnost/NNFS7-----A---- ././Z:-------------;0;NMG: publicistika
22;Ukázalo/ukázat/VpNS----R-AAP-- se/se/P7--4---------- ,/,/Z:------------- že/že/J,------------- stejný/stejný/AAIS4----1A----;úmysl/úmysl/NNIS4-----A---- chová/chovat/VB-S---3P-AAI--;i/i/J^------------- on/on/PPMS1--3------- ,/,/Z:------------- a/a/J^------------- navrhl/navrhnout/VpMS----R-AAP-1 mi/já/PH-S3--1------- ,/,/Z:------------- že/že/J,------------- bychom/být/Vc-P---1----I-- mohli/moci/VpMP----R-AAI-- jet/jet/Vf--------A-I-- spolu/spolu/Db------------- ././Z:-------------;1;NFC: oborová literatura
23;Věřím/věřit/VB-S---1P-AAI-- tomu/ten/PDNS3---------- ,/,/Z:------------- že/že/J,------------- někteří/některý/PZMP1---------- politici/politik/NNMP1-----A---- jsou/být/VB-P---3P-AAI-- čestní/čestný/AAMP1----1A---- a/a/J^------------- mají/mít/VB-P---3P-AAI-- čisté/čistý/AAIP4----1A----;úmysly/úmysl/NNIP4-----A---- ,/,/Z:------------- jenže/jenže/J^------------- jsou/být/VB-P---3P-AAI-- nakonec/nakonec/TT------------- ovlivněni/ovlivnit/VsMP------APP-- těmi/ten/PDMP7---------- špatnými/špatný/AAMP7----1A---- ,/,/Z:------------- kteří/který/P4MP1---------- jim/oni/PPMP3--3------- pohrozí/pohrozit/VB-P---3P-AAP-- ,/,/Z:------------- pokud/pokud/J,------------- se/se/P7--4---------- nebudou/být/VB-P---3F-NAI-- chovat/chovat/Vf--------A-I--;tak/tak/Db------------- ,/,/Z:------------- jak/jak/Db------------- je/být/VB-S---3P-AAI-- v/v/RR--6---------- dnešní/dnešní/AAFS6----1A---- politice/politika/NNFS6-----A---- trendem/trend/NNIS7-----A---- ././Z:-------------;0;NMG: publicistika
24;Jen/jen/Db------------- potvrdil/potvrdit/VpMS----R-AAP-- ,/,/Z:------------- jaké/jaký/P4IP4----------;úmysly/úmysl/NNIP4-----A---- vůči/vůči/RR--3---------- unii/unie/NNFS3-----A---- ve/v/RV--6---------- skrytu/skryt/NNIS6-----A---- duše/duše/NNFS2-----A---- chová/chovat/VB-S---3P-AAI--;a/a/J^------------- že/že/J,------------- nešlo/jít/VpNS----R-NAI-- jen/jen/Db------------- o/o/RR--4---------- náhlou/náhlý/AAFS4----1A---- změnu/změna/NNFS4-----A---- názoru/názor/NNIS2-----A---- ././Z:-------------;1;NMG: publicistika
25;Aby/aby|být/J,-------------|Vc----------I-- hájil/hájit/VpMS----R-AAI-- názory/názor/NNIP4-----A---- ,/,/Z:------------- které/který/P4IP4---------- hlásal/hlásat/VpMS----R-AAI-- ,/,/Z:-------------;úmysly/úmysl/NNIP4-----A---- ,/,/Z:------------- které/který/P4IP4---------- choval/chovat/VpMS----R-AAI--;,/,/Z:------------- metody/metoda/NNFP4-----A---- ,/,/Z:------------- kterých/který/P4FP2---------- užil/užít/VpMS----R-AAP-- ././Z:-------------;3;NMG: publicistika
26;Jestliže/jestliže/J,------------- máte/mít/VB-P---2P-AAI-- jasnou/jasný/AAFS4----1A---- představu/představa/NNFS4-----A---- a/a/J^------------- jasný/jasný/AAIS4----1A----;úmysl/úmysl/NNIS4-----A---- vytvořit/vytvořit/Vf--------A-P-- pozitivní/pozitivní/AAIP4----1A---- vztahy/vztah/NNIP4-----A---- ,/,/Z:------------- budete/být/VB-P---2F-AAI-- mít/mít/Vf--------A-I-- sklon/sklon/NNIS4-----A---- se/se/P7--4---------- automaticky/automaticky/Dg-------1A---- chovat/chovat/Vf--------A-I--;a/a/J^------------- hovořit/hovořit/Vf--------A-I-- takovým/takový/PDIS7---------- způsobem/způsob/NNIS7-----A---- ,/,/Z:------------- který/který/P4IS1---------- to/ten/PDNS4---------- umožňuje/umožňovat/VB-S---3P-AAI-- ././Z:-------------;0;NMG: publicistika
27;"„/""/Z:------------- A/a/J^------------- vy/vy/PP-P1--2------- nevíte/vědět/VB-P---2P-NAI-- ,/,/Z:------------- že/že/J,------------- podle/podle/RR--2---------- §/§/Z:------------- 5/5/C=------------- veterinárního/veterinární/AAIS2----1A---- zákona/zákon/NNIS2-----A---- jste/být/VB-P---2P-AAI-- povinen/povinný/ACMS------A----";úmysl/úmysl/NNIS4-----A---- chovat/chovat/Vf--------A-I--;hospodářská/hospodářský/AANP4----1A---- zvířata/zvíře/NNNP4-----A---- oznámit/oznámit/Vf--------A-P-- krajské/krajský/AAFS3----1A---- veterinární/veterinární/AAFS3----1A---- správě/správa/NNFS3-----A---- nejméně/málo/Dg-------3A---- sedm/sedm/Cn-S4---------- dní/den/NNIP2-----A---1 předem/předem/Db------------- ././Z:-------------;0;NFC: oborová literatura
28;Nebudu/být/VB-S---1F-NAI-- ale/ale/J^------------- nikomu/nikdo/PWM-3---------- přičítat/přičítat/Vf--------A-I-- špatné/špatný/AAIP4----1A----;úmysly/úmysl/NNIP4-----A---- ,/,/Z:------------- a/a/J^------------- pokud/pokud/J,------------- nebude/být/VB-S---3F-NAI-- jasný/jasný/AAIS1----1A---- důkaz/důkaz/NNIS1-----A---- ,/,/Z:------------- že/že/J,------------- se/se/P7--4---------- někdo/někdo/PZM-1---------- ke/k/RV--3---------- mě/já/PH-S2--1------- nechoval/chovat/VpMS----R-NAI--;fér/fér/Db------------- ,/,/Z:------------- nemám/mít/VB-S---1P-NAI-- důvod/důvod/NNIS4-----A---- měnit/měnit/Vf--------A-I-- svůj/svůj/P8IS4---------- férový/férový/AAIS4----1A---- postoj/postoj/NNIS4-----A---- vůči/vůči/RR--3---------- jiným/jiný/AAMP3----1A---- kandidátům/kandidát/NNMP3-----A---- ././Z:-------------;0;NMG: publicistika
