id;left;kwic;right;VNP?;doc.txtype_group
1;"""/""/Z:------------- Už/už/Db------------- takto/takto/Db------------- malé/malý/AAIP1----1A---- mají/mít/VB-P---3P-AAI--";předsudky/předsudek/NNIP4-----A---- a/a/J^------------- jsou/být/VB-P---3P-AAI-- ovlivňovány/ovlivňovat/VsIP------API-- stereotypy/stereotyp/NNIP1-----A---- ,/,/Z:------------- jak/jak/Db------------- se/se/P7--4---------- mají/mít/VB-P---3P-AAI-- chovat/chovat/Vf--------A-I--;,/,/Z:------------- co/co/PQ--1---------- je/být/VB-S---3P-AAI-- a/a/J^------------- co/co/PQ--1---------- není/být/VB-S---3P-NAI-- pro/pro/RR--4---------- ně/oni/P5IP4--3------- vhodné/vhodný/AANS1----1A---- ././Z:-------------;0;NMG: publicistika
2;Nadějný/nadějný/AAIS1----1A---- je/být/VB-S---3P-AAI-- také/také/Db------------- postoj/postoj/NNIS1-----A---- Evropské/evropský/AAFS2----1A---- komise/komise/NNFS2-----A---- ,/,/Z:------------- jejíž/jejíž/P1FS1FS3------- komisařka/komisařka/NNFS1-----A---- pro/pro/RR--4---------- hospodářskou/hospodářský/AAFS4----1A---- soutěž/soutěž/NNFS4-----A---- Neelie/Neelie/NNFS1-----A---- Kroesová/Kroesová/NNFS1-----A---- řekla/říci/VpFS----R-AAP-- ,/,/Z:------------- že/že/J,------------- plán/plán/NNIS4-----A---- prozkoumá/prozkoumat/VB-S---3P-AAP-- ,/,/Z:------------- ale/ale/J^------------- že/že/J,------------- žádné/žádný/PWIP4----------;předsudky/předsudek/NNIP4-----A---- vůči/vůči/RR--3---------- němu/on/P5IS3--3------- nechová/chovat/VB-S---3P-NAI--;././Z:-------------;1;NMG: publicistika
3;"„/""/Z:------------- Když/když/J,------------- byly/být/VpFP----R-AAI-- malé/malý/AAFP1----1A---- ,/,/Z:------------- vedl/vést/VpMS----R-AAI-- jsem/být/VB-S---1P-AAI-- je/oni/PPFP4--3------- k/k/RR--3---------- tomu/ten/PDNS3---------- ,/,/Z:------------- aby/aby|být/J,-------------|Vc----------I-- neměly/mít/VpFP----R-NAI--";předsudky/předsudek/NNIP4-----A---- a/a/J^------------- nezošklivila/zošklivit/VpFS----R-NAP-- se/se/P7--4---------- jim/oni/PPFP3--3------- matematika/matematika/NNFS1-----A---- ,/,/Z:------------- kterou/který/P4FS4---------- mám/mít/VB-S---1P-AAI-- i/i/J^------------- přes/přes/RR--4---------- svou/svůj/P8FS4---------1 profesi/profese/NNFS4-----A---- rád/rád/ACMS------A---- a/a/J^------------- chovám/chovat/VB-S---1P-AAI--;k/k/RR--3---------- ní/on/P5FS3--3------- úctu/úcta/NNFS4-----A---- ././Z:-------------;0;NMG: publicistika
4;Reaguje/reagovat/VB-S---3P-AAI-- nejen/nejen/Db------------- na/na/RR--4---------- vzrůstající/vzrůstající/AGIS4-----A---- zájem/zájem/NNIS4-----A---- o/o/RR--4---------- ně/oni/P5MP4--3------- ,/,/Z:------------- ale/ale/J^------------- také/také/Db------------- na/na/RR--4----------;předsudky/předsudek/NNIP4-----A---- a/a/J^------------- klišé/klišé/NNNS4-----A---- ,/,/Z:------------- které/který/P4IP4---------- vůči/vůči/RR--3---------- nim/oni/P5IP3--3------- a/a/J^------------- jejich/jejich/PSMP3-P3------- nositelům/nositel/NNMP3-----A---- chováme/chovat/VB-P---1P-AAI--;",/,/Z:------------- “/""/Z:------------- dodává/dodávat/VB-S---3P-AAI-- ředitelka/ředitelka/NNFS1-----A---- ././Z:-------------";3;NMG: publicistika
5;Ujistil/ujistit/VpMS----R-AAP-- jsem/být/VB-S---1P-AAI-- ji/on/PPFS4--3------- ,/,/Z:------------- že/že/J,------------- nemám/mít/VB-S---1P-NAI-- sám/sám/PLMS1---------- žádné/žádný/PWIP4----------;předsudky/předsudek/NNIP4-----A---- a/a/J^------------- nechovám/chovat/VB-S---1P-NAI--;proto/proto/Db------------- vůči/vůči/RR--3---------- ní/on/P5FS3--3------- žádné/žádný/PWIP4---------- hořké/hořký/AAIP4----1A---- pocity/pocit/NNIP4-----A---- ,/,/Z:------------- ale/ale/J^------------- naléhal/naléhat/VpMS----R-AAI-- jsem/být/VB-S---1P-AAI-- na/na/RR--4---------- ni/on/P5FS4--3------- ,/,/Z:------------- aby/aby|být/J,-------------|Vc----------I-- v/v/RR--6---------- zájmu/zájem/NNIS6-----A---- upevnění/upevnění/NNNS2-----A---- zdraví/zdraví/NNNS2-----A---- lidu/lid/NNIS2-----A---- i/i/J^------------- ona/on/PPFS1--3------- okamžitě/okamžitě/Dg-------1A---- vyhledala/vyhledat/VpFS----R-AAP-- lékařskou/lékařský/AAFS4----1A---- pomoc/pomoc/NNFS4-----A---- ././Z:-------------;0;FIC: beletrie
6;Pochopitelně/pochopitelně/Dg-------1A---- ,/,/Z:------------- já/já/PP-S1--1------- osobně/osobně/Dg-------1A---- vůči/vůči/RR--3---------- Korejcům/Korejec/NNMP3-----A---- žádné/žádný/PWIP4----------;předsudky/předsudek/NNIP4-----A---- nechoval/chovat/VpMS----R-NAI--;././Z:-------------;1;FIC: beletrie
7;Ale/ale/J^------------- není/být/VB-S---3P-NAI-- vyloučeno/vyloučit/VsNS------APP-- ,/,/Z:------------- že/že/J,------------- odhodím/odhodit/VB-S---1P-AAP-- své/svůj/P8IP4---------1;předsudky/předsudek/NNIP4-----A---- ,/,/Z:------------- které/který/P4IP4---------- chovám/chovat/VB-S---1P-AAI--;k/k/RR--3---------- Britům/Brit/NNMP3-----A---- (/(/Z:------------- i/i/J^------------- když/když/J,------------- jsem/být/VB-S---1P-AAI-- si/se/P7--3---------- vědom/vědomý/ACMS------A---- ,/,/Z:------------- že/že/J,------------- tím/ten/PDNS7---------- přijdu/přijít/VB-S---1P-AAP-- o/o/RR--4---------- své/svůj/P8NS4---------1 bostonsko-irské/bostonsko-irský/AANS4----1A---- občanství/občanství/NNNS4-----A---- )/)/Z:------------- ././Z:-------------;3;FIC: beletrie
8;Na/na/RR--4---------- tři/tři/ClIP4---------- dny/den/NNIP4-----A---- odložili/odložit/VpMP----R-AAP-- společenské/společenský/AAIP4----1A---- a/a/J^------------- rasové/rasový/AAIP4----1A----;předsudky/předsudek/NNIP4-----A---- a/a/J^------------- chovali/chovat/VpMP----R-AAI--;se/se/P7--4---------- tak/tak/Db------------- ,/,/Z:------------- jak/jak/Db------------- muslimovi/muslim/NNMS3-----A---- korán/korán/NNIS4-----A---- předepisuje/předepisovat/VB-S---3P-AAI-- ././Z:-------------;0;NMG: publicistika
9;Kromě/kromě/RR--2---------- definice/definice/NNFS2-----A---- národnostních/národnostní/AAFP2----1A---- menšin/menšina/NNFP2-----A---- se/se/P7--4---------- dozvídají/dozvídat/VB-P---3P-AAI-- například/například/TT------------- to/ten/PDNS4---------- ,/,/Z:------------- kolik/kolik/Ca--1---------- se/se/P7--4---------- jich/oni/PPFP2--3------- v/v/RR--6---------- zemi/země/NNFS6-----A---- nachází/nacházet/VB-S---3P-AAI-- ,/,/Z:------------- co/co/PQ--1---------- je/oni/PPMP4--3------- sem/sem/Db------------- přivedlo/přivést/VpNS----R-AAP-- ,/,/Z:------------- čím/co/PQ--7---------- a/a/J^------------- proč/proč/Db------------- se/se/P7--4---------- odlišují/odlišovat/VB-P---3P-AAI-- od/od/RR--2---------- většinové/většinový/AAFS2----1A---- společnosti/společnost/NNFS2-----A---- ,/,/Z:------------- která/který/P4FS1---------- má/mít/VB-S---3P-AAI-- své/svůj/P8IP4---------1 pseudodůvody/pseudodůvod/NNIP4-----A---- a/a/J^-------------;předsudky/předsudek/NNIP4-----A---- ,/,/Z:------------- na/na/RR--6---------- základě/základ/NNIS6-----A---- kterých/který/P4IP2---------- se/se/P7--4---------- k/k/RR--3---------- nim/oni/P5IP3--3------- nechová/chovat/VB-S---3P-NAI--;vždy/vždy/Db------------- přátelsky/přátelsky/Dg-------1A---- ././Z:-------------;3;NMG: publicistika
10;Tato/tento/PDFS1---------- otevřenost/otevřenost/NNFS1-----A---- nevyhnutelně/nevyhnutelně/Dg-------1A---- posílila/posílit/VpFS----R-AAP-- obavy/obava/NNFP4-----A---- veřejnosti/veřejnost/NNFS2-----A---- z/z/RR--2---------- nákazy/nákaza/NNFS2-----A---- i/i/J^-------------;předsudky/předsudek/NNIP4-----A---- ,/,/Z:------------- které/který/P4IP4---------- mnozí/mnohý/AAMP1----1A---- lidé/člověk/NNMP1-----A---- chovají/chovat/VB-P---3P-AAI--;k/k/RR--3---------- příslušníkům/příslušník/NNMP3-----A---- rizikových/rizikový/AAFP2----1A---- skupin/skupina/NNFP2-----A---- ././Z:-------------;3;NFC: oborová literatura
11;Děti/dítě/NNFP1-----A---- nemají/mít/VB-P---3P-NAI--;předsudky/předsudek/NNIP4-----A---- a/a/J^------------- v/v/RR--6---------- jistém/jistý/AAIS6----1A---- smyslu/smysl/NNIS6-----A---- se/se/P7--4---------- nacházejí/nacházet/VB-P---3P-AAI-- v/v/RR--6---------- primitivním/primitivní/AANS6----1A---- stadiu/stadium/NNNS6-----A---- vývoje/vývoj/NNIS2-----A---- ,/,/Z:------------- chovají/chovat/VB-P---3P-AAI--;se/se/P7--4---------- až/až/TT------------- jakýmsi/jakýsi/PZIS7---------- prvotním/prvotní/AAIS7----1A---- způsobem/způsob/NNIS7-----A---- ././Z:-------------;0;NMG: publicistika
12;Důležité/důležitý/AANS1----1A---- je/být/VB-S---3P-AAI-- ,/,/Z:------------- z/z/RR--2---------- jaké/jaký/P4FS2---------- blízkosti/blízkost/NNFS2-----A---- tak/tak/Db------------- činíme/činit/VB-P---1P-AAI-- ,/,/Z:------------- kolik/kolik/Ca--4---------- informací/informace/NNFP2-----A---- máme/mít/VB-P---1P-AAI-- a/a/J^------------- jaké/jaký/P4IP4----------;předsudky/předsudek/NNIP4-----A---- v/v/RR--6---------- sobě/se/P6--6---------- chováme/chovat/VB-P---1P-AAI--;././Z:-------------;1;NMG: publicistika
13;Stejně/stejně/Dg-------1A---- jako/jako/J,------------- tehdy/tehdy/Db------------- jim/oni/PPMP3--3------- v/v/RR--6---------- uskutečnění/uskutečnění/NNNS6-----A---- tohoto/tento/PDIS2---------- snu/sen/NNIS2-----A---- brání/bránit/VB-S---3P-AAI-- Ruml/Ruml/NNMS1-----A---- ,/,/Z:------------- který/který/P4MS1---------- se/se/P7--4---------- nepoučil/poučit/VpMS----R-NAP-- a/a/J^------------- stále/stále/Dg-------1A---- není/být/VB-S---3P-NAI-- schopen/schopný/ACMS------A---- překročit/překročit/Vf--------A-P-- svůj/svůj/P8IS4---------- stín/stín/NNIS4-----A---- ,/,/Z:------------- odložit/odložit/Vf--------A-P-- ideologické/ideologický/AAIP4----1A----;předsudky/předsudek/NNIP4-----A---- a/a/J^------------- začít/začít/Vf--------A-P-- se/se/P7--4---------- chovat/chovat/Vf--------A-I--;jako/jako/J,------------- politik/politik/NNMS1-----A---- schopný/schopný/AAMS1----1A---- kompromisů/kompromis/NNIP2-----A---- ././Z:-------------;0;NMG: publicistika
14;Na/na/RR--4----------;předsudky/předsudek/NNIP4-----A---- útočí/útočit/VB-S---3P-AAI-- s/s/RR--7---------- podobnou/podobný/AAFS7----1A---- vervou/verva/NNFS7-----A---- jako/jako/J,------------- jeden/jeden/ClMS1---------- z/z/RR--2---------- umělců/umělec/NNMP2-----A---- ,/,/Z:------------- který/který/P4MS1---------- ve/v/RV--6---------- snímku/snímek/NNIS6-----A---- vtrhne/vtrhnout/VB-S---3P-AAP-- na/na/RR--4---------- snobský/snobský/AAIS4----1A---- večírek/večírek/NNIS4-----A---- svlečený/svlečený/AAIS4----1A---- do/do/RR--2---------- půl/půl/CyFS2---------1 těla/tělo/NNNS2-----A---- a/a/J^------------- chová/chovat/VB-S---3P-AAI--;se/se/P7--4---------- jako/jako/J,------------- opičák/opičák/NNMS1-----A---- ././Z:-------------;0;NMG: publicistika
15;"""/""/Z:------------- Budu/být/VB-S---1F-AAI-- se/se/P7--4---------- snažit/snažit/Vf--------A-I-- překonat/překonat/Vf--------A-P--";předsudky/předsudek/NNIP4-----A---- mnohých/mnohý/AAMP2----1A---- kolegů/kolega/NNMP2-----A---- v/v/RR--6---------- branži/branže/NNFS6-----A---- ,/,/Z:------------- kteří/který/P4MP1---------- se/se/P7--4---------- ke/k/RV--3---------- mně/já/PP-S3--1------- chovají/chovat/VB-P---3P-AAI--;"nedůvěřivě/důvěřivě/Dg-------1N---- ,/,/Z:------------- protože/protože/J,------------- nemohu/moci/VB-S---1P-NAI-1 vystupovat/vystupovat/Vf--------A-I-- tak/tak/Db------------- operativně/operativně/Dg-------1A---- ,/,/Z:------------- ""/""/Z:------------- říká/říkat/VB-S---3P-AAI-- Bohuslav/Bohuslav/NNMS1-----A---- Dohelský/Dohelský/NNMS1-----A---- ././Z:-------------";0;NMG: publicistika
16;Většina/většina/NNFS1-----A---- z/z/RR--2---------- nás/my/PP-P2--1------- má/mít/VB-S---3P-AAI-- podezření/podezření/NNNS4-----A---- ,/,/Z:------------- a/a/J^------------- někteří/některý/PZMP1---------- přímo/přímo/Dg-------1A----;předsudek/předsudek/NNIS4-----A---- ,/,/Z:------------- že/že/J,------------- politici/politik/NNMP1-----A---- se/se/P7--4---------- chovají/chovat/VB-P---3P-AAI--;jako/jako/J,------------- slušní/slušný/AAMP1----1A---- lidé/člověk/NNMP1-----A---- jen/jen/Db------------- do/do/RR--2---------- chvíle/chvíle/NNFS2-----A---- ,/,/Z:------------- dokud/dokud/J,------------- nedosáhnou/dosáhnout/VB-P---3P-NAP-- na/na/RR--4---------- moc/moc/NNFS4-----A---- ././Z:-------------;0;NMG: publicistika
17;"Když/když/J,------------- ho/on/PHMS4--3------- Bertie/Bertie/NNMS1-----A---- přemlouval/přemlouvat/VpMS----R-AAI-- ,/,/Z:------------- aby/aby|být/J,-------------|Vc----------I-- se/se/P7--4---------- ujal/ujmout/VpMS----R-AAP-- role/role/NNFS2-----A---- ""/""/Z:------------- křena/křen/NNMS2-----A---- ""/""/Z:------------- ,/,/Z:------------- nebylo/být/VpNS----R-NAI-- mu/on/PHMS3--3------- to/ten/PDNS1---------- pochuti/pochuti/X@------------- ,/,/Z:------------- ale/ale/J^------------- teď/teď/Db------------- odhodil/odhodit/VpMS----R-AAP--";předsudky/předsudek/NNIP4-----A---- a/a/J^------------- rozhodl/rozhodnout/VpMS----R-AAP-1 se/se/P7--4---------- chovat/chovat/Vf--------A-I--;jako/jako/J,------------- příjemný/příjemný/AAMS1----1A---- společník/společník/NNMS1-----A---- ././Z:-------------;0;FIC: beletrie
18;Publikace/publikace/NNFS1-----A---- je/být/VB-S---3P-AAI-- součástí/součást/NNFS7-----A---- kampaně/kampaň/NNFS2-----A---- Českého/český/AANS2----1A---- paralympijského/paralympijský/AANS2----1A---- hnutí/hnutí/NNNS2-----A---- a/a/J^------------- jejím/její/PSIS7FS3------- smyslem/smysl/NNIS7-----A---- je/být/VB-S---3P-AAI-- změnit/změnit/Vf--------A-P-- obecně/obecně/Dg-------1A---- panující/panující/AGIS4-----A----;předsudek/předsudek/NNIS4-----A---- ,/,/Z:------------- že/že/J,------------- k/k/RR--3---------- postiženým/postižený/AAMP3----1A---- lidem/člověk/NNMP3-----A---- je/být/VB-S---3P-AAI-- třeba/třeba/Db------------- se/se/P7--4---------- chovat/chovat/Vf--------A-I--;s/s/RR--7---------- lítostí/lítost/NNFS7-----A---- a/a/J^------------- soucitem/soucit/NNIS7-----A---- ././Z:-------------;0;NMG: publicistika
19;Lidé/člověk/NNMP1-----A---- mají/mít/VB-P---3P-AAI-- zbytečné/zbytečný/AAIP4----1A----;"předsudky/předsudek/NNIP4-----A---- ,/,/Z:------------- ""/""/Z:------------- říká/říkat/VB-S---3P-AAI-- Yvona/Yvona/NNFS1-----A---- Richterová/Richterová/NNFS1-----A---- z/z/RR--2---------- Prostějova/Prostějov/NNIS2-----A---- ,/,/Z:------------- která/který/P4FS1---------- ve/v/RV--6---------- svém/svůj/P8IS6---------- bytě/byt/NNIS6-----A---- chová/chovat/VB-S---3P-AAI--";tři/tři/ClFP4---------- desítky/desítka/NNFP4-----A---- potkanů/potkan/NNMP2-----A---- ././Z:-------------;0;NMG: publicistika
20;Pokud/pokud/J,------------- někdo/někdo/PZM-1---------- vyrábí/vyrábět/VB-S---3P-AAI-- falešný/falešný/AAIS4----1A---- vzkaz/vzkaz/NNIS4-----A---- na/na/RR--4---------- rozloučenou/rozloučená/NNFS4-----A---- ,/,/Z:------------- většinou/většinou/Db------------- do/do/RR--2---------- něj/on/P5MS2--3------- automaticky/automaticky/Dg-------1A---- vkládá/vkládat/VB-S---3P-AAI--;předsudky/předsudek/NNIP4-----A---- ,/,/Z:------------- které/který/P4IP4---------- společnost/společnost/NNFS1-----A---- k/k/RR--3---------- suicidantům/suicidantům/X@------------- chová/chovat/VB-S---3P-AAI--;././Z:-------------;3;NMG: publicistika
21;Přitom/přitom/Db------------- vyvrací/vyvracet/VB-S---3P-AAI-- mnohé/mnohý/AAIP4----1A----;předsudky/předsudek/NNIP4-----A---- a/a/J^------------- klamné/klamný/AAFP4----1A---- představy/představa/NNFP4-----A---- ,/,/Z:------------- které/který/P4FP4---------- lidé/člověk/NNMP1-----A---- o/o/RR--6---------- svých/svůj/P8MP6---------- spoluobyvatelích/spoluobyvatel/NNMP6-----A---- na/na/RR--6---------- této/tento/PDFS6---------- planetě/planeta/NNFS6-----A---- chovají/chovat/VB-P---3P-AAI--;././Z:-------------;3;NMG: publicistika
22;Na/na/RR--6---------- základě/základ/NNIS6-----A---- poznatků/poznatek/NNIP2-----A---- vědy/věda/NNFS2-----A---- srozumitelně/srozumitelně/Dg-------1A---- vysvětluje/vysvětlovat/VB-S---3P-AAI-- ,/,/Z:------------- jak/jak/Db------------- funguje/fungovat/VB-S---3P-AAI-- lidská/lidský/AAFS1----1A---- mysl/mysl/NNFS1-----A---- ,/,/Z:------------- jak/jak/Db------------- překvapivě/překvapivě/Dg-------1A---- snadno/snadno/Dg-------1A---- je/být/VB-S---3P-AAI-- ovlivnitelná/ovlivnitelný/AAFS1----1A---- vnějším/vnější/AANS7----1A---- děním/dění/NNNS7-----A---- a/a/J^------------- vytváří/vytvářet/VB-S---3P-AAI-- si/se/P7--3----------;předsudky/předsudek/NNIP4-----A---- a/a/J^------------- stereotypy/stereotyp/NNIP4-----A---- ,/,/Z:------------- jak/jak/Db------------- jsme/být/VB-P---1P-AAI-- náchylní/náchylný/AAMP1----1A---- k/k/RR--3---------- tomu/ten/PDNS3---------- ,/,/Z:------------- přemýšlet/přemýšlet/Vf--------A-I-- a/a/J^------------- chovat/chovat/Vf--------A-I--;se/se/P7--4---------- v/v/RR--6---------- souladu/soulad/NNIS6-----A---- s/s/RR--7---------- tím/ten/PDNS7---------- ,/,/Z:------------- co/co/PQ--4---------- nám/my/PP-P3--1------- jiní/jiný/AAMP1----1A---- řeknou/říci/VB-P---3P-AAP-- ././Z:-------------;0;NMG: publicistika
23;Podle/podle/RR--2---------- faráře/farář/NNMS2-----A---- Jan/Jan/NNMS1-----A---- Bleši/Bleša/NNMS2-----A---- z/z/RR--2---------- kelečské/kelečský/AAFS2----1A---- farnosti/farnost/NNFS2-----A---- je/být/VB-S---3P-AAI-- Noc/noc/NNFS1-----A---- kostelů/kostel/NNIP2-----A---- příležitostí/příležitost/NNFP2-----A---- odbourat/odbourat/Vf--------A-P--;předsudky/předsudek/NNIP4-----A---- ,/,/Z:------------- které/který/P4IP4---------- část/část/NNFS1-----A---- veřejnosti/veřejnost/NNFS2-----A---- vůči/vůči/RR--3---------- církvi/církev/NNFS3-----A---- chová/chovat/VB-S---3P-AAI--;././Z:-------------;3;NMG: publicistika
24;Nový/nový/AAIS1----1A---- pořad/pořad/NNIS1-----A---- ,/,/Z:------------- s/s/RR--7---------- nímž/jenž/P9IS7---------- se/se/P7--4---------- poprvé/poprvé/Cv------------- setkáme/setkat/VB-P---1P-AAP-- dnes/dnes/Db------------- v/v/RR--4---------- 18/18/C=------------- ././Z0------------- 00/00/C=------------- hod/hod/BN------------- ././Z0------------- na/na/RR--6---------- TV/TV/BN------------- Prima/Prima/NNFS1-----A---- ,/,/Z:------------- bude/být/VB-S---3F-AAI-- vlídně/vlídně/Dg-------1A---- a/a/J^------------- s/s/RR--7---------- úsměvem/úsměv/NNIS7-----A---- rozebírat/rozebírat/Vf--------A-I-- život/život/NNIS4-----A---- ,/,/Z:------------- naše/náš/PSFP4-P1------- pověry/pověra/NNFP4-----A---- a/a/J^-------------;předsudky/předsudek/NNIP4-----A---- ,/,/Z:------------- které/který/P4IP4---------- chováme/chovat/VB-P---1P-AAI--;k/k/RR--3---------- lidem/člověk/NNMP3-----A---- jiným/jiný/AAMP3----1A---- než/než/J,------------- my/my/PP-P1--1------- ././Z:-------------;3;NMG: publicistika
25;V/v/RR--6---------- pojetí/pojetí/NNNS6-----A---- Jitky/Jitka/NNFS2-----A---- Čvančarové/Čvančarová/NNFS2-----A---- je/být/VB-S---3P-AAI-- to/ten/PDNS1---------- citlivá/citlivý/AAFS1----1A---- a/a/J^------------- nebezpečně/bezpečně/Dg-------1N---- hrdá/hrdý/AAFS1----1A---- žena/žena/NNFS1-----A---- ,/,/Z:------------- která/který/P4FS1---------- touží/toužit/VB-S---3P-AAI-- žít/žít/Vf--------A-I-- v/v/RR--6---------- pravdě/pravda/NNFS6-----A---- ,/,/Z:------------- neuznává/uznávat/VB-S---3P-NAI-- kompromisy/kompromis/NNIP4-----A---- ani/ani/J^-------------;předsudky/předsudek/NNIP4-----A---- ,/,/Z:------------- ale/ale/J^------------- v/v/RR--6---------- klíčových/klíčový/AAIP6----1A---- momentech/moment/NNIP6-----A---- se/se/P7--4---------- chová/chovat/VB-S---3P-AAI--;až/až/TT------------- paličatě/paličatě/Dg-------1A---- a/a/J^------------- sama/sám/PLFS1---------- sebe/se/P6--4---------- vhání/vhánět/VB-S---3P-AAI-- do/do/RR--2---------- bezvýchodné/bezvýchodný/AAFS2----1A---- situace/situace/NNFS2-----A---- ././Z:-------------;0;NMG: publicistika
26;Další/další/AAFS4----1A---- vrstvu/vrstva/NNFS4-----A---- filmu/film/NNIS2-----A---- představuje/představovat/VB-S---3P-AAI-- jaksi/jaksi/Db------------- čistá/čistý/AAFS1----1A---- ,/,/Z:------------- často/často/Dg-------1A---- fyzická/fyzický/AAFS1----1A---- komedie/komedie/NNFS1-----A---- ,/,/Z:------------- která/který/P4FS1---------- ve/v/RV--6---------- filmu/film/NNIS6-----A---- Můj/můj/PSMS1-S1------- vůdce/vůdce/NNMS1-----A---- .../.../Z:------------- potvrzuje/potvrzovat/VB-S---3P-AAI-- všechny/všechen/PLIP4----------;předsudky/předsudek/NNIP4-----A---- ,/,/Z:------------- jaké/jaký/P4IP4---------- o/o/RR--6---------- německém/německý/AAIS6----1A---- smyslu/smysl/NNIS6-----A---- pro/pro/RR--4---------- humor/humor/NNIS4-----A---- chová/chovat/VB-S---3P-AAI--;"neněmecký/německý/AAIS4----1N---- svět/svět/NNIS4-----A---- (/(/Z:------------- jistou/jistý/AAFS4----1A---- velmi/velmi/Db------------- mrazivou/mrazivý/AAFS4----1A---- komiku/komika/NNFS4-----A---- v/v/RR--6---------- sobě/se/P6--6---------- má/mít/VB-S---3P-AAI-- snad/snad/TT------------- jen/jen/Db------------- věta/věta/NNFS1-----A---- ""/""/Z:------------- Nesmíte/smět/VB-P---2P-NAI-- si/se/P7--3---------- to/ten/PDNS4---------- konečné/konečný/AANS4----1A---- řešení/řešení/NNNS4-----A---- brát/brát/Vf--------A-I-- moc/moc/Db------------- osobně/osobně/Dg-------1A---- ""/""/Z:------------- )/)/Z:------------- ././Z:-------------";3;NMG: publicistika
27;"Justiční/justiční/AANS1----1A---- drama/drama/NNNS1-----A---- ""/""/Z:------------- cikánské/cikánský/AAFS2----1A---- vášně/vášeň/NNFS2-----A---- ""/""/Z:------------- z/z/RR--2---------- pohledu/pohled/NNIS2-----A---- Španělů/Španěl/NNMP2-----A---- jen/jen/Db------------- potvrzuje/potvrzovat/VB-S---3P-AAI-- všechny/všechen/PLIP4----------";předsudky/předsudek/NNIP4-----A---- ,/,/Z:------------- jež/jenž/PJIP1---------- vůči/vůči/RR--3---------- Romům/Rom/NNMP3-----A---- chovají/chovat/VB-P---3P-AAI--;././Z:-------------;3;NMG: publicistika
28;Jejich/jejich/PSIS1-P3------- obraz/obraz/NNIS1-----A---- se/se/P7--4---------- v/v/RR--6---------- očích/oko/NNFP6-----A---- veřejnosti/veřejnost/NNFS2-----A---- velmi/velmi/Db------------- zplošťuje/zplošťovat/VB-S---3P-AAI-- ,/,/Z:------------- což/co/PE--1---------- posiluje/posilovat/VB-S---3P-AAI-- zažité/zažitý/AAIP4----1A----;"předsudky/předsudek/NNIP4-----A---- ,/,/Z:------------- které/který/P4IP4---------- vůči/vůči/RR--3---------- migrantům/migrant/NNMP3-----A---- nemalá/malý/AAFS1----1N---- část/část/NNFS1-----A---- „/""/Z:------------- místních/místní/AAMP2----1A---- “/""/Z:------------- chová/chovat/VB-S---3P-AAI--";././Z:-------------;3;NMG: publicistika
29;Šlo/jít/VpNS----R-AAI-- o/o/RR--4---------- přátelskou/přátelský/AAFS4----1A---- diskusi/diskuse/NNFS4-----A---- ,/,/Z:------------- během/během/RR--2---------- níž/jenž/P9FS2---------- jsme/být/VB-P---1P-AAI-- se/se/P7--4---------- shodli/shodnout/VpMP----R-AAP-1 ,/,/Z:------------- že/že/J,------------- bychom/být/Vc-P---1----I-- neměli/mít/VpMP----R-NAI-- mít/mít/Vf--------A-I--;předsudky/předsudek/NNIP4-----A---- vůči/vůči/RR--3---------- žádné/žádný/PWFS3---------- zemi/země/NNFS3-----A---- a/a/J^------------- měli/mít/VpMP----R-AAI-- bychom/být/Vc-P---1----I-- mít/mít/Vf--------A-I-- odpovídající/odpovídající/AGNS4-----A---- sebevědomí/sebevědomí/NNNS4-----A---- směrem/směr/NNIS7-----A---- k/k/RR--3---------- USA/USA/BN------------- ,/,/Z:------------- Rusku/Rusko/NNNS3-----A---- i/i/J^------------- Číně/Čína/NNFS3-----A---- a/a/J^------------- dopředu/dopředu/Db------------- nesortýrovat/sortýrovat/Vf--------N-I-- ,/,/Z:------------- kdo/kdo/PKM-1---------- je/být/VB-S---3P-AAI-- lepší/dobrý/AAMS1----2A---- a/a/J^------------- kdo/kdo/PKM-1---------- horší/špatný/AAMS1----2A---- ,/,/Z:------------- chovat/chovat/Vf--------A-I--;se/se/P7--4---------- pragmaticky/pragmaticky/Dg-------1A---- ././Z:-------------;0;NMG: publicistika
30;Lidem/člověk/NNMP3-----A---- často/často/Dg-------1A---- vadí/vadit/VB-P---3P-AAI-- a/a/J^------------- mají/mít/VB-P---3P-AAI-- vůči/vůči/RR--3---------- nim/oni/P5MP3--3------- různé/různý/AAIP4----1A----;předsudky/předsudek/NNIP4-----A---- ,/,/Z:------------- i/i/J^------------- když/když/J,------------- se/se/P7--4---------- nechovají/chovat/VB-P---3P-NAI--;nijak/nijak/Db------------- nepřátelsky/přátelsky/Dg-------1N---- ././Z:-------------;0;NMG: publicistika
