id;left;kwic;right
"24";"Jednotlivé/jednotlivý/AAIP1----1A---- paragrafy/paragraf/NNIP1-----A---- se/se/P7--4---------- týkaly/týkat/VpIP----R-AAI-- jednoty/jednota/NNFS2-----A---- řádu/řád/NNIS2-----A---- ,/,/Z:------------- opravdové/opravdový/AAFS2----1A---- věrnosti/věrnost/NNFS2-----A---- bratří/bratr/NNMP2-----A---1 ,/,/Z:------------- kteří/který/P4MP1---------- měli/mít/VpMP----R-AAI-- toužit/toužit/Vf--------A-I-- po/po/RR--6---------- dosažení/dosažení/NNNS6-----A---- dokonalosti/dokonalost/NNFS2-----A---- ,/,/Z:------------- jednat/jednat/Vf--------A-I-- ve/v/RV--6---------- jménu/jméno/NNNS6-----A---1 lidskosti/lidskost/NNFS2-----A---- a/a/J^------------- spravedlnosti/spravedlnost/NNFS2-----A---- ,/,/Z:------------- podílet/podílet/Vf--------A-I-- se/se/P7--4---------- na/na/RR--6---------- podpoře/podpora/NNFS6-----A---- šíření/šíření/NNNS2-----A---- věd/věda/NNFP2-----A---- a/a/J^------------- umění/umění/NNNS2-----A---- ,/,/Z:-------------";"chovat/chovat/Vf--------A-I-- se/se/P7--4---------- střídmě/střídmě/Dg-------1A---- a/a/J^------------- hospodárně/hospodárně/Dg-------1A---- ,/,/Z:------------- být/být/Vf--------A-I-- spokojeni/spokojený/ACMP------A---- se/s/RV--7---------- svým/svůj/P8IS7---------- údělem/úděl/NNIS7-----A---- ,/,/Z:------------- být/být/Vf--------A-I-- ohleduplní/ohleduplný/AAMP1----1A---- vůči/vůči/RR--3---------- starým/starý/AAMP3----1A---- lidem/člověk/NNMP3-----A---- ,/,/Z:------------- nadřízeným/nadřízený/AAMP3----1A---- a/a/J^------------- státním/státní/AAMP3----1A---- úředníkům/úředník/NNMP3-----A---- ,/,/Z:------------- pěstovat/pěstovat/Vf--------A-I-- přátelství/přátelství/NNNS4-----A----";"a/a/J^------------- lásku/láska/NNFS4-----A---- mezi/mezi/RR--7---------- bratry/bratr/NNMP7-----A---- ,/,/Z:------------- žít/žít/Vf--------A-I-- v/v/RR--6---------- srdečných/srdečný/AAIP6----1A---- a/a/J^------------- láskyplných/láskyplný/AAIP6----1A---- vztazích/vztah/NNIP6-----A---- se/s/RV--7---------- všemi/všechen/PLMP7---------- lidmi/člověk/NNMP7-----A---- ,/,/Z:------------- být/být/Vf--------A-I-- snaživí/snaživý/AAMP1----1A---- a/a/J^------------- pracovití/pracovitý/AAMP1----1A---- ,/,/Z:------------- plnit/plnit/Vf--------A-I-- řádně/řádně/Dg-------1A---- otcovské/otcovský/AAFP4----1A---- povinnosti/povinnost/NNFP4-----A---- i/i/J^------------- povinnosti/povinnost/NNFP4-----A---- vyplývající/vyplývající/AGFP4-----A---- z/z/RR--2---------- jejich/jejich/PSNS2-P3------- společenského/společenský/AANS2----1A---- postavení/postavení/NNNS2-----A---- a/a/J^------------- funkcí/funkce/NNFP2-----A---- ././Z:-------------"
"25";"Vždycky/vždy/Db------------- mě/já/PH-S4--1------- s/s/RR--7---------- radostí/radost/NNFS7-----A---- vítala/vítat/VpFS----R-AAI-- ,/,/Z:------------- a/a/J^------------- já/já/PP-S1--1------- začal/začít/VpMS----R-AAP-- pomalu/pomalu/Dg-------1A---- chápat/chápat/Vf--------A-I-- ,/,/Z:------------- že/že/J,------------- i/i/J^------------- ona/on/PPFS1--3------- je/být/VB-S---3P-AAI-- osamělá/osamělý/AAFS1----1A---- ;/;/Z:------------- přestože/přestože/J,------------- se/se/P7--4---------- k/k/RR--3---------- ní/on/P5FS3--3------- ostatní/ostatní/AAMP1----1A---- studenti/student/NNMP1-----A---- a/a/J^------------- učitelé/učitel/NNMP1-----A----";"chovali/chovat/VpMP----R-AAI-- s/s/RR--7---------- úctou/úcta/NNFS7-----A---- a/a/J^------------- vřelostí/vřelost/NNFS7-----A---- a/a/J^------------- neustále/neustále/Dg-------1A---- mluvili/mluvit/VpMP----R-AAI-- o/o/RR--6---------- tom/ten/PDNS6---------- ,/,/Z:------------- jakým/jaký/P4IS7---------- je/být/VB-S---3P-AAI-- její/její/PSFS1FS3------- práce/práce/NNFS1-----A---- pro/pro/RR--4---------- fakultu/fakulta/NNFS4-----A---- cizích/cizí/AAIP2----1A---- jazyků/jazyk/NNIP2-----A---- přínosem/přínos/NNIS7-----A---- ,/,/Z:------------- nikdo/nikdo/PWM-1---------- se/se/P7--4---------- neodvážil/odvážit/VpMS----R-NAP-- navázat/navázat/Vf--------A-P-- s/s/RR--7---------- ní/on/P5FS7--3------- opravdové/opravdový/AANS4----1A---- přátelství/přátelství/NNNS4-----A----";"././Z:-------------"
"26";"To/ten/PDNS1---------- nám/my/PP-P3--1------- umožňovalo/umožňovat/VpNS----R-AAI--";"chovat/chovat/Vf--------A-I-- se/se/P7--4---------- navzájem/navzájem/Db------------- jinak/jinak/Db------------- ,/,/Z:------------- než/než/J,------------- jsme/být/VB-P---1P-AAI-- byli/být/VpMP----R-AAI-- zvyklí/zvyklý/AAMP1----1A---- ,/,/Z:------------- a/a/J^------------- bezpochyby/bezpochyby/Db------------- to/ten/PDNS1---------- příznivě/příznivě/Dg-------1A---- ovlivnilo/ovlivnit/VpNS----R-AAP-- ovzduší/ovzduší/NNNS4-----A---- úcty/úcta/NNFS2-----A---- a/a/J^------------- přátelství/přátelství/NNNS4-----A----";",/,/Z:------------- ve/v/RV--6---------- kterém/který/P4NS6---------- jsme/být/VB-P---1P-AAI-- žili/žít/VpMP----R-AAI-- ././Z:-------------"
"27";"Začala/začít/VpFS----R-AAP-- se/se/P7--4----------";"chovat/chovat/Vf--------A-I-- protivně/protivně/Dg-------1A---- ,/,/Z:------------- což/co/PE--1---------- znemožňovalo/znemožňovat/VpNS----R-AAI-- navazovat/navazovat/Vf--------A-I-- přátelství/přátelství/NNNS4-----A----";"jak/jak/Db------------- s/s/RR--7---------- muži/muž/NNMP7-----A---- ,/,/Z:------------- tak/tak/J^------------- se/s/RV--7---------- ženami/žena/NNFP7-----A---- ././Z:-------------"
"28";"Tato/tento/PDFS1---------- země/země/NNFS1-----A---- je/být/VB-S---3P-AAI-- jeho/jeho/PSFS7-S3------- první/první/CrFS7---------- zastávkou/zastávka/NNFS7-----A---- na/na/RR--6---------- cestě/cesta/NNFS6-----A---- po/po/RR--6---------- třech/tři/ClIP6---------- anglofonních/anglofonní/AAIP6----1A---- karibských/karibský/AAIP6----1A---- státech/stát/NNIP6-----A---- ,/,/Z:------------- které/který/P4IP1---------- v/v/RR--6---------- minulosti/minulost/NNFS6-----A---- ke/k/RV--3---------- komunistickému/komunistický/AAIS3----1A---- režimu/režim/NNIS3-----A---- v/v/RR--6---------- Havaně/Havana/NNFS6-----A----";"nechovaly/chovat/VpIP----R-NAI-- přátelství/přátelství/NNNS4-----A----";"././Z:-------------"
"29";"";"Choval/chovat/VpMS----R-AAI-- se/se/P7--4---------- tam/tam/Db------------- tak/tak/Db------------- ,/,/Z:------------- že/že/J,------------- si/se/P7--3---------- získal/získat/VpMS----R-AAP-- přátelství/přátelství/NNNS4-----A----";"všech/všechen/PLMP2---------- ././Z:-------------"
"30";"Věra/Věra/NNFS1-----A---- jí/on/PPFS3--3------- dovolila/dovolit/VpFS----R-AAP-- ,/,/Z:------------- aby/aby|být/J,-------------|Vc----------I-- na/na/RR--4---------- chvíli/chvíle/NNFS4-----A---- podržela/podržet/VpFS----R-AAP-- v/v/RR--6---------- rukou/ruka/NNFP6-----A---- odlitek/odlitek/NNIS4-----A---- Ortenovy/Ortenův/AUFS2M--------- posmrtné/posmrtný/AAFS2----1A---- masky/maska/NNFS2-----A---- ,/,/Z:------------- který/který/P4IS4---------- navzdory/navzdory/RR--3---------- všemu/všechen/PLNS3----------";"chovala/chovat/VpFS----R-AAI-- ve/v/RV--6---------- vitríně/vitrína/NNFS6-----A---- ,/,/Z:------------- slíbily/slíbit/VpFP----R-AAP-- si/se/P7--3---------- přátelství/přátelství/NNNS4-----A----";",/,/Z:------------- nebylo/být/VpNS----R-NAI-- proč/proč/Db------------- na/na/RR--4---------- sebe/se/P6--4---------- žárlit/žárlit/Vf--------A-I-- ././Z:-------------"
"31";"Rebeka/Rebeka/NNFS1-----A---- se/se/P7--4---------- k/k/RR--3---------- němu/on/P5MS3--3------- zpočátku/zpočátku/Db-------------";"chová/chovat/VB-S---3P-AAI-- nevraživě/nevraživě/Dg-------1A---- ,/,/Z:------------- její/její/PSIP1FS3------- pocity/pocit/NNIP1-----A---- se/se/P7--4---------- však/však/J^------------- postupně/postupně/Dg-------1A---- mění/měnit/VB-P---3P-AAI-- v/v/RR--4---------- přátelství/přátelství/NNNS4-----A----";"-/-/Z:------------- a/a/J^------------- časem/čas/NNIS7-----A---- přerostou/přerůst/VB-P---3P-AAP-- v/v/RR--4---------- cosi/cosi/PZ--4---------- ještě/ještě/Db------------- hlubšího/hluboký/AANS2----2A---- ././Z:-------------"
"32";"Francie/Francie/NNFS1-----A---- a/a/J^------------- já/já/PP-S1--1------- k/k/RR--3---------- nim/oni/P5MP3--3-------";"chováme/chovat/VB-P---1P-AAI-- úctu/úcta/NNFS4-----A---- a/a/J^------------- přátelství/přátelství/NNNS4-----A----";"././Z:-------------"
"33";"Vždy/vždy/Db------------- se/se/P7--4----------";"chovali/chovat/VpMP----R-AAI-- přívětivě/přívětivě/Dg-------1A---- a/a/J^------------- fotografování/fotografování/NNNS1-----A---- nakonec/nakonec/TT------------- přerostlo/přerůst/VpNS----R-AAP-- v/v/RR--4---------- okouzlující/okouzlující/AAFP4----1A---- návštěvy/návštěva/NNFP4-----A---- a/a/J^------------- u/u/RR--2---------- mnohých/mnohý/AAMP2----1A---- i/i/J^------------- v/v/RR--4---------- letité/letitý/AANS4----1A---- přátelství/přátelství/NNNS4-----A----";"././Z:------------- ""/""/Z:-------------"
"34";"Ujišťují/ujišťovat/VB-P---3P-AAI-- však/však/J^------------- ,/,/Z:------------- že/že/J,------------- k/k/RR--3---------- sobě/se/P6--3---------- dál/dál/Db-------------";"chovají/chovat/VB-P---3P-AAI-- hluboký/hluboký/AAIS4----1A---- respekt/respekt/NNIS4-----A---- a/a/J^------------- přátelství/přátelství/NNNS4-----A----";"a/a/J^------------- společně/společně/Dg-------1A---- chtějí/chtít/VB-P---3P-AAI-- vytvořit/vytvořit/Vf--------A-P-- prostředí/prostředí/NNNS4-----A---- ,/,/Z:------------- v/v/RR--6---------- němž/jenž/P9NS6---------- budou/být/VB-P---3F-AAI-- spokojeně/spokojeně/Dg-------1A---- vyrůstat/vyrůstat/Vf--------A-I-- jejich/jejich/PSMP1-P3------- dva/dva/ClMP1---------- synové/syn/NNMP1-----A---- ././Z:-------------"
"35";"Československý/československý/AAIS1----1A---- lid/lid/NNIS1-----A----";"chová/chovat/VB-S---3P-AAI-- vřelé/vřelý/AAFP4----1A---- sympatie/sympatie/NNFP4-----A---- a/a/J^------------- přátelství/přátelství/NNNS4-----A----";"k/k/RR--3---------- iráckému/irácký/AAIS3----1A---- lidu/lid/NNIS3-----A---- ,/,/Z:------------- jeho/jeho/PSFS3-S3------- revoluční/revoluční/AAFS3----1A---- vládě/vláda/NNFS3-----A---- a/a/J^------------- k/k/RR--3---------- panu/pán/NNMS3-----A---1 prezidentu/prezident/NNMS3-----A---1 Bakrovi/Baker/NNMS3-----A---- ,/,/Z:------------- “/""/Z:------------- řekl/říci/VpMS----R-AAP-- Husák/Husák/NNMS1-----A---- ././Z:-------------"
"36";"Cílem/cíl/NNIS7-----A---- všeho/všechen/PLNS2---------- je/být/VB-S---3P-AAI-- pokusit/pokusit/Vf--------A-P-- se/se/P7--4---------- najít/najít/Vf--------A-P-- s/s/RR--7---------- Němci/Němec/NNMP7-----A---- ,/,/Z:------------- kteří/který/P4MP1---------- vyvraždili/vyvraždit/VpMP----R-AAP-- desetinu/desetina/CyFS4---------- Poláků/Polák/NNMP2-----A---- ,/,/Z:------------- srovnali/srovnat/VpMP----R-AAP-- se/s/RV--7---------- zemí/země/NNFS7-----A---- Varšavu/Varšava/NNFS4-----A---- a/a/J^------------- vůbec/vůbec/TT------------- se/se/P7--4----------";"chovali/chovat/VpMP----R-AAI-- tak/tak/Db------------- ,/,/Z:------------- jak/jak/Db------------- to/ten/PDNS4---------- Češi/Čech/NNMP1-----A---- za/za/RR--2---------- války/válka/NNFS2-----A---- s/s/RR--7---------- výjimkou/výjimka/NNFS7-----A---- heydrichiády/heydrichiáda/NNFS2-----A---- nezažili/zažít/VpMP----R-NAP-- ,/,/Z:------------- nejen/nejen/Db------------- smíření/smíření/NNNS4-----A---- ,/,/Z:------------- ale/ale/J^------------- přátelství/přátelství/NNNS4-----A----";"a/a/J^------------- spojenectví/spojenectví/NNNS4-----A---- ././Z:-------------"
"37";"Myslím/myslet/VB-S---1P-AAI-- si/se/P7--3---------- ,/,/Z:------------- že/že/J,------------- pokud/pokud/J,------------- se/se/P7--4---------- k/k/RR--3---------- tobě/ty/PP-S3--2------- někdo/někdo/PZM-1----------";"chová/chovat/VB-S---3P-AAI-- tak/tak/Db------------- bezohledně/bezohledně/Dg-------1A---- ,/,/Z:------------- tak/tak/J^------------- si/se/P7--3---------- tvoje/tvůj/PSNS1-S2------- přátelství/přátelství/NNNS4-----A----";"vůbec/vůbec/TT------------- nezaslouží/zasloužit/VB-S---3P-NAP-- ././Z:-------------"
"38";"V/v/RR--6---------- tamním/tamní/AAIS6----1A---- bufetu/bufet/NNIS6-----A---1 o/o/RR--6---------- přestávce/přestávka/NNFS6-----A---- natáčení/natáčení/NNNS2-----A---- se/se/P7--4---------- oba/oba/ClMP1---------- k/k/RR--3---------- sobě/se/P6--3----------";"chovali/chovat/VpMP----R-AAI-- důvěrně/důvěrně/Dg-------1A---- a/a/J^------------- bylo/být/VpNS----R-AAI-- jasné/jasný/AANS1----1A---- ,/,/Z:------------- že/že/J,------------- jde/jít/VB-S---3P-AAI-- o/o/RR--4---------- více/hodně/Dg-------2A---- než/než/J,------------- přátelství/přátelství/NNNS4-----A----";"././Z:-------------"
"39";"Z/z/RR--2---------- toho/ten/PDNS2---------- plyne/plynout/VB-S---3P-AAI-- ,/,/Z:------------- že/že/J,------------- první/první/CrMS1---------- zesnulý/zesnulý/AAMS1----1A---- byl/být/VpMS----R-AAI-- laskavý/laskavý/AAMS1----1A---- člověk/člověk/NNMS1-----A---- ,/,/Z:------------- ke/k/RV--3---------- kterému/který/P4MS3---------- mnoho/mnoho/Ca--1---------- lidí/člověk/NNMP2-----A----";"chovalo/chovat/VpNS----R-AAI-- náklonnost/náklonnost/NNFS4-----A---- a/a/J^------------- přátelství/přátelství/NNNS4-----A----";",/,/Z:------------- a/a/J^------------- proto/proto/J^------------- přišel/přijít/VpMS----R-AAP-- určitě/určitě/TT------------- do/do/RR--2---------- nebe/nebe/NNNS2-----A---- ././Z:-------------"
"40";"Jaroslav/Jaroslav/NNMS1-----A---- Skála/Skála/NNMS1-----A---- k/k/RR--3---------- nim/oni/P5MP3--3------- nepřestal/přestat/VpMS----R-NAP--";"chovat/chovat/Vf--------A-I-- úctu/úcta/NNFS4-----A---- a/a/J^------------- s/s/RR--7---------- mnohými/mnohý/AAMP7----1A---- uzavřel/uzavřít/VpMS----R-AAP-- vzácná/vzácný/AANP4----1A---- přátelství/přátelství/NNNP4-----A----";"././Z:-------------"
"41";"Obě/oba/ClFP1---------- reprezentace/reprezentace/NNFP1-----A---- se/se/P7--4---------- k/k/RR--3---------- sobě/se/P6--3---------- na/na/RR--6---------- žíněnce/žíněnka/NNFS6-----A----";"chovaly/chovat/VpFP----R-AAI-- vzorně/vzorně/Dg-------1A---- a/a/J^------------- po/po/RR--6---------- každém/každý/PLNS6---------- měření/měření/NNNS6-----A---- sil/síla/NNFP2-----A---- si/se/P7--3---------- daly/dát/VpFP----R-AAP-- najevo/najevo/Db------------- vzájemný/vzájemný/AAIS4----1A---- respekt/respekt/NNIS4-----A---- a/a/J^------------- přátelství/přátelství/NNNS4-----A----";"././Z:-------------"
"42";"Havlův/Havlův/AUMS1M--------- životopisec/životopisec/NNMS1-----A---- Michael/Michael/NNMS1-----A---- Žantovský/Žantovský/NNMS1-----A---- v/v/RR--6---------- této/tento/PDFS6---------- souvislosti/souvislost/NNFS6-----A---- napsal/napsat/VpMS----R-AAP-- :/:/Z:------------- „/""/Z:------------- Mnoho/mnoho/Ca--1---------- lidí/člověk/NNMP2-----A---- ,/,/Z:------------- včetně/včetně/RR--2---------- leckterých/leckterý/PZMP2---------- ,/,/Z:------------- kteří/který/P4MP1----------";"nechovali/chovat/VpMP----R-NAI-- k/k/RR--3---------- režimu/režim/NNIS3-----A---- žádné/žádný/PWNS4---------- přátelství/přátelství/NNNS4-----A----";",/,/Z:------------- odpuzovalo/odpuzovat/VpNS----R-AAI-- to/ten/PDNS1---------- ,/,/Z:------------- jak/jak/Db------------- Plastici/plastik/NNMP1-----A---- vypadali/vypadat/VpMP----R-AAI-- a/a/J^------------- jak/jak/Db------------- hráli/hrát/VpMP----R-AAI-- ,/,/Z:------------- a/a/J^------------- nikdy/nikdy/Db------------- nepochopilo/pochopit/VpNS----R-NAP-- ,/,/Z:------------- proč/proč/Db------------- někdo/někdo/PZM-1---------- jako/jako/J,------------- Havel/Havel/NNMS1-----A---- ztrácí/ztrácet/VB-S---3P-AAI-- čas/čas/NNIS4-----A---- s/s/RR--7---------- takovými/takový/PDMP7---------- budižkničemy/budižkničemu/NNMP7-----A---- ././Z:------------- “/""/Z:-------------"
"43";"„/""/Z:------------- Pokud/pokud/J,------------- se/se/P7--4---------- otec/otec/NNMS1-----A----";"chová/chovat/VB-S---3P-AAI-- jako/jako/J,------------- pozorovatel/pozorovatel/NNMS1-----A---- a/a/J^------------- ujímá/ujímat/VB-S---3P-AAI-- se/se/P7--4---------- funkce/funkce/NNFS2-----A---- kameramana/kameraman/NNMS2-----A---- a/a/J^------------- fotografa/fotograf/NNMS2-----A---- v/v/RR--6---------- jedné/jeden/ClFS6---------- osobě/osoba/NNFS6-----A---- ,/,/Z:------------- může/moci/VB-S---3P-AAI-- být/být/Vf--------A-I-- rodící/rodící/AGFS7-----A---- ženou/žena/NNFS7-----A---- ,/,/Z:------------- která/který/P4FS1---------- potřebuje/potřebovat/VB-S---3P-AAI-- být/být/Vf--------A-I-- ve/v/RV--6---------- svém/svůj/P8IS6---------- vlastním/vlastní/AAIS6----1A---- světě/svět/NNIS6-----A---- ,/,/Z:------------- kde/kde/Db------------- nemusí/muset/VB-S---3P-NAI-- mluvit/mluvit/Vf--------A-I-- ani/ani/J^------------- myslet/myslet/Vf--------A-I-- ,/,/Z:------------- vnímán/vnímat/VsMS------API-- velmi/velmi/Db------------- negativně/negativně/Dg-------1A---- ,/,/Z:------------- “/""/Z:------------- prohlásil/prohlásit/VpMS----R-AAP-- Odent/Odent/X@------------- a/a/J^------------- ještě/ještě/Db------------- dodal/dodat/VpMS----R-AAP-- :/:/Z:------------- „/""/Z:------------- Porod/porod/NNIS1-----A---- může/moci/VB-S---3P-AAI-- posílit/posílit/Vf--------A-P-- přátelství/přátelství/NNNS4-----A----";"mezi/mezi/RR--7---------- mužem/muž/NNMS7-----A---- a/a/J^------------- ženou/žena/NNFS7-----A---- ,/,/Z:------------- ale/ale/J^------------- zároveň/zároveň/Db------------- může/moci/VB-S---3P-AAI-- zcela/zcela/Db------------- ochromit/ochromit/Vf--------A-P-- jejich/jejich/PSIS4-P3------- sexuální/sexuální/AAIS4----1A---- vztah/vztah/NNIS4-----A---- ././Z:------------- “/""/Z:-------------"
"44";"V/v/RR--6---------- tom/ten/PDNS6---------- jsem/být/VB-S---1P-AAI-- dost/dost/Dg-------1A---- tolerantní/tolerantní/AAMS1----1A---- ././Z0------------- (/(/Z:------------- snaží/snažit/VB-S---3P-AAI-- se/se/P7--4---------- zachovat/zachovat/Vf--------A-P-- vážnou/vážný/AAFS4----1A---- tvář/tvář/NNFS4-----A---- )/)/Z:------------- Martha/Marta/NNFS1-----A---- :/:/Z:------------- Já/já/PP-S1--1------- tedy/tedy/TT------------- k/k/RR--3---------- Jirkovi/Jirka/NNMS3-----A----";"chovám/chovat/VB-S---1P-AAI-- čisté/čistý/AANS4----1A---- přátelství/přátelství/NNNS4-----A----";"././Z:-------------"
"45";"Rusové/Rus/NNMP1-----A---- ztratili/ztratit/VpMP----R-AAP-- strach/strach/NNIS4-----A---- z/z/RR--2---------- Němců/Němec/NNMP2-----A---- ,/,/Z:------------- vidí/vidět/VB-P---3P-AAI-- v/v/RR--6---------- nich/oni/P5MP6--3------- národ/národ/NNIS4-----A---- ,/,/Z:------------- který/který/P4IS1---------- k/k/RR--3---------- nim/oni/P5IP3--3-------";"chová/chovat/VB-S---3P-AAI-- největší/velký/AANS4----3A---- přátelství/přátelství/NNNS4-----A----";"././Z:-------------"
"46";"Vždy/vždy/Db------------- se/se/P7--4---------- k/k/RR--3---------- sobě/se/P6--3---------- snažili/snažit/VpMP----R-AAI--";"chovat/chovat/Vf--------A-I-- úctu/úcta/NNFS4-----A---- a/a/J^------------- právě/právě/Db------------- ta/ten/PDFS1---------- jim/oni/PPMP3--3------- nedovolila/dovolit/VpFS----R-NAP-- narušit/narušit/Vf--------A-P-- cenné/cenný/AANS4----1A---- přátelství/přátelství/NNNS4-----A----";"././Z:-------------"
"47";"„/""/Z:------------- Vždycky/vždy/Db------------- jsme/být/VB-P---1P-AAI--";"chovali/chovat/VpMP----R-AAI-- vřelé/vřelý/AANS4----1A---- přátelství/přátelství/NNNS4-----A----";"k/k/RR--3---------- České/český/AAFS3----1A---- republice/republika/NNFS3-----A---- už/už/Db------------- za/za/RR--2---------- doby/doba/NNFS2-----A---- Československa/Československo/NNNS2-----A---- ././Z:-------------"
"48";"Dobře/dobře/Dg-------1A---- se/se/P7--4---------- znali/znát/VpMP----R-AAI-- a/a/J^------------- dodnes/dodnes/Db------------- k/k/RR--3---------- sobě/se/P6--3----------";"chovají/chovat/VB-P---3P-AAI-- upřímné/upřímný/AANS4----1A---- přátelství/přátelství/NNNS4-----A----";"././Z:-------------"
"49";"Jeho/jeho/PSFP1-S3------- členky/členka/NNFP1-----A---- se/se/P7--4---------- příkladně/příkladně/Dg-------1A----";"chovaly/chovat/VpFP----R-AAI-- ,/,/Z:------------- pěstovaly/pěstovat/VpFP----R-AAI-- přátelství/přátelství/NNNS4-----A----";",/,/Z:------------- organizovaly/organizovat/VpFP----R-AAB-- různé/různý/AAFP4----1A---- kulturní/kulturní/AAFP4----1A---- akce/akce/NNFP4-----A---- a/a/J^------------- pomáhaly/pomáhat/VpFP----R-AAI-- starým/starý/AAMP3----1A---- lidem/člověk/NNMP3-----A---- ././Z:-------------"
"50";"";"Chovám/chovat/VB-S---1P-AAI-- velký/velký/AAIS4----1A---- obdiv/obdiv/NNIS4-----A---- a/a/J^------------- přátelství/přátelství/NNNS4-----A----";"k/k/RR--3---------- prezidentu/prezident/NNMS3-----A---1 Václavu/Václav/NNMS3-----A---1 Havlovi/Havel/NNMS3-----A---- ././Z:-------------"
"51";"„/""/Z:------------- Když/když/J,------------- jste/být/VB-P---2P-AAI-- politik/politik/NNMS1-----A---- ,/,/Z:------------- musíte/muset/VB-P---2P-AAI-- fungovat/fungovat/Vf--------A-I-- tak/tak/Db------------- ,/,/Z:------------- aby/aby|být/J,-------------|Vc----------I-- třeba/třeba/TT------------- kompromitující/kompromitující/AGFP1-----A---- fotky/fotka/NNFP1-----A---- nevznikly/vzniknout/VpFP----R-NAP-1 ,/,/Z:------------- bereme/brát/VB-P---1P-AAI-- to/ten/PDNS4---------- tak/tak/Db------------- ,/,/Z:------------- že/že/J,------------- žijeme/žít/VB-P---1P-AAI-- v/v/RR--6---------- akváriu/akvárium/NNNS6-----A---- a/a/J^------------- musíme/muset/VB-P---1P-AAI-- se/se/P7--4---------- podle/podle/RR--2---------- toho/ten/PDNS2----------";"chovat/chovat/Vf--------A-I-- ,/,/Z:------------- “/""/Z:------------- říká/říkat/VB-S---3P-AAI-- Droba/droba/NNFS1-----A---- a/a/J^------------- na/na/RR--4---------- závěr/závěr/NNIS4-----A---- rozhovoru/rozhovor/NNIS2-----A---- mě/já/PH-S4--1------- vyzývá/vyzývat/VB-S---3P-AAI-- :/:/Z:------------- Požádejte/požádat/Vi-P---2--A-P-- mě/já/PH-S4--1------- o/o/RR--4---------- přátelství/přátelství/NNNS4-----A----";"././Z:-------------"
"52";"„/""/Z:------------- Cam/Cam/NNMS1-----A---- a/a/J^------------- Mike/Mike/NNMP1-----A---- k/k/RR--3---------- sobě/se/P6--3----------";"chovají/chovat/VB-P---3P-AAI-- zvláštní/zvláštní/AANS4----1A---- přátelství/přátelství/NNNS4-----A----";",/,/Z:------------- “/""/Z:------------- tvrdí/tvrdit/VB-S---3P-AAI-- Faulk/Faulk/X@------------- ././Z:-------------"
"53";"V/v/RR--6---------- prohlášení/prohlášení/NNNS6-----A---- Sobotkových/Sobotkovi/NNMP2-----A---- se/se/P7--4---------- píše/psát/VB-S---3P-AAI-- :/:/Z:------------- „/""/Z:------------- Oba/oba/ClMP1---------- k/k/RR--3---------- sobě/se/P6--3---------- nadále/nadále/Db-------------";"chováme/chovat/VB-P---1P-AAI-- hluboký/hluboký/AAIS4----1A---- respekt/respekt/NNIS4-----A---- a/a/J^------------- přátelství/přátelství/NNNS4-----A----";",/,/Z:------------- jež/jenž/PJNP1---------- nám/my/PP-P3--1------- umožňují/umožňovat/VB-P---3P-AAI-- naši/náš/PSFS4-P1------- situaci/situace/NNFS4-----A---- řešit/řešit/Vf--------A-I-- se/s/RV--7---------- vzájemným/vzájemný/AANS7----1A---- pochopením/pochopení/NNNS7-----A---- ././Z:-------------"
"54";"";"Chovají/chovat/VB-P---3P-AAI-- k/k/RR--3---------- nám/my/PP-P3--1------- velké/velký/AANS4----1A---- přátelství/přátelství/NNNS4-----A----";",/,/Z:------------- může/moci/VB-S---3P-AAI-- za/za/RR--4---------- to/ten/PDNS4---------- asi/asi/TT------------- i/i/J^------------- jakási/jakýsi/PZFS1---------- blízkost/blízkost/NNFS1-----A---- ,/,/Z:------------- kterou/který/P4FS4---------- k/k/RR--3---------- nám/my/PP-P3--1------- pociťují/pociťovat/VB-P---3P-AAI-- jako/jako/J,------------- ke/k/RV--3---------- Slovanům/Slovan/NNMP3-----A---- ././Z:-------------"
"55";"";"Chovám/chovat/VB-S---1P-AAI-- velký/velký/AAIS4----1A---- respekt/respekt/NNIS4-----A---- a/a/J^------------- přátelství/přátelství/NNNS4-----A----";"vůči/vůči/RR--3---------- Rusku/Rusko/NNNS3-----A---- ,/,/Z:------------- ale/ale/J^------------- nemám/mít/VB-S---1P-NAI-- rád/rád/ACMS------A---- autoritářství/autoritářství/NNNS4-----A---- ,/,/Z:------------- imperialismus/imperialismus/NNIS4-----A---- a/a/J^------------- diktaturu/diktatura/NNFS4-----A---- ././Z:-------------"
"56";"Z/z/RR--2---------- obdržených/obdržený/AAIP2----1A---- mnohých/mnohý/AAIP2----1A---- novoročních/novoroční/AAIP2----1A---- vinšů/vinš/NNIP2-----A---- (/(/Z:------------- sám/sám/PLMS1---------- jsem/být/VB-S---1P-AAI-- jich/oni/PPMP2--3------- rovněž/rovněž/Db------------- mnoho/mnoho/Ca--4---------- odeslal/odeslat/VpMS----R-AAP-- )/)/Z:------------- ,/,/Z:------------- čerpám/čerpat/VB-S---1P-AAI-- jistotu/jistota/NNFS4-----A---- ,/,/Z:------------- že/že/J,------------- četní/četný/AAMP1----1A---- dosud/dosud/Db-------------";"chovají/chovat/VB-P---3P-AAI-- ke/k/RV--3---------- mně/já/PP-S3--1------- přátelství/přátelství/NNNS4-----A----";"././Z:-------------"
"57";"Už/už/Db------------- tě/ty/PH-S4--2------- nemiluji/milovat/VB-S---1P-NAI-1 ,/,/Z:------------- ale/ale/J^-------------";"chovám/chovat/VB-S---1P-AAI-- k/k/RR--3---------- tobě/ty/PP-S3--2------- upřímné/upřímný/AANS4----1A---- přátelství/přátelství/NNNS4-----A----";"././Z:-------------"
