id;left;kwic;right
"58";"Obávám/obávat/VB-S---1P-AAI-- se/se/P7--4---------- ,/,/Z:------------- že/že/J,------------- varovné/varovný/AANS1----1A---- vyjádření/vyjádření/NNNS1-----A---- pana/pan/NNMS2-----A---- prezidenta/prezident/NNMS2-----A---- Miloše/Miloš/NNMS2-----A---- Zemana/Zeman/NNMS2-----A---- ,/,/Z:------------- ke/ke/RV--3---------- kterému/který/P4MS3---------- jinak/jinak/Db-------------";"chovám/chovat/VB-S---1P-AAI-- úctu/úcta/NNFS4-----A---- a/a/J^------------- přátelství/přátelství/NNNS4-----A----";"déle/dlouho/Dg-------2A---- než/než/J,------------- půl/půl/CyFS4---------- století/století/NNNS2-----A---- ,/,/Z:------------- k/k/RR--3---------- výše/vysoko/Dg-------2A---1 uvedeným/uvedený/AAIP3----1A---- námětům/námět/NNIP3-----A---- na/na/RR--4---------- možné/možný/AANS4----1A---- strategické/strategický/AANS4----1A---- posílení/posílení/NNNS4-----A---- pozice/pozice/NNFS2-----A---- státu/stát/NNIS2-----A---- v/v/RR--6---------- klíčových/klíčový/AAFP6----1A---- firmách/firma/NNFP6-----A---- je/být/VB-S---3P-AAI-- dávno/dávno/Dg-------1A---- úplně/úplně/Dg-------1A---- »/""/Z:------------- mimo/mimo/RR--4---------- mísu/mísa/NNFS4-----A---- «/""/Z:------------- ,/,/Z:------------- a/a/J^------------- asi/asi/TT------------- nejsem/být/VB-S---1P-NAI-- sám/sám/PLMS1---------- ,/,/Z:------------- koho/kdo/PKM-4---------- jeho/jeho/PSNS1-S3------- vyjádření/vyjádření/NNNS1-----A---- udivilo/udivit/VpNS----R-AAP-- ././Z:-------------"
"59";"Ve/v/RV--6---------- své/svůj/P8FS6---------1 tvorbě/tvorba/NNFS6-----A---- se/se/P7--4---------- snaží/snažit/VB-S---3P-AAI-- akcentovat/akcentovat/Vf--------A-I-- autenticitu/autenticita/NNFS4-----A---- v/v/RR--6---------- osobním/osobní/AAIS6----1A---- i/i/J^------------- uměleckém/umělecký/AAIS6----1A---- životě/život/NNIS6-----A---- ,/,/Z:------------- to/ten/PDNS4---------- ,/,/Z:------------- jak/jak/Db------------- k/k/RR--3---------- sobě/se/P6--3----------";"chovat/chovat/Vf--------A-I-- absolutní/absolutní/AANS4----1A---- přátelství/přátelství/NNNS4-----A----";",/,/Z:------------- smát/smát/Vf--------A-I-- se/se/P7--4---------- penězům/peníze/NNIP3-----A---- a/a/J^------------- nelpět/lpět/Vf--------N-I-- na/na/RR--6---------- materiálních/materiální/AAFP6----1A---- věcech/věc/NNFP6-----A---- ././Z:-------------"
"60";"Osmnáctiletý/osmnáctiletý/AAMS1----1A---- Gustav/Gustav/NNMS1-----A----";"choval/chovat/VpMS----R-AAI-- k/k/RR--3---------- dívce/dívka/NNFS3-----A---- čisté/čistý/AANS4----1A---- přátelství/přátelství/NNNS4-----A----";"././Z:-------------"
"61";"Znát/znát/Vf--------A-I-- ho/on/PHMS4--3------- znamenalo/znamenat/VpNS----R-AAI-- postoupit/postoupit/Vf--------A-P-- na/na/RR--6---------- společenském/společenský/AAIS6----1A---- stupínku/stupínek/NNIS6-----A---- o/o/RR--4---------- kus/kus/NNIS4-----A---- výš/vysoko/Dg-------2A---- ,/,/Z:------------- a/a/J^------------- spřátelit/spřátelit/Vf--------A-P-- se/se/P7--4---------- s/s/RR--7---------- ním/on/P5MS7--3------- ,/,/Z:------------- ó/ó/II------------- ne/ne/TT------------- ,/,/Z:------------- na/na/RR--4---------- to/ten/PDNS4---------- už/už/Db------------- nebylo/být/VpNS----R-NAI-- ani/ani/TT------------- pomyšlení/pomyšlení/NNNS1-----A---- pro/pro/RR--4---------- normálního/normální/AAMS4----1A---- smrtelníka/smrtelník/NNMS4-----A---- ,/,/Z:------------- zvlášť/zvlášť/TT------------- proto/proto/Db------------- ,/,/Z:------------- že/že/J,------------- pan/pán/NNMS1-----A---- Nechleba/Nechleba/NNMS1-----A---- se/se/P7--4----------";"choval/chovat/VpMS----R-AAI-- tak/tak/Db------------- trochu/trochu/Db------------- podivínsky/podivínsky/Dg-------1A---- a/a/J^------------- hned/hned/Db------------- tak/tak/Db------------- přátelství/přátelství/NNNS4-----A----";"neuzavíral/uzavírat/VpMS----R-NAI-- ././Z:-------------"
"62";"Arnošt/Arnošt/NNMS1-----A---- Heidrich/Heidrich/NNMS1-----A---- vypráví/vyprávět/VB-S---3P-AAI-- o/o/RR--6---------- deziluzi/deziluze/NNFS6-----A---- Milady/Milada/NNFS2-----A---- Horákové/Horáková/NNFS2-----A---- ,/,/Z:------------- když/když/J,------------- jí/on/PPFS3--3------- jako/jako/J,------------- člen/člen/NNMS1-----A---- československé/československý/AAFS2----1A---- vládní/vládní/AAFS2----1A---- delegace/delegace/NNFS2-----A---- vyprávěl/vyprávět/VpMS----R-AAI-- o/o/RR--6---------- svém/svůj/P8IS6---------- pobytu/pobyt/NNIS6-----A---1 v/v/RR--6---------- Moskvě/Moskva/NNFS6-----A---- v/v/RR--6---------- červenci/červenec/NNIS6-----A---- 1945/1945/C=------------- :/:/Z:------------- ""/""/Z:------------- Nikdy/nikdy/Db------------- nezapomenu/zapomenout/VB-S---1P-NAP-- na/na/RR--4---------- výrok/výrok/NNIS4-----A---- ,/,/Z:------------- kterým/který/P4IS7---------- Milada/Milada/NNFS1-----A---- na/na/RR--4---------- moje/můj/PSNS4-S1------- sdělení/sdělení/NNNS4-----A---- reagovala/reagovat/VpFS----R-AAI-- :/:/Z:------------- '/'/Z:------------- Jestliže/jestliže/J,------------- Kremlu/Kreml/NNIS3-----A---- nestačí/stačit/VB-S---3P-NAI-- vědomí/vědomí/NNNS1-----A---- ,/,/Z:------------- že/že/J,------------- náš/náš/PSIS1-P1------- lid/lid/NNIS1-----A---- se/se/P7--4----------";"choval/chovat/VpIS----R-AAI-- k/k/RR--3---------- Rusku/Rusko/NNNS3-----A---- vždy/vždy/Db------------- přátelsky/přátelsky/Dg-------1A---- ,/,/Z:------------- ať/ať/J,------------- tam/tam/Db------------- byl/být/VpIS----R-AAI-- režim/režim/NNIS1-----A---- jakýkoli/jakýkoli/PZIS1---------- ,/,/Z:------------- tak/tak/J^------------- je/být/VB-S---3P-AAI-- to/ten/PDNS1---------- jasným/jasný/AAIS7----1A---- náznakem/náznak/NNIS7-----A---- ,/,/Z:------------- že/že/J,------------- více/hodně/Dg-------2A---- než/než/J,------------- na/na/RR--4---------- přátelství/přátelství/NNNS4-----A----";"a/a/J^------------- spojenectví/spojenectví/NNNS4-----A---- Stalinovi/Stalin/NNMS3-----A---- záleží/záležet/VB-S---3P-AAI-- na/na/RR--6---------- obdobném/obdobný/AANS6----1A---- okleštění/okleštění/NNNS6-----A---- československé/československý/AAFS2----1A---- státnosti/státnost/NNFS2-----A---- a/a/J^------------- obdobném/obdobný/AANS6----1A---- zotročení/zotročení/NNNS6-----A---- našeho/náš/PSIS2-P1------- lidu/lid/NNIS2-----A---- právě/právě/Db------------- tak/tak/Db------------- jako/jako/J,------------- Hitlerovi/Hitler/NNMS3-----A---- ././Z:-------------"
